
============================================================
RRMC Experiment: dc_methods/fixed_turns
============================================================
Initializing LLM: qwen/qwen-2.5-7b-instruct (max_workers=32)
Task: detective_cases
Data: /root/RRMC/AR-Bench/data/dc/test.json
Loading weights:   0%|          | 0/103 [00:00<?, ?it/s]Loading weights:   1%|          | 1/103 [00:00<00:00, 20460.02it/s, Materializing param=embeddings.LayerNorm.bias]Loading weights:   1%|          | 1/103 [00:00<00:00, 2526.69it/s, Materializing param=embeddings.LayerNorm.bias] Loading weights:   2%|▁         | 2/103 [00:00<00:00, 2362.32it/s, Materializing param=embeddings.LayerNorm.weight]Loading weights:   2%|▁         | 2/103 [00:00<00:00, 1989.71it/s, Materializing param=embeddings.LayerNorm.weight]Loading weights:   3%|▎         | 3/103 [00:00<00:00, 2614.36it/s, Materializing param=embeddings.position_embeddings.weight]Loading weights:   3%|▎         | 3/103 [00:00<00:00, 1930.78it/s, Materializing param=embeddings.position_embeddings.weight]Loading weights:   4%|▁         | 4/103 [00:00<00:00, 1883.39it/s, Materializing param=embeddings.token_type_embeddings.weight]Loading weights:   4%|▁         | 4/103 [00:00<00:00, 1797.62it/s, Materializing param=embeddings.token_type_embeddings.weight]Loading weights:   5%|▁         | 5/103 [00:00<00:00, 1922.76it/s, Materializing param=embeddings.word_embeddings.weight]      Loading weights:   5%|▁         | 5/103 [00:00<00:00, 1708.89it/s, Materializing param=embeddings.word_embeddings.weight]Loading weights:   6%|▌         | 6/103 [00:00<00:00, 1845.14it/s, Materializing param=encoder.layer.0.attention.output.LayerNorm.bias]Loading weights:   6%|▌         | 6/103 [00:00<00:00, 1761.82it/s, Materializing param=encoder.layer.0.attention.output.LayerNorm.bias]Loading weights:   7%|▋         | 7/103 [00:00<00:00, 1791.34it/s, Materializing param=encoder.layer.0.attention.output.LayerNorm.weight]Loading weights:   7%|▋         | 7/103 [00:00<00:00, 1534.85it/s, Materializing param=encoder.layer.0.attention.output.LayerNorm.weight]Loading weights:   8%|▊         | 8/103 [00:00<00:00, 1698.96it/s, Materializing param=encoder.layer.0.attention.output.dense.bias]      Loading weights:   8%|▊         | 8/103 [00:00<00:00, 1654.72it/s, Materializing param=encoder.layer.0.attention.output.dense.bias]Loading weights:   9%|▊         | 9/103 [00:00<00:00, 1796.96it/s, Materializing param=encoder.layer.0.attention.output.dense.weight]Loading weights:   9%|▊         | 9/103 [00:00<00:00, 1624.65it/s, Materializing param=encoder.layer.0.attention.output.dense.weight]Loading weights:  10%|▉         | 10/103 [00:00<00:00, 1672.57it/s, Materializing param=encoder.layer.0.attention.self.key.bias]     Loading weights:  10%|▉         | 10/103 [00:00<00:00, 1640.45it/s, Materializing param=encoder.layer.0.attention.self.key.bias]Loading weights:  11%|█         | 11/103 [00:00<00:00, 1663.69it/s, Materializing param=encoder.layer.0.attention.self.key.weight]Loading weights:  11%|█         | 11/103 [00:00<00:00, 1648.53it/s, Materializing param=encoder.layer.0.attention.self.key.weight]Loading weights:  12%|█▁        | 12/103 [00:00<00:00, 1709.23it/s, Materializing param=encoder.layer.0.attention.self.query.bias]Loading weights:  12%|█▁        | 12/103 [00:00<00:00, 1694.27it/s, Materializing param=encoder.layer.0.attention.self.query.bias]Loading weights:  13%|█▎        | 13/103 [00:00<00:00, 1807.53it/s, Materializing param=encoder.layer.0.attention.self.query.weight]Loading weights:  13%|█▎        | 13/103 [00:00<00:00, 1781.49it/s, Materializing param=encoder.layer.0.attention.self.query.weight]Loading weights:  14%|█▎        | 14/103 [00:00<00:00, 1890.79it/s, Materializing param=encoder.layer.0.attention.self.value.bias]  Loading weights:  14%|█▎        | 14/103 [00:00<00:00, 1857.77it/s, Materializing param=encoder.layer.0.attention.self.value.bias]Loading weights:  15%|█▁        | 15/103 [00:00<00:00, 1914.22it/s, Materializing param=encoder.layer.0.attention.self.value.weight]Loading weights:  15%|█▁        | 15/103 [00:00<00:00, 1895.30it/s, Materializing param=encoder.layer.0.attention.self.value.weight]Loading weights:  16%|█▌        | 16/103 [00:00<00:00, 1993.67it/s, Materializing param=encoder.layer.0.intermediate.dense.bias]    Loading weights:  16%|█▌        | 16/103 [00:00<00:00, 1890.28it/s, Materializing param=encoder.layer.0.intermediate.dense.bias]Loading weights:  17%|█▋        | 17/103 [00:00<00:00, 1945.89it/s, Materializing param=encoder.layer.0.intermediate.dense.weight]Loading weights:  17%|█▋        | 17/103 [00:00<00:00, 1927.32it/s, Materializing param=encoder.layer.0.intermediate.dense.weight]Loading weights:  17%|█▋        | 18/103 [00:00<00:00, 1968.54it/s, Materializing param=encoder.layer.0.output.LayerNorm.bias]    Loading weights:  17%|█▋        | 18/103 [00:00<00:00, 1888.66it/s, Materializing param=encoder.layer.0.output.LayerNorm.bias]Loading weights:  18%|█▊        | 19/103 [00:00<00:00, 1953.95it/s, Materializing param=encoder.layer.0.output.LayerNorm.weight]Loading weights:  18%|█▊        | 19/103 [00:00<00:00, 1943.51it/s, Materializing param=encoder.layer.0.output.LayerNorm.weight]Loading weights:  19%|█▉        | 20/103 [00:00<00:00, 2021.98it/s, Materializing param=encoder.layer.0.output.dense.bias]      Loading weights:  19%|█▉        | 20/103 [00:00<00:00, 2011.66it/s, Materializing param=encoder.layer.0.output.dense.bias]Loading weights:  20%|██        | 21/103 [00:00<00:00, 1998.96it/s, Materializing param=encoder.layer.0.output.dense.weight]Loading weights:  20%|██        | 21/103 [00:00<00:00, 1967.79it/s, Materializing param=encoder.layer.0.output.dense.weight]Loading weights:  21%|██▁       | 22/103 [00:00<00:00, 1980.61it/s, Materializing param=encoder.layer.1.attention.output.LayerNorm.bias]Loading weights:  21%|██▁       | 22/103 [00:00<00:00, 1968.23it/s, Materializing param=encoder.layer.1.attention.output.LayerNorm.bias]Loading weights:  22%|██▁       | 23/103 [00:00<00:00, 2039.08it/s, Materializing param=encoder.layer.1.attention.output.LayerNorm.weight]Loading weights:  22%|██▁       | 23/103 [00:00<00:00, 2030.50it/s, Materializing param=encoder.layer.1.attention.output.LayerNorm.weight]Loading weights:  23%|██▎       | 24/103 [00:00<00:00, 2100.92it/s, Materializing param=encoder.layer.1.attention.output.dense.bias]      Loading weights:  23%|██▎       | 24/103 [00:00<00:00, 2092.14it/s, Materializing param=encoder.layer.1.attention.output.dense.bias]Loading weights:  24%|██▁       | 25/103 [00:00<00:00, 2159.12it/s, Materializing param=encoder.layer.1.attention.output.dense.weight]Loading weights:  24%|██▁       | 25/103 [00:00<00:00, 2150.04it/s, Materializing param=encoder.layer.1.attention.output.dense.weight]Loading weights:  25%|██▌       | 26/103 [00:00<00:00, 2218.89it/s, Materializing param=encoder.layer.1.attention.self.key.bias]      Loading weights:  25%|██▌       | 26/103 [00:00<00:00, 2210.08it/s, Materializing param=encoder.layer.1.attention.self.key.bias]Loading weights:  26%|██▌       | 27/103 [00:00<00:00, 2278.23it/s, Materializing param=encoder.layer.1.attention.self.key.weight]Loading weights:  26%|██▌       | 27/103 [00:00<00:00, 2269.42it/s, Materializing param=encoder.layer.1.attention.self.key.weight]Loading weights:  27%|██▋       | 28/103 [00:00<00:00, 2336.52it/s, Materializing param=encoder.layer.1.attention.self.query.bias]Loading weights:  27%|██▋       | 28/103 [00:00<00:00, 2327.58it/s, Materializing param=encoder.layer.1.attention.self.query.bias]Loading weights:  28%|██▊       | 29/103 [00:00<00:00, 2393.49it/s, Materializing param=encoder.layer.1.attention.self.query.weight]Loading weights:  28%|██▊       | 29/103 [00:00<00:00, 2384.44it/s, Materializing param=encoder.layer.1.attention.self.query.weight]Loading weights:  29%|██▉       | 30/103 [00:00<00:00, 2449.71it/s, Materializing param=encoder.layer.1.attention.self.value.bias]  Loading weights:  29%|██▉       | 30/103 [00:00<00:00, 2439.26it/s, Materializing param=encoder.layer.1.attention.self.value.bias]Loading weights:  30%|███       | 31/103 [00:00<00:00, 2502.62it/s, Materializing param=encoder.layer.1.attention.self.value.weight]Loading weights:  30%|███       | 31/103 [00:00<00:00, 2493.21it/s, Materializing param=encoder.layer.1.attention.self.value.weight]Loading weights:  31%|███       | 32/103 [00:00<00:00, 2554.19it/s, Materializing param=encoder.layer.1.intermediate.dense.bias]    Loading weights:  31%|███       | 32/103 [00:00<00:00, 2543.54it/s, Materializing param=encoder.layer.1.intermediate.dense.bias]Loading weights:  32%|███▁      | 33/103 [00:00<00:00, 2604.13it/s, Materializing param=encoder.layer.1.intermediate.dense.weight]Loading weights:  32%|███▁      | 33/103 [00:00<00:00, 2594.51it/s, Materializing param=encoder.layer.1.intermediate.dense.weight]Loading weights:  33%|███▎      | 34/103 [00:00<00:00, 2655.17it/s, Materializing param=encoder.layer.1.output.LayerNorm.bias]    Loading weights:  33%|███▎      | 34/103 [00:00<00:00, 2645.71it/s, Materializing param=encoder.layer.1.output.LayerNorm.bias]Loading weights:  34%|███▁      | 35/103 [00:00<00:00, 2705.80it/s, Materializing param=encoder.layer.1.output.LayerNorm.weight]Loading weights:  34%|███▁      | 35/103 [00:00<00:00, 2696.41it/s, Materializing param=encoder.layer.1.output.LayerNorm.weight]Loading weights:  35%|███▁      | 36/103 [00:00<00:00, 2755.73it/s, Materializing param=encoder.layer.1.output.dense.bias]      Loading weights:  35%|███▁      | 36/103 [00:00<00:00, 2746.21it/s, Materializing param=encoder.layer.1.output.dense.bias]Loading weights:  36%|███▌      | 37/103 [00:00<00:00, 2804.64it/s, Materializing param=encoder.layer.1.output.dense.weight]Loading weights:  36%|███▌      | 37/103 [00:00<00:00, 2795.20it/s, Materializing param=encoder.layer.1.output.dense.weight]Loading weights:  37%|███▋      | 38/103 [00:00<00:00, 2852.55it/s, Materializing param=encoder.layer.2.attention.output.LayerNorm.bias]Loading weights:  37%|███▋      | 38/103 [00:00<00:00, 2842.68it/s, Materializing param=encoder.layer.2.attention.output.LayerNorm.bias]Loading weights:  38%|███▊      | 39/103 [00:00<00:00, 2897.34it/s, Materializing param=encoder.layer.2.attention.output.LayerNorm.weight]Loading weights:  38%|███▊      | 39/103 [00:00<00:00, 2884.82it/s, Materializing param=encoder.layer.2.attention.output.LayerNorm.weight]Loading weights:  39%|███▉      | 40/103 [00:00<00:00, 2938.53it/s, Materializing param=encoder.layer.2.attention.output.dense.bias]      Loading weights:  39%|███▉      | 40/103 [00:00<00:00, 2928.68it/s, Materializing param=encoder.layer.2.attention.output.dense.bias]Loading weights:  40%|███▉      | 41/103 [00:00<00:00, 2983.15it/s, Materializing param=encoder.layer.2.attention.output.dense.weight]Loading weights:  40%|███▉      | 41/103 [00:00<00:00, 2973.14it/s, Materializing param=encoder.layer.2.attention.output.dense.weight]Loading weights:  41%|████      | 42/103 [00:00<00:00, 3026.51it/s, Materializing param=encoder.layer.2.attention.self.key.bias]      Loading weights:  41%|████      | 42/103 [00:00<00:00, 3016.71it/s, Materializing param=encoder.layer.2.attention.self.key.bias]Loading weights:  42%|████▁     | 43/103 [00:00<00:00, 3069.98it/s, Materializing param=encoder.layer.2.attention.self.key.weight]Loading weights:  42%|████▁     | 43/103 [00:00<00:00, 3060.34it/s, Materializing param=encoder.layer.2.attention.self.key.weight]Loading weights:  43%|████▎     | 44/103 [00:00<00:00, 3112.87it/s, Materializing param=encoder.layer.2.attention.self.query.bias]Loading weights:  43%|████▎     | 44/103 [00:00<00:00, 3102.97it/s, Materializing param=encoder.layer.2.attention.self.query.bias]Loading weights:  44%|████▎     | 45/103 [00:00<00:00, 3152.45it/s, Materializing param=encoder.layer.2.attention.self.query.weight]Loading weights:  44%|████▎     | 45/103 [00:00<00:00, 3141.80it/s, Materializing param=encoder.layer.2.attention.self.query.weight]Loading weights:  45%|████▁     | 46/103 [00:00<00:00, 3192.12it/s, Materializing param=encoder.layer.2.attention.self.value.bias]  Loading weights:  45%|████▁     | 46/103 [00:00<00:00, 3181.96it/s, Materializing param=encoder.layer.2.attention.self.value.bias]Loading weights:  46%|████▌     | 47/103 [00:00<00:00, 3228.55it/s, Materializing param=encoder.layer.2.attention.self.value.weight]Loading weights:  46%|████▌     | 47/103 [00:00<00:00, 3217.91it/s, Materializing param=encoder.layer.2.attention.self.value.weight]Loading weights:  47%|████▋     | 48/103 [00:00<00:00, 3267.33it/s, Materializing param=encoder.layer.2.intermediate.dense.bias]    Loading weights:  47%|████▋     | 48/103 [00:00<00:00, 3257.50it/s, Materializing param=encoder.layer.2.intermediate.dense.bias]Loading weights:  48%|████▊     | 49/103 [00:00<00:00, 3306.80it/s, Materializing param=encoder.layer.2.intermediate.dense.weight]Loading weights:  48%|████▊     | 49/103 [00:00<00:00, 3296.62it/s, Materializing param=encoder.layer.2.intermediate.dense.weight]Loading weights:  49%|████▊     | 50/103 [00:00<00:00, 3344.95it/s, Materializing param=encoder.layer.2.output.LayerNorm.bias]    Loading weights:  49%|████▊     | 50/103 [00:00<00:00, 3334.95it/s, Materializing param=encoder.layer.2.output.LayerNorm.bias]Loading weights:  50%|████▉     | 51/103 [00:00<00:00, 3382.88it/s, Materializing param=encoder.layer.2.output.LayerNorm.weight]Loading weights:  50%|████▉     | 51/103 [00:00<00:00, 3372.64it/s, Materializing param=encoder.layer.2.output.LayerNorm.weight]Loading weights:  50%|█████     | 52/103 [00:00<00:00, 3419.84it/s, Materializing param=encoder.layer.2.output.dense.bias]      Loading weights:  50%|█████     | 52/103 [00:00<00:00, 3409.79it/s, Materializing param=encoder.layer.2.output.dense.bias]Loading weights:  51%|█████▁    | 53/103 [00:00<00:00, 3456.34it/s, Materializing param=encoder.layer.2.output.dense.weight]Loading weights:  51%|█████▁    | 53/103 [00:00<00:00, 3446.11it/s, Materializing param=encoder.layer.2.output.dense.weight]Loading weights:  52%|█████▁    | 54/103 [00:00<00:00, 3491.91it/s, Materializing param=encoder.layer.3.attention.output.LayerNorm.bias]Loading weights:  52%|█████▁    | 54/103 [00:00<00:00, 3478.99it/s, Materializing param=encoder.layer.3.attention.output.LayerNorm.bias]Loading weights:  53%|█████▎    | 55/103 [00:00<00:00, 3520.21it/s, Materializing param=encoder.layer.3.attention.output.LayerNorm.weight]Loading weights:  53%|█████▎    | 55/103 [00:00<00:00, 3509.50it/s, Materializing param=encoder.layer.3.attention.output.LayerNorm.weight]Loading weights:  54%|█████▁    | 56/103 [00:00<00:00, 3553.04it/s, Materializing param=encoder.layer.3.attention.output.dense.bias]      Loading weights:  54%|█████▁    | 56/103 [00:00<00:00, 3542.70it/s, Materializing param=encoder.layer.3.attention.output.dense.bias]Loading weights:  55%|█████▌    | 57/103 [00:00<00:00, 3586.17it/s, Materializing param=encoder.layer.3.attention.output.dense.weight]Loading weights:  55%|█████▌    | 57/103 [00:00<00:00, 3575.81it/s, Materializing param=encoder.layer.3.attention.output.dense.weight]Loading weights:  56%|█████▋    | 58/103 [00:00<00:00, 3619.06it/s, Materializing param=encoder.layer.3.attention.self.key.bias]      Loading weights:  56%|█████▋    | 58/103 [00:00<00:00, 3608.91it/s, Materializing param=encoder.layer.3.attention.self.key.bias]Loading weights:  57%|█████▋    | 59/103 [00:00<00:00, 3651.58it/s, Materializing param=encoder.layer.3.attention.self.key.weight]Loading weights:  57%|█████▋    | 59/103 [00:00<00:00, 3640.03it/s, Materializing param=encoder.layer.3.attention.self.key.weight]Loading weights:  58%|█████▊    | 60/103 [00:00<00:00, 3681.64it/s, Materializing param=encoder.layer.3.attention.self.query.bias]Loading weights:  58%|█████▊    | 60/103 [00:00<00:00, 3671.32it/s, Materializing param=encoder.layer.3.attention.self.query.bias]Loading weights:  59%|█████▉    | 61/103 [00:00<00:00, 3712.80it/s, Materializing param=encoder.layer.3.attention.self.query.weight]Loading weights:  59%|█████▉    | 61/103 [00:00<00:00, 3702.32it/s, Materializing param=encoder.layer.3.attention.self.query.weight]Loading weights:  60%|██████    | 62/103 [00:00<00:00, 3740.01it/s, Materializing param=encoder.layer.3.attention.self.value.bias]  Loading weights:  60%|██████    | 62/103 [00:00<00:00, 3729.34it/s, Materializing param=encoder.layer.3.attention.self.value.bias]Loading weights:  61%|██████    | 63/103 [00:00<00:00, 3769.60it/s, Materializing param=encoder.layer.3.attention.self.value.weight]Loading weights:  61%|██████    | 63/103 [00:00<00:00, 3759.30it/s, Materializing param=encoder.layer.3.attention.self.value.weight]Loading weights:  62%|██████▁   | 64/103 [00:00<00:00, 3799.46it/s, Materializing param=encoder.layer.3.intermediate.dense.bias]    Loading weights:  62%|██████▁   | 64/103 [00:00<00:00, 3788.46it/s, Materializing param=encoder.layer.3.intermediate.dense.bias]Loading weights:  63%|██████▎   | 65/103 [00:00<00:00, 3828.21it/s, Materializing param=encoder.layer.3.intermediate.dense.weight]Loading weights:  63%|██████▎   | 65/103 [00:00<00:00, 3817.86it/s, Materializing param=encoder.layer.3.intermediate.dense.weight]Loading weights:  64%|██████▁   | 66/103 [00:00<00:00, 3857.10it/s, Materializing param=encoder.layer.3.output.LayerNorm.bias]    Loading weights:  64%|██████▁   | 66/103 [00:00<00:00, 3846.92it/s, Materializing param=encoder.layer.3.output.LayerNorm.bias]Loading weights:  65%|██████▌   | 67/103 [00:00<00:00, 3885.92it/s, Materializing param=encoder.layer.3.output.LayerNorm.weight]Loading weights:  65%|██████▌   | 67/103 [00:00<00:00, 3875.90it/s, Materializing param=encoder.layer.3.output.LayerNorm.weight]Loading weights:  66%|██████▌   | 68/103 [00:00<00:00, 3915.01it/s, Materializing param=encoder.layer.3.output.dense.bias]      Loading weights:  66%|██████▌   | 68/103 [00:00<00:00, 3905.10it/s, Materializing param=encoder.layer.3.output.dense.bias]Loading weights:  67%|██████▋   | 69/103 [00:00<00:00, 3940.78it/s, Materializing param=encoder.layer.3.output.dense.weight]Loading weights:  67%|██████▋   | 69/103 [00:00<00:00, 3929.28it/s, Materializing param=encoder.layer.3.output.dense.weight]Loading weights:  68%|██████▊   | 70/103 [00:00<00:00, 3965.82it/s, Materializing param=encoder.layer.4.attention.output.LayerNorm.bias]Loading weights:  68%|██████▊   | 70/103 [00:00<00:00, 3955.29it/s, Materializing param=encoder.layer.4.attention.output.LayerNorm.bias]Loading weights:  69%|██████▉   | 71/103 [00:00<00:00, 3992.11it/s, Materializing param=encoder.layer.4.attention.output.LayerNorm.weight]Loading weights:  69%|██████▉   | 71/103 [00:00<00:00, 3981.76it/s, Materializing param=encoder.layer.4.attention.output.LayerNorm.weight]Loading weights:  70%|██████▉   | 72/103 [00:00<00:00, 4018.28it/s, Materializing param=encoder.layer.4.attention.output.dense.bias]      Loading weights:  70%|██████▉   | 72/103 [00:00<00:00, 4007.88it/s, Materializing param=encoder.layer.4.attention.output.dense.bias]Loading weights:  71%|███████   | 73/103 [00:00<00:00, 4044.06it/s, Materializing param=encoder.layer.4.attention.output.dense.weight]Loading weights:  71%|███████   | 73/103 [00:00<00:00, 4032.19it/s, Materializing param=encoder.layer.4.attention.output.dense.weight]Loading weights:  72%|███████▁  | 74/103 [00:00<00:00, 4066.91it/s, Materializing param=encoder.layer.4.attention.self.key.bias]      Loading weights:  72%|███████▁  | 74/103 [00:00<00:00, 4056.55it/s, Materializing param=encoder.layer.4.attention.self.key.bias]Loading weights:  73%|███████▎  | 75/103 [00:00<00:00, 4091.95it/s, Materializing param=encoder.layer.4.attention.self.key.weight]Loading weights:  73%|███████▎  | 75/103 [00:00<00:00, 4081.97it/s, Materializing param=encoder.layer.4.attention.self.key.weight]Loading weights:  74%|███████▁  | 76/103 [00:00<00:00, 4117.32it/s, Materializing param=encoder.layer.4.attention.self.query.bias]Loading weights:  74%|███████▁  | 76/103 [00:00<00:00, 4104.60it/s, Materializing param=encoder.layer.4.attention.self.query.bias]Loading weights:  75%|███████▁  | 77/103 [00:00<00:00, 4138.04it/s, Materializing param=encoder.layer.4.attention.self.query.weight]Loading weights:  75%|███████▁  | 77/103 [00:00<00:00, 4127.78it/s, Materializing param=encoder.layer.4.attention.self.query.weight]Loading weights:  76%|███████▌  | 78/103 [00:00<00:00, 4161.97it/s, Materializing param=encoder.layer.4.attention.self.value.bias]  Loading weights:  76%|███████▌  | 78/103 [00:00<00:00, 4151.88it/s, Materializing param=encoder.layer.4.attention.self.value.bias]Loading weights:  77%|███████▋  | 79/103 [00:00<00:00, 4185.88it/s, Materializing param=encoder.layer.4.attention.self.value.weight]Loading weights:  77%|███████▋  | 79/103 [00:00<00:00, 4175.91it/s, Materializing param=encoder.layer.4.attention.self.value.weight]Loading weights:  78%|███████▊  | 80/103 [00:00<00:00, 4209.93it/s, Materializing param=encoder.layer.4.intermediate.dense.bias]    Loading weights:  78%|███████▊  | 80/103 [00:00<00:00, 4200.03it/s, Materializing param=encoder.layer.4.intermediate.dense.bias]Loading weights:  79%|███████▊  | 81/103 [00:00<00:00, 4234.14it/s, Materializing param=encoder.layer.4.intermediate.dense.weight]Loading weights:  79%|███████▊  | 81/103 [00:00<00:00, 4224.40it/s, Materializing param=encoder.layer.4.intermediate.dense.weight]Loading weights:  80%|███████▉  | 82/103 [00:00<00:00, 4257.97it/s, Materializing param=encoder.layer.4.output.LayerNorm.bias]    Loading weights:  80%|███████▉  | 82/103 [00:00<00:00, 4248.08it/s, Materializing param=encoder.layer.4.output.LayerNorm.bias]Loading weights:  81%|████████  | 83/103 [00:00<00:00, 4281.27it/s, Materializing param=encoder.layer.4.output.LayerNorm.weight]Loading weights:  81%|████████  | 83/103 [00:00<00:00, 4271.39it/s, Materializing param=encoder.layer.4.output.LayerNorm.weight]Loading weights:  82%|████████▁ | 84/103 [00:00<00:00, 4300.85it/s, Materializing param=encoder.layer.4.output.dense.bias]      Loading weights:  82%|████████▁ | 84/103 [00:00<00:00, 4289.59it/s, Materializing param=encoder.layer.4.output.dense.bias]Loading weights:  83%|████████▎ | 85/103 [00:00<00:00, 4321.51it/s, Materializing param=encoder.layer.4.output.dense.weight]Loading weights:  83%|████████▎ | 85/103 [00:00<00:00, 4311.63it/s, Materializing param=encoder.layer.4.output.dense.weight]Loading weights:  83%|████████▎ | 86/103 [00:00<00:00, 4331.55it/s, Materializing param=encoder.layer.5.attention.output.LayerNorm.bias]Loading weights:  83%|████████▎ | 86/103 [00:00<00:00, 4321.64it/s, Materializing param=encoder.layer.5.attention.output.LayerNorm.bias]Loading weights:  84%|████████▁ | 87/103 [00:00<00:00, 4352.86it/s, Materializing param=encoder.layer.5.attention.output.LayerNorm.weight]Loading weights:  84%|████████▁ | 87/103 [00:00<00:00, 4341.57it/s, Materializing param=encoder.layer.5.attention.output.LayerNorm.weight]Loading weights:  85%|████████▌ | 88/103 [00:00<00:00, 4372.22it/s, Materializing param=encoder.layer.5.attention.output.dense.bias]      Loading weights:  85%|████████▌ | 88/103 [00:00<00:00, 4362.51it/s, Materializing param=encoder.layer.5.attention.output.dense.bias]Loading weights:  86%|████████▋ | 89/103 [00:00<00:00, 4393.65it/s, Materializing param=encoder.layer.5.attention.output.dense.weight]Loading weights:  86%|████████▋ | 89/103 [00:00<00:00, 4383.64it/s, Materializing param=encoder.layer.5.attention.output.dense.weight]Loading weights:  87%|████████▋ | 90/103 [00:00<00:00, 4413.77it/s, Materializing param=encoder.layer.5.attention.self.key.bias]      Loading weights:  87%|████████▋ | 90/103 [00:00<00:00, 4403.88it/s, Materializing param=encoder.layer.5.attention.self.key.bias]Loading weights:  88%|████████▊ | 91/103 [00:00<00:00, 4432.28it/s, Materializing param=encoder.layer.5.attention.self.key.weight]Loading weights:  88%|████████▊ | 91/103 [00:00<00:00, 4421.40it/s, Materializing param=encoder.layer.5.attention.self.key.weight]Loading weights:  89%|████████▉ | 92/103 [00:00<00:00, 4450.65it/s, Materializing param=encoder.layer.5.attention.self.query.bias]Loading weights:  89%|████████▉ | 92/103 [00:00<00:00, 4440.82it/s, Materializing param=encoder.layer.5.attention.self.query.bias]Loading weights:  90%|█████████ | 93/103 [00:00<00:00, 4470.31it/s, Materializing param=encoder.layer.5.attention.self.query.weight]Loading weights:  90%|█████████ | 93/103 [00:00<00:00, 4460.39it/s, Materializing param=encoder.layer.5.attention.self.query.weight]Loading weights:  91%|█████████▁| 94/103 [00:00<00:00, 4489.36it/s, Materializing param=encoder.layer.5.attention.self.value.bias]  Loading weights:  91%|█████████▁| 94/103 [00:00<00:00, 4479.57it/s, Materializing param=encoder.layer.5.attention.self.value.bias]Loading weights:  92%|█████████▁| 95/103 [00:00<00:00, 4508.98it/s, Materializing param=encoder.layer.5.attention.self.value.weight]Loading weights:  92%|█████████▁| 95/103 [00:00<00:00, 4499.41it/s, Materializing param=encoder.layer.5.attention.self.value.weight]Loading weights:  93%|█████████▎| 96/103 [00:00<00:00, 4528.31it/s, Materializing param=encoder.layer.5.intermediate.dense.bias]    Loading weights:  93%|█████████▎| 96/103 [00:00<00:00, 4518.51it/s, Materializing param=encoder.layer.5.intermediate.dense.bias]Loading weights:  94%|█████████▁| 97/103 [00:00<00:00, 4547.31it/s, Materializing param=encoder.layer.5.intermediate.dense.weight]Loading weights:  94%|█████████▁| 97/103 [00:00<00:00, 4537.52it/s, Materializing param=encoder.layer.5.intermediate.dense.weight]Loading weights:  95%|█████████▌| 98/103 [00:00<00:00, 4566.32it/s, Materializing param=encoder.layer.5.output.LayerNorm.bias]    Loading weights:  95%|█████████▌| 98/103 [00:00<00:00, 4553.67it/s, Materializing param=encoder.layer.5.output.LayerNorm.bias]Loading weights:  96%|█████████▌| 99/103 [00:00<00:00, 4579.19it/s, Materializing param=encoder.layer.5.output.LayerNorm.weight]Loading weights:  96%|█████████▌| 99/103 [00:00<00:00, 4569.11it/s, Materializing param=encoder.layer.5.output.LayerNorm.weight]Loading weights:  97%|█████████▋| 100/103 [00:00<00:00, 4596.65it/s, Materializing param=encoder.layer.5.output.dense.bias]     Loading weights:  97%|█████████▋| 100/103 [00:00<00:00, 4586.90it/s, Materializing param=encoder.layer.5.output.dense.bias]Loading weights:  98%|█████████▊| 101/103 [00:00<00:00, 4612.94it/s, Materializing param=encoder.layer.5.output.dense.weight]Loading weights:  98%|█████████▊| 101/103 [00:00<00:00, 4603.17it/s, Materializing param=encoder.layer.5.output.dense.weight]Loading weights:  99%|█████████▉| 102/103 [00:00<00:00, 4630.53it/s, Materializing param=pooler.dense.bias]                  Loading weights:  99%|█████████▉| 102/103 [00:00<00:00, 4620.62it/s, Materializing param=pooler.dense.bias]Loading weights: 100%|██████████| 103/103 [00:00<00:00, 4649.45it/s, Materializing param=pooler.dense.weight]Loading weights: 100%|██████████| 103/103 [00:00<00:00, 4640.17it/s, Materializing param=pooler.dense.weight]Loading weights: 100%|██████████| 103/103 [00:00<00:00, 4620.27it/s, Materializing param=pooler.dense.weight]
[1mBertModel LOAD REPORT[0m from: sentence-transformers/all-MiniLM-L6-v2
Key                     | Status     |  | 
------------------------+------------+--+-
embeddings.position_ids | UNEXPECTED |  | 

[3mNotes:
- UNEXPECTED[3m	:can be ignored when loading from different task/architecture; not ok if you expect identical arch.[0m
Warning: You are sending unauthenticated requests to the HF Hub. Please set a HF_TOKEN to enable higher rate limits and faster downloads.
API calls:   0%|          | 0/250 [00:00<?, ?call/s]Evaluating 5 puzzles
Methods: ['fixed_turns']

============================================================
STARTING EVALUATION
============================================================

Evaluating FixedTurnsStopping on 5 puzzles...

  FixedTurnsStopping:   0%|          | 0/5 [00:00<?, ?it/s][AAPI calls:   0%|          | 1/250 [00:01<05:06,  1.23s/call]API calls:   1%|          | 2/250 [00:01<02:32,  1.62call/s]API calls:   2%|▁         | 4/250 [00:01<01:07,  3.63call/s]API calls:   2%|▁         | 5/250 [00:01<00:57,  4.29call/s]API calls:   2%|▁         | 6/250 [00:02<01:26,  2.83call/s]API calls:   3%|▎         | 8/250 [00:02<00:54,  4.46call/s]API calls:   4%|▎         | 9/250 [00:02<00:59,  4.06call/s]API calls:   4%|▁         | 11/250 [00:03<01:15,  3.18call/s]API calls:   5%|▁         | 12/250 [00:03<01:07,  3.50call/s]API calls:   6%|▌         | 15/250 [00:04<00:58,  4.01call/s]API calls:   6%|▋         | 16/250 [00:04<00:54,  4.31call/s]API calls:   7%|▋         | 18/250 [00:04<00:43,  5.30call/s]API calls:   8%|▊         | 20/250 [00:05<00:54,  4.21call/s]API calls:   8%|▊         | 21/250 [00:05<00:55,  4.11call/s]API calls:   9%|▉         | 22/250 [00:05<00:55,  4.13call/s]API calls:   9%|▉         | 23/250 [00:06<00:54,  4.20call/s]API calls:  10%|▉         | 24/250 [00:06<00:46,  4.89call/s]API calls:  10%|█         | 25/250 [00:06<00:40,  5.51call/s]API calls:  10%|█         | 26/250 [00:07<01:21,  2.74call/s]API calls:  11%|█         | 27/250 [00:07<01:13,  3.03call/s]API calls:  11%|█         | 28/250 [00:07<01:12,  3.07call/s]API calls:  12%|█▁        | 29/250 [00:08<01:18,  2.80call/s]API calls:  12%|█▁        | 31/250 [00:08<00:48,  4.51call/s]API calls:  13%|█▎        | 33/250 [00:08<00:47,  4.56call/s]API calls:  14%|█▎        | 34/250 [00:08<00:45,  4.80call/s]API calls:  14%|█▁        | 35/250 [00:09<00:48,  4.40call/s]API calls:  14%|█▁        | 36/250 [00:09<00:44,  4.81call/s]API calls:  15%|█▁        | 37/250 [00:10<01:05,  3.24call/s]API calls:  15%|█▌        | 38/250 [00:10<00:53,  3.97call/s]API calls:  16%|█▌        | 39/250 [00:10<01:04,  3.29call/s]API calls:  16%|█▌        | 40/250 [00:10<01:00,  3.46call/s]API calls:  17%|█▋        | 42/250 [00:11<00:48,  4.25call/s]API calls:  17%|█▋        | 43/250 [00:11<00:44,  4.64call/s]API calls:  18%|█▊        | 44/250 [00:11<00:54,  3.76call/s]API calls:  18%|█▊        | 45/250 [00:11<00:47,  4.34call/s]API calls:  18%|█▊        | 46/250 [00:12<00:55,  3.67call/s]API calls:  20%|█▉        | 49/250 [00:12<00:42,  4.78call/s]API calls:  20%|██        | 50/250 [00:13<00:53,  3.73call/s]API calls:  21%|██        | 52/250 [00:13<00:43,  4.57call/s]API calls:  21%|██        | 53/250 [00:13<00:43,  4.55call/s]API calls:  22%|██▁       | 54/250 [00:13<00:45,  4.30call/s]API calls:  22%|██▁       | 55/250 [00:14<00:54,  3.59call/s]API calls:  22%|██▁       | 56/250 [00:14<00:48,  3.96call/s]API calls:  23%|██▎       | 58/250 [00:14<00:36,  5.22call/s]API calls:  24%|██▎       | 59/250 [00:15<00:43,  4.44call/s]API calls:  24%|██▁       | 60/250 [00:15<00:41,  4.55call/s]API calls:  25%|██▁       | 62/250 [00:15<00:42,  4.47call/s]API calls:  26%|██▌       | 64/250 [00:16<00:33,  5.50call/s]API calls:  26%|██▌       | 65/250 [00:16<00:46,  3.97call/s]API calls:  26%|██▋       | 66/250 [00:16<00:43,  4.26call/s]API calls:  27%|██▋       | 67/250 [00:17<00:46,  3.95call/s]API calls:  27%|██▋       | 68/250 [00:17<00:41,  4.42call/s]API calls:  28%|██▊       | 69/250 [00:17<00:37,  4.79call/s]API calls:  28%|██▊       | 70/250 [00:17<00:53,  3.37call/s]API calls:  29%|██▉       | 72/250 [00:18<00:45,  3.94call/s]API calls:  29%|██▉       | 73/250 [00:18<00:45,  3.92call/s]API calls:  30%|██▉       | 74/250 [00:18<00:38,  4.63call/s]API calls:  30%|███       | 75/250 [00:18<00:38,  4.50call/s]API calls:  30%|███       | 76/250 [00:19<00:41,  4.15call/s]API calls:  31%|███       | 77/250 [00:19<00:36,  4.70call/s]API calls:  31%|███       | 78/250 [00:19<00:49,  3.48call/s]API calls:  32%|███▁      | 79/250 [00:19<00:43,  3.97call/s]API calls:  32%|███▁      | 81/250 [00:20<00:38,  4.40call/s]API calls:  33%|███▎      | 83/250 [00:20<00:38,  4.34call/s]API calls:  34%|███▎      | 84/250 [00:20<00:36,  4.59call/s]API calls:  34%|███▁      | 85/250 [00:21<00:32,  5.03call/s]API calls:  34%|███▁      | 86/250 [00:21<00:46,  3.54call/s]API calls:  35%|███▁      | 87/250 [00:21<00:44,  3.66call/s]API calls:  35%|███▌      | 88/250 [00:22<00:42,  3.84call/s]API calls:  36%|███▌      | 90/250 [00:22<00:29,  5.38call/s]API calls:  36%|███▋      | 91/250 [00:22<00:46,  3.44call/s]API calls:  38%|███▊      | 95/250 [00:23<00:30,  5.05call/s]API calls:  38%|███▊      | 96/250 [00:23<00:33,  4.54call/s]API calls:  39%|███▉      | 97/250 [00:24<00:36,  4.21call/s]API calls:  40%|███▉      | 99/250 [00:24<00:27,  5.43call/s]API calls:  40%|████      | 100/250 [00:25<00:48,  3.11call/s]API calls:  40%|████      | 101/250 [00:25<00:40,  3.65call/s]API calls:  41%|████      | 102/250 [00:25<00:39,  3.74call/s]API calls:  41%|████      | 103/250 [00:25<00:41,  3.54call/s]API calls:  42%|████▁     | 104/250 [00:25<00:39,  3.73call/s]API calls:  42%|████▁     | 105/250 [00:26<00:38,  3.75call/s]API calls:  43%|████▎     | 107/250 [00:26<00:30,  4.70call/s]API calls:  43%|████▎     | 108/250 [00:26<00:27,  5.24call/s]API calls:  44%|████▎     | 109/250 [00:26<00:25,  5.61call/s]API calls:  44%|████▁     | 110/250 [00:27<00:38,  3.63call/s]API calls:  44%|████▁     | 111/250 [00:27<00:49,  2.79call/s]API calls:  46%|████▌     | 114/250 [00:28<00:29,  4.62call/s]API calls:  46%|████▌     | 115/250 [00:29<00:44,  3.00call/s]API calls:  47%|████▋     | 117/250 [00:29<00:30,  4.31call/s]API calls:  48%|████▊     | 119/250 [00:29<00:31,  4.16call/s]API calls:  48%|████▊     | 121/250 [00:30<00:34,  3.69call/s]API calls:  49%|████▉     | 122/250 [00:30<00:33,  3.78call/s]API calls:  50%|████▉     | 124/250 [00:30<00:26,  4.83call/s]API calls:  50%|█████     | 126/250 [00:31<00:34,  3.54call/s]API calls:  51%|█████     | 127/250 [00:31<00:33,  3.68call/s]API calls:  51%|█████     | 128/250 [00:31<00:29,  4.16call/s]API calls:  52%|█████▁    | 129/250 [00:32<00:25,  4.78call/s]API calls:  52%|█████▁    | 130/250 [00:32<00:32,  3.71call/s]
  FixedTurnsStopping:  20%|██        | 1/5 [00:32<02:10, 32.52s/it][A
  FixedTurnsStopping:  20%|██        | 1/5 [00:32<02:10, 32.52s/it, acc=0%, turns=10.0][AAPI calls:  52%|█████▁    | 131/250 [00:32<00:28,  4.18call/s]API calls:  53%|█████▎    | 132/250 [00:32<00:27,  4.29call/s]API calls:  54%|█████▎    | 134/250 [00:32<00:17,  6.54call/s]API calls:  54%|█████▁    | 135/250 [00:33<00:34,  3.32call/s]
  FixedTurnsStopping:  40%|████      | 2/5 [00:33<00:42, 14.12s/it, acc=0%, turns=10.0][A
  FixedTurnsStopping:  40%|████      | 2/5 [00:33<00:42, 14.12s/it, acc=0%, turns=10.0][AAPI calls:  54%|█████▁    | 136/250 [00:33<00:29,  3.87call/s]
  FixedTurnsStopping:  60%|██████    | 3/5 [00:33<00:15,  7.73s/it, acc=0%, turns=10.0][A
  FixedTurnsStopping:  60%|██████    | 3/5 [00:33<00:15,  7.73s/it, acc=0%, turns=10.0][AAPI calls:  55%|█████▌    | 138/250 [00:34<00:30,  3.73call/s]API calls:  56%|█████▌    | 139/250 [00:35<00:38,  2.91call/s]
  FixedTurnsStopping:  80%|████████  | 4/5 [00:35<00:05,  5.14s/it, acc=0%, turns=10.0][A
  FixedTurnsStopping:  80%|████████  | 4/5 [00:35<00:05,  5.14s/it, acc=0%, turns=10.0][AAPI calls:  56%|█████▌    | 140/250 [00:35<00:37,  2.92call/s]
  FixedTurnsStopping: 100%|██████████| 5/5 [00:35<00:00,  3.41s/it, acc=0%, turns=10.0][A
  FixedTurnsStopping: 100%|██████████| 5/5 [00:35<00:00,  3.41s/it, acc=20%, turns=10.0][A
                                                                                        [AAPI calls:  56%|█████▌    | 140/250 [00:35<00:27,  3.95call/s]
  Results: Accuracy=20.00% [0.00%, 60.00%], Avg Turns=10.0 [10.0, 10.0]

==========================================================================================
COMPARISON RESULTS
==========================================================================================
Method                      Accuracy           95% CI  Avg Turns           95% CI
------------------------------------------------------------------------------------------
FixedTurnsStopping            20.00%   [0.00%,60.00%]       10.0      [10.0,10.0]
==========================================================================================

Total API usage:
  Prompt tokens: 150,504
  Completion tokens: 1,857
  Total tokens: 152,361
