
============================================================
RRMC Experiment: dc_methods/dqs_mi_only
============================================================
Initializing LLM: qwen/qwen-2.5-7b-instruct (max_workers=32)
Task: detective_cases
Data: /root/RRMC/AR-Bench/data/dc/test.json
DQS question selection (LLM-eval): M=5
Loading weights:   0%|          | 0/103 [00:00<?, ?it/s]Loading weights:   1%|          | 1/103 [00:00<00:00, 21732.15it/s, Materializing param=embeddings.LayerNorm.bias]Loading weights:   1%|          | 1/103 [00:00<00:00, 4387.35it/s, Materializing param=embeddings.LayerNorm.bias] Loading weights:   2%|▁         | 2/103 [00:00<00:00, 5526.09it/s, Materializing param=embeddings.LayerNorm.weight]Loading weights:   2%|▁         | 2/103 [00:00<00:00, 4234.53it/s, Materializing param=embeddings.LayerNorm.weight]Loading weights:   3%|▎         | 3/103 [00:00<00:00, 4327.00it/s, Materializing param=embeddings.position_embeddings.weight]Loading weights:   3%|▎         | 3/103 [00:00<00:00, 3165.51it/s, Materializing param=embeddings.position_embeddings.weight]Loading weights:   4%|▁         | 4/103 [00:00<00:00, 2360.66it/s, Materializing param=embeddings.token_type_embeddings.weight]Loading weights:   4%|▁         | 4/103 [00:00<00:00, 1762.68it/s, Materializing param=embeddings.token_type_embeddings.weight]Loading weights:   5%|▁         | 5/103 [00:00<00:00, 1955.75it/s, Materializing param=embeddings.word_embeddings.weight]      Loading weights:   5%|▁         | 5/103 [00:00<00:00, 1912.59it/s, Materializing param=embeddings.word_embeddings.weight]Loading weights:   6%|▌         | 6/103 [00:00<00:00, 2215.30it/s, Materializing param=encoder.layer.0.attention.output.LayerNorm.bias]Loading weights:   6%|▌         | 6/103 [00:00<00:00, 2008.93it/s, Materializing param=encoder.layer.0.attention.output.LayerNorm.bias]Loading weights:   7%|▋         | 7/103 [00:00<00:00, 2245.34it/s, Materializing param=encoder.layer.0.attention.output.LayerNorm.weight]Loading weights:   7%|▋         | 7/103 [00:00<00:00, 1911.22it/s, Materializing param=encoder.layer.0.attention.output.LayerNorm.weight]Loading weights:   8%|▊         | 8/103 [00:00<00:00, 2040.03it/s, Materializing param=encoder.layer.0.attention.output.dense.bias]      Loading weights:   8%|▊         | 8/103 [00:00<00:00, 1906.83it/s, Materializing param=encoder.layer.0.attention.output.dense.bias]Loading weights:   9%|▊         | 9/103 [00:00<00:00, 2034.31it/s, Materializing param=encoder.layer.0.attention.output.dense.weight]Loading weights:   9%|▊         | 9/103 [00:00<00:00, 1968.23it/s, Materializing param=encoder.layer.0.attention.output.dense.weight]Loading weights:  10%|▉         | 10/103 [00:00<00:00, 2047.60it/s, Materializing param=encoder.layer.0.attention.self.key.bias]     Loading weights:  10%|▉         | 10/103 [00:00<00:00, 1946.04it/s, Materializing param=encoder.layer.0.attention.self.key.bias]Loading weights:  11%|█         | 11/103 [00:00<00:00, 1985.26it/s, Materializing param=encoder.layer.0.attention.self.key.weight]Loading weights:  11%|█         | 11/103 [00:00<00:00, 1923.91it/s, Materializing param=encoder.layer.0.attention.self.key.weight]Loading weights:  12%|█▁        | 12/103 [00:00<00:00, 2047.50it/s, Materializing param=encoder.layer.0.attention.self.query.bias]Loading weights:  12%|█▁        | 12/103 [00:00<00:00, 2028.77it/s, Materializing param=encoder.layer.0.attention.self.query.bias]Loading weights:  13%|█▎        | 13/103 [00:00<00:00, 2094.41it/s, Materializing param=encoder.layer.0.attention.self.query.weight]Loading weights:  13%|█▎        | 13/103 [00:00<00:00, 2076.23it/s, Materializing param=encoder.layer.0.attention.self.query.weight]Loading weights:  14%|█▎        | 14/103 [00:00<00:00, 2162.01it/s, Materializing param=encoder.layer.0.attention.self.value.bias]  Loading weights:  14%|█▎        | 14/103 [00:00<00:00, 2140.89it/s, Materializing param=encoder.layer.0.attention.self.value.bias]Loading weights:  15%|█▁        | 15/103 [00:00<00:00, 2206.60it/s, Materializing param=encoder.layer.0.attention.self.value.weight]Loading weights:  15%|█▁        | 15/103 [00:00<00:00, 2170.14it/s, Materializing param=encoder.layer.0.attention.self.value.weight]Loading weights:  16%|█▌        | 16/103 [00:00<00:00, 2081.41it/s, Materializing param=encoder.layer.0.intermediate.dense.bias]    Loading weights:  16%|█▌        | 16/103 [00:00<00:00, 2023.67it/s, Materializing param=encoder.layer.0.intermediate.dense.bias]Loading weights:  17%|█▋        | 17/103 [00:00<00:00, 2087.27it/s, Materializing param=encoder.layer.0.intermediate.dense.weight]Loading weights:  17%|█▋        | 17/103 [00:00<00:00, 2045.71it/s, Materializing param=encoder.layer.0.intermediate.dense.weight]Loading weights:  17%|█▋        | 18/103 [00:00<00:00, 2054.91it/s, Materializing param=encoder.layer.0.output.LayerNorm.bias]    Loading weights:  17%|█▋        | 18/103 [00:00<00:00, 2020.49it/s, Materializing param=encoder.layer.0.output.LayerNorm.bias]Loading weights:  18%|█▊        | 19/103 [00:00<00:00, 2043.48it/s, Materializing param=encoder.layer.0.output.LayerNorm.weight]Loading weights:  18%|█▊        | 19/103 [00:00<00:00, 1990.30it/s, Materializing param=encoder.layer.0.output.LayerNorm.weight]Loading weights:  19%|█▉        | 20/103 [00:00<00:00, 2058.15it/s, Materializing param=encoder.layer.0.output.dense.bias]      Loading weights:  19%|█▉        | 20/103 [00:00<00:00, 2036.91it/s, Materializing param=encoder.layer.0.output.dense.bias]Loading weights:  20%|██        | 21/103 [00:00<00:00, 2111.33it/s, Materializing param=encoder.layer.0.output.dense.weight]Loading weights:  20%|██        | 21/103 [00:00<00:00, 2093.91it/s, Materializing param=encoder.layer.0.output.dense.weight]Loading weights:  21%|██▁       | 22/103 [00:00<00:00, 2168.82it/s, Materializing param=encoder.layer.1.attention.output.LayerNorm.bias]Loading weights:  21%|██▁       | 22/103 [00:00<00:00, 2156.96it/s, Materializing param=encoder.layer.1.attention.output.LayerNorm.bias]Loading weights:  22%|██▁       | 23/103 [00:00<00:00, 2231.32it/s, Materializing param=encoder.layer.1.attention.output.LayerNorm.weight]Loading weights:  22%|██▁       | 23/103 [00:00<00:00, 2219.41it/s, Materializing param=encoder.layer.1.attention.output.LayerNorm.weight]Loading weights:  23%|██▎       | 24/103 [00:00<00:00, 2292.65it/s, Materializing param=encoder.layer.1.attention.output.dense.bias]      Loading weights:  23%|██▎       | 24/103 [00:00<00:00, 2278.22it/s, Materializing param=encoder.layer.1.attention.output.dense.bias]Loading weights:  24%|██▁       | 25/103 [00:00<00:00, 2348.75it/s, Materializing param=encoder.layer.1.attention.output.dense.weight]Loading weights:  24%|██▁       | 25/103 [00:00<00:00, 2336.45it/s, Materializing param=encoder.layer.1.attention.output.dense.weight]Loading weights:  25%|██▌       | 26/103 [00:00<00:00, 2404.30it/s, Materializing param=encoder.layer.1.attention.self.key.bias]      Loading weights:  25%|██▌       | 26/103 [00:00<00:00, 2392.17it/s, Materializing param=encoder.layer.1.attention.self.key.bias]Loading weights:  26%|██▌       | 27/103 [00:00<00:00, 2460.11it/s, Materializing param=encoder.layer.1.attention.self.key.weight]Loading weights:  26%|██▌       | 27/103 [00:00<00:00, 2448.09it/s, Materializing param=encoder.layer.1.attention.self.key.weight]Loading weights:  27%|██▋       | 28/103 [00:00<00:00, 2515.00it/s, Materializing param=encoder.layer.1.attention.self.query.bias]Loading weights:  27%|██▋       | 28/103 [00:00<00:00, 2502.89it/s, Materializing param=encoder.layer.1.attention.self.query.bias]Loading weights:  28%|██▊       | 29/103 [00:00<00:00, 2568.52it/s, Materializing param=encoder.layer.1.attention.self.query.weight]Loading weights:  28%|██▊       | 29/103 [00:00<00:00, 2556.27it/s, Materializing param=encoder.layer.1.attention.self.query.weight]Loading weights:  29%|██▉       | 30/103 [00:00<00:00, 2620.84it/s, Materializing param=encoder.layer.1.attention.self.value.bias]  Loading weights:  29%|██▉       | 30/103 [00:00<00:00, 2603.76it/s, Materializing param=encoder.layer.1.attention.self.value.bias]Loading weights:  30%|███       | 31/103 [00:00<00:00, 2664.14it/s, Materializing param=encoder.layer.1.attention.self.value.weight]Loading weights:  30%|███       | 31/103 [00:00<00:00, 2651.48it/s, Materializing param=encoder.layer.1.attention.self.value.weight]Loading weights:  31%|███       | 32/103 [00:00<00:00, 2712.78it/s, Materializing param=encoder.layer.1.intermediate.dense.bias]    Loading weights:  31%|███       | 32/103 [00:00<00:00, 2700.01it/s, Materializing param=encoder.layer.1.intermediate.dense.bias]Loading weights:  32%|███▁      | 33/103 [00:00<00:00, 2760.02it/s, Materializing param=encoder.layer.1.intermediate.dense.weight]Loading weights:  32%|███▁      | 33/103 [00:00<00:00, 2747.63it/s, Materializing param=encoder.layer.1.intermediate.dense.weight]Loading weights:  33%|███▎      | 34/103 [00:00<00:00, 2807.60it/s, Materializing param=encoder.layer.1.output.LayerNorm.bias]    Loading weights:  33%|███▎      | 34/103 [00:00<00:00, 2795.16it/s, Materializing param=encoder.layer.1.output.LayerNorm.bias]Loading weights:  34%|███▁      | 35/103 [00:00<00:00, 2853.55it/s, Materializing param=encoder.layer.1.output.LayerNorm.weight]Loading weights:  34%|███▁      | 35/103 [00:00<00:00, 2841.45it/s, Materializing param=encoder.layer.1.output.LayerNorm.weight]Loading weights:  35%|███▁      | 36/103 [00:00<00:00, 2899.46it/s, Materializing param=encoder.layer.1.output.dense.bias]      Loading weights:  35%|███▁      | 36/103 [00:00<00:00, 2887.09it/s, Materializing param=encoder.layer.1.output.dense.bias]Loading weights:  36%|███▌      | 37/103 [00:00<00:00, 2940.75it/s, Materializing param=encoder.layer.1.output.dense.weight]Loading weights:  36%|███▌      | 37/103 [00:00<00:00, 2928.26it/s, Materializing param=encoder.layer.1.output.dense.weight]Loading weights:  37%|███▋      | 38/103 [00:00<00:00, 2983.98it/s, Materializing param=encoder.layer.2.attention.output.LayerNorm.bias]Loading weights:  37%|███▋      | 38/103 [00:00<00:00, 2971.36it/s, Materializing param=encoder.layer.2.attention.output.LayerNorm.bias]Loading weights:  38%|███▊      | 39/103 [00:00<00:00, 3025.19it/s, Materializing param=encoder.layer.2.attention.output.LayerNorm.weight]Loading weights:  38%|███▊      | 39/103 [00:00<00:00, 3012.48it/s, Materializing param=encoder.layer.2.attention.output.LayerNorm.weight]Loading weights:  39%|███▉      | 40/103 [00:00<00:00, 3065.34it/s, Materializing param=encoder.layer.2.attention.output.dense.bias]      Loading weights:  39%|███▉      | 40/103 [00:00<00:00, 3052.85it/s, Materializing param=encoder.layer.2.attention.output.dense.bias]Loading weights:  40%|███▉      | 41/103 [00:00<00:00, 3104.76it/s, Materializing param=encoder.layer.2.attention.output.dense.weight]Loading weights:  40%|███▉      | 41/103 [00:00<00:00, 3091.53it/s, Materializing param=encoder.layer.2.attention.output.dense.weight]Loading weights:  41%|████      | 42/103 [00:00<00:00, 3140.23it/s, Materializing param=encoder.layer.2.attention.self.key.bias]      Loading weights:  41%|████      | 42/103 [00:00<00:00, 3127.63it/s, Materializing param=encoder.layer.2.attention.self.key.bias]Loading weights:  42%|████▁     | 43/103 [00:00<00:00, 3175.88it/s, Materializing param=encoder.layer.2.attention.self.key.weight]Loading weights:  42%|████▁     | 43/103 [00:00<00:00, 3161.96it/s, Materializing param=encoder.layer.2.attention.self.key.weight]Loading weights:  43%|████▎     | 44/103 [00:00<00:00, 3211.12it/s, Materializing param=encoder.layer.2.attention.self.query.bias]Loading weights:  43%|████▎     | 44/103 [00:00<00:00, 3198.71it/s, Materializing param=encoder.layer.2.attention.self.query.bias]Loading weights:  44%|████▎     | 45/103 [00:00<00:00, 3245.53it/s, Materializing param=encoder.layer.2.attention.self.query.weight]Loading weights:  44%|████▎     | 45/103 [00:00<00:00, 3232.96it/s, Materializing param=encoder.layer.2.attention.self.query.weight]Loading weights:  45%|████▁     | 46/103 [00:00<00:00, 3280.64it/s, Materializing param=encoder.layer.2.attention.self.value.bias]  Loading weights:  45%|████▁     | 46/103 [00:00<00:00, 3267.98it/s, Materializing param=encoder.layer.2.attention.self.value.bias]Loading weights:  46%|████▌     | 47/103 [00:00<00:00, 3314.76it/s, Materializing param=encoder.layer.2.attention.self.value.weight]Loading weights:  46%|████▌     | 47/103 [00:00<00:00, 3302.32it/s, Materializing param=encoder.layer.2.attention.self.value.weight]Loading weights:  47%|████▋     | 48/103 [00:00<00:00, 3348.52it/s, Materializing param=encoder.layer.2.intermediate.dense.bias]    Loading weights:  47%|████▋     | 48/103 [00:00<00:00, 3336.15it/s, Materializing param=encoder.layer.2.intermediate.dense.bias]Loading weights:  48%|████▊     | 49/103 [00:00<00:00, 3380.56it/s, Materializing param=encoder.layer.2.intermediate.dense.weight]Loading weights:  48%|████▊     | 49/103 [00:00<00:00, 3366.88it/s, Materializing param=encoder.layer.2.intermediate.dense.weight]Loading weights:  49%|████▊     | 50/103 [00:00<00:00, 3411.56it/s, Materializing param=encoder.layer.2.output.LayerNorm.bias]    Loading weights:  49%|████▊     | 50/103 [00:00<00:00, 3399.50it/s, Materializing param=encoder.layer.2.output.LayerNorm.bias]Loading weights:  50%|████▉     | 51/103 [00:00<00:00, 3444.49it/s, Materializing param=encoder.layer.2.output.LayerNorm.weight]Loading weights:  50%|████▉     | 51/103 [00:00<00:00, 3432.11it/s, Materializing param=encoder.layer.2.output.LayerNorm.weight]Loading weights:  50%|█████     | 52/103 [00:00<00:00, 3476.31it/s, Materializing param=encoder.layer.2.output.dense.bias]      Loading weights:  50%|█████     | 52/103 [00:00<00:00, 3464.55it/s, Materializing param=encoder.layer.2.output.dense.bias]Loading weights:  51%|█████▁    | 53/103 [00:00<00:00, 3508.60it/s, Materializing param=encoder.layer.2.output.dense.weight]Loading weights:  51%|█████▁    | 53/103 [00:00<00:00, 3496.35it/s, Materializing param=encoder.layer.2.output.dense.weight]Loading weights:  52%|█████▁    | 54/103 [00:00<00:00, 3539.39it/s, Materializing param=encoder.layer.3.attention.output.LayerNorm.bias]Loading weights:  52%|█████▁    | 54/103 [00:00<00:00, 3525.83it/s, Materializing param=encoder.layer.3.attention.output.LayerNorm.bias]Loading weights:  53%|█████▎    | 55/103 [00:00<00:00, 3567.08it/s, Materializing param=encoder.layer.3.attention.output.LayerNorm.weight]Loading weights:  53%|█████▎    | 55/103 [00:00<00:00, 3554.49it/s, Materializing param=encoder.layer.3.attention.output.LayerNorm.weight]Loading weights:  54%|█████▁    | 56/103 [00:00<00:00, 3591.95it/s, Materializing param=encoder.layer.3.attention.output.dense.bias]      Loading weights:  54%|█████▁    | 56/103 [00:00<00:00, 3579.30it/s, Materializing param=encoder.layer.3.attention.output.dense.bias]Loading weights:  55%|█████▌    | 57/103 [00:00<00:00, 3619.67it/s, Materializing param=encoder.layer.3.attention.output.dense.weight]Loading weights:  55%|█████▌    | 57/103 [00:00<00:00, 3607.65it/s, Materializing param=encoder.layer.3.attention.output.dense.weight]Loading weights:  56%|█████▋    | 58/103 [00:00<00:00, 3647.60it/s, Materializing param=encoder.layer.3.attention.self.key.bias]      Loading weights:  56%|█████▋    | 58/103 [00:00<00:00, 3635.45it/s, Materializing param=encoder.layer.3.attention.self.key.bias]Loading weights:  57%|█████▋    | 59/103 [00:00<00:00, 3674.73it/s, Materializing param=encoder.layer.3.attention.self.key.weight]Loading weights:  57%|█████▋    | 59/103 [00:00<00:00, 3661.36it/s, Materializing param=encoder.layer.3.attention.self.key.weight]Loading weights:  58%|█████▊    | 60/103 [00:00<00:00, 3699.55it/s, Materializing param=encoder.layer.3.attention.self.query.bias]Loading weights:  58%|█████▊    | 60/103 [00:00<00:00, 3687.73it/s, Materializing param=encoder.layer.3.attention.self.query.bias]Loading weights:  59%|█████▉    | 61/103 [00:00<00:00, 3726.15it/s, Materializing param=encoder.layer.3.attention.self.query.weight]Loading weights:  59%|█████▉    | 61/103 [00:00<00:00, 3714.20it/s, Materializing param=encoder.layer.3.attention.self.query.weight]Loading weights:  60%|██████    | 62/103 [00:00<00:00, 3750.32it/s, Materializing param=encoder.layer.3.attention.self.value.bias]  Loading weights:  60%|██████    | 62/103 [00:00<00:00, 3737.16it/s, Materializing param=encoder.layer.3.attention.self.value.bias]Loading weights:  61%|██████    | 63/103 [00:00<00:00, 3774.28it/s, Materializing param=encoder.layer.3.attention.self.value.weight]Loading weights:  61%|██████    | 63/103 [00:00<00:00, 3762.46it/s, Materializing param=encoder.layer.3.attention.self.value.weight]Loading weights:  62%|██████▁   | 64/103 [00:00<00:00, 3799.51it/s, Materializing param=encoder.layer.3.intermediate.dense.bias]    Loading weights:  62%|██████▁   | 64/103 [00:00<00:00, 3787.24it/s, Materializing param=encoder.layer.3.intermediate.dense.bias]Loading weights:  63%|██████▎   | 65/103 [00:00<00:00, 3824.45it/s, Materializing param=encoder.layer.3.intermediate.dense.weight]Loading weights:  63%|██████▎   | 65/103 [00:00<00:00, 3812.63it/s, Materializing param=encoder.layer.3.intermediate.dense.weight]Loading weights:  64%|██████▁   | 66/103 [00:00<00:00, 3848.89it/s, Materializing param=encoder.layer.3.output.LayerNorm.bias]    Loading weights:  64%|██████▁   | 66/103 [00:00<00:00, 3837.05it/s, Materializing param=encoder.layer.3.output.LayerNorm.bias]Loading weights:  65%|██████▌   | 67/103 [00:00<00:00, 3872.75it/s, Materializing param=encoder.layer.3.output.LayerNorm.weight]Loading weights:  65%|██████▌   | 67/103 [00:00<00:00, 3861.26it/s, Materializing param=encoder.layer.3.output.LayerNorm.weight]Loading weights:  66%|██████▌   | 68/103 [00:00<00:00, 3894.91it/s, Materializing param=encoder.layer.3.output.dense.bias]      Loading weights:  66%|██████▌   | 68/103 [00:00<00:00, 3880.55it/s, Materializing param=encoder.layer.3.output.dense.bias]Loading weights:  67%|██████▋   | 69/103 [00:00<00:00, 3914.93it/s, Materializing param=encoder.layer.3.output.dense.weight]Loading weights:  67%|██████▋   | 69/103 [00:00<00:00, 3903.47it/s, Materializing param=encoder.layer.3.output.dense.weight]Loading weights:  68%|██████▊   | 70/103 [00:00<00:00, 3938.68it/s, Materializing param=encoder.layer.4.attention.output.LayerNorm.bias]Loading weights:  68%|██████▊   | 70/103 [00:00<00:00, 3927.04it/s, Materializing param=encoder.layer.4.attention.output.LayerNorm.bias]Loading weights:  69%|██████▉   | 71/103 [00:00<00:00, 3960.89it/s, Materializing param=encoder.layer.4.attention.output.LayerNorm.weight]Loading weights:  69%|██████▉   | 71/103 [00:00<00:00, 3948.97it/s, Materializing param=encoder.layer.4.attention.output.LayerNorm.weight]Loading weights:  70%|██████▉   | 72/103 [00:00<00:00, 3982.14it/s, Materializing param=encoder.layer.4.attention.output.dense.bias]      Loading weights:  70%|██████▉   | 72/103 [00:00<00:00, 3970.42it/s, Materializing param=encoder.layer.4.attention.output.dense.bias]Loading weights:  71%|███████   | 73/103 [00:00<00:00, 4003.51it/s, Materializing param=encoder.layer.4.attention.output.dense.weight]Loading weights:  71%|███████   | 73/103 [00:00<00:00, 3990.51it/s, Materializing param=encoder.layer.4.attention.output.dense.weight]Loading weights:  72%|███████▁  | 74/103 [00:00<00:00, 4022.27it/s, Materializing param=encoder.layer.4.attention.self.key.bias]      Loading weights:  72%|███████▁  | 74/103 [00:00<00:00, 4010.58it/s, Materializing param=encoder.layer.4.attention.self.key.bias]Loading weights:  73%|███████▎  | 75/103 [00:00<00:00, 4039.61it/s, Materializing param=encoder.layer.4.attention.self.key.weight]Loading weights:  73%|███████▎  | 75/103 [00:00<00:00, 4027.82it/s, Materializing param=encoder.layer.4.attention.self.key.weight]Loading weights:  74%|███████▁  | 76/103 [00:00<00:00, 4059.74it/s, Materializing param=encoder.layer.4.attention.self.query.bias]Loading weights:  74%|███████▁  | 76/103 [00:00<00:00, 4048.45it/s, Materializing param=encoder.layer.4.attention.self.query.bias]Loading weights:  75%|███████▁  | 77/103 [00:00<00:00, 4079.91it/s, Materializing param=encoder.layer.4.attention.self.query.weight]Loading weights:  75%|███████▁  | 77/103 [00:00<00:00, 4068.45it/s, Materializing param=encoder.layer.4.attention.self.query.weight]Loading weights:  76%|███████▌  | 78/103 [00:00<00:00, 4099.80it/s, Materializing param=encoder.layer.4.attention.self.value.bias]  Loading weights:  76%|███████▌  | 78/103 [00:00<00:00, 4088.48it/s, Materializing param=encoder.layer.4.attention.self.value.bias]Loading weights:  77%|███████▋  | 79/103 [00:00<00:00, 4119.27it/s, Materializing param=encoder.layer.4.attention.self.value.weight]Loading weights:  77%|███████▋  | 79/103 [00:00<00:00, 4107.88it/s, Materializing param=encoder.layer.4.attention.self.value.weight]Loading weights:  78%|███████▊  | 80/103 [00:00<00:00, 4138.33it/s, Materializing param=encoder.layer.4.intermediate.dense.bias]    Loading weights:  78%|███████▊  | 80/103 [00:00<00:00, 4126.83it/s, Materializing param=encoder.layer.4.intermediate.dense.bias]Loading weights:  79%|███████▊  | 81/103 [00:00<00:00, 4157.50it/s, Materializing param=encoder.layer.4.intermediate.dense.weight]Loading weights:  79%|███████▊  | 81/103 [00:00<00:00, 4144.27it/s, Materializing param=encoder.layer.4.intermediate.dense.weight]Loading weights:  80%|███████▉  | 82/103 [00:00<00:00, 4173.23it/s, Materializing param=encoder.layer.4.output.LayerNorm.bias]    Loading weights:  80%|███████▉  | 82/103 [00:00<00:00, 4162.02it/s, Materializing param=encoder.layer.4.output.LayerNorm.bias]Loading weights:  81%|████████  | 83/103 [00:00<00:00, 4190.52it/s, Materializing param=encoder.layer.4.output.LayerNorm.weight]Loading weights:  81%|████████  | 83/103 [00:00<00:00, 4179.15it/s, Materializing param=encoder.layer.4.output.LayerNorm.weight]Loading weights:  82%|████████▁ | 84/103 [00:00<00:00, 4208.58it/s, Materializing param=encoder.layer.4.output.dense.bias]      Loading weights:  82%|████████▁ | 84/103 [00:00<00:00, 4197.40it/s, Materializing param=encoder.layer.4.output.dense.bias]Loading weights:  83%|████████▎ | 85/103 [00:00<00:00, 4226.63it/s, Materializing param=encoder.layer.4.output.dense.weight]Loading weights:  83%|████████▎ | 85/103 [00:00<00:00, 4215.58it/s, Materializing param=encoder.layer.4.output.dense.weight]Loading weights:  83%|████████▎ | 86/103 [00:00<00:00, 4244.35it/s, Materializing param=encoder.layer.5.attention.output.LayerNorm.bias]Loading weights:  83%|████████▎ | 86/103 [00:00<00:00, 4233.24it/s, Materializing param=encoder.layer.5.attention.output.LayerNorm.bias]Loading weights:  84%|████████▁ | 87/103 [00:00<00:00, 4261.06it/s, Materializing param=encoder.layer.5.attention.output.LayerNorm.weight]Loading weights:  84%|████████▁ | 87/103 [00:00<00:00, 4248.46it/s, Materializing param=encoder.layer.5.attention.output.LayerNorm.weight]Loading weights:  85%|████████▌ | 88/103 [00:00<00:00, 4271.53it/s, Materializing param=encoder.layer.5.attention.output.dense.bias]      Loading weights:  85%|████████▌ | 88/103 [00:00<00:00, 4260.04it/s, Materializing param=encoder.layer.5.attention.output.dense.bias]Loading weights:  86%|████████▋ | 89/103 [00:00<00:00, 4287.03it/s, Materializing param=encoder.layer.5.attention.output.dense.weight]Loading weights:  86%|████████▋ | 89/103 [00:00<00:00, 4275.93it/s, Materializing param=encoder.layer.5.attention.output.dense.weight]Loading weights:  87%|████████▋ | 90/103 [00:00<00:00, 4302.83it/s, Materializing param=encoder.layer.5.attention.self.key.bias]      Loading weights:  87%|████████▋ | 90/103 [00:00<00:00, 4291.87it/s, Materializing param=encoder.layer.5.attention.self.key.bias]Loading weights:  88%|████████▊ | 91/103 [00:00<00:00, 4318.45it/s, Materializing param=encoder.layer.5.attention.self.key.weight]Loading weights:  88%|████████▊ | 91/103 [00:00<00:00, 4307.53it/s, Materializing param=encoder.layer.5.attention.self.key.weight]Loading weights:  89%|████████▉ | 92/103 [00:00<00:00, 4334.22it/s, Materializing param=encoder.layer.5.attention.self.query.bias]Loading weights:  89%|████████▉ | 92/103 [00:00<00:00, 4323.39it/s, Materializing param=encoder.layer.5.attention.self.query.bias]Loading weights:  90%|█████████ | 93/103 [00:00<00:00, 4349.92it/s, Materializing param=encoder.layer.5.attention.self.query.weight]Loading weights:  90%|█████████ | 93/103 [00:00<00:00, 4338.79it/s, Materializing param=encoder.layer.5.attention.self.query.weight]Loading weights:  91%|█████████▁| 94/103 [00:00<00:00, 4362.59it/s, Materializing param=encoder.layer.5.attention.self.value.bias]  Loading weights:  91%|█████████▁| 94/103 [00:00<00:00, 4351.08it/s, Materializing param=encoder.layer.5.attention.self.value.bias]Loading weights:  92%|█████████▁| 95/103 [00:00<00:00, 4376.41it/s, Materializing param=encoder.layer.5.attention.self.value.weight]Loading weights:  92%|█████████▁| 95/103 [00:00<00:00, 4365.52it/s, Materializing param=encoder.layer.5.attention.self.value.weight]Loading weights:  93%|█████████▎| 96/103 [00:00<00:00, 4391.03it/s, Materializing param=encoder.layer.5.intermediate.dense.bias]    Loading weights:  93%|█████████▎| 96/103 [00:00<00:00, 4380.43it/s, Materializing param=encoder.layer.5.intermediate.dense.bias]Loading weights:  94%|█████████▁| 97/103 [00:00<00:00, 4406.35it/s, Materializing param=encoder.layer.5.intermediate.dense.weight]Loading weights:  94%|█████████▁| 97/103 [00:00<00:00, 4395.88it/s, Materializing param=encoder.layer.5.intermediate.dense.weight]Loading weights:  95%|█████████▌| 98/103 [00:00<00:00, 4420.90it/s, Materializing param=encoder.layer.5.output.LayerNorm.bias]    Loading weights:  95%|█████████▌| 98/103 [00:00<00:00, 4410.08it/s, Materializing param=encoder.layer.5.output.LayerNorm.bias]Loading weights:  96%|█████████▌| 99/103 [00:00<00:00, 4435.62it/s, Materializing param=encoder.layer.5.output.LayerNorm.weight]Loading weights:  96%|█████████▌| 99/103 [00:00<00:00, 4425.31it/s, Materializing param=encoder.layer.5.output.LayerNorm.weight]Loading weights:  97%|█████████▋| 100/103 [00:00<00:00, 4450.95it/s, Materializing param=encoder.layer.5.output.dense.bias]     Loading weights:  97%|█████████▋| 100/103 [00:00<00:00, 4438.37it/s, Materializing param=encoder.layer.5.output.dense.bias]Loading weights:  98%|█████████▊| 101/103 [00:00<00:00, 4461.37it/s, Materializing param=encoder.layer.5.output.dense.weight]Loading weights:  98%|█████████▊| 101/103 [00:00<00:00, 4450.91it/s, Materializing param=encoder.layer.5.output.dense.weight]Loading weights:  99%|█████████▉| 102/103 [00:00<00:00, 4475.70it/s, Materializing param=pooler.dense.bias]                  Loading weights:  99%|█████████▉| 102/103 [00:00<00:00, 4465.61it/s, Materializing param=pooler.dense.bias]Loading weights: 100%|██████████| 103/103 [00:00<00:00, 4491.81it/s, Materializing param=pooler.dense.weight]Loading weights: 100%|██████████| 103/103 [00:00<00:00, 4481.93it/s, Materializing param=pooler.dense.weight]Loading weights: 100%|██████████| 103/103 [00:00<00:00, 4461.15it/s, Materializing param=pooler.dense.weight]
[1mBertModel LOAD REPORT[0m from: sentence-transformers/all-MiniLM-L6-v2
Key                     | Status     |  | 
------------------------+------------+--+-
embeddings.position_ids | UNEXPECTED |  | 

[3mNotes:
- UNEXPECTED[3m	:can be ignored when loading from different task/architecture; not ok if you expect identical arch.[0m
Warning: You are sending unauthenticated requests to the HF Hub. Please set a HF_TOKEN to enable higher rate limits and faster downloads.
API calls:   0%|          | 0/250 [00:00<?, ?call/s]Evaluating 5 puzzles
Methods: ['mi_only']

============================================================
STARTING EVALUATION
============================================================

Evaluating MIOnlyStopping on 5 puzzles...

  MIOnlyStopping:   0%|          | 0/5 [00:00<?, ?it/s][AAPI calls:   0%|          | 1/250 [00:02<09:32,  2.30s/call]API calls:   1%|          | 2/250 [00:02<04:14,  1.02s/call]API calls:   1%|          | 3/250 [00:06<10:27,  2.54s/call]API calls:   2%|▁         | 4/250 [00:06<06:36,  1.61s/call]API calls:   2%|▁         | 6/250 [00:07<03:11,  1.27call/s]API calls:   4%|▁         | 10/250 [00:07<01:20,  2.97call/s]API calls:   5%|▁         | 12/250 [00:07<00:59,  3.99call/s]API calls:   6%|▋         | 16/250 [00:07<00:34,  6.82call/s]API calls:   8%|▊         | 19/250 [00:08<00:59,  3.89call/s]API calls:   8%|▊         | 21/250 [00:11<01:56,  1.97call/s]API calls:  12%|█▁        | 31/250 [00:14<01:25,  2.56call/s]API calls:  13%|█▎        | 32/250 [00:15<01:35,  2.29call/s]API calls:  13%|█▎        | 33/250 [00:16<01:53,  1.91call/s]API calls:  14%|█▎        | 34/250 [00:17<01:56,  1.85call/s]API calls:  14%|█▁        | 36/250 [00:17<01:27,  2.45call/s]API calls:  15%|█▁        | 37/250 [00:17<01:23,  2.56call/s]API calls:  16%|█▌        | 40/250 [00:18<00:52,  4.00call/s]API calls:  17%|█▋        | 43/250 [00:18<00:39,  5.19call/s]API calls:  18%|█▊        | 46/250 [00:18<00:28,  7.25call/s]API calls:  20%|█▉        | 49/250 [00:18<00:21,  9.22call/s]API calls:  21%|██        | 52/250 [00:19<00:25,  7.65call/s]API calls:  22%|██▁       | 54/250 [00:21<01:08,  2.88call/s]API calls:  22%|██▁       | 56/250 [00:22<01:22,  2.35call/s]
  MIOnlyStopping:  20%|██        | 1/5 [00:22<01:30, 22.71s/it][A
  MIOnlyStopping:  20%|██        | 1/5 [00:22<01:30, 22.71s/it, acc=0%, turns=1.0][AAPI calls:  24%|██▎       | 59/250 [00:22<00:55,  3.45call/s]
  MIOnlyStopping:  40%|████      | 2/5 [00:22<01:08, 22.71s/it, acc=0%, turns=1.0][AAPI calls:  24%|██▁       | 61/250 [00:23<00:52,  3.58call/s]API calls:  25%|██▌       | 63/250 [00:23<00:56,  3.33call/s]API calls:  26%|██▋       | 66/250 [00:24<00:48,  3.80call/s]API calls:  27%|██▋       | 67/250 [00:24<00:46,  3.98call/s]API calls:  28%|██▊       | 70/250 [00:25<00:35,  5.05call/s]API calls:  29%|██▉       | 72/250 [00:25<00:33,  5.33call/s]API calls:  29%|██▉       | 73/250 [00:25<00:34,  5.07call/s]API calls:  30%|██▉       | 74/250 [00:25<00:34,  5.04call/s]API calls:  30%|███       | 76/250 [00:26<00:27,  6.23call/s]API calls:  31%|███       | 77/250 [00:26<00:34,  5.03call/s]API calls:  32%|███▁      | 79/250 [00:26<00:25,  6.80call/s]API calls:  32%|███▁      | 81/250 [00:27<00:38,  4.36call/s]API calls:  33%|███▎      | 82/250 [00:27<00:35,  4.69call/s]API calls:  33%|███▎      | 83/250 [00:27<00:42,  3.95call/s]API calls:  34%|███▎      | 84/250 [00:27<00:38,  4.30call/s]API calls:  34%|███▁      | 86/250 [00:28<00:26,  6.26call/s]API calls:  35%|███▁      | 87/250 [00:28<00:26,  6.19call/s]API calls:  35%|███▌      | 88/250 [00:28<00:29,  5.47call/s]API calls:  36%|███▌      | 89/250 [00:28<00:29,  5.40call/s]API calls:  36%|███▌      | 90/250 [00:28<00:33,  4.75call/s]API calls:  36%|███▋      | 91/250 [00:29<00:31,  5.03call/s]API calls:  37%|███▋      | 92/250 [00:29<00:57,  2.73call/s]API calls:  38%|███▊      | 95/250 [00:31<01:15,  2.05call/s]API calls:  38%|███▊      | 96/250 [00:32<01:19,  1.93call/s]API calls:  39%|███▉      | 97/250 [00:32<01:15,  2.03call/s]API calls:  39%|███▉      | 98/250 [00:33<01:29,  1.70call/s]API calls:  40%|███▉      | 99/250 [00:34<01:21,  1.85call/s]API calls:  40%|████      | 101/250 [00:34<00:58,  2.53call/s]API calls:  41%|████      | 102/250 [00:37<02:14,  1.10call/s]API calls:  41%|████      | 103/250 [00:37<01:58,  1.25call/s]API calls:  42%|████▁     | 104/250 [00:37<01:42,  1.42call/s]API calls:  42%|████▁     | 105/250 [00:38<01:22,  1.76call/s]API calls:  42%|████▁     | 106/250 [00:38<01:06,  2.18call/s]API calls:  43%|████▎     | 107/250 [00:38<00:54,  2.61call/s]API calls:  43%|████▎     | 108/250 [00:38<00:57,  2.48call/s]API calls:  44%|████▁     | 111/250 [00:39<00:31,  4.46call/s]API calls:  45%|████▌     | 113/250 [00:39<00:24,  5.68call/s]API calls:  46%|████▌     | 114/250 [00:39<00:22,  5.93call/s]API calls:  46%|████▌     | 115/250 [00:42<01:33,  1.44call/s]API calls:  46%|████▋     | 116/250 [00:42<01:26,  1.56call/s]API calls:  47%|████▋     | 117/250 [00:42<01:08,  1.95call/s]API calls:  48%|████▊     | 120/250 [00:43<00:41,  3.17call/s]API calls:  48%|████▊     | 121/250 [00:43<00:46,  2.77call/s]API calls:  49%|████▉     | 122/250 [00:43<00:42,  3.05call/s]API calls:  50%|████▉     | 124/250 [00:44<00:31,  3.97call/s]API calls:  51%|█████     | 127/250 [00:45<00:45,  2.68call/s]API calls:  52%|█████▁    | 130/250 [00:45<00:29,  4.09call/s]API calls:  52%|█████▁    | 131/250 [00:45<00:27,  4.32call/s]API calls:  53%|█████▎    | 132/250 [00:46<00:30,  3.93call/s]API calls:  53%|█████▎    | 133/250 [00:46<00:28,  4.13call/s]API calls:  54%|█████▁    | 135/250 [00:46<00:20,  5.62call/s]API calls:  55%|█████▁    | 137/250 [00:47<00:23,  4.89call/s]
  MIOnlyStopping:  60%|██████    | 3/5 [00:47<00:29, 14.94s/it, acc=0%, turns=1.0][A
  MIOnlyStopping:  60%|██████    | 3/5 [00:47<00:29, 14.94s/it, acc=0%, turns=1.3][AAPI calls:  55%|█████▌    | 138/250 [00:48<00:44,  2.53call/s]API calls:  56%|█████▌    | 139/250 [00:48<00:37,  2.99call/s]API calls:  56%|█████▋    | 141/250 [00:48<00:24,  4.42call/s]API calls:  57%|█████▋    | 142/250 [00:48<00:24,  4.50call/s]API calls:  58%|█████▊    | 144/250 [00:48<00:16,  6.38call/s]API calls:  58%|█████▊    | 146/250 [00:48<00:12,  8.34call/s]API calls:  59%|█████▉    | 148/250 [00:49<00:18,  5.46call/s]API calls:  60%|██████    | 150/250 [00:50<00:25,  3.98call/s]API calls:  60%|██████    | 151/250 [00:50<00:24,  4.05call/s]API calls:  61%|██████    | 152/250 [00:50<00:27,  3.54call/s]API calls:  61%|██████    | 153/250 [00:51<00:39,  2.47call/s]API calls:  62%|██████▁   | 155/250 [00:53<00:55,  1.70call/s]API calls:  62%|██████▁   | 156/250 [00:54<01:05,  1.43call/s]API calls:  63%|██████▎   | 158/250 [00:54<00:43,  2.11call/s]API calls:  64%|██████▎   | 159/250 [00:55<00:51,  1.77call/s]API calls:  64%|██████▁   | 160/250 [00:56<00:44,  2.01call/s]API calls:  64%|██████▁   | 161/250 [00:56<00:36,  2.46call/s]API calls:  65%|██████▁   | 162/250 [00:57<00:48,  1.82call/s]API calls:  65%|██████▌   | 163/250 [00:57<00:44,  1.95call/s]API calls:  66%|██████▌   | 164/250 [00:59<01:08,  1.25call/s]API calls:  66%|██████▌   | 165/250 [01:00<01:12,  1.18call/s]API calls:  66%|██████▋   | 166/250 [01:00<00:57,  1.47call/s]API calls:  67%|██████▋   | 167/250 [01:00<00:43,  1.91call/s]API calls:  67%|██████▋   | 168/250 [01:03<01:44,  1.28s/call]API calls:  68%|██████▊   | 169/250 [01:04<01:37,  1.20s/call]API calls:  68%|██████▊   | 171/250 [01:04<00:53,  1.47call/s]API calls:  69%|██████▉   | 172/250 [01:05<00:50,  1.54call/s]API calls:  69%|██████▉   | 173/250 [01:05<00:47,  1.62call/s]API calls:  70%|██████▉   | 174/250 [01:06<00:40,  1.87call/s]
  MIOnlyStopping:  80%|████████  | 4/5 [01:06<00:16, 16.34s/it, acc=0%, turns=1.3][A
  MIOnlyStopping:  80%|████████  | 4/5 [01:06<00:16, 16.34s/it, acc=25%, turns=1.8][AAPI calls:  70%|███████   | 176/250 [01:07<00:42,  1.73call/s]API calls:  71%|███████   | 178/250 [01:07<00:27,  2.61call/s]API calls:  72%|███████▁  | 179/250 [01:07<00:26,  2.72call/s]API calls:  72%|███████▁  | 180/250 [01:09<00:41,  1.69call/s]API calls:  72%|███████▁  | 181/250 [01:09<00:35,  1.97call/s]API calls:  73%|███████▎  | 182/250 [01:09<00:29,  2.31call/s]API calls:  73%|███████▎  | 183/250 [01:09<00:26,  2.51call/s]API calls:  74%|███████▎  | 184/250 [01:10<00:23,  2.81call/s]API calls:  74%|███████▁  | 185/250 [01:11<00:37,  1.72call/s]API calls:  74%|███████▁  | 186/250 [01:11<00:32,  1.96call/s]API calls:  75%|███████▌  | 188/250 [01:12<00:23,  2.63call/s]API calls:  76%|███████▌  | 190/250 [01:12<00:19,  3.09call/s]API calls:  76%|███████▋  | 191/250 [01:14<00:36,  1.62call/s]API calls:  77%|███████▋  | 192/250 [01:17<01:14,  1.28s/call]API calls:  77%|███████▋  | 193/250 [01:17<00:59,  1.05s/call]API calls:  78%|███████▊  | 194/250 [01:18<00:46,  1.21call/s]API calls:  78%|███████▊  | 195/250 [01:20<01:09,  1.25s/call]API calls:  78%|███████▊  | 196/250 [01:21<00:57,  1.06s/call]API calls:  79%|███████▉  | 197/250 [01:21<00:42,  1.24call/s]API calls:  79%|███████▉  | 198/250 [01:26<01:43,  1.99s/call]API calls:  80%|███████▉  | 199/250 [01:26<01:22,  1.62s/call]API calls:  80%|████████  | 200/250 [01:27<01:10,  1.41s/call]API calls:  80%|████████  | 201/250 [01:28<00:52,  1.07s/call]API calls:  81%|████████  | 202/250 [01:28<00:42,  1.13call/s]API calls:  81%|████████  | 203/250 [01:29<00:37,  1.26call/s]API calls:  82%|████████▁ | 204/250 [01:30<00:42,  1.07call/s]API calls:  82%|████████▁ | 205/250 [01:30<00:32,  1.39call/s]API calls:  83%|████████▎ | 207/250 [01:30<00:17,  2.43call/s]API calls:  83%|████████▎ | 208/250 [01:31<00:16,  2.60call/s]API calls:  84%|████████▎ | 209/250 [01:32<00:23,  1.78call/s]API calls:  84%|████████▁ | 210/250 [01:32<00:18,  2.18call/s]API calls:  84%|████████▁ | 211/250 [01:32<00:18,  2.08call/s]API calls:  85%|████████▁ | 212/250 [01:32<00:14,  2.66call/s]API calls:  85%|████████▌ | 213/250 [01:33<00:14,  2.52call/s]API calls:  86%|████████▌ | 214/250 [01:34<00:18,  1.95call/s]API calls:  86%|████████▌ | 215/250 [01:35<00:26,  1.30call/s]API calls:  86%|████████▋ | 216/250 [01:38<00:52,  1.55s/call]API calls:  87%|████████▋ | 217/250 [01:39<00:44,  1.35s/call]API calls:  87%|████████▋ | 218/250 [01:41<00:49,  1.54s/call]API calls:  88%|████████▊ | 219/250 [01:42<00:42,  1.37s/call]API calls:  89%|████████▉ | 222/250 [01:48<00:44,  1.61s/call]API calls:  90%|█████████ | 225/250 [01:49<00:27,  1.11s/call]API calls:  90%|█████████ | 226/250 [01:49<00:22,  1.05call/s]API calls:  91%|█████████ | 228/250 [01:51<00:19,  1.11call/s]API calls:  92%|█████████▁| 230/250 [01:51<00:12,  1.57call/s]API calls:  93%|█████████▎| 232/250 [01:51<00:08,  2.17call/s]API calls:  93%|█████████▎| 233/250 [01:52<00:10,  1.65call/s]API calls:  94%|█████████▎| 234/250 [01:53<00:08,  1.90call/s]API calls:  94%|█████████▁| 235/250 [01:53<00:06,  2.31call/s]API calls:  94%|█████████▁| 236/250 [01:53<00:05,  2.79call/s]API calls:  95%|█████████▁| 237/250 [01:53<00:04,  3.17call/s]API calls:  95%|█████████▌| 238/250 [01:54<00:04,  2.78call/s]API calls:  96%|█████████▌| 239/250 [01:55<00:05,  1.99call/s]API calls:  96%|█████████▌| 240/250 [01:57<00:11,  1.16s/call]API calls:  96%|█████████▋| 241/250 [01:58<00:08,  1.10call/s]API calls:  97%|█████████▋| 242/250 [01:59<00:07,  1.04call/s]API calls:  97%|█████████▋| 243/250 [01:59<00:05,  1.29call/s]API calls:  98%|█████████▊| 244/250 [02:00<00:04,  1.35call/s]API calls:  98%|█████████▊| 245/250 [02:00<00:02,  1.76call/s]API calls:  98%|█████████▊| 246/250 [02:06<00:08,  2.23s/call]API calls: 100%|█████████▉| 249/250 [02:06<00:01,  1.05s/call]API calls: 100%|██████████| 250/250 [02:07<00:00,  1.16call/s]API calls: 252call [02:09,  1.10call/s]                       API calls: 253call [02:09,  1.31call/s]API calls: 254call [02:09,  1.57call/s]API calls: 255call [02:11,  1.01call/s]API calls: 256call [02:11,  1.26call/s]API calls: 257call [02:13,  1.08s/call]API calls: 258call [02:13,  1.17call/s]API calls: 260call [02:14,  1.92call/s]API calls: 261call [02:14,  2.20call/s]API calls: 262call [02:15,  1.61call/s]API calls: 263call [02:17,  1.06call/s]API calls: 264call [02:21,  1.78s/call]API calls: 265call [02:22,  1.55s/call]API calls: 266call [02:22,  1.23s/call]API calls: 267call [02:22,  1.09call/s]API calls: 268call [02:23,  1.27call/s]API calls: 269call [02:23,  1.34call/s]API calls: 270call [02:30,  2.44s/call]API calls: 272call [02:30,  1.35s/call]API calls: 273call [02:30,  1.14s/call]API calls: 276call [02:32,  1.17call/s]API calls: 279call [02:33,  1.74call/s]API calls: 280call [02:33,  2.01call/s]API calls: 281call [02:34,  1.44call/s]API calls: 284call [02:35,  2.31call/s]API calls: 286call [02:36,  2.11call/s]API calls: 287call [02:38,  1.45call/s]API calls: 288call [02:46,  2.34s/call]API calls: 289call [02:47,  1.88s/call]API calls: 290call [02:48,  1.83s/call]API calls: 291call [02:53,  2.42s/call]API calls: 292call [02:53,  1.96s/call]API calls: 294call [03:00,  2.60s/call]API calls: 296call [03:00,  1.63s/call]API calls: 297call [03:01,  1.43s/call]API calls: 298call [03:03,  1.62s/call]API calls: 300call [03:05,  1.36s/call]API calls: 301call [03:05,  1.09s/call]API calls: 302call [03:09,  1.85s/call]API calls: 305call [03:11,  1.18s/call]API calls: 306call [03:12,  1.04s/call]API calls: 308call [03:12,  1.44call/s]API calls: 310call [03:13,  1.49call/s]API calls: 311call [03:15,  1.03call/s]API calls: 312call [03:19,  1.50s/call]API calls: 313call [03:19,  1.24s/call]API calls: 314call [03:19,  1.01call/s]API calls: 315call [03:20,  1.01s/call]API calls: 316call [03:23,  1.37s/call]API calls: 318call [03:25,  1.18s/call]API calls: 319call [03:27,  1.48s/call]API calls: 320call [03:28,  1.39s/call]API calls: 321call [03:29,  1.33s/call]API calls: 322call [03:29,  1.02s/call]API calls: 324call [03:31,  1.12call/s]API calls: 327call [03:32,  1.71call/s]API calls: 328call [03:32,  1.81call/s]API calls: 329call [03:34,  1.28call/s]API calls: 331call [03:34,  1.98call/s]API calls: 333call [03:34,  2.69call/s]API calls: 334call [03:35,  2.49call/s]API calls: 335call [03:36,  1.83call/s]API calls: 336call [03:39,  1.28s/call]API calls: 337call [03:40,  1.11s/call]API calls: 338call [03:41,  1.12s/call]API calls: 339call [03:42,  1.06s/call]API calls: 340call [03:42,  1.15call/s]API calls: 341call [03:43,  1.44call/s]API calls: 342call [03:47,  1.72s/call]API calls: 343call [03:48,  1.50s/call]API calls: 347call [03:49,  1.26call/s]API calls: 348call [03:51,  1.03s/call]API calls: 351call [03:51,  1.67call/s]API calls: 352call [03:52,  1.95call/s]API calls: 353call [03:54,  1.18call/s]API calls: 356call [03:54,  2.01call/s]API calls: 357call [03:54,  2.28call/s]API calls: 358call [03:55,  1.94call/s]API calls: 359call [03:57,  1.25call/s]API calls: 360call [03:59,  1.23s/call]API calls: 361call [04:00,  1.01s/call]API calls: 362call [04:01,  1.01call/s]API calls: 363call [04:01,  1.19call/s]API calls: 364call [04:03,  1.26s/call]API calls: 366call [04:08,  1.64s/call]API calls: 367call [04:08,  1.36s/call]API calls: 368call [04:10,  1.36s/call]API calls: 369call [04:10,  1.11s/call]API calls: 370call [04:10,  1.13call/s]API calls: 371call [04:11,  1.33call/s]API calls: 372call [04:12,  1.04call/s]API calls: 373call [04:13,  1.19call/s]API calls: 374call [04:13,  1.46call/s]API calls: 376call [04:13,  2.34call/s]API calls: 377call [04:14,  1.58call/s]API calls: 378call [04:15,  1.75call/s]API calls: 379call [04:15,  1.99call/s]API calls: 380call [04:15,  2.82call/s]API calls: 381call [04:16,  2.78call/s]API calls: 382call [04:17,  1.71call/s]API calls: 383call [04:18,  1.42call/s]API calls: 384call [04:22,  1.65s/call]API calls: 385call [04:23,  1.54s/call]API calls: 386call [04:25,  1.48s/call]API calls: 387call [04:25,  1.16s/call]API calls: 388call [04:25,  1.17call/s]API calls: 389call [04:26,  1.12call/s]API calls: 390call [04:31,  2.03s/call]API calls: 394call [04:33,  1.14s/call]API calls: 395call [04:34,  1.03s/call]API calls: 396call [04:35,  1.03call/s]API calls: 397call [04:36,  1.01s/call]API calls: 399call [04:36,  1.52call/s]API calls: 400call [04:36,  1.58call/s]API calls: 401call [04:38,  1.15call/s]API calls: 403call [04:38,  1.72call/s]API calls: 405call [04:39,  2.26call/s]API calls: 406call [04:40,  1.65call/s]API calls: 407call [04:41,  1.50call/s]API calls: 408call [04:45,  1.62s/call]API calls: 409call [04:48,  1.75s/call]API calls: 410call [04:49,  1.62s/call]API calls: 412call [04:49,  1.02call/s]API calls: 414call [04:55,  1.67s/call]API calls: 415call [04:55,  1.33s/call]API calls: 416call [04:56,  1.28s/call]API calls: 417call [04:56,  1.04s/call]API calls: 418call [04:56,  1.25call/s]API calls: 419call [04:57,  1.64call/s]API calls: 420call [04:58,  1.22call/s]API calls: 421call [04:58,  1.51call/s]API calls: 423call [04:59,  2.14call/s]API calls: 424call [04:59,  2.27call/s]API calls: 425call [05:00,  1.47call/s]API calls: 426call [05:01,  1.78call/s]API calls: 427call [05:01,  2.30call/s]API calls: 428call [05:01,  2.51call/s]API calls: 430call [05:02,  1.88call/s]API calls: 431call [05:04,  1.32call/s]API calls: 432call [05:08,  1.51s/call]API calls: 433call [05:09,  1.49s/call]API calls: 435call [05:09,  1.15call/s]API calls: 436call [05:09,  1.43call/s]API calls: 437call [05:11,  1.12call/s]API calls: 438call [05:15,  1.83s/call]API calls: 439call [05:17,  1.95s/call]API calls: 441call [05:18,  1.14s/call]API calls: 442call [05:18,  1.05call/s]API calls: 443call [05:18,  1.36call/s]
  MIOnlyStopping: 100%|██████████| 5/5 [05:18<00:00, 94.44s/it, acc=25%, turns=1.8][A
  MIOnlyStopping: 100%|██████████| 5/5 [05:18<00:00, 94.44s/it, acc=20%, turns=4.2][A
                                                                                   [AAPI calls: 443call [05:18,  1.39call/s]
  Results: Accuracy=20.00% [0.00%, 60.00%], Avg Turns=4.2 [1.2, 9.2]

==========================================================================================
COMPARISON RESULTS
==========================================================================================
Method                      Accuracy           95% CI  Avg Turns           95% CI
------------------------------------------------------------------------------------------
MIOnlyStopping                20.00%   [0.00%,60.00%]        4.2        [1.2,9.2]
==========================================================================================

Total API usage:
  Prompt tokens: 492,496
  Completion tokens: 64,324
  Total tokens: 556,820
