Warning: You are sending unauthenticated requests to the HF Hub. Please set a HF_TOKEN to enable higher rate limits and faster downloads.

============================================================
RRMC Experiment: dc_methods/zero_shot
============================================================
Initializing LLM: qwen/qwen-2.5-7b-instruct (max_workers=32)
Task: detective_cases
Data: /root/RRMC/AR-Bench/data/dc/test.json
Loading weights:   0%|          | 0/103 [00:00<?, ?it/s]Loading weights:   1%|          | 1/103 [00:00<00:00, 22550.02it/s, Materializing param=embeddings.LayerNorm.bias]Loading weights:   1%|          | 1/103 [00:00<00:00, 2608.40it/s, Materializing param=embeddings.LayerNorm.bias] Loading weights:   2%|▁         | 2/103 [00:00<00:00, 3235.10it/s, Materializing param=embeddings.LayerNorm.weight]Loading weights:   2%|▁         | 2/103 [00:00<00:00, 1453.08it/s, Materializing param=embeddings.LayerNorm.weight]Loading weights:   3%|▎         | 3/103 [00:00<00:00, 1905.06it/s, Materializing param=embeddings.position_embeddings.weight]Loading weights:   3%|▎         | 3/103 [00:00<00:00, 1646.76it/s, Materializing param=embeddings.position_embeddings.weight]Loading weights:   4%|▁         | 4/103 [00:00<00:00, 1682.94it/s, Materializing param=embeddings.token_type_embeddings.weight]Loading weights:   4%|▁         | 4/103 [00:00<00:00, 1565.62it/s, Materializing param=embeddings.token_type_embeddings.weight]Loading weights:   5%|▁         | 5/103 [00:00<00:00, 1388.02it/s, Materializing param=embeddings.word_embeddings.weight]      Loading weights:   5%|▁         | 5/103 [00:00<00:00, 1301.61it/s, Materializing param=embeddings.word_embeddings.weight]Loading weights:   6%|▌         | 6/103 [00:00<00:00, 1462.28it/s, Materializing param=encoder.layer.0.attention.output.LayerNorm.bias]Loading weights:   6%|▌         | 6/103 [00:00<00:00, 1444.15it/s, Materializing param=encoder.layer.0.attention.output.LayerNorm.bias]Loading weights:   7%|▋         | 7/103 [00:00<00:00, 1639.22it/s, Materializing param=encoder.layer.0.attention.output.LayerNorm.weight]Loading weights:   7%|▋         | 7/103 [00:00<00:00, 1621.48it/s, Materializing param=encoder.layer.0.attention.output.LayerNorm.weight]Loading weights:   8%|▊         | 8/103 [00:00<00:00, 1796.66it/s, Materializing param=encoder.layer.0.attention.output.dense.bias]      Loading weights:   8%|▊         | 8/103 [00:00<00:00, 1777.91it/s, Materializing param=encoder.layer.0.attention.output.dense.bias]Loading weights:   9%|▊         | 9/103 [00:00<00:00, 1958.94it/s, Materializing param=encoder.layer.0.attention.output.dense.weight]Loading weights:   9%|▊         | 9/103 [00:00<00:00, 1940.41it/s, Materializing param=encoder.layer.0.attention.output.dense.weight]Loading weights:  10%|▉         | 10/103 [00:00<00:00, 2012.82it/s, Materializing param=encoder.layer.0.attention.self.key.bias]     Loading weights:  10%|▉         | 10/103 [00:00<00:00, 1992.83it/s, Materializing param=encoder.layer.0.attention.self.key.bias]Loading weights:  11%|█         | 11/103 [00:00<00:00, 2153.74it/s, Materializing param=encoder.layer.0.attention.self.key.weight]Loading weights:  11%|█         | 11/103 [00:00<00:00, 2136.48it/s, Materializing param=encoder.layer.0.attention.self.key.weight]Loading weights:  12%|█▁        | 12/103 [00:00<00:00, 2284.58it/s, Materializing param=encoder.layer.0.attention.self.query.bias]Loading weights:  12%|█▁        | 12/103 [00:00<00:00, 2138.68it/s, Materializing param=encoder.layer.0.attention.self.query.bias]Loading weights:  13%|█▎        | 13/103 [00:00<00:00, 2273.90it/s, Materializing param=encoder.layer.0.attention.self.query.weight]Loading weights:  13%|█▎        | 13/103 [00:00<00:00, 2236.41it/s, Materializing param=encoder.layer.0.attention.self.query.weight]Loading weights:  14%|█▎        | 14/103 [00:00<00:00, 2367.08it/s, Materializing param=encoder.layer.0.attention.self.value.bias]  Loading weights:  14%|█▎        | 14/103 [00:00<00:00, 2276.07it/s, Materializing param=encoder.layer.0.attention.self.value.bias]Loading weights:  15%|█▁        | 15/103 [00:00<00:00, 2365.48it/s, Materializing param=encoder.layer.0.attention.self.value.weight]Loading weights:  15%|█▁        | 15/103 [00:00<00:00, 2348.35it/s, Materializing param=encoder.layer.0.attention.self.value.weight]Loading weights:  16%|█▌        | 16/103 [00:00<00:00, 2463.98it/s, Materializing param=encoder.layer.0.intermediate.dense.bias]    Loading weights:  16%|█▌        | 16/103 [00:00<00:00, 2447.80it/s, Materializing param=encoder.layer.0.intermediate.dense.bias]Loading weights:  17%|█▋        | 17/103 [00:00<00:00, 2375.35it/s, Materializing param=encoder.layer.0.intermediate.dense.weight]Loading weights:  17%|█▋        | 17/103 [00:00<00:00, 2286.31it/s, Materializing param=encoder.layer.0.intermediate.dense.weight]Loading weights:  17%|█▋        | 18/103 [00:00<00:00, 2382.07it/s, Materializing param=encoder.layer.0.output.LayerNorm.bias]    Loading weights:  17%|█▋        | 18/103 [00:00<00:00, 2368.03it/s, Materializing param=encoder.layer.0.output.LayerNorm.bias]Loading weights:  18%|█▊        | 19/103 [00:00<00:00, 2461.75it/s, Materializing param=encoder.layer.0.output.LayerNorm.weight]Loading weights:  18%|█▊        | 19/103 [00:00<00:00, 2421.73it/s, Materializing param=encoder.layer.0.output.LayerNorm.weight]Loading weights:  19%|█▉        | 20/103 [00:00<00:00, 2420.88it/s, Materializing param=encoder.layer.0.output.dense.bias]      Loading weights:  19%|█▉        | 20/103 [00:00<00:00, 2390.39it/s, Materializing param=encoder.layer.0.output.dense.bias]Loading weights:  20%|██        | 21/103 [00:00<00:00, 2475.07it/s, Materializing param=encoder.layer.0.output.dense.weight]Loading weights:  20%|██        | 21/103 [00:00<00:00, 2409.20it/s, Materializing param=encoder.layer.0.output.dense.weight]Loading weights:  21%|██▁       | 22/103 [00:00<00:00, 2438.36it/s, Materializing param=encoder.layer.1.attention.output.LayerNorm.bias]Loading weights:  21%|██▁       | 22/103 [00:00<00:00, 2409.45it/s, Materializing param=encoder.layer.1.attention.output.LayerNorm.bias]Loading weights:  22%|██▁       | 23/103 [00:00<00:00, 2470.21it/s, Materializing param=encoder.layer.1.attention.output.LayerNorm.weight]Loading weights:  22%|██▁       | 23/103 [00:00<00:00, 2427.08it/s, Materializing param=encoder.layer.1.attention.output.LayerNorm.weight]Loading weights:  23%|██▎       | 24/103 [00:00<00:00, 2457.18it/s, Materializing param=encoder.layer.1.attention.output.dense.bias]      Loading weights:  23%|██▎       | 24/103 [00:00<00:00, 2440.44it/s, Materializing param=encoder.layer.1.attention.output.dense.bias]Loading weights:  24%|██▁       | 25/103 [00:00<00:00, 2372.24it/s, Materializing param=encoder.layer.1.attention.output.dense.weight]Loading weights:  24%|██▁       | 25/103 [00:00<00:00, 2327.79it/s, Materializing param=encoder.layer.1.attention.output.dense.weight]Loading weights:  25%|██▌       | 26/103 [00:00<00:00, 2351.07it/s, Materializing param=encoder.layer.1.attention.self.key.bias]      Loading weights:  25%|██▌       | 26/103 [00:00<00:00, 2341.12it/s, Materializing param=encoder.layer.1.attention.self.key.bias]Loading weights:  26%|██▌       | 27/103 [00:00<00:00, 2409.24it/s, Materializing param=encoder.layer.1.attention.self.key.weight]Loading weights:  26%|██▌       | 27/103 [00:00<00:00, 2381.67it/s, Materializing param=encoder.layer.1.attention.self.key.weight]Loading weights:  27%|██▋       | 28/103 [00:00<00:00, 2341.04it/s, Materializing param=encoder.layer.1.attention.self.query.bias]Loading weights:  27%|██▋       | 28/103 [00:00<00:00, 2314.65it/s, Materializing param=encoder.layer.1.attention.self.query.bias]Loading weights:  28%|██▊       | 29/103 [00:00<00:00, 2364.37it/s, Materializing param=encoder.layer.1.attention.self.query.weight]Loading weights:  28%|██▊       | 29/103 [00:00<00:00, 2355.76it/s, Materializing param=encoder.layer.1.attention.self.query.weight]Loading weights:  29%|██▉       | 30/103 [00:00<00:00, 2420.77it/s, Materializing param=encoder.layer.1.attention.self.value.bias]  Loading weights:  29%|██▉       | 30/103 [00:00<00:00, 2412.51it/s, Materializing param=encoder.layer.1.attention.self.value.bias]Loading weights:  30%|███       | 31/103 [00:00<00:00, 2478.34it/s, Materializing param=encoder.layer.1.attention.self.value.weight]Loading weights:  30%|███       | 31/103 [00:00<00:00, 2470.24it/s, Materializing param=encoder.layer.1.attention.self.value.weight]Loading weights:  31%|███       | 32/103 [00:00<00:00, 2535.04it/s, Materializing param=encoder.layer.1.intermediate.dense.bias]    Loading weights:  31%|███       | 32/103 [00:00<00:00, 2527.12it/s, Materializing param=encoder.layer.1.intermediate.dense.bias]Loading weights:  32%|███▁      | 33/103 [00:00<00:00, 2588.64it/s, Materializing param=encoder.layer.1.intermediate.dense.weight]Loading weights:  32%|███▁      | 33/103 [00:00<00:00, 2579.62it/s, Materializing param=encoder.layer.1.intermediate.dense.weight]Loading weights:  33%|███▎      | 34/103 [00:00<00:00, 2642.13it/s, Materializing param=encoder.layer.1.output.LayerNorm.bias]    Loading weights:  33%|███▎      | 34/103 [00:00<00:00, 2633.88it/s, Materializing param=encoder.layer.1.output.LayerNorm.bias]Loading weights:  34%|███▁      | 35/103 [00:00<00:00, 2696.01it/s, Materializing param=encoder.layer.1.output.LayerNorm.weight]Loading weights:  34%|███▁      | 35/103 [00:00<00:00, 2687.72it/s, Materializing param=encoder.layer.1.output.LayerNorm.weight]Loading weights:  35%|███▁      | 36/103 [00:00<00:00, 2749.26it/s, Materializing param=encoder.layer.1.output.dense.bias]      Loading weights:  35%|███▁      | 36/103 [00:00<00:00, 2740.93it/s, Materializing param=encoder.layer.1.output.dense.bias]Loading weights:  36%|███▌      | 37/103 [00:00<00:00, 2801.91it/s, Materializing param=encoder.layer.1.output.dense.weight]Loading weights:  36%|███▌      | 37/103 [00:00<00:00, 2793.64it/s, Materializing param=encoder.layer.1.output.dense.weight]Loading weights:  37%|███▋      | 38/103 [00:00<00:00, 2853.98it/s, Materializing param=encoder.layer.2.attention.output.LayerNorm.bias]Loading weights:  37%|███▋      | 38/103 [00:00<00:00, 2845.22it/s, Materializing param=encoder.layer.2.attention.output.LayerNorm.bias]Loading weights:  38%|███▊      | 39/103 [00:00<00:00, 2901.81it/s, Materializing param=encoder.layer.2.attention.output.LayerNorm.weight]Loading weights:  38%|███▊      | 39/103 [00:00<00:00, 2892.78it/s, Materializing param=encoder.layer.2.attention.output.LayerNorm.weight]Loading weights:  39%|███▉      | 40/103 [00:00<00:00, 2948.49it/s, Materializing param=encoder.layer.2.attention.output.dense.bias]      Loading weights:  39%|███▉      | 40/103 [00:00<00:00, 2939.76it/s, Materializing param=encoder.layer.2.attention.output.dense.bias]Loading weights:  40%|███▉      | 41/103 [00:00<00:00, 2997.34it/s, Materializing param=encoder.layer.2.attention.output.dense.weight]Loading weights:  40%|███▉      | 41/103 [00:00<00:00, 2986.77it/s, Materializing param=encoder.layer.2.attention.output.dense.weight]Loading weights:  41%|████      | 42/103 [00:00<00:00, 3042.71it/s, Materializing param=encoder.layer.2.attention.self.key.bias]      Loading weights:  41%|████      | 42/103 [00:00<00:00, 3032.60it/s, Materializing param=encoder.layer.2.attention.self.key.bias]Loading weights:  42%|████▁     | 43/103 [00:00<00:00, 3088.96it/s, Materializing param=encoder.layer.2.attention.self.key.weight]Loading weights:  42%|████▁     | 43/103 [00:00<00:00, 3080.20it/s, Materializing param=encoder.layer.2.attention.self.key.weight]Loading weights:  43%|████▎     | 44/103 [00:00<00:00, 3135.72it/s, Materializing param=encoder.layer.2.attention.self.query.bias]Loading weights:  43%|████▎     | 44/103 [00:00<00:00, 3125.62it/s, Materializing param=encoder.layer.2.attention.self.query.bias]Loading weights:  44%|████▎     | 45/103 [00:00<00:00, 3179.48it/s, Materializing param=encoder.layer.2.attention.self.query.weight]Loading weights:  44%|████▎     | 45/103 [00:00<00:00, 3170.40it/s, Materializing param=encoder.layer.2.attention.self.query.weight]Loading weights:  45%|████▁     | 46/103 [00:00<00:00, 3223.96it/s, Materializing param=encoder.layer.2.attention.self.value.bias]  Loading weights:  45%|████▁     | 46/103 [00:00<00:00, 3214.78it/s, Materializing param=encoder.layer.2.attention.self.value.bias]Loading weights:  46%|████▌     | 47/103 [00:00<00:00, 3267.73it/s, Materializing param=encoder.layer.2.attention.self.value.weight]Loading weights:  46%|████▌     | 47/103 [00:00<00:00, 3258.71it/s, Materializing param=encoder.layer.2.attention.self.value.weight]Loading weights:  47%|████▋     | 48/103 [00:00<00:00, 3311.13it/s, Materializing param=encoder.layer.2.intermediate.dense.bias]    Loading weights:  47%|████▋     | 48/103 [00:00<00:00, 3302.33it/s, Materializing param=encoder.layer.2.intermediate.dense.bias]Loading weights:  48%|████▊     | 49/103 [00:00<00:00, 3352.49it/s, Materializing param=encoder.layer.2.intermediate.dense.weight]Loading weights:  48%|████▊     | 49/103 [00:00<00:00, 3343.43it/s, Materializing param=encoder.layer.2.intermediate.dense.weight]Loading weights:  49%|████▊     | 50/103 [00:00<00:00, 3393.18it/s, Materializing param=encoder.layer.2.output.LayerNorm.bias]    Loading weights:  49%|████▊     | 50/103 [00:00<00:00, 3383.16it/s, Materializing param=encoder.layer.2.output.LayerNorm.bias]Loading weights:  50%|████▉     | 51/103 [00:00<00:00, 3433.87it/s, Materializing param=encoder.layer.2.output.LayerNorm.weight]Loading weights:  50%|████▉     | 51/103 [00:00<00:00, 3424.69it/s, Materializing param=encoder.layer.2.output.LayerNorm.weight]Loading weights:  50%|█████     | 52/103 [00:00<00:00, 3475.37it/s, Materializing param=encoder.layer.2.output.dense.bias]      Loading weights:  50%|█████     | 52/103 [00:00<00:00, 3466.15it/s, Materializing param=encoder.layer.2.output.dense.bias]Loading weights:  51%|█████▁    | 53/103 [00:00<00:00, 3516.54it/s, Materializing param=encoder.layer.2.output.dense.weight]Loading weights:  51%|█████▁    | 53/103 [00:00<00:00, 3507.39it/s, Materializing param=encoder.layer.2.output.dense.weight]Loading weights:  52%|█████▁    | 54/103 [00:00<00:00, 3557.12it/s, Materializing param=encoder.layer.3.attention.output.LayerNorm.bias]Loading weights:  52%|█████▁    | 54/103 [00:00<00:00, 3548.20it/s, Materializing param=encoder.layer.3.attention.output.LayerNorm.bias]Loading weights:  53%|█████▎    | 55/103 [00:00<00:00, 3595.21it/s, Materializing param=encoder.layer.3.attention.output.LayerNorm.weight]Loading weights:  53%|█████▎    | 55/103 [00:00<00:00, 3585.38it/s, Materializing param=encoder.layer.3.attention.output.LayerNorm.weight]Loading weights:  54%|█████▁    | 56/103 [00:00<00:00, 3632.72it/s, Materializing param=encoder.layer.3.attention.output.dense.bias]      Loading weights:  54%|█████▁    | 56/103 [00:00<00:00, 3623.31it/s, Materializing param=encoder.layer.3.attention.output.dense.bias]Loading weights:  55%|█████▌    | 57/103 [00:00<00:00, 3670.91it/s, Materializing param=encoder.layer.3.attention.output.dense.weight]Loading weights:  55%|█████▌    | 57/103 [00:00<00:00, 3661.58it/s, Materializing param=encoder.layer.3.attention.output.dense.weight]Loading weights:  56%|█████▋    | 58/103 [00:00<00:00, 3708.83it/s, Materializing param=encoder.layer.3.attention.self.key.bias]      Loading weights:  56%|█████▋    | 58/103 [00:00<00:00, 3699.81it/s, Materializing param=encoder.layer.3.attention.self.key.bias]Loading weights:  57%|█████▋    | 59/103 [00:00<00:00, 3740.27it/s, Materializing param=encoder.layer.3.attention.self.key.weight]Loading weights:  57%|█████▋    | 59/103 [00:00<00:00, 3730.24it/s, Materializing param=encoder.layer.3.attention.self.key.weight]Loading weights:  58%|█████▊    | 60/103 [00:00<00:00, 3776.16it/s, Materializing param=encoder.layer.3.attention.self.query.bias]Loading weights:  58%|█████▊    | 60/103 [00:00<00:00, 3767.11it/s, Materializing param=encoder.layer.3.attention.self.query.bias]Loading weights:  59%|█████▉    | 61/103 [00:00<00:00, 3812.89it/s, Materializing param=encoder.layer.3.attention.self.query.weight]Loading weights:  59%|█████▉    | 61/103 [00:00<00:00, 3803.76it/s, Materializing param=encoder.layer.3.attention.self.query.weight]Loading weights:  60%|██████    | 62/103 [00:00<00:00, 3848.84it/s, Materializing param=encoder.layer.3.attention.self.value.bias]  Loading weights:  60%|██████    | 62/103 [00:00<00:00, 3839.24it/s, Materializing param=encoder.layer.3.attention.self.value.bias]Loading weights:  61%|██████    | 63/103 [00:00<00:00, 3883.67it/s, Materializing param=encoder.layer.3.attention.self.value.weight]Loading weights:  61%|██████    | 63/103 [00:00<00:00, 3874.05it/s, Materializing param=encoder.layer.3.attention.self.value.weight]Loading weights:  62%|██████▁   | 64/103 [00:00<00:00, 3917.79it/s, Materializing param=encoder.layer.3.intermediate.dense.bias]    Loading weights:  62%|██████▁   | 64/103 [00:00<00:00, 3908.21it/s, Materializing param=encoder.layer.3.intermediate.dense.bias]Loading weights:  63%|██████▎   | 65/103 [00:00<00:00, 3951.67it/s, Materializing param=encoder.layer.3.intermediate.dense.weight]Loading weights:  63%|██████▎   | 65/103 [00:00<00:00, 3942.07it/s, Materializing param=encoder.layer.3.intermediate.dense.weight]Loading weights:  64%|██████▁   | 66/103 [00:00<00:00, 3985.60it/s, Materializing param=encoder.layer.3.output.LayerNorm.bias]    Loading weights:  64%|██████▁   | 66/103 [00:00<00:00, 3976.39it/s, Materializing param=encoder.layer.3.output.LayerNorm.bias]Loading weights:  65%|██████▌   | 67/103 [00:00<00:00, 4019.31it/s, Materializing param=encoder.layer.3.output.LayerNorm.weight]Loading weights:  65%|██████▌   | 67/103 [00:00<00:00, 4007.28it/s, Materializing param=encoder.layer.3.output.LayerNorm.weight]Loading weights:  66%|██████▌   | 68/103 [00:00<00:00, 4048.38it/s, Materializing param=encoder.layer.3.output.dense.bias]      Loading weights:  66%|██████▌   | 68/103 [00:00<00:00, 4039.04it/s, Materializing param=encoder.layer.3.output.dense.bias]Loading weights:  67%|██████▋   | 69/103 [00:00<00:00, 4078.45it/s, Materializing param=encoder.layer.3.output.dense.weight]Loading weights:  67%|██████▋   | 69/103 [00:00<00:00, 4066.65it/s, Materializing param=encoder.layer.3.output.dense.weight]Loading weights:  68%|██████▊   | 70/103 [00:00<00:00, 4107.17it/s, Materializing param=encoder.layer.4.attention.output.LayerNorm.bias]Loading weights:  68%|██████▊   | 70/103 [00:00<00:00, 4097.89it/s, Materializing param=encoder.layer.4.attention.output.LayerNorm.bias]Loading weights:  69%|██████▉   | 71/103 [00:00<00:00, 4138.58it/s, Materializing param=encoder.layer.4.attention.output.LayerNorm.weight]Loading weights:  69%|██████▉   | 71/103 [00:00<00:00, 4129.05it/s, Materializing param=encoder.layer.4.attention.output.LayerNorm.weight]Loading weights:  70%|██████▉   | 72/103 [00:00<00:00, 4169.46it/s, Materializing param=encoder.layer.4.attention.output.dense.bias]      Loading weights:  70%|██████▉   | 72/103 [00:00<00:00, 4160.16it/s, Materializing param=encoder.layer.4.attention.output.dense.bias]Loading weights:  71%|███████   | 73/103 [00:00<00:00, 4198.56it/s, Materializing param=encoder.layer.4.attention.output.dense.weight]Loading weights:  71%|███████   | 73/103 [00:00<00:00, 4189.02it/s, Materializing param=encoder.layer.4.attention.output.dense.weight]Loading weights:  72%|███████▁  | 74/103 [00:00<00:00, 4229.05it/s, Materializing param=encoder.layer.4.attention.self.key.bias]      Loading weights:  72%|███████▁  | 74/103 [00:00<00:00, 4219.68it/s, Materializing param=encoder.layer.4.attention.self.key.bias]Loading weights:  73%|███████▎  | 75/103 [00:00<00:00, 4259.10it/s, Materializing param=encoder.layer.4.attention.self.key.weight]Loading weights:  73%|███████▎  | 75/103 [00:00<00:00, 4249.66it/s, Materializing param=encoder.layer.4.attention.self.key.weight]Loading weights:  74%|███████▁  | 76/103 [00:00<00:00, 4285.43it/s, Materializing param=encoder.layer.4.attention.self.query.bias]Loading weights:  74%|███████▁  | 76/103 [00:00<00:00, 4274.79it/s, Materializing param=encoder.layer.4.attention.self.query.bias]Loading weights:  75%|███████▁  | 77/103 [00:00<00:00, 4312.94it/s, Materializing param=encoder.layer.4.attention.self.query.weight]Loading weights:  75%|███████▁  | 77/103 [00:00<00:00, 4303.74it/s, Materializing param=encoder.layer.4.attention.self.query.weight]Loading weights:  76%|███████▌  | 78/103 [00:00<00:00, 4342.33it/s, Materializing param=encoder.layer.4.attention.self.value.bias]  Loading weights:  76%|███████▌  | 78/103 [00:00<00:00, 4332.79it/s, Materializing param=encoder.layer.4.attention.self.value.bias]Loading weights:  77%|███████▋  | 79/103 [00:00<00:00, 4371.14it/s, Materializing param=encoder.layer.4.attention.self.value.weight]Loading weights:  77%|███████▋  | 79/103 [00:00<00:00, 4361.59it/s, Materializing param=encoder.layer.4.attention.self.value.weight]Loading weights:  78%|███████▊  | 80/103 [00:00<00:00, 4399.77it/s, Materializing param=encoder.layer.4.intermediate.dense.bias]    Loading weights:  78%|███████▊  | 80/103 [00:00<00:00, 4390.62it/s, Materializing param=encoder.layer.4.intermediate.dense.bias]Loading weights:  79%|███████▊  | 81/103 [00:00<00:00, 4428.64it/s, Materializing param=encoder.layer.4.intermediate.dense.weight]Loading weights:  79%|███████▊  | 81/103 [00:00<00:00, 4418.21it/s, Materializing param=encoder.layer.4.intermediate.dense.weight]Loading weights:  80%|███████▉  | 82/103 [00:00<00:00, 4455.84it/s, Materializing param=encoder.layer.4.output.LayerNorm.bias]    Loading weights:  80%|███████▉  | 82/103 [00:00<00:00, 4446.45it/s, Materializing param=encoder.layer.4.output.LayerNorm.bias]Loading weights:  81%|████████  | 83/103 [00:00<00:00, 4483.98it/s, Materializing param=encoder.layer.4.output.LayerNorm.weight]Loading weights:  81%|████████  | 83/103 [00:00<00:00, 4474.36it/s, Materializing param=encoder.layer.4.output.LayerNorm.weight]Loading weights:  82%|████████▁ | 84/103 [00:00<00:00, 4508.85it/s, Materializing param=encoder.layer.4.output.dense.bias]      Loading weights:  82%|████████▁ | 84/103 [00:00<00:00, 4499.58it/s, Materializing param=encoder.layer.4.output.dense.bias]Loading weights:  83%|████████▎ | 85/103 [00:00<00:00, 4533.81it/s, Materializing param=encoder.layer.4.output.dense.weight]Loading weights:  83%|████████▎ | 85/103 [00:00<00:00, 4522.71it/s, Materializing param=encoder.layer.4.output.dense.weight]Loading weights:  83%|████████▎ | 86/103 [00:00<00:00, 4558.39it/s, Materializing param=encoder.layer.5.attention.output.LayerNorm.bias]Loading weights:  83%|████████▎ | 86/103 [00:00<00:00, 4548.85it/s, Materializing param=encoder.layer.5.attention.output.LayerNorm.bias]Loading weights:  84%|████████▁ | 87/103 [00:00<00:00, 4582.33it/s, Materializing param=encoder.layer.5.attention.output.LayerNorm.weight]Loading weights:  84%|████████▁ | 87/103 [00:00<00:00, 4572.91it/s, Materializing param=encoder.layer.5.attention.output.LayerNorm.weight]Loading weights:  85%|████████▌ | 88/103 [00:00<00:00, 4608.03it/s, Materializing param=encoder.layer.5.attention.output.dense.bias]      Loading weights:  85%|████████▌ | 88/103 [00:00<00:00, 4598.90it/s, Materializing param=encoder.layer.5.attention.output.dense.bias]Loading weights:  86%|████████▋ | 89/103 [00:00<00:00, 4633.73it/s, Materializing param=encoder.layer.5.attention.output.dense.weight]Loading weights:  86%|████████▋ | 89/103 [00:00<00:00, 4624.49it/s, Materializing param=encoder.layer.5.attention.output.dense.weight]Loading weights:  87%|████████▋ | 90/103 [00:00<00:00, 4659.36it/s, Materializing param=encoder.layer.5.attention.self.key.bias]      Loading weights:  87%|████████▋ | 90/103 [00:00<00:00, 4650.18it/s, Materializing param=encoder.layer.5.attention.self.key.bias]Loading weights:  88%|████████▊ | 91/103 [00:00<00:00, 4684.88it/s, Materializing param=encoder.layer.5.attention.self.key.weight]Loading weights:  88%|████████▊ | 91/103 [00:00<00:00, 4675.58it/s, Materializing param=encoder.layer.5.attention.self.key.weight]Loading weights:  89%|████████▉ | 92/103 [00:00<00:00, 4710.11it/s, Materializing param=encoder.layer.5.attention.self.query.bias]Loading weights:  89%|████████▉ | 92/103 [00:00<00:00, 4700.47it/s, Materializing param=encoder.layer.5.attention.self.query.bias]Loading weights:  90%|█████████ | 93/103 [00:00<00:00, 4734.61it/s, Materializing param=encoder.layer.5.attention.self.query.weight]Loading weights:  90%|█████████ | 93/103 [00:00<00:00, 4725.15it/s, Materializing param=encoder.layer.5.attention.self.query.weight]Loading weights:  91%|█████████▁| 94/103 [00:00<00:00, 4755.73it/s, Materializing param=encoder.layer.5.attention.self.value.bias]  Loading weights:  91%|█████████▁| 94/103 [00:00<00:00, 4746.23it/s, Materializing param=encoder.layer.5.attention.self.value.bias]Loading weights:  92%|█████████▁| 95/103 [00:00<00:00, 4779.92it/s, Materializing param=encoder.layer.5.attention.self.value.weight]Loading weights:  92%|█████████▁| 95/103 [00:00<00:00, 4770.76it/s, Materializing param=encoder.layer.5.attention.self.value.weight]Loading weights:  93%|█████████▎| 96/103 [00:00<00:00, 4804.30it/s, Materializing param=encoder.layer.5.intermediate.dense.bias]    Loading weights:  93%|█████████▎| 96/103 [00:00<00:00, 4795.26it/s, Materializing param=encoder.layer.5.intermediate.dense.bias]Loading weights:  94%|█████████▁| 97/103 [00:00<00:00, 4828.25it/s, Materializing param=encoder.layer.5.intermediate.dense.weight]Loading weights:  94%|█████████▁| 97/103 [00:00<00:00, 4818.76it/s, Materializing param=encoder.layer.5.intermediate.dense.weight]Loading weights:  95%|█████████▌| 98/103 [00:00<00:00, 4851.88it/s, Materializing param=encoder.layer.5.output.LayerNorm.bias]    Loading weights:  95%|█████████▌| 98/103 [00:00<00:00, 4842.39it/s, Materializing param=encoder.layer.5.output.LayerNorm.bias]Loading weights:  96%|█████████▌| 99/103 [00:00<00:00, 4874.06it/s, Materializing param=encoder.layer.5.output.LayerNorm.weight]Loading weights:  96%|█████████▌| 99/103 [00:00<00:00, 4864.41it/s, Materializing param=encoder.layer.5.output.LayerNorm.weight]Loading weights:  97%|█████████▋| 100/103 [00:00<00:00, 4896.63it/s, Materializing param=encoder.layer.5.output.dense.bias]     Loading weights:  97%|█████████▋| 100/103 [00:00<00:00, 4885.96it/s, Materializing param=encoder.layer.5.output.dense.bias]Loading weights:  98%|█████████▊| 101/103 [00:00<00:00, 4917.29it/s, Materializing param=encoder.layer.5.output.dense.weight]Loading weights:  98%|█████████▊| 101/103 [00:00<00:00, 4908.23it/s, Materializing param=encoder.layer.5.output.dense.weight]Loading weights:  99%|█████████▉| 102/103 [00:00<00:00, 4940.34it/s, Materializing param=pooler.dense.bias]                  Loading weights:  99%|█████████▉| 102/103 [00:00<00:00, 4931.52it/s, Materializing param=pooler.dense.bias]Loading weights: 100%|██████████| 103/103 [00:00<00:00, 4961.34it/s, Materializing param=pooler.dense.weight]Loading weights: 100%|██████████| 103/103 [00:00<00:00, 4951.95it/s, Materializing param=pooler.dense.weight]Loading weights: 100%|██████████| 103/103 [00:00<00:00, 4933.29it/s, Materializing param=pooler.dense.weight]
[1mBertModel LOAD REPORT[0m from: sentence-transformers/all-MiniLM-L6-v2
Key                     | Status     |  | 
------------------------+------------+--+-
embeddings.position_ids | UNEXPECTED |  | 

[3mNotes:
- UNEXPECTED[3m	:can be ignored when loading from different task/architecture; not ok if you expect identical arch.[0m
API calls:   0%|          | 0/5000 [00:00<?, ?call/s]Evaluating 100 puzzles
Methods: ['fixed_turns']

============================================================
STARTING EVALUATION
============================================================

Evaluating FixedTurnsStopping on 100 puzzles...

  FixedTurnsStopping:   0%|          | 0/100 [00:00<?, ?it/s][AAPI calls:   0%|          | 1/5000 [00:02<2:50:58,  2.05s/call]
  FixedTurnsStopping:   1%|          | 1/100 [00:02<03:23,  2.05s/it][A
  FixedTurnsStopping:   1%|          | 1/100 [00:02<03:23,  2.05s/it, acc=100%, turns=1.0][A
  FixedTurnsStopping:   2%|▁         | 2/100 [00:02<03:21,  2.05s/it, acc=100%, turns=1.0][A
  FixedTurnsStopping:   3%|▎         | 3/100 [00:02<03:19,  2.05s/it, acc=67%, turns=1.0] [A
  FixedTurnsStopping:   4%|▁         | 4/100 [00:02<03:17,  2.05s/it, acc=50%, turns=1.0][AAPI calls:   0%|          | 5/5000 [00:02<31:30,  2.64call/s]  API calls:   0%|          | 6/5000 [00:02<15:57,  5.22call/s]
  FixedTurnsStopping:   5%|▌         | 5/100 [00:02<00:35,  2.64it/s, acc=50%, turns=1.0][A
  FixedTurnsStopping:   5%|▌         | 5/100 [00:02<00:35,  2.64it/s, acc=40%, turns=1.0][A
  FixedTurnsStopping:   6%|▌         | 6/100 [00:02<00:35,  2.64it/s, acc=50%, turns=1.0][A
  FixedTurnsStopping:   7%|▋         | 7/100 [00:02<00:35,  2.64it/s, acc=43%, turns=1.0][A
  FixedTurnsStopping:   8%|▊         | 8/100 [00:02<00:34,  2.64it/s, acc=38%, turns=1.0][AAPI calls:   0%|          | 9/5000 [00:02<11:56,  6.96call/s]
  FixedTurnsStopping:   9%|▉         | 9/100 [00:02<00:17,  5.21it/s, acc=38%, turns=1.0][A
  FixedTurnsStopping:   9%|▉         | 9/100 [00:02<00:17,  5.21it/s, acc=33%, turns=1.0][A
  FixedTurnsStopping:  10%|█         | 10/100 [00:02<00:17,  5.21it/s, acc=40%, turns=1.0][A
  FixedTurnsStopping:  11%|█         | 11/100 [00:02<00:17,  5.21it/s, acc=45%, turns=1.0][AAPI calls:   0%|          | 12/5000 [00:02<09:02,  9.19call/s]
  FixedTurnsStopping:  12%|█▁        | 12/100 [00:02<00:11,  7.43it/s, acc=45%, turns=1.0][A
  FixedTurnsStopping:  12%|█▁        | 12/100 [00:02<00:11,  7.43it/s, acc=42%, turns=1.0][A
  FixedTurnsStopping:  13%|█▎        | 13/100 [00:02<00:11,  7.43it/s, acc=38%, turns=1.0][AAPI calls:   0%|          | 14/5000 [00:02<08:08, 10.21call/s]
  FixedTurnsStopping:  14%|█▁        | 14/100 [00:02<00:11,  7.43it/s, acc=36%, turns=1.0][A
  FixedTurnsStopping:  15%|█▌        | 15/100 [00:02<00:09,  9.14it/s, acc=36%, turns=1.0][A
  FixedTurnsStopping:  15%|█▌        | 15/100 [00:02<00:09,  9.14it/s, acc=33%, turns=1.0][AAPI calls:   0%|          | 16/5000 [00:02<07:51, 10.58call/s]
  FixedTurnsStopping:  16%|█▌        | 16/100 [00:02<00:09,  9.14it/s, acc=38%, turns=1.0][A
  FixedTurnsStopping:  17%|█▋        | 17/100 [00:03<00:08,  9.40it/s, acc=38%, turns=1.0][A
  FixedTurnsStopping:  17%|█▋        | 17/100 [00:03<00:08,  9.40it/s, acc=35%, turns=1.0][AAPI calls:   0%|          | 18/5000 [00:03<07:50, 10.58call/s]
  FixedTurnsStopping:  18%|█▊        | 18/100 [00:03<00:08,  9.40it/s, acc=33%, turns=1.0][A
  FixedTurnsStopping:  19%|█▉        | 19/100 [00:03<00:07, 10.44it/s, acc=33%, turns=1.0][A
  FixedTurnsStopping:  19%|█▉        | 19/100 [00:03<00:07, 10.44it/s, acc=32%, turns=1.0][A
  FixedTurnsStopping:  20%|██        | 20/100 [00:03<00:07, 10.44it/s, acc=30%, turns=1.0][A
  FixedTurnsStopping:  21%|██        | 21/100 [00:03<00:07, 10.44it/s, acc=29%, turns=1.0][AAPI calls:   0%|          | 22/5000 [00:03<05:41, 14.59call/s]
  FixedTurnsStopping:  22%|██▁       | 22/100 [00:03<00:05, 13.42it/s, acc=29%, turns=1.0][A
  FixedTurnsStopping:  22%|██▁       | 22/100 [00:03<00:05, 13.42it/s, acc=32%, turns=1.0][A
  FixedTurnsStopping:  23%|██▎       | 23/100 [00:03<00:05, 13.42it/s, acc=30%, turns=1.0][AAPI calls:   0%|          | 24/5000 [00:03<05:32, 14.97call/s]
  FixedTurnsStopping:  24%|██▁       | 24/100 [00:03<00:05, 14.07it/s, acc=30%, turns=1.0][A
  FixedTurnsStopping:  24%|██▁       | 24/100 [00:03<00:05, 14.07it/s, acc=29%, turns=1.0][A
  FixedTurnsStopping:  25%|██▌       | 25/100 [00:03<00:05, 14.07it/s, acc=32%, turns=1.0][AAPI calls:   1%|          | 26/5000 [00:03<06:04, 13.64call/s]
  FixedTurnsStopping:  26%|██▌       | 26/100 [00:03<00:05, 13.01it/s, acc=32%, turns=1.0][A
  FixedTurnsStopping:  26%|██▌       | 26/100 [00:03<00:05, 13.01it/s, acc=31%, turns=1.0][A
  FixedTurnsStopping:  27%|██▋       | 27/100 [00:03<00:05, 13.01it/s, acc=33%, turns=1.0][AAPI calls:   1%|          | 28/5000 [00:03<06:45, 12.25call/s]
  FixedTurnsStopping:  28%|██▊       | 28/100 [00:03<00:06, 11.82it/s, acc=33%, turns=1.0][A
  FixedTurnsStopping:  28%|██▊       | 28/100 [00:03<00:06, 11.82it/s, acc=32%, turns=1.0][A
  FixedTurnsStopping:  29%|██▉       | 29/100 [00:03<00:06, 11.82it/s, acc=31%, turns=1.0][A
  FixedTurnsStopping:  30%|███       | 30/100 [00:03<00:05, 11.82it/s, acc=30%, turns=1.0][AAPI calls:   1%|          | 31/5000 [00:03<05:42, 14.52call/s]
  FixedTurnsStopping:  31%|███       | 31/100 [00:03<00:04, 14.22it/s, acc=30%, turns=1.0][A
  FixedTurnsStopping:  31%|███       | 31/100 [00:03<00:04, 14.22it/s, acc=32%, turns=1.0][A
  FixedTurnsStopping:  32%|███▁      | 32/100 [00:04<00:04, 14.22it/s, acc=31%, turns=1.0][AAPI calls:   1%|          | 33/5000 [00:04<07:05, 11.67call/s]
  FixedTurnsStopping:  33%|███▎      | 33/100 [00:04<00:05, 11.48it/s, acc=31%, turns=1.0][A
  FixedTurnsStopping:  33%|███▎      | 33/100 [00:04<00:05, 11.48it/s, acc=33%, turns=1.0][A
  FixedTurnsStopping:  34%|███▁      | 34/100 [00:04<00:05, 11.48it/s, acc=35%, turns=1.0][AAPI calls:   1%|          | 35/5000 [00:04<06:42, 12.33call/s]API calls:   1%|          | 36/5000 [00:04<05:39, 14.64call/s]
  FixedTurnsStopping:  35%|███▌      | 35/100 [00:04<00:05, 12.16it/s, acc=35%, turns=1.0][A
  FixedTurnsStopping:  35%|███▌      | 35/100 [00:04<00:05, 12.16it/s, acc=37%, turns=1.0][A
  FixedTurnsStopping:  36%|███▌      | 36/100 [00:04<00:05, 12.16it/s, acc=39%, turns=1.0][A
  FixedTurnsStopping:  37%|███▋      | 37/100 [00:04<00:05, 12.16it/s, acc=38%, turns=1.0][AAPI calls:   1%|          | 38/5000 [00:04<08:25,  9.81call/s]
  FixedTurnsStopping:  38%|███▊      | 38/100 [00:04<00:06,  9.93it/s, acc=38%, turns=1.0][A
  FixedTurnsStopping:  38%|███▊      | 38/100 [00:04<00:06,  9.93it/s, acc=37%, turns=1.0][A
  FixedTurnsStopping:  39%|███▉      | 39/100 [00:04<00:06,  9.93it/s, acc=38%, turns=1.0][AAPI calls:   1%|          | 40/5000 [00:04<08:47,  9.41call/s]API calls:   1%|          | 42/5000 [00:04<07:58, 10.35call/s]
  FixedTurnsStopping:  40%|████      | 40/100 [00:04<00:06,  9.45it/s, acc=38%, turns=1.0][A
  FixedTurnsStopping:  40%|████      | 40/100 [00:04<00:06,  9.45it/s, acc=40%, turns=1.0][A
  FixedTurnsStopping:  41%|████      | 41/100 [00:04<00:06,  9.45it/s, acc=39%, turns=1.0][A
  FixedTurnsStopping:  42%|████▁     | 42/100 [00:05<00:06,  9.45it/s, acc=38%, turns=1.0][A
  FixedTurnsStopping:  43%|████▎     | 43/100 [00:05<00:06,  9.45it/s, acc=37%, turns=1.0][AAPI calls:   1%|          | 51/5000 [00:05<03:41, 22.34call/s]
  FixedTurnsStopping:  44%|████▁     | 44/100 [00:05<00:04, 13.86it/s, acc=37%, turns=1.0][A
  FixedTurnsStopping:  44%|████▁     | 44/100 [00:05<00:04, 13.86it/s, acc=36%, turns=1.0][A
  FixedTurnsStopping:  45%|████▌     | 45/100 [00:05<00:03, 13.86it/s, acc=36%, turns=1.0][A
  FixedTurnsStopping:  46%|████▌     | 46/100 [00:05<00:03, 13.86it/s, acc=35%, turns=1.0][A
  FixedTurnsStopping:  47%|████▋     | 47/100 [00:05<00:03, 13.86it/s, acc=34%, turns=1.0][A
  FixedTurnsStopping:  48%|████▊     | 48/100 [00:05<00:03, 13.86it/s, acc=33%, turns=1.0][A
  FixedTurnsStopping:  49%|████▉     | 49/100 [00:05<00:02, 19.01it/s, acc=33%, turns=1.0][A
  FixedTurnsStopping:  49%|████▉     | 49/100 [00:05<00:02, 19.01it/s, acc=33%, turns=1.0][A
  FixedTurnsStopping:  50%|█████     | 50/100 [00:05<00:02, 19.01it/s, acc=32%, turns=1.0][A
  FixedTurnsStopping:  51%|█████     | 51/100 [00:05<00:02, 19.01it/s, acc=33%, turns=1.0][A
  FixedTurnsStopping:  52%|█████▁    | 52/100 [00:05<00:02, 19.01it/s, acc=35%, turns=1.0][AAPI calls:   1%|          | 55/5000 [00:05<03:43, 22.13call/s]
  FixedTurnsStopping:  53%|█████▎    | 53/100 [00:05<00:02, 19.01it/s, acc=36%, turns=1.0][A
  FixedTurnsStopping:  54%|█████▁    | 54/100 [00:05<00:02, 19.01it/s, acc=35%, turns=1.0][A
  FixedTurnsStopping:  55%|█████▌    | 55/100 [00:05<00:01, 26.02it/s, acc=35%, turns=1.0][A
  FixedTurnsStopping:  55%|█████▌    | 55/100 [00:05<00:01, 26.02it/s, acc=35%, turns=1.0][A
  FixedTurnsStopping:  56%|█████▌    | 56/100 [00:05<00:01, 26.02it/s, acc=34%, turns=1.0][A
  FixedTurnsStopping:  57%|█████▋    | 57/100 [00:05<00:01, 26.02it/s, acc=33%, turns=1.0][AAPI calls:   1%|          | 61/5000 [00:05<02:57, 27.84call/s]
  FixedTurnsStopping:  58%|█████▊    | 58/100 [00:05<00:01, 26.02it/s, acc=34%, turns=1.0][A
  FixedTurnsStopping:  59%|█████▉    | 59/100 [00:05<00:01, 26.02it/s, acc=36%, turns=1.0][A
  FixedTurnsStopping:  60%|██████    | 60/100 [00:05<00:01, 26.02it/s, acc=35%, turns=1.0][A
  FixedTurnsStopping:  61%|██████    | 61/100 [00:05<00:01, 31.35it/s, acc=35%, turns=1.0][A
  FixedTurnsStopping:  61%|██████    | 61/100 [00:05<00:01, 31.35it/s, acc=34%, turns=1.0][A
  FixedTurnsStopping:  62%|██████▁   | 62/100 [00:05<00:01, 31.35it/s, acc=35%, turns=1.0][A
  FixedTurnsStopping:  63%|██████▎   | 63/100 [00:05<00:01, 31.35it/s, acc=37%, turns=1.0][A
  FixedTurnsStopping:  64%|██████▁   | 64/100 [00:05<00:01, 31.35it/s, acc=38%, turns=1.0][AAPI calls:   1%|▁         | 65/5000 [00:05<03:31, 23.38call/s]
  FixedTurnsStopping:  65%|██████▌   | 65/100 [00:05<00:01, 28.54it/s, acc=38%, turns=1.0][A
  FixedTurnsStopping:  65%|██████▌   | 65/100 [00:05<00:01, 28.54it/s, acc=38%, turns=1.0][A
  FixedTurnsStopping:  66%|██████▌   | 66/100 [00:05<00:01, 28.54it/s, acc=38%, turns=1.0][A
  FixedTurnsStopping:  67%|██████▋   | 67/100 [00:05<00:01, 28.54it/s, acc=39%, turns=1.0][A
  FixedTurnsStopping:  68%|██████▊   | 68/100 [00:05<00:01, 28.54it/s, acc=40%, turns=1.0][AAPI calls:   1%|▁         | 69/5000 [00:05<03:50, 21.44call/s]
  FixedTurnsStopping:  69%|██████▉   | 69/100 [00:05<00:01, 24.35it/s, acc=40%, turns=1.0][A
  FixedTurnsStopping:  69%|██████▉   | 69/100 [00:05<00:01, 24.35it/s, acc=39%, turns=1.0][A
  FixedTurnsStopping:  70%|███████   | 70/100 [00:06<00:01, 24.35it/s, acc=39%, turns=1.0][A
  FixedTurnsStopping:  71%|███████   | 71/100 [00:06<00:01, 24.35it/s, acc=38%, turns=1.0][AAPI calls:   1%|▁         | 72/5000 [00:06<04:26, 18.50call/s]
  FixedTurnsStopping:  72%|███████▁  | 72/100 [00:06<00:01, 20.09it/s, acc=38%, turns=1.0][A
  FixedTurnsStopping:  72%|███████▁  | 72/100 [00:06<00:01, 20.09it/s, acc=39%, turns=1.0][A
  FixedTurnsStopping:  73%|███████▎  | 73/100 [00:06<00:01, 20.09it/s, acc=40%, turns=1.0][A
  FixedTurnsStopping:  74%|███████▁  | 74/100 [00:06<00:01, 20.09it/s, acc=39%, turns=1.0][A
  FixedTurnsStopping:  75%|███████▌  | 75/100 [00:06<00:01, 20.09it/s, acc=40%, turns=1.0][A
  FixedTurnsStopping:  76%|███████▌  | 76/100 [00:06<00:01, 20.09it/s, acc=41%, turns=1.0][AAPI calls:   2%|▁         | 77/5000 [00:06<03:40, 22.31call/s]
  FixedTurnsStopping:  77%|███████▋  | 77/100 [00:06<00:00, 23.80it/s, acc=41%, turns=1.0][A
  FixedTurnsStopping:  77%|███████▋  | 77/100 [00:06<00:00, 23.80it/s, acc=42%, turns=1.0][A
  FixedTurnsStopping:  78%|███████▊  | 78/100 [00:06<00:00, 23.80it/s, acc=41%, turns=1.0][A
  FixedTurnsStopping:  79%|███████▉  | 79/100 [00:06<00:00, 23.80it/s, acc=41%, turns=1.0][AAPI calls:   2%|▁         | 80/5000 [00:06<04:28, 18.29call/s]
  FixedTurnsStopping:  80%|████████  | 80/100 [00:06<00:01, 19.03it/s, acc=41%, turns=1.0][A
  FixedTurnsStopping:  80%|████████  | 80/100 [00:06<00:01, 19.03it/s, acc=40%, turns=1.0][A
  FixedTurnsStopping:  81%|████████  | 81/100 [00:06<00:00, 19.03it/s, acc=41%, turns=1.0][A
  FixedTurnsStopping:  82%|████████▁ | 82/100 [00:06<00:00, 19.03it/s, acc=40%, turns=1.0][A
  FixedTurnsStopping:  83%|████████▎ | 83/100 [00:06<00:00, 19.03it/s, acc=40%, turns=1.0][AAPI calls:   2%|▁         | 84/5000 [00:06<03:48, 21.51call/s]
  FixedTurnsStopping:  84%|████████▁ | 84/100 [00:06<00:00, 22.23it/s, acc=40%, turns=1.0][A
  FixedTurnsStopping:  84%|████████▁ | 84/100 [00:06<00:00, 22.23it/s, acc=39%, turns=1.0][A
  FixedTurnsStopping:  85%|████████▌ | 85/100 [00:06<00:00, 22.23it/s, acc=40%, turns=1.0][A
  FixedTurnsStopping:  86%|████████▌ | 86/100 [00:07<00:00, 22.23it/s, acc=40%, turns=1.0][AAPI calls:   2%|▁         | 87/5000 [00:07<10:21,  7.91call/s]
  FixedTurnsStopping:  87%|████████▋ | 87/100 [00:07<00:01,  7.98it/s, acc=40%, turns=1.0][A
  FixedTurnsStopping:  87%|████████▋ | 87/100 [00:07<00:01,  7.98it/s, acc=39%, turns=1.0][A
  FixedTurnsStopping:  88%|████████▊ | 88/100 [00:08<00:01,  7.98it/s, acc=39%, turns=1.0][AAPI calls:   2%|▁         | 89/5000 [00:09<19:51,  4.12call/s]
  FixedTurnsStopping:  89%|████████▉ | 89/100 [00:09<00:02,  4.14it/s, acc=39%, turns=1.0][A
  FixedTurnsStopping:  89%|████████▉ | 89/100 [00:09<00:02,  4.14it/s, acc=38%, turns=1.0][A
  FixedTurnsStopping:  90%|█████████ | 90/100 [00:09<00:02,  4.14it/s, acc=38%, turns=1.0][AAPI calls:   2%|▁         | 91/5000 [00:09<19:09,  4.27call/s]
  FixedTurnsStopping:  91%|█████████ | 91/100 [00:09<00:02,  4.28it/s, acc=38%, turns=1.0][A
  FixedTurnsStopping:  91%|█████████ | 91/100 [00:09<00:02,  4.28it/s, acc=37%, turns=1.0][A
  FixedTurnsStopping:  92%|█████████▁| 92/100 [00:09<00:01,  4.28it/s, acc=37%, turns=1.0][AAPI calls:   2%|▁         | 93/5000 [00:10<19:11,  4.26call/s]
  FixedTurnsStopping:  93%|█████████▎| 93/100 [00:10<00:01,  4.27it/s, acc=37%, turns=1.0][A
  FixedTurnsStopping:  93%|█████████▎| 93/100 [00:10<00:01,  4.27it/s, acc=37%, turns=1.0][AAPI calls:   2%|▁         | 94/5000 [00:10<17:45,  4.61call/s]
  FixedTurnsStopping:  94%|█████████▁| 94/100 [00:10<00:01,  4.61it/s, acc=37%, turns=1.0][A
  FixedTurnsStopping:  94%|█████████▁| 94/100 [00:10<00:01,  4.61it/s, acc=36%, turns=1.0][AAPI calls:   2%|▁         | 95/5000 [00:10<16:23,  4.99call/s]
  FixedTurnsStopping:  95%|█████████▌| 95/100 [00:10<00:01,  4.99it/s, acc=36%, turns=1.0][A
  FixedTurnsStopping:  95%|█████████▌| 95/100 [00:10<00:01,  4.99it/s, acc=37%, turns=1.0][AAPI calls:   2%|▁         | 96/5000 [00:10<19:20,  4.23call/s]
  FixedTurnsStopping:  96%|█████████▌| 96/100 [00:10<00:00,  4.23it/s, acc=37%, turns=1.0][A
  FixedTurnsStopping:  96%|█████████▌| 96/100 [00:10<00:00,  4.23it/s, acc=38%, turns=1.0][AAPI calls:   2%|▁         | 97/5000 [00:10<19:14,  4.25call/s]
  FixedTurnsStopping:  97%|█████████▋| 97/100 [00:10<00:00,  4.25it/s, acc=38%, turns=1.0][A
  FixedTurnsStopping:  97%|█████████▋| 97/100 [00:10<00:00,  4.25it/s, acc=37%, turns=1.0][A
  FixedTurnsStopping:  98%|█████████▊| 98/100 [00:11<00:00,  4.25it/s, acc=38%, turns=1.0][AAPI calls:   2%|▁         | 99/5000 [00:11<15:36,  5.24call/s]
  FixedTurnsStopping:  99%|█████████▉| 99/100 [00:11<00:00,  5.24it/s, acc=38%, turns=1.0][A
  FixedTurnsStopping:  99%|█████████▉| 99/100 [00:11<00:00,  5.24it/s, acc=38%, turns=1.0][A
  FixedTurnsStopping: 100%|██████████| 100/100 [00:11<00:00,  5.24it/s, acc=38%, turns=1.0][A
                                                                                           [AAPI calls:   2%|▁         | 100/5000 [00:11<09:14,  8.84call/s]
  Results: Accuracy=38.00% [29.00%, 48.00%], Avg Turns=1.0 [1.0, 1.0]

==========================================================================================
COMPARISON RESULTS
==========================================================================================
Method                      Accuracy           95% CI  Avg Turns           95% CI
------------------------------------------------------------------------------------------
FixedTurnsStopping            38.00%  [29.00%,48.00%]        1.0        [1.0,1.0]
==========================================================================================

Total API usage:
  Prompt tokens: 54,956
  Completion tokens: 158
  Total tokens: 55,114
