Warning: You are sending unauthenticated requests to the HF Hub. Please set a HF_TOKEN to enable higher rate limits and faster downloads.

============================================================
RRMC Experiment: dc_methods/knowno
============================================================
Initializing LLM: qwen/qwen-2.5-7b-instruct (max_workers=32)
Task: detective_cases
Data: /root/RRMC/AR-Bench/data/dc/test.json
Loading weights:   0%|          | 0/103 [00:00<?, ?it/s]Loading weights:   1%|          | 1/103 [00:00<00:00, 18157.16it/s, Materializing param=embeddings.LayerNorm.bias]Loading weights:   1%|          | 1/103 [00:00<00:00, 7796.10it/s, Materializing param=embeddings.LayerNorm.bias] Loading weights:   2%|▁         | 2/103 [00:00<00:00, 7256.58it/s, Materializing param=embeddings.LayerNorm.weight]Loading weights:   2%|▁         | 2/103 [00:00<00:00, 6030.63it/s, Materializing param=embeddings.LayerNorm.weight]Loading weights:   3%|▎         | 3/103 [00:00<00:00, 6452.78it/s, Materializing param=embeddings.position_embeddings.weight]Loading weights:   3%|▎         | 3/103 [00:00<00:00, 5801.25it/s, Materializing param=embeddings.position_embeddings.weight]Loading weights:   4%|▁         | 4/103 [00:00<00:00, 6141.00it/s, Materializing param=embeddings.token_type_embeddings.weight]Loading weights:   4%|▁         | 4/103 [00:00<00:00, 5603.61it/s, Materializing param=embeddings.token_type_embeddings.weight]Loading weights:   5%|▁         | 5/103 [00:00<00:00, 5782.06it/s, Materializing param=embeddings.word_embeddings.weight]      Loading weights:   5%|▁         | 5/103 [00:00<00:00, 5465.60it/s, Materializing param=embeddings.word_embeddings.weight]Loading weights:   6%|▌         | 6/103 [00:00<00:00, 5675.65it/s, Materializing param=encoder.layer.0.attention.output.LayerNorm.bias]Loading weights:   6%|▌         | 6/103 [00:00<00:00, 5412.01it/s, Materializing param=encoder.layer.0.attention.output.LayerNorm.bias]Loading weights:   7%|▋         | 7/103 [00:00<00:00, 5480.70it/s, Materializing param=encoder.layer.0.attention.output.LayerNorm.weight]Loading weights:   7%|▋         | 7/103 [00:00<00:00, 5271.12it/s, Materializing param=encoder.layer.0.attention.output.LayerNorm.weight]Loading weights:   8%|▊         | 8/103 [00:00<00:00, 5397.21it/s, Materializing param=encoder.layer.0.attention.output.dense.bias]      Loading weights:   8%|▊         | 8/103 [00:00<00:00, 5219.23it/s, Materializing param=encoder.layer.0.attention.output.dense.bias]Loading weights:   9%|▊         | 9/103 [00:00<00:00, 5339.28it/s, Materializing param=encoder.layer.0.attention.output.dense.weight]Loading weights:   9%|▊         | 9/103 [00:00<00:00, 5185.98it/s, Materializing param=encoder.layer.0.attention.output.dense.weight]Loading weights:  10%|▉         | 10/103 [00:00<00:00, 5304.55it/s, Materializing param=encoder.layer.0.attention.self.key.bias]     Loading weights:  10%|▉         | 10/103 [00:00<00:00, 5172.41it/s, Materializing param=encoder.layer.0.attention.self.key.bias]Loading weights:  11%|█         | 11/103 [00:00<00:00, 5299.49it/s, Materializing param=encoder.layer.0.attention.self.key.weight]Loading weights:  11%|█         | 11/103 [00:00<00:00, 4132.69it/s, Materializing param=encoder.layer.0.attention.self.key.weight]Loading weights:  12%|█▁        | 12/103 [00:00<00:00, 4286.10it/s, Materializing param=encoder.layer.0.attention.self.query.bias]Loading weights:  12%|█▁        | 12/103 [00:00<00:00, 4210.09it/s, Materializing param=encoder.layer.0.attention.self.query.bias]Loading weights:  13%|█▎        | 13/103 [00:00<00:00, 4341.93it/s, Materializing param=encoder.layer.0.attention.self.query.weight]Loading weights:  13%|█▎        | 13/103 [00:00<00:00, 4269.51it/s, Materializing param=encoder.layer.0.attention.self.query.weight]Loading weights:  14%|█▎        | 14/103 [00:00<00:00, 4343.54it/s, Materializing param=encoder.layer.0.attention.self.value.bias]  Loading weights:  14%|█▎        | 14/103 [00:00<00:00, 4251.70it/s, Materializing param=encoder.layer.0.attention.self.value.bias]Loading weights:  15%|█▁        | 15/103 [00:00<00:00, 3597.79it/s, Materializing param=encoder.layer.0.attention.self.value.weight]Loading weights:  15%|█▁        | 15/103 [00:00<00:00, 3385.78it/s, Materializing param=encoder.layer.0.attention.self.value.weight]Loading weights:  16%|█▌        | 16/103 [00:00<00:00, 3506.21it/s, Materializing param=encoder.layer.0.intermediate.dense.bias]    Loading weights:  16%|█▌        | 16/103 [00:00<00:00, 3467.44it/s, Materializing param=encoder.layer.0.intermediate.dense.bias]Loading weights:  17%|█▋        | 17/103 [00:00<00:00, 3585.96it/s, Materializing param=encoder.layer.0.intermediate.dense.weight]Loading weights:  17%|█▋        | 17/103 [00:00<00:00, 3547.77it/s, Materializing param=encoder.layer.0.intermediate.dense.weight]Loading weights:  17%|█▋        | 18/103 [00:00<00:00, 3648.98it/s, Materializing param=encoder.layer.0.output.LayerNorm.bias]    Loading weights:  17%|█▋        | 18/103 [00:00<00:00, 3613.88it/s, Materializing param=encoder.layer.0.output.LayerNorm.bias]Loading weights:  18%|█▊        | 19/103 [00:00<00:00, 3704.35it/s, Materializing param=encoder.layer.0.output.LayerNorm.weight]Loading weights:  18%|█▊        | 19/103 [00:00<00:00, 3374.77it/s, Materializing param=encoder.layer.0.output.LayerNorm.weight]Loading weights:  19%|█▉        | 20/103 [00:00<00:00, 3470.24it/s, Materializing param=encoder.layer.0.output.dense.bias]      Loading weights:  19%|█▉        | 20/103 [00:00<00:00, 3440.92it/s, Materializing param=encoder.layer.0.output.dense.bias]Loading weights:  20%|██        | 21/103 [00:00<00:00, 3533.96it/s, Materializing param=encoder.layer.0.output.dense.weight]Loading weights:  20%|██        | 21/103 [00:00<00:00, 3505.27it/s, Materializing param=encoder.layer.0.output.dense.weight]Loading weights:  21%|██▁       | 22/103 [00:00<00:00, 3582.09it/s, Materializing param=encoder.layer.1.attention.output.LayerNorm.bias]Loading weights:  21%|██▁       | 22/103 [00:00<00:00, 3550.39it/s, Materializing param=encoder.layer.1.attention.output.LayerNorm.bias]Loading weights:  22%|██▁       | 23/103 [00:00<00:00, 3623.38it/s, Materializing param=encoder.layer.1.attention.output.LayerNorm.weight]Loading weights:  22%|██▁       | 23/103 [00:00<00:00, 3595.97it/s, Materializing param=encoder.layer.1.attention.output.LayerNorm.weight]Loading weights:  23%|██▎       | 24/103 [00:00<00:00, 3667.15it/s, Materializing param=encoder.layer.1.attention.output.dense.bias]      Loading weights:  23%|██▎       | 24/103 [00:00<00:00, 3640.10it/s, Materializing param=encoder.layer.1.attention.output.dense.bias]Loading weights:  24%|██▁       | 25/103 [00:00<00:00, 3711.64it/s, Materializing param=encoder.layer.1.attention.output.dense.weight]Loading weights:  24%|██▁       | 25/103 [00:00<00:00, 3685.94it/s, Materializing param=encoder.layer.1.attention.output.dense.weight]Loading weights:  25%|██▌       | 26/103 [00:00<00:00, 3754.33it/s, Materializing param=encoder.layer.1.attention.self.key.bias]      Loading weights:  25%|██▌       | 26/103 [00:00<00:00, 3728.02it/s, Materializing param=encoder.layer.1.attention.self.key.bias]Loading weights:  26%|██▌       | 27/103 [00:00<00:00, 3788.26it/s, Materializing param=encoder.layer.1.attention.self.key.weight]Loading weights:  26%|██▌       | 27/103 [00:00<00:00, 3760.71it/s, Materializing param=encoder.layer.1.attention.self.key.weight]Loading weights:  27%|██▋       | 28/103 [00:00<00:00, 3506.42it/s, Materializing param=encoder.layer.1.attention.self.query.bias]Loading weights:  27%|██▋       | 28/103 [00:00<00:00, 3408.91it/s, Materializing param=encoder.layer.1.attention.self.query.bias]Loading weights:  28%|██▊       | 29/103 [00:00<00:00, 3113.33it/s, Materializing param=encoder.layer.1.attention.self.query.weight]Loading weights:  28%|██▊       | 29/103 [00:00<00:00, 3012.18it/s, Materializing param=encoder.layer.1.attention.self.query.weight]Loading weights:  29%|██▉       | 30/103 [00:00<00:00, 2961.66it/s, Materializing param=encoder.layer.1.attention.self.value.bias]  Loading weights:  29%|██▉       | 30/103 [00:00<00:00, 2829.85it/s, Materializing param=encoder.layer.1.attention.self.value.bias]Loading weights:  30%|███       | 31/103 [00:00<00:00, 2887.87it/s, Materializing param=encoder.layer.1.attention.self.value.weight]Loading weights:  30%|███       | 31/103 [00:00<00:00, 2873.51it/s, Materializing param=encoder.layer.1.attention.self.value.weight]Loading weights:  31%|███       | 32/103 [00:00<00:00, 2936.42it/s, Materializing param=encoder.layer.1.intermediate.dense.bias]    Loading weights:  31%|███       | 32/103 [00:00<00:00, 2922.92it/s, Materializing param=encoder.layer.1.intermediate.dense.bias]Loading weights:  32%|███▁      | 33/103 [00:00<00:00, 2978.84it/s, Materializing param=encoder.layer.1.intermediate.dense.weight]Loading weights:  32%|███▁      | 33/103 [00:00<00:00, 2858.28it/s, Materializing param=encoder.layer.1.intermediate.dense.weight]Loading weights:  33%|███▎      | 34/103 [00:00<00:00, 2916.82it/s, Materializing param=encoder.layer.1.output.LayerNorm.bias]    Loading weights:  33%|███▎      | 34/103 [00:00<00:00, 2906.42it/s, Materializing param=encoder.layer.1.output.LayerNorm.bias]Loading weights:  34%|███▁      | 35/103 [00:00<00:00, 2964.83it/s, Materializing param=encoder.layer.1.output.LayerNorm.weight]Loading weights:  34%|███▁      | 35/103 [00:00<00:00, 2953.85it/s, Materializing param=encoder.layer.1.output.LayerNorm.weight]Loading weights:  35%|███▁      | 36/103 [00:00<00:00, 3011.89it/s, Materializing param=encoder.layer.1.output.dense.bias]      Loading weights:  35%|███▁      | 36/103 [00:00<00:00, 3001.53it/s, Materializing param=encoder.layer.1.output.dense.bias]Loading weights:  36%|███▌      | 37/103 [00:00<00:00, 3059.12it/s, Materializing param=encoder.layer.1.output.dense.weight]Loading weights:  36%|███▌      | 37/103 [00:00<00:00, 2893.27it/s, Materializing param=encoder.layer.1.output.dense.weight]Loading weights:  37%|███▋      | 38/103 [00:00<00:00, 2940.55it/s, Materializing param=encoder.layer.2.attention.output.LayerNorm.bias]Loading weights:  37%|███▋      | 38/103 [00:00<00:00, 2930.33it/s, Materializing param=encoder.layer.2.attention.output.LayerNorm.bias]Loading weights:  38%|███▊      | 39/103 [00:00<00:00, 2980.81it/s, Materializing param=encoder.layer.2.attention.output.LayerNorm.weight]Loading weights:  38%|███▊      | 39/103 [00:00<00:00, 2968.21it/s, Materializing param=encoder.layer.2.attention.output.LayerNorm.weight]Loading weights:  39%|███▉      | 40/103 [00:00<00:00, 3017.59it/s, Materializing param=encoder.layer.2.attention.output.dense.bias]      Loading weights:  39%|███▉      | 40/103 [00:00<00:00, 3007.91it/s, Materializing param=encoder.layer.2.attention.output.dense.bias]Loading weights:  40%|███▉      | 41/103 [00:00<00:00, 3058.49it/s, Materializing param=encoder.layer.2.attention.output.dense.weight]Loading weights:  40%|███▉      | 41/103 [00:00<00:00, 3048.73it/s, Materializing param=encoder.layer.2.attention.output.dense.weight]Loading weights:  41%|████      | 42/103 [00:00<00:00, 3098.69it/s, Materializing param=encoder.layer.2.attention.self.key.bias]      Loading weights:  41%|████      | 42/103 [00:00<00:00, 3089.24it/s, Materializing param=encoder.layer.2.attention.self.key.bias]Loading weights:  42%|████▁     | 43/103 [00:00<00:00, 3138.14it/s, Materializing param=encoder.layer.2.attention.self.key.weight]Loading weights:  42%|████▁     | 43/103 [00:00<00:00, 3128.56it/s, Materializing param=encoder.layer.2.attention.self.key.weight]Loading weights:  43%|████▎     | 44/103 [00:00<00:00, 3175.86it/s, Materializing param=encoder.layer.2.attention.self.query.bias]Loading weights:  43%|████▎     | 44/103 [00:00<00:00, 3129.23it/s, Materializing param=encoder.layer.2.attention.self.query.bias]Loading weights:  44%|████▎     | 45/103 [00:00<00:00, 3168.17it/s, Materializing param=encoder.layer.2.attention.self.query.weight]Loading weights:  44%|████▎     | 45/103 [00:00<00:00, 3157.62it/s, Materializing param=encoder.layer.2.attention.self.query.weight]Loading weights:  45%|████▁     | 46/103 [00:00<00:00, 3202.98it/s, Materializing param=encoder.layer.2.attention.self.value.bias]  Loading weights:  45%|████▁     | 46/103 [00:00<00:00, 3193.17it/s, Materializing param=encoder.layer.2.attention.self.value.bias]Loading weights:  46%|████▌     | 47/103 [00:00<00:00, 3238.63it/s, Materializing param=encoder.layer.2.attention.self.value.weight]Loading weights:  46%|████▌     | 47/103 [00:00<00:00, 3229.14it/s, Materializing param=encoder.layer.2.attention.self.value.weight]Loading weights:  47%|████▋     | 48/103 [00:00<00:00, 3274.30it/s, Materializing param=encoder.layer.2.intermediate.dense.bias]    Loading weights:  47%|████▋     | 48/103 [00:00<00:00, 3264.84it/s, Materializing param=encoder.layer.2.intermediate.dense.bias]Loading weights:  48%|████▊     | 49/103 [00:00<00:00, 3309.57it/s, Materializing param=encoder.layer.2.intermediate.dense.weight]Loading weights:  48%|████▊     | 49/103 [00:00<00:00, 3300.00it/s, Materializing param=encoder.layer.2.intermediate.dense.weight]Loading weights:  49%|████▊     | 50/103 [00:00<00:00, 3344.42it/s, Materializing param=encoder.layer.2.output.LayerNorm.bias]    Loading weights:  49%|████▊     | 50/103 [00:00<00:00, 3334.95it/s, Materializing param=encoder.layer.2.output.LayerNorm.bias]Loading weights:  50%|████▉     | 51/103 [00:00<00:00, 3378.44it/s, Materializing param=encoder.layer.2.output.LayerNorm.weight]Loading weights:  50%|████▉     | 51/103 [00:00<00:00, 3365.16it/s, Materializing param=encoder.layer.2.output.LayerNorm.weight]Loading weights:  50%|█████     | 52/103 [00:00<00:00, 3405.90it/s, Materializing param=encoder.layer.2.output.dense.bias]      Loading weights:  50%|█████     | 52/103 [00:00<00:00, 3396.20it/s, Materializing param=encoder.layer.2.output.dense.bias]Loading weights:  51%|█████▁    | 53/103 [00:00<00:00, 3435.99it/s, Materializing param=encoder.layer.2.output.dense.weight]Loading weights:  51%|█████▁    | 53/103 [00:00<00:00, 3426.51it/s, Materializing param=encoder.layer.2.output.dense.weight]Loading weights:  52%|█████▁    | 54/103 [00:00<00:00, 3467.27it/s, Materializing param=encoder.layer.3.attention.output.LayerNorm.bias]Loading weights:  52%|█████▁    | 54/103 [00:00<00:00, 3457.74it/s, Materializing param=encoder.layer.3.attention.output.LayerNorm.bias]Loading weights:  53%|█████▎    | 55/103 [00:00<00:00, 3496.74it/s, Materializing param=encoder.layer.3.attention.output.LayerNorm.weight]Loading weights:  53%|█████▎    | 55/103 [00:00<00:00, 3487.27it/s, Materializing param=encoder.layer.3.attention.output.LayerNorm.weight]Loading weights:  54%|█████▁    | 56/103 [00:00<00:00, 3269.55it/s, Materializing param=encoder.layer.3.attention.output.dense.bias]      Loading weights:  54%|█████▁    | 56/103 [00:00<00:00, 3259.52it/s, Materializing param=encoder.layer.3.attention.output.dense.bias]Loading weights:  55%|█████▌    | 57/103 [00:00<00:00, 3295.82it/s, Materializing param=encoder.layer.3.attention.output.dense.weight]Loading weights:  55%|█████▌    | 57/103 [00:00<00:00, 3287.39it/s, Materializing param=encoder.layer.3.attention.output.dense.weight]Loading weights:  56%|█████▋    | 58/103 [00:00<00:00, 3324.26it/s, Materializing param=encoder.layer.3.attention.self.key.bias]      Loading weights:  56%|█████▋    | 58/103 [00:00<00:00, 3316.20it/s, Materializing param=encoder.layer.3.attention.self.key.bias]Loading weights:  57%|█████▋    | 59/103 [00:00<00:00, 3300.53it/s, Materializing param=encoder.layer.3.attention.self.key.weight]Loading weights:  57%|█████▋    | 59/103 [00:00<00:00, 3292.28it/s, Materializing param=encoder.layer.3.attention.self.key.weight]Loading weights:  58%|█████▊    | 60/103 [00:00<00:00, 3326.44it/s, Materializing param=encoder.layer.3.attention.self.query.bias]Loading weights:  58%|█████▊    | 60/103 [00:00<00:00, 3318.32it/s, Materializing param=encoder.layer.3.attention.self.query.bias]Loading weights:  59%|█████▉    | 61/103 [00:00<00:00, 3351.75it/s, Materializing param=encoder.layer.3.attention.self.query.weight]Loading weights:  59%|█████▉    | 61/103 [00:00<00:00, 3343.60it/s, Materializing param=encoder.layer.3.attention.self.query.weight]Loading weights:  60%|██████    | 62/103 [00:00<00:00, 3378.42it/s, Materializing param=encoder.layer.3.attention.self.value.bias]  Loading weights:  60%|██████    | 62/103 [00:00<00:00, 3370.45it/s, Materializing param=encoder.layer.3.attention.self.value.bias]Loading weights:  61%|██████    | 63/103 [00:00<00:00, 3404.82it/s, Materializing param=encoder.layer.3.attention.self.value.weight]Loading weights:  61%|██████    | 63/103 [00:00<00:00, 3397.20it/s, Materializing param=encoder.layer.3.attention.self.value.weight]Loading weights:  62%|██████▁   | 64/103 [00:00<00:00, 3429.78it/s, Materializing param=encoder.layer.3.intermediate.dense.bias]    Loading weights:  62%|██████▁   | 64/103 [00:00<00:00, 3421.52it/s, Materializing param=encoder.layer.3.intermediate.dense.bias]Loading weights:  63%|██████▎   | 65/103 [00:00<00:00, 3458.63it/s, Materializing param=encoder.layer.3.intermediate.dense.weight]Loading weights:  63%|██████▎   | 65/103 [00:00<00:00, 3451.10it/s, Materializing param=encoder.layer.3.intermediate.dense.weight]Loading weights:  64%|██████▁   | 66/103 [00:00<00:00, 3293.88it/s, Materializing param=encoder.layer.3.output.LayerNorm.bias]    Loading weights:  64%|██████▁   | 66/103 [00:00<00:00, 3285.51it/s, Materializing param=encoder.layer.3.output.LayerNorm.bias]Loading weights:  65%|██████▌   | 67/103 [00:00<00:00, 3314.36it/s, Materializing param=encoder.layer.3.output.LayerNorm.weight]Loading weights:  65%|██████▌   | 67/103 [00:00<00:00, 3307.38it/s, Materializing param=encoder.layer.3.output.LayerNorm.weight]Loading weights:  66%|██████▌   | 68/103 [00:00<00:00, 3339.49it/s, Materializing param=encoder.layer.3.output.dense.bias]      Loading weights:  66%|██████▌   | 68/103 [00:00<00:00, 3332.78it/s, Materializing param=encoder.layer.3.output.dense.bias]Loading weights:  67%|██████▋   | 69/103 [00:00<00:00, 3363.95it/s, Materializing param=encoder.layer.3.output.dense.weight]Loading weights:  67%|██████▋   | 69/103 [00:00<00:00, 3357.04it/s, Materializing param=encoder.layer.3.output.dense.weight]Loading weights:  68%|██████▊   | 70/103 [00:00<00:00, 3388.98it/s, Materializing param=encoder.layer.4.attention.output.LayerNorm.bias]Loading weights:  68%|██████▊   | 70/103 [00:00<00:00, 3382.15it/s, Materializing param=encoder.layer.4.attention.output.LayerNorm.bias]Loading weights:  69%|██████▉   | 71/103 [00:00<00:00, 3271.18it/s, Materializing param=encoder.layer.4.attention.output.LayerNorm.weight]Loading weights:  69%|██████▉   | 71/103 [00:00<00:00, 3230.66it/s, Materializing param=encoder.layer.4.attention.output.LayerNorm.weight]Loading weights:  70%|██████▉   | 72/103 [00:00<00:00, 3260.49it/s, Materializing param=encoder.layer.4.attention.output.dense.bias]      Loading weights:  70%|██████▉   | 72/103 [00:00<00:00, 3252.59it/s, Materializing param=encoder.layer.4.attention.output.dense.bias]Loading weights:  71%|███████   | 73/103 [00:00<00:00, 3250.64it/s, Materializing param=encoder.layer.4.attention.output.dense.weight]Loading weights:  71%|███████   | 73/103 [00:00<00:00, 3244.20it/s, Materializing param=encoder.layer.4.attention.output.dense.weight]Loading weights:  72%|███████▁  | 74/103 [00:00<00:00, 3273.07it/s, Materializing param=encoder.layer.4.attention.self.key.bias]      Loading weights:  72%|███████▁  | 74/103 [00:00<00:00, 3267.07it/s, Materializing param=encoder.layer.4.attention.self.key.bias]Loading weights:  73%|███████▎  | 75/103 [00:00<00:00, 3296.03it/s, Materializing param=encoder.layer.4.attention.self.key.weight]Loading weights:  73%|███████▎  | 75/103 [00:00<00:00, 3289.99it/s, Materializing param=encoder.layer.4.attention.self.key.weight]Loading weights:  74%|███████▁  | 76/103 [00:00<00:00, 3318.93it/s, Materializing param=encoder.layer.4.attention.self.query.bias]Loading weights:  74%|███████▁  | 76/103 [00:00<00:00, 3312.97it/s, Materializing param=encoder.layer.4.attention.self.query.bias]Loading weights:  75%|███████▁  | 77/103 [00:00<00:00, 3341.25it/s, Materializing param=encoder.layer.4.attention.self.query.weight]Loading weights:  75%|███████▁  | 77/103 [00:00<00:00, 3335.14it/s, Materializing param=encoder.layer.4.attention.self.query.weight]Loading weights:  76%|███████▌  | 78/103 [00:00<00:00, 3340.44it/s, Materializing param=encoder.layer.4.attention.self.value.bias]  Loading weights:  76%|███████▌  | 78/103 [00:00<00:00, 3333.09it/s, Materializing param=encoder.layer.4.attention.self.value.bias]Loading weights:  77%|███████▋  | 79/103 [00:00<00:00, 3361.98it/s, Materializing param=encoder.layer.4.attention.self.value.weight]Loading weights:  77%|███████▋  | 79/103 [00:00<00:00, 3355.61it/s, Materializing param=encoder.layer.4.attention.self.value.weight]Loading weights:  78%|███████▊  | 80/103 [00:00<00:00, 3381.99it/s, Materializing param=encoder.layer.4.intermediate.dense.bias]    Loading weights:  78%|███████▊  | 80/103 [00:00<00:00, 3376.07it/s, Materializing param=encoder.layer.4.intermediate.dense.bias]Loading weights:  79%|███████▊  | 81/103 [00:00<00:00, 3402.59it/s, Materializing param=encoder.layer.4.intermediate.dense.weight]Loading weights:  79%|███████▊  | 81/103 [00:00<00:00, 3396.67it/s, Materializing param=encoder.layer.4.intermediate.dense.weight]Loading weights:  80%|███████▉  | 82/103 [00:00<00:00, 3418.17it/s, Materializing param=encoder.layer.4.output.LayerNorm.bias]    Loading weights:  80%|███████▉  | 82/103 [00:00<00:00, 3409.06it/s, Materializing param=encoder.layer.4.output.LayerNorm.bias]Loading weights:  81%|████████  | 83/103 [00:00<00:00, 3362.22it/s, Materializing param=encoder.layer.4.output.LayerNorm.weight]Loading weights:  81%|████████  | 83/103 [00:00<00:00, 3337.59it/s, Materializing param=encoder.layer.4.output.LayerNorm.weight]Loading weights:  82%|████████▁ | 84/103 [00:00<00:00, 3363.10it/s, Materializing param=encoder.layer.4.output.dense.bias]      Loading weights:  82%|████████▁ | 84/103 [00:00<00:00, 3357.39it/s, Materializing param=encoder.layer.4.output.dense.bias]Loading weights:  83%|████████▎ | 85/103 [00:00<00:00, 3385.91it/s, Materializing param=encoder.layer.4.output.dense.weight]Loading weights:  83%|████████▎ | 85/103 [00:00<00:00, 3378.37it/s, Materializing param=encoder.layer.4.output.dense.weight]Loading weights:  83%|████████▎ | 86/103 [00:00<00:00, 3359.19it/s, Materializing param=encoder.layer.5.attention.output.LayerNorm.bias]Loading weights:  83%|████████▎ | 86/103 [00:00<00:00, 3353.10it/s, Materializing param=encoder.layer.5.attention.output.LayerNorm.bias]Loading weights:  84%|████████▁ | 87/103 [00:00<00:00, 3317.98it/s, Materializing param=encoder.layer.5.attention.output.LayerNorm.weight]Loading weights:  84%|████████▁ | 87/103 [00:00<00:00, 3311.77it/s, Materializing param=encoder.layer.5.attention.output.LayerNorm.weight]Loading weights:  85%|████████▌ | 88/103 [00:00<00:00, 3335.73it/s, Materializing param=encoder.layer.5.attention.output.dense.bias]      Loading weights:  85%|████████▌ | 88/103 [00:00<00:00, 3330.34it/s, Materializing param=encoder.layer.5.attention.output.dense.bias]Loading weights:  86%|████████▋ | 89/103 [00:00<00:00, 3224.91it/s, Materializing param=encoder.layer.5.attention.output.dense.weight]Loading weights:  86%|████████▋ | 89/103 [00:00<00:00, 3219.10it/s, Materializing param=encoder.layer.5.attention.output.dense.weight]Loading weights:  87%|████████▋ | 90/103 [00:00<00:00, 3242.52it/s, Materializing param=encoder.layer.5.attention.self.key.bias]      Loading weights:  87%|████████▋ | 90/103 [00:00<00:00, 3237.46it/s, Materializing param=encoder.layer.5.attention.self.key.bias]Loading weights:  88%|████████▊ | 91/103 [00:00<00:00, 3260.95it/s, Materializing param=encoder.layer.5.attention.self.key.weight]Loading weights:  88%|████████▊ | 91/103 [00:00<00:00, 3256.03it/s, Materializing param=encoder.layer.5.attention.self.key.weight]Loading weights:  89%|████████▉ | 92/103 [00:00<00:00, 3278.86it/s, Materializing param=encoder.layer.5.attention.self.query.bias]Loading weights:  89%|████████▉ | 92/103 [00:00<00:00, 3273.83it/s, Materializing param=encoder.layer.5.attention.self.query.bias]Loading weights:  90%|█████████ | 93/103 [00:00<00:00, 3297.91it/s, Materializing param=encoder.layer.5.attention.self.query.weight]Loading weights:  90%|█████████ | 93/103 [00:00<00:00, 3293.04it/s, Materializing param=encoder.layer.5.attention.self.query.weight]Loading weights:  91%|█████████▁| 94/103 [00:00<00:00, 3315.85it/s, Materializing param=encoder.layer.5.attention.self.value.bias]  Loading weights:  91%|█████████▁| 94/103 [00:00<00:00, 3310.89it/s, Materializing param=encoder.layer.5.attention.self.value.bias]Loading weights:  92%|█████████▁| 95/103 [00:00<00:00, 3333.91it/s, Materializing param=encoder.layer.5.attention.self.value.weight]Loading weights:  92%|█████████▁| 95/103 [00:00<00:00, 3329.09it/s, Materializing param=encoder.layer.5.attention.self.value.weight]Loading weights:  93%|█████████▎| 96/103 [00:00<00:00, 3351.56it/s, Materializing param=encoder.layer.5.intermediate.dense.bias]    Loading weights:  93%|█████████▎| 96/103 [00:00<00:00, 3346.57it/s, Materializing param=encoder.layer.5.intermediate.dense.bias]Loading weights:  94%|█████████▁| 97/103 [00:00<00:00, 3369.48it/s, Materializing param=encoder.layer.5.intermediate.dense.weight]Loading weights:  94%|█████████▁| 97/103 [00:00<00:00, 3364.57it/s, Materializing param=encoder.layer.5.intermediate.dense.weight]Loading weights:  95%|█████████▌| 98/103 [00:00<00:00, 3387.05it/s, Materializing param=encoder.layer.5.output.LayerNorm.bias]    Loading weights:  95%|█████████▌| 98/103 [00:00<00:00, 3382.09it/s, Materializing param=encoder.layer.5.output.LayerNorm.bias]Loading weights:  96%|█████████▌| 99/103 [00:00<00:00, 3357.29it/s, Materializing param=encoder.layer.5.output.LayerNorm.weight]Loading weights:  96%|█████████▌| 99/103 [00:00<00:00, 3351.89it/s, Materializing param=encoder.layer.5.output.LayerNorm.weight]Loading weights:  97%|█████████▋| 100/103 [00:00<00:00, 3377.14it/s, Materializing param=encoder.layer.5.output.dense.bias]     Loading weights:  97%|█████████▋| 100/103 [00:00<00:00, 3372.11it/s, Materializing param=encoder.layer.5.output.dense.bias]Loading weights:  98%|█████████▊| 101/103 [00:00<00:00, 3397.10it/s, Materializing param=encoder.layer.5.output.dense.weight]Loading weights:  98%|█████████▊| 101/103 [00:00<00:00, 3392.47it/s, Materializing param=encoder.layer.5.output.dense.weight]Loading weights:  99%|█████████▉| 102/103 [00:00<00:00, 3417.93it/s, Materializing param=pooler.dense.bias]                  Loading weights:  99%|█████████▉| 102/103 [00:00<00:00, 3413.65it/s, Materializing param=pooler.dense.bias]Loading weights: 100%|██████████| 103/103 [00:00<00:00, 3439.73it/s, Materializing param=pooler.dense.weight]Loading weights: 100%|██████████| 103/103 [00:00<00:00, 3435.58it/s, Materializing param=pooler.dense.weight]Loading weights: 100%|██████████| 103/103 [00:00<00:00, 3426.61it/s, Materializing param=pooler.dense.weight]
[1mBertModel LOAD REPORT[0m from: sentence-transformers/all-MiniLM-L6-v2
Key                     | Status     |  | 
------------------------+------------+--+-
embeddings.position_ids | UNEXPECTED |  | 

[3mNotes:
- UNEXPECTED[3m	:can be ignored when loading from different task/architecture; not ok if you expect identical arch.[0m
API calls:   0%|          | 0/5000 [00:00<?, ?call/s]Evaluating 100 puzzles
Methods: ['knowno']

============================================================
STARTING EVALUATION
============================================================

Evaluating KnowNoStopping on 100 puzzles...

  KnowNoStopping:   0%|          | 0/100 [00:00<?, ?it/s][AAPI calls:   0%|          | 1/5000 [00:02<3:03:10,  2.20s/call]API calls:   0%|          | 5/5000 [00:02<29:09,  2.86call/s]  API calls:   0%|          | 8/5000 [00:02<17:53,  4.65call/s]API calls:   0%|          | 19/5000 [00:02<06:41, 12.42call/s]API calls:   1%|          | 39/5000 [00:02<02:47, 29.63call/s]API calls:   1%|          | 45/5000 [00:03<03:30, 23.58call/s]API calls:   2%|▁         | 86/5000 [00:03<01:15, 65.44call/s]
  KnowNoStopping:   1%|          | 1/100 [00:03<06:17,  3.82s/it][A
  KnowNoStopping:   1%|          | 1/100 [00:03<06:17,  3.82s/it, acc=100%, turns=1.0][AAPI calls:   2%|▁         | 102/5000 [00:03<01:21, 59.92call/s]
  KnowNoStopping:   2%|▁         | 2/100 [00:03<06:13,  3.82s/it, acc=50%, turns=1.0] [AAPI calls:   2%|▁         | 118/5000 [00:03<01:07, 72.72call/s]API calls:   2%|▁         | 123/5000 [00:03<00:46, 104.05call/s]API calls:   2%|▁         | 124/5000 [00:03<00:46, 104.05call/s]API calls:   3%|▎         | 142/5000 [00:04<01:22, 58.60call/s] 
  KnowNoStopping:   3%|▎         | 3/100 [00:04<02:01,  1.26s/it, acc=50%, turns=1.0][A
  KnowNoStopping:   3%|▎         | 3/100 [00:04<02:01,  1.26s/it, acc=33%, turns=1.0][AAPI calls:   4%|▎         | 181/5000 [00:04<00:53, 90.07call/s]
  KnowNoStopping:   4%|▁         | 4/100 [00:04<01:24,  1.13it/s, acc=33%, turns=1.0][A
  KnowNoStopping:   4%|▁         | 4/100 [00:04<01:24,  1.13it/s, acc=50%, turns=1.0][AAPI calls:   4%|▁         | 196/5000 [00:05<01:02, 77.08call/s]
  KnowNoStopping:   5%|▌         | 5/100 [00:05<01:05,  1.45it/s, acc=50%, turns=1.0][A
  KnowNoStopping:   5%|▌         | 5/100 [00:05<01:05,  1.45it/s, acc=40%, turns=1.0][A
  KnowNoStopping:   6%|▌         | 6/100 [00:05<01:05,  1.45it/s, acc=33%, turns=1.0][AAPI calls:   4%|▁         | 208/5000 [00:05<01:10, 67.93call/s]
  KnowNoStopping:   7%|▋         | 7/100 [00:05<00:39,  2.33it/s, acc=33%, turns=1.0][A
  KnowNoStopping:   7%|▋         | 7/100 [00:05<00:39,  2.33it/s, acc=29%, turns=1.0][A
  KnowNoStopping:   8%|▊         | 8/100 [00:05<00:39,  2.33it/s, acc=25%, turns=1.0][A
  KnowNoStopping:   9%|▉         | 9/100 [00:05<00:39,  2.33it/s, acc=22%, turns=1.0][AAPI calls:   4%|▁         | 222/5000 [00:05<01:02, 76.63call/s]API calls:   5%|▁         | 233/5000 [00:05<01:05, 73.06call/s]API calls:   5%|▁         | 243/5000 [00:05<01:22, 57.92call/s]API calls:   5%|▌         | 251/5000 [00:06<01:43, 45.74call/s]API calls:   5%|▌         | 265/5000 [00:06<01:32, 50.93call/s]
  KnowNoStopping:  10%|█         | 10/100 [00:06<00:39,  2.26it/s, acc=22%, turns=1.0][A
  KnowNoStopping:  10%|█         | 10/100 [00:06<00:39,  2.26it/s, acc=30%, turns=1.0][AAPI calls:   5%|▌         | 272/5000 [00:06<02:12, 35.72call/s]
  KnowNoStopping:  11%|█         | 11/100 [00:06<00:34,  2.57it/s, acc=30%, turns=1.0][A
  KnowNoStopping:  11%|█         | 11/100 [00:06<00:34,  2.57it/s, acc=36%, turns=1.0][A
  KnowNoStopping:  12%|█▁        | 12/100 [00:06<00:34,  2.57it/s, acc=33%, turns=1.0][A
  KnowNoStopping:  13%|█▎        | 13/100 [00:06<00:33,  2.57it/s, acc=38%, turns=1.0][AAPI calls:   6%|▌         | 277/5000 [00:07<02:29, 31.68call/s]
  KnowNoStopping:  14%|█▁        | 14/100 [00:07<00:21,  4.06it/s, acc=38%, turns=1.0][A
  KnowNoStopping:  14%|█▁        | 14/100 [00:07<00:21,  4.06it/s, acc=36%, turns=1.0][A
  KnowNoStopping:  15%|█▌        | 15/100 [00:07<00:19,  4.41it/s, acc=36%, turns=1.0][A
  KnowNoStopping:  15%|█▌        | 15/100 [00:07<00:19,  4.41it/s, acc=40%, turns=1.0][AAPI calls:   6%|▌         | 281/5000 [00:07<02:48, 27.93call/s]
  KnowNoStopping:  16%|█▌        | 16/100 [00:07<00:17,  4.71it/s, acc=40%, turns=1.0][A
  KnowNoStopping:  16%|█▌        | 16/100 [00:07<00:17,  4.71it/s, acc=38%, turns=1.0][AAPI calls:   6%|▌         | 288/5000 [00:07<02:20, 33.63call/s]
  KnowNoStopping:  17%|█▋        | 17/100 [00:07<00:17,  4.71it/s, acc=35%, turns=1.0][AAPI calls:   6%|▌         | 294/5000 [00:07<02:08, 36.55call/s]API calls:   6%|▌         | 302/5000 [00:07<01:50, 42.52call/s]API calls:   6%|▌         | 303/5000 [00:07<01:35, 49.39call/s]
  KnowNoStopping:  18%|█▊        | 18/100 [00:07<00:15,  5.32it/s, acc=35%, turns=1.0][A
  KnowNoStopping:  18%|█▊        | 18/100 [00:07<00:15,  5.32it/s, acc=39%, turns=1.0][AAPI calls:   6%|▌         | 311/5000 [00:07<01:33, 50.32call/s]
  KnowNoStopping:  19%|█▉        | 19/100 [00:07<00:14,  5.54it/s, acc=39%, turns=1.0][A
  KnowNoStopping:  19%|█▉        | 19/100 [00:07<00:14,  5.54it/s, acc=42%, turns=1.0][AAPI calls:   6%|▋         | 317/5000 [00:07<01:33, 49.88call/s]API calls:   7%|▋         | 331/5000 [00:08<01:11, 65.25call/s]
  KnowNoStopping:  20%|██        | 20/100 [00:08<00:16,  4.96it/s, acc=42%, turns=1.0][A
  KnowNoStopping:  20%|██        | 20/100 [00:08<00:16,  4.96it/s, acc=45%, turns=1.0][AAPI calls:   7%|▋         | 338/5000 [00:08<01:17, 60.45call/s]
  KnowNoStopping:  21%|██        | 21/100 [00:08<00:16,  4.83it/s, acc=45%, turns=1.0][A
  KnowNoStopping:  21%|██        | 21/100 [00:08<00:16,  4.83it/s, acc=43%, turns=1.0][AAPI calls:   7%|▋         | 346/5000 [00:08<01:15, 61.63call/s]
  KnowNoStopping:  22%|██▁       | 22/100 [00:08<00:15,  4.99it/s, acc=43%, turns=1.0][A
  KnowNoStopping:  22%|██▁       | 22/100 [00:08<00:15,  4.99it/s, acc=45%, turns=1.0][AAPI calls:   7%|▋         | 353/5000 [00:08<01:35, 48.42call/s]
  KnowNoStopping:  23%|██▎       | 23/100 [00:08<00:15,  4.99it/s, acc=43%, turns=1.0][A
  KnowNoStopping:  24%|██▁       | 24/100 [00:08<00:11,  6.84it/s, acc=43%, turns=1.0][A
  KnowNoStopping:  24%|██▁       | 24/100 [00:08<00:11,  6.84it/s, acc=46%, turns=1.0][AAPI calls:   7%|▋         | 359/5000 [00:08<01:56, 39.87call/s]
  KnowNoStopping:  25%|██▌       | 25/100 [00:08<00:12,  6.00it/s, acc=46%, turns=1.0][A
  KnowNoStopping:  25%|██▌       | 25/100 [00:08<00:12,  6.00it/s, acc=48%, turns=1.0][AAPI calls:   7%|▋         | 367/5000 [00:08<01:39, 46.68call/s]
  KnowNoStopping:  26%|██▌       | 26/100 [00:08<00:12,  6.00it/s, acc=46%, turns=1.0][AAPI calls:   8%|▊         | 375/5000 [00:09<01:49, 42.24call/s]
  KnowNoStopping:  27%|██▋       | 27/100 [00:09<00:11,  6.31it/s, acc=46%, turns=1.0][A
  KnowNoStopping:  27%|██▋       | 27/100 [00:09<00:11,  6.31it/s, acc=44%, turns=1.0][AAPI calls:   8%|▊         | 382/5000 [00:09<02:07, 36.13call/s]API calls:   8%|▊         | 383/5000 [00:09<02:16, 33.78call/s]
  KnowNoStopping:  28%|██▊       | 28/100 [00:09<00:13,  5.42it/s, acc=44%, turns=1.0][A
  KnowNoStopping:  28%|██▊       | 28/100 [00:09<00:13,  5.42it/s, acc=43%, turns=1.0][AAPI calls:   8%|▊         | 395/5000 [00:09<01:55, 39.87call/s]
  KnowNoStopping:  29%|██▉       | 29/100 [00:09<00:13,  5.25it/s, acc=43%, turns=1.0][A
  KnowNoStopping:  29%|██▉       | 29/100 [00:09<00:13,  5.25it/s, acc=41%, turns=1.0][A
  KnowNoStopping:  30%|███       | 30/100 [00:09<00:13,  5.25it/s, acc=43%, turns=1.0][AAPI calls:   8%|▊         | 403/5000 [00:09<01:39, 45.99call/s]
  KnowNoStopping:  31%|███       | 31/100 [00:09<00:10,  6.66it/s, acc=43%, turns=1.0][A
  KnowNoStopping:  31%|███       | 31/100 [00:09<00:10,  6.66it/s, acc=42%, turns=1.0][A
  KnowNoStopping:  32%|███▁      | 32/100 [00:09<00:10,  6.66it/s, acc=44%, turns=1.0][AAPI calls:   8%|▊         | 409/5000 [00:09<01:51, 41.30call/s]
  KnowNoStopping:  33%|███▎      | 33/100 [00:09<00:07,  8.65it/s, acc=44%, turns=1.0][A
  KnowNoStopping:  33%|███▎      | 33/100 [00:09<00:07,  8.65it/s, acc=45%, turns=1.0][AAPI calls:   8%|▊         | 414/5000 [00:10<01:56, 39.28call/s]
  KnowNoStopping:  34%|███▁      | 34/100 [00:10<00:07,  8.65it/s, acc=44%, turns=1.0][A
  KnowNoStopping:  35%|███▌      | 35/100 [00:10<00:07,  9.05it/s, acc=44%, turns=1.0][A
  KnowNoStopping:  35%|███▌      | 35/100 [00:10<00:07,  9.05it/s, acc=43%, turns=1.0][AAPI calls:   8%|▊         | 421/5000 [00:10<01:43, 44.14call/s]API calls:   9%|▊         | 427/5000 [00:10<01:39, 46.18call/s]
  KnowNoStopping:  36%|███▌      | 36/100 [00:10<00:07,  9.05it/s, acc=42%, turns=1.0][AAPI calls:   9%|▊         | 432/5000 [00:10<01:40, 45.27call/s]API calls:   9%|▉         | 439/5000 [00:10<01:31, 49.98call/s]API calls:   9%|▉         | 440/5000 [00:10<01:21, 55.97call/s]
  KnowNoStopping:  37%|███▋      | 37/100 [00:10<00:09,  6.91it/s, acc=42%, turns=1.0][A
  KnowNoStopping:  37%|███▋      | 37/100 [00:10<00:09,  6.91it/s, acc=41%, turns=1.0][AAPI calls:   9%|▉         | 448/5000 [00:10<01:13, 62.10call/s]API calls:   9%|▉         | 449/5000 [00:10<01:05, 69.40call/s]
  KnowNoStopping:  38%|███▊      | 38/100 [00:10<00:08,  7.12it/s, acc=41%, turns=1.0][A
  KnowNoStopping:  38%|███▊      | 38/100 [00:10<00:08,  7.12it/s, acc=42%, turns=1.0][AAPI calls:   9%|▉         | 458/5000 [00:10<01:11, 63.14call/s]API calls:   9%|▉         | 466/5000 [00:10<01:11, 63.35call/s]
  KnowNoStopping:  39%|███▉      | 39/100 [00:11<00:11,  5.43it/s, acc=42%, turns=1.0][A
  KnowNoStopping:  39%|███▉      | 39/100 [00:11<00:11,  5.43it/s, acc=44%, turns=1.0][AAPI calls:   9%|▉         | 473/5000 [00:11<01:20, 56.34call/s]
  KnowNoStopping:  40%|████      | 40/100 [00:11<00:11,  5.43it/s, acc=42%, turns=1.0][A
  KnowNoStopping:  41%|████      | 41/100 [00:11<00:10,  5.43it/s, acc=41%, turns=1.0][AAPI calls:  10%|▉         | 484/5000 [00:11<01:10, 64.31call/s]
  KnowNoStopping:  42%|████▁     | 42/100 [00:11<00:07,  8.09it/s, acc=41%, turns=1.0][A
  KnowNoStopping:  42%|████▁     | 42/100 [00:11<00:07,  8.09it/s, acc=40%, turns=1.0][AAPI calls:  10%|▉         | 492/5000 [00:11<01:16, 58.66call/s]API calls:  10%|▉         | 499/5000 [00:11<01:36, 46.86call/s]
  KnowNoStopping:  43%|████▎     | 43/100 [00:11<00:09,  5.87it/s, acc=40%, turns=1.0][A
  KnowNoStopping:  43%|████▎     | 43/100 [00:11<00:09,  5.87it/s, acc=42%, turns=1.0][AAPI calls:  10%|█         | 506/5000 [00:11<01:28, 50.88call/s]API calls:  10%|█         | 512/5000 [00:11<01:34, 47.50call/s]API calls:  10%|█         | 518/5000 [00:12<01:47, 41.71call/s]
  KnowNoStopping:  44%|████▁     | 44/100 [00:12<00:13,  4.10it/s, acc=42%, turns=1.0][A
  KnowNoStopping:  44%|████▁     | 44/100 [00:12<00:13,  4.10it/s, acc=41%, turns=1.0][AAPI calls:  11%|█         | 528/5000 [00:12<01:24, 52.96call/s]API calls:  11%|█         | 534/5000 [00:12<01:32, 48.47call/s]API calls:  11%|█         | 540/5000 [00:12<01:43, 43.24call/s]
  KnowNoStopping:  45%|████▌     | 45/100 [00:12<00:15,  3.44it/s, acc=41%, turns=1.0][A
  KnowNoStopping:  45%|████▌     | 45/100 [00:12<00:15,  3.44it/s, acc=42%, turns=1.0][AAPI calls:  11%|█         | 545/5000 [00:12<01:59, 37.42call/s]API calls:  11%|█         | 550/5000 [00:13<03:10, 23.37call/s]
  KnowNoStopping:  46%|████▌     | 46/100 [00:13<00:21,  2.51it/s, acc=42%, turns=1.0][AAPI calls:  11%|█         | 554/5000 [00:13<03:09, 23.46call/s]
  KnowNoStopping:  46%|████▌     | 46/100 [00:13<00:21,  2.51it/s, acc=43%, turns=1.0][A
  KnowNoStopping:  47%|████▋     | 47/100 [00:13<00:21,  2.51it/s, acc=43%, turns=1.0][AAPI calls:  11%|█         | 558/5000 [00:13<03:00, 24.63call/s]
  KnowNoStopping:  48%|████▊     | 48/100 [00:13<00:16,  3.24it/s, acc=43%, turns=1.0][A
  KnowNoStopping:  48%|████▊     | 48/100 [00:13<00:16,  3.24it/s, acc=42%, turns=1.0][AAPI calls:  11%|█         | 561/5000 [00:13<03:55, 18.87call/s]
  KnowNoStopping:  49%|████▉     | 49/100 [00:13<00:13,  3.68it/s, acc=42%, turns=1.0][A
  KnowNoStopping:  49%|████▉     | 49/100 [00:13<00:13,  3.68it/s, acc=41%, turns=1.0][AAPI calls:  11%|█▁        | 564/5000 [00:13<03:44, 19.80call/s]
  KnowNoStopping:  50%|█████     | 50/100 [00:13<00:11,  4.31it/s, acc=41%, turns=1.0][A
  KnowNoStopping:  50%|█████     | 50/100 [00:13<00:11,  4.31it/s, acc=40%, turns=1.0][AAPI calls:  11%|█▁        | 572/5000 [00:14<02:35, 28.39call/s]API calls:  12%|█▁        | 577/5000 [00:14<02:19, 31.71call/s]
  KnowNoStopping:  51%|█████     | 51/100 [00:14<00:10,  4.46it/s, acc=40%, turns=1.0][A
  KnowNoStopping:  51%|█████     | 51/100 [00:14<00:10,  4.46it/s, acc=39%, turns=1.0][AAPI calls:  12%|█▁        | 581/5000 [00:14<02:22, 30.92call/s]API calls:  12%|█▁        | 589/5000 [00:14<01:50, 40.10call/s]
  KnowNoStopping:  52%|█████▁    | 52/100 [00:14<00:11,  4.27it/s, acc=39%, turns=1.0][A
  KnowNoStopping:  52%|█████▁    | 52/100 [00:14<00:11,  4.27it/s, acc=38%, turns=1.0][A
  KnowNoStopping:  53%|█████▎    | 53/100 [00:14<00:11,  4.27it/s, acc=40%, turns=1.0][AAPI calls:  12%|█▁        | 599/5000 [00:14<01:35, 45.93call/s]
  KnowNoStopping:  54%|█████▁    | 54/100 [00:14<00:07,  5.92it/s, acc=40%, turns=1.0][A
  KnowNoStopping:  54%|█████▁    | 54/100 [00:14<00:07,  5.92it/s, acc=41%, turns=1.0][AAPI calls:  12%|█▁        | 604/5000 [00:14<01:40, 43.74call/s]API calls:  12%|█▁        | 611/5000 [00:14<01:31, 48.05call/s]
  KnowNoStopping:  55%|█████▌    | 55/100 [00:14<00:08,  5.34it/s, acc=41%, turns=1.0][A
  KnowNoStopping:  55%|█████▌    | 55/100 [00:14<00:08,  5.34it/s, acc=40%, turns=1.0][AAPI calls:  12%|█▁        | 616/5000 [00:14<01:37, 44.76call/s]
  KnowNoStopping:  56%|█████▌    | 56/100 [00:14<00:07,  5.73it/s, acc=40%, turns=1.0][A
  KnowNoStopping:  56%|█████▌    | 56/100 [00:14<00:07,  5.73it/s, acc=41%, turns=1.0][AAPI calls:  12%|█▁        | 621/5000 [00:15<02:15, 32.31call/s]API calls:  12%|█▁        | 622/5000 [00:15<02:36, 27.97call/s]
  KnowNoStopping:  57%|█████▋    | 57/100 [00:15<00:09,  4.77it/s, acc=41%, turns=1.0][A
  KnowNoStopping:  57%|█████▋    | 57/100 [00:15<00:09,  4.77it/s, acc=42%, turns=1.0][A
  KnowNoStopping:  58%|█████▊    | 58/100 [00:15<00:08,  4.77it/s, acc=43%, turns=1.0][AAPI calls:  13%|█▎        | 640/5000 [00:15<01:31, 47.70call/s]
  KnowNoStopping:  59%|█████▉    | 59/100 [00:15<00:05,  6.93it/s, acc=43%, turns=1.0][A
  KnowNoStopping:  59%|█████▉    | 59/100 [00:15<00:05,  6.93it/s, acc=42%, turns=1.0][A
  KnowNoStopping:  60%|██████    | 60/100 [00:15<00:05,  6.89it/s, acc=42%, turns=1.0][A
  KnowNoStopping:  60%|██████    | 60/100 [00:15<00:05,  6.89it/s, acc=42%, turns=1.0][AAPI calls:  13%|█▎        | 646/5000 [00:15<01:45, 41.20call/s]
  KnowNoStopping:  61%|██████    | 61/100 [00:15<00:05,  6.96it/s, acc=42%, turns=1.0][A
  KnowNoStopping:  61%|██████    | 61/100 [00:15<00:05,  6.96it/s, acc=43%, turns=1.0][AAPI calls:  13%|█▎        | 651/5000 [00:15<01:46, 40.94call/s]API calls:  13%|█▎        | 656/5000 [00:15<01:52, 38.77call/s]API calls:  13%|█▎        | 661/5000 [00:15<01:56, 37.20call/s]API calls:  13%|█▎        | 674/5000 [00:16<01:17, 55.84call/s]
  KnowNoStopping:  62%|██████▁   | 62/100 [00:16<00:10,  3.52it/s, acc=43%, turns=1.0][A
  KnowNoStopping:  62%|██████▁   | 62/100 [00:16<00:10,  3.52it/s, acc=44%, turns=1.0][AAPI calls:  14%|█▎        | 681/5000 [00:16<01:41, 42.48call/s]API calls:  14%|█▎        | 683/5000 [00:16<01:55, 37.37call/s]
  KnowNoStopping:  63%|██████▎   | 63/100 [00:16<00:10,  3.52it/s, acc=43%, turns=1.0][A
  KnowNoStopping:  64%|██████▁   | 64/100 [00:16<00:10,  3.52it/s, acc=42%, turns=1.0][A
  KnowNoStopping:  65%|██████▌   | 65/100 [00:16<00:05,  6.31it/s, acc=42%, turns=1.0][A
  KnowNoStopping:  65%|██████▌   | 65/100 [00:16<00:05,  6.31it/s, acc=43%, turns=1.0][AAPI calls:  14%|█▁        | 689/5000 [00:16<01:49, 39.29call/s]
  KnowNoStopping:  66%|██████▌   | 66/100 [00:16<00:05,  6.31it/s, acc=42%, turns=1.0][AAPI calls:  14%|█▁        | 694/5000 [00:16<02:14, 31.99call/s]
  KnowNoStopping:  67%|██████▋   | 67/100 [00:16<00:05,  6.50it/s, acc=42%, turns=1.0][A
  KnowNoStopping:  67%|██████▋   | 67/100 [00:16<00:05,  6.50it/s, acc=43%, turns=1.0][AAPI calls:  14%|█▁        | 699/5000 [00:16<02:10, 33.08call/s]
  KnowNoStopping:  68%|██████▊   | 68/100 [00:16<00:04,  6.65it/s, acc=43%, turns=1.0][A
  KnowNoStopping:  68%|██████▊   | 68/100 [00:16<00:04,  6.65it/s, acc=44%, turns=1.0][AAPI calls:  14%|█▁        | 703/5000 [00:16<02:06, 33.98call/s]API calls:  14%|█▁        | 714/5000 [00:17<01:51, 38.40call/s]
  KnowNoStopping:  69%|██████▉   | 69/100 [00:17<00:05,  5.17it/s, acc=44%, turns=1.0][A
  KnowNoStopping:  69%|██████▉   | 69/100 [00:17<00:05,  5.17it/s, acc=43%, turns=1.0][A
  KnowNoStopping:  70%|███████   | 70/100 [00:17<00:05,  5.17it/s, acc=43%, turns=1.0][AAPI calls:  14%|█▁        | 720/5000 [00:17<01:45, 40.57call/s]
  KnowNoStopping:  71%|███████   | 71/100 [00:17<00:04,  6.94it/s, acc=43%, turns=1.0][A
  KnowNoStopping:  71%|███████   | 71/100 [00:17<00:04,  6.94it/s, acc=42%, turns=1.0][A
  KnowNoStopping:  72%|███████▁  | 72/100 [00:17<00:04,  6.94it/s, acc=43%, turns=1.0][A
  KnowNoStopping:  73%|███████▎  | 73/100 [00:17<00:03,  6.94it/s, acc=44%, turns=1.0][A
  KnowNoStopping:  74%|███████▁  | 74/100 [00:17<00:03,  6.94it/s, acc=45%, turns=1.0][AAPI calls:  15%|█▁        | 735/5000 [00:17<01:08, 62.03call/s]API calls:  15%|█▁        | 743/5000 [00:17<01:10, 60.17call/s]
  KnowNoStopping:  75%|███████▌  | 75/100 [00:17<00:02,  9.80it/s, acc=45%, turns=1.0][A
  KnowNoStopping:  75%|███████▌  | 75/100 [00:17<00:02,  9.80it/s, acc=45%, turns=1.0][A
  KnowNoStopping:  76%|███████▌  | 76/100 [00:17<00:02,  9.80it/s, acc=45%, turns=1.0][AAPI calls:  15%|█▌        | 752/5000 [00:17<01:09, 61.53call/s]
  KnowNoStopping:  77%|███████▋  | 77/100 [00:17<00:02,  9.37it/s, acc=45%, turns=1.0][A
  KnowNoStopping:  77%|███████▋  | 77/100 [00:17<00:02,  9.37it/s, acc=44%, turns=1.0][AAPI calls:  15%|█▌        | 759/5000 [00:18<01:37, 43.37call/s]
  KnowNoStopping:  78%|███████▊  | 78/100 [00:18<00:02,  9.37it/s, acc=45%, turns=1.0][A
  KnowNoStopping:  79%|███████▉  | 79/100 [00:18<00:04,  4.42it/s, acc=45%, turns=1.0][A
  KnowNoStopping:  79%|███████▉  | 79/100 [00:18<00:04,  4.42it/s, acc=44%, turns=1.0][AAPI calls:  15%|█▌        | 765/5000 [00:18<03:50, 18.37call/s]
  KnowNoStopping:  80%|████████  | 80/100 [00:19<00:04,  4.47it/s, acc=44%, turns=1.0][A
  KnowNoStopping:  80%|████████  | 80/100 [00:19<00:04,  4.47it/s, acc=45%, turns=1.0][A
  KnowNoStopping:  81%|████████  | 81/100 [00:19<00:03,  4.84it/s, acc=45%, turns=1.0][A
  KnowNoStopping:  81%|████████  | 81/100 [00:19<00:03,  4.84it/s, acc=44%, turns=1.0][AAPI calls:  15%|█▌        | 769/5000 [00:19<04:24, 15.98call/s]
  KnowNoStopping:  82%|████████▁ | 82/100 [00:19<00:03,  5.02it/s, acc=44%, turns=1.0][A
  KnowNoStopping:  82%|████████▁ | 82/100 [00:19<00:03,  5.02it/s, acc=44%, turns=1.0][AAPI calls:  15%|█▌        | 773/5000 [00:19<04:19, 16.31call/s]
  KnowNoStopping:  83%|████████▎ | 83/100 [00:19<00:03,  5.18it/s, acc=44%, turns=1.0][A
  KnowNoStopping:  83%|████████▎ | 83/100 [00:19<00:03,  5.18it/s, acc=45%, turns=1.0][AAPI calls:  16%|█▌        | 776/5000 [00:19<04:18, 16.36call/s]
  KnowNoStopping:  84%|████████▁ | 84/100 [00:19<00:03,  5.31it/s, acc=45%, turns=1.0][A
  KnowNoStopping:  84%|████████▁ | 84/100 [00:19<00:03,  5.31it/s, acc=44%, turns=1.0][A
  KnowNoStopping:  85%|████████▌ | 85/100 [00:19<00:02,  5.31it/s, acc=44%, turns=1.0][AAPI calls:  16%|█▌        | 779/5000 [00:19<04:11, 16.76call/s]
  KnowNoStopping:  86%|████████▌ | 86/100 [00:20<00:02,  6.35it/s, acc=44%, turns=1.0][A
  KnowNoStopping:  86%|████████▌ | 86/100 [00:20<00:02,  6.35it/s, acc=44%, turns=1.0][A
  KnowNoStopping:  87%|████████▋ | 87/100 [00:20<00:01,  6.82it/s, acc=44%, turns=1.0][A
  KnowNoStopping:  87%|████████▋ | 87/100 [00:20<00:01,  6.82it/s, acc=44%, turns=1.0][AAPI calls:  16%|█▌        | 782/5000 [00:20<04:29, 15.63call/s]API calls:  16%|█▌        | 784/5000 [00:20<04:22, 16.06call/s]
  KnowNoStopping:  88%|████████▊ | 88/100 [00:20<00:01,  6.58it/s, acc=44%, turns=1.0][A
  KnowNoStopping:  88%|████████▊ | 88/100 [00:20<00:01,  6.58it/s, acc=44%, turns=1.0][A
  KnowNoStopping:  89%|████████▉ | 89/100 [00:20<00:01,  6.87it/s, acc=44%, turns=1.0][A
  KnowNoStopping:  89%|████████▉ | 89/100 [00:20<00:01,  6.87it/s, acc=44%, turns=1.0][AAPI calls:  16%|█▌        | 786/5000 [00:20<05:12, 13.49call/s]
  KnowNoStopping:  90%|█████████ | 90/100 [00:20<00:01,  7.32it/s, acc=44%, turns=1.0][A
  KnowNoStopping:  90%|█████████ | 90/100 [00:20<00:01,  7.32it/s, acc=43%, turns=1.0][AAPI calls:  16%|█▌        | 788/5000 [00:20<07:36,  9.22call/s]API calls:  16%|█▌        | 790/5000 [00:21<06:48, 10.30call/s]
  KnowNoStopping:  91%|█████████ | 91/100 [00:21<00:02,  3.85it/s, acc=43%, turns=1.0][A
  KnowNoStopping:  91%|█████████ | 91/100 [00:21<00:02,  3.85it/s, acc=43%, turns=1.0][AAPI calls:  16%|█▌        | 792/5000 [00:21<07:29,  9.36call/s]API calls:  16%|█▌        | 794/5000 [00:21<09:57,  7.04call/s]API calls:  16%|█▌        | 795/5000 [00:21<09:49,  7.13call/s]API calls:  16%|█▌        | 796/5000 [00:22<10:32,  6.65call/s]
  KnowNoStopping:  92%|█████████▁| 92/100 [00:22<00:03,  2.04it/s, acc=43%, turns=1.0][A
  KnowNoStopping:  92%|█████████▁| 92/100 [00:22<00:03,  2.04it/s, acc=43%, turns=1.0][AAPI calls:  16%|█▌        | 797/5000 [00:22<10:37,  6.59call/s]API calls:  16%|█▌        | 799/5000 [00:22<07:58,  8.77call/s]API calls:  16%|█▌        | 801/5000 [00:22<07:15,  9.65call/s]API calls:  16%|█▌        | 804/5000 [00:22<05:31, 12.65call/s]
  KnowNoStopping:  93%|█████████▎| 93/100 [00:22<00:03,  1.88it/s, acc=43%, turns=1.0][A
  KnowNoStopping:  93%|█████████▎| 93/100 [00:22<00:03,  1.88it/s, acc=43%, turns=1.0][AAPI calls:  16%|█▌        | 806/5000 [00:22<06:18, 11.07call/s]
  KnowNoStopping:  94%|█████████▁| 94/100 [00:22<00:02,  2.35it/s, acc=43%, turns=1.0][A
  KnowNoStopping:  94%|█████████▁| 94/100 [00:22<00:02,  2.35it/s, acc=43%, turns=1.0][A
  KnowNoStopping:  95%|█████████▌| 95/100 [00:23<00:02,  2.35it/s, acc=42%, turns=1.0][A
  KnowNoStopping:  96%|█████████▌| 96/100 [00:23<00:01,  2.35it/s, acc=42%, turns=1.0][A
  KnowNoStopping:  97%|█████████▋| 97/100 [00:23<00:01,  2.35it/s, acc=41%, turns=1.0][AAPI calls:  16%|█▌        | 810/5000 [00:23<04:22, 15.98call/s]
  KnowNoStopping:  98%|█████████▊| 98/100 [00:23<00:00,  4.62it/s, acc=41%, turns=1.0][A
  KnowNoStopping:  98%|█████████▊| 98/100 [00:23<00:00,  4.62it/s, acc=41%, turns=1.0][AAPI calls:  16%|█▌        | 812/5000 [00:23<07:22,  9.46call/s]
  KnowNoStopping:  99%|█████████▉| 99/100 [00:23<00:00,  3.91it/s, acc=41%, turns=1.0][A
  KnowNoStopping:  99%|█████████▉| 99/100 [00:23<00:00,  3.91it/s, acc=41%, turns=1.0][AAPI calls:  16%|█▋        | 814/5000 [00:25<22:47,  3.06call/s]API calls:  16%|█▋        | 816/5000 [00:26<28:53,  2.41call/s]API calls:  16%|█▋        | 818/5000 [00:26<22:00,  3.17call/s]API calls:  16%|█▋        | 820/5000 [00:27<16:56,  4.11call/s]API calls:  16%|█▋        | 822/5000 [00:28<21:54,  3.18call/s]
  KnowNoStopping: 100%|██████████| 100/100 [00:28<00:00,  1.08s/it, acc=41%, turns=1.0][A
  KnowNoStopping: 100%|██████████| 100/100 [00:28<00:00,  1.08s/it, acc=41%, turns=1.0][A
                                                                                       [AAPI calls:  16%|█▋        | 822/5000 [00:28<02:22, 29.28call/s]
  Results: Accuracy=41.00% [31.00%, 50.02%], Avg Turns=1.0 [1.0, 1.1]

==========================================================================================
COMPARISON RESULTS
==========================================================================================
Method                      Accuracy           95% CI  Avg Turns           95% CI
------------------------------------------------------------------------------------------
KnowNoStopping                41.00%  [31.00%,50.02%]        1.0        [1.0,1.1]
==========================================================================================

Total API usage:
  Prompt tokens: 450,743
  Completion tokens: 1,485
  Total tokens: 452,228
