Warning: You are sending unauthenticated requests to the HF Hub. Please set a HF_TOKEN to enable higher rate limits and faster downloads.

============================================================
RRMC Experiment: dc_methods/self_consistency
============================================================
Initializing LLM: qwen/qwen-2.5-7b-instruct (max_workers=32)
Task: detective_cases
Data: /root/RRMC/AR-Bench/data/dc/test.json
Loading weights:   0%|          | 0/103 [00:00<?, ?it/s]Loading weights:   1%|          | 1/103 [00:00<00:00, 22919.69it/s, Materializing param=embeddings.LayerNorm.bias]Loading weights:   1%|          | 1/103 [00:00<00:00, 9939.11it/s, Materializing param=embeddings.LayerNorm.bias] Loading weights:   2%|▁         | 2/103 [00:00<00:00, 9543.35it/s, Materializing param=embeddings.LayerNorm.weight]Loading weights:   2%|▁         | 2/103 [00:00<00:00, 7667.83it/s, Materializing param=embeddings.LayerNorm.weight]Loading weights:   3%|▎         | 3/103 [00:00<00:00, 8439.24it/s, Materializing param=embeddings.position_embeddings.weight]Loading weights:   3%|▎         | 3/103 [00:00<00:00, 7454.33it/s, Materializing param=embeddings.position_embeddings.weight]Loading weights:   4%|▁         | 4/103 [00:00<00:00, 7925.00it/s, Materializing param=embeddings.token_type_embeddings.weight]Loading weights:   4%|▁         | 4/103 [00:00<00:00, 6147.75it/s, Materializing param=embeddings.token_type_embeddings.weight]Loading weights:   5%|▁         | 5/103 [00:00<00:00, 6563.86it/s, Materializing param=embeddings.word_embeddings.weight]      Loading weights:   5%|▁         | 5/103 [00:00<00:00, 4624.37it/s, Materializing param=embeddings.word_embeddings.weight]Loading weights:   6%|▌         | 6/103 [00:00<00:00, 3835.08it/s, Materializing param=encoder.layer.0.attention.output.LayerNorm.bias]Loading weights:   6%|▌         | 6/103 [00:00<00:00, 3350.53it/s, Materializing param=encoder.layer.0.attention.output.LayerNorm.bias]Loading weights:   7%|▋         | 7/103 [00:00<00:00, 3681.52it/s, Materializing param=encoder.layer.0.attention.output.LayerNorm.weight]Loading weights:   7%|▋         | 7/103 [00:00<00:00, 3195.14it/s, Materializing param=encoder.layer.0.attention.output.LayerNorm.weight]Loading weights:   8%|▊         | 8/103 [00:00<00:00, 2322.75it/s, Materializing param=encoder.layer.0.attention.output.dense.bias]      Loading weights:   8%|▊         | 8/103 [00:00<00:00, 2197.98it/s, Materializing param=encoder.layer.0.attention.output.dense.bias]Loading weights:   9%|▊         | 9/103 [00:00<00:00, 2328.73it/s, Materializing param=encoder.layer.0.attention.output.dense.weight]Loading weights:   9%|▊         | 9/103 [00:00<00:00, 2248.82it/s, Materializing param=encoder.layer.0.attention.output.dense.weight]Loading weights:  10%|▉         | 10/103 [00:00<00:00, 2436.00it/s, Materializing param=encoder.layer.0.attention.self.key.bias]     Loading weights:  10%|▉         | 10/103 [00:00<00:00, 2409.83it/s, Materializing param=encoder.layer.0.attention.self.key.bias]Loading weights:  11%|█         | 11/103 [00:00<00:00, 2593.44it/s, Materializing param=encoder.layer.0.attention.self.key.weight]Loading weights:  11%|█         | 11/103 [00:00<00:00, 2430.46it/s, Materializing param=encoder.layer.0.attention.self.key.weight]Loading weights:  12%|█▁        | 12/103 [00:00<00:00, 2433.83it/s, Materializing param=encoder.layer.0.attention.self.query.bias]Loading weights:  12%|█▁        | 12/103 [00:00<00:00, 2411.44it/s, Materializing param=encoder.layer.0.attention.self.query.bias]Loading weights:  13%|█▎        | 13/103 [00:00<00:00, 2557.14it/s, Materializing param=encoder.layer.0.attention.self.query.weight]Loading weights:  13%|█▎        | 13/103 [00:00<00:00, 2535.27it/s, Materializing param=encoder.layer.0.attention.self.query.weight]Loading weights:  14%|█▎        | 14/103 [00:00<00:00, 2675.79it/s, Materializing param=encoder.layer.0.attention.self.value.bias]  Loading weights:  14%|█▎        | 14/103 [00:00<00:00, 2653.54it/s, Materializing param=encoder.layer.0.attention.self.value.bias]Loading weights:  15%|█▁        | 15/103 [00:00<00:00, 2553.04it/s, Materializing param=encoder.layer.0.attention.self.value.weight]Loading weights:  15%|█▁        | 15/103 [00:00<00:00, 2444.71it/s, Materializing param=encoder.layer.0.attention.self.value.weight]Loading weights:  16%|█▌        | 16/103 [00:00<00:00, 2516.65it/s, Materializing param=encoder.layer.0.intermediate.dense.bias]    Loading weights:  16%|█▌        | 16/103 [00:00<00:00, 2421.83it/s, Materializing param=encoder.layer.0.intermediate.dense.bias]Loading weights:  17%|█▋        | 17/103 [00:00<00:00, 2397.63it/s, Materializing param=encoder.layer.0.intermediate.dense.weight]Loading weights:  17%|█▋        | 17/103 [00:00<00:00, 2341.11it/s, Materializing param=encoder.layer.0.intermediate.dense.weight]Loading weights:  17%|█▋        | 18/103 [00:00<00:00, 2445.34it/s, Materializing param=encoder.layer.0.output.LayerNorm.bias]    Loading weights:  17%|█▋        | 18/103 [00:00<00:00, 2351.07it/s, Materializing param=encoder.layer.0.output.LayerNorm.bias]Loading weights:  18%|█▊        | 19/103 [00:00<00:00, 2387.05it/s, Materializing param=encoder.layer.0.output.LayerNorm.weight]Loading weights:  18%|█▊        | 19/103 [00:00<00:00, 2373.26it/s, Materializing param=encoder.layer.0.output.LayerNorm.weight]Loading weights:  19%|█▉        | 20/103 [00:00<00:00, 2467.02it/s, Materializing param=encoder.layer.0.output.dense.bias]      Loading weights:  19%|█▉        | 20/103 [00:00<00:00, 2387.26it/s, Materializing param=encoder.layer.0.output.dense.bias]Loading weights:  20%|██        | 21/103 [00:00<00:00, 2429.07it/s, Materializing param=encoder.layer.0.output.dense.weight]Loading weights:  20%|██        | 21/103 [00:00<00:00, 2348.56it/s, Materializing param=encoder.layer.0.output.dense.weight]Loading weights:  21%|██▁       | 22/103 [00:00<00:00, 2432.44it/s, Materializing param=encoder.layer.1.attention.output.LayerNorm.bias]Loading weights:  21%|██▁       | 22/103 [00:00<00:00, 2421.08it/s, Materializing param=encoder.layer.1.attention.output.LayerNorm.bias]Loading weights:  22%|██▁       | 23/103 [00:00<00:00, 2505.69it/s, Materializing param=encoder.layer.1.attention.output.LayerNorm.weight]Loading weights:  22%|██▁       | 23/103 [00:00<00:00, 2467.74it/s, Materializing param=encoder.layer.1.attention.output.LayerNorm.weight]Loading weights:  23%|██▎       | 24/103 [00:00<00:00, 2455.86it/s, Materializing param=encoder.layer.1.attention.output.dense.bias]      Loading weights:  23%|██▎       | 24/103 [00:00<00:00, 2427.61it/s, Materializing param=encoder.layer.1.attention.output.dense.bias]Loading weights:  24%|██▁       | 25/103 [00:00<00:00, 2502.99it/s, Materializing param=encoder.layer.1.attention.output.dense.weight]Loading weights:  24%|██▁       | 25/103 [00:00<00:00, 2469.97it/s, Materializing param=encoder.layer.1.attention.output.dense.weight]Loading weights:  25%|██▌       | 26/103 [00:00<00:00, 2543.78it/s, Materializing param=encoder.layer.1.attention.self.key.bias]      Loading weights:  25%|██▌       | 26/103 [00:00<00:00, 2533.44it/s, Materializing param=encoder.layer.1.attention.self.key.bias]Loading weights:  26%|██▌       | 27/103 [00:00<00:00, 2608.16it/s, Materializing param=encoder.layer.1.attention.self.key.weight]Loading weights:  26%|██▌       | 27/103 [00:00<00:00, 2597.99it/s, Materializing param=encoder.layer.1.attention.self.key.weight]Loading weights:  27%|██▋       | 28/103 [00:00<00:00, 2668.50it/s, Materializing param=encoder.layer.1.attention.self.query.bias]Loading weights:  27%|██▋       | 28/103 [00:00<00:00, 2329.38it/s, Materializing param=encoder.layer.1.attention.self.query.bias]Loading weights:  28%|██▊       | 29/103 [00:00<00:00, 2350.11it/s, Materializing param=encoder.layer.1.attention.self.query.weight]Loading weights:  28%|██▊       | 29/103 [00:00<00:00, 2255.04it/s, Materializing param=encoder.layer.1.attention.self.query.weight]Loading weights:  29%|██▉       | 30/103 [00:00<00:00, 2244.54it/s, Materializing param=encoder.layer.1.attention.self.value.bias]  Loading weights:  29%|██▉       | 30/103 [00:00<00:00, 2236.72it/s, Materializing param=encoder.layer.1.attention.self.value.bias]Loading weights:  30%|███       | 31/103 [00:00<00:00, 2290.64it/s, Materializing param=encoder.layer.1.attention.self.value.weight]Loading weights:  30%|███       | 31/103 [00:00<00:00, 2269.41it/s, Materializing param=encoder.layer.1.attention.self.value.weight]Loading weights:  31%|███       | 32/103 [00:00<00:00, 2321.95it/s, Materializing param=encoder.layer.1.intermediate.dense.bias]    Loading weights:  31%|███       | 32/103 [00:00<00:00, 2289.47it/s, Materializing param=encoder.layer.1.intermediate.dense.bias]Loading weights:  32%|███▁      | 33/103 [00:00<00:00, 2330.33it/s, Materializing param=encoder.layer.1.intermediate.dense.weight]Loading weights:  32%|███▁      | 33/103 [00:00<00:00, 2322.78it/s, Materializing param=encoder.layer.1.intermediate.dense.weight]Loading weights:  33%|███▎      | 34/103 [00:00<00:00, 2376.50it/s, Materializing param=encoder.layer.1.output.LayerNorm.bias]    Loading weights:  33%|███▎      | 34/103 [00:00<00:00, 2335.78it/s, Materializing param=encoder.layer.1.output.LayerNorm.bias]Loading weights:  34%|███▁      | 35/103 [00:00<00:00, 2372.92it/s, Materializing param=encoder.layer.1.output.LayerNorm.weight]Loading weights:  34%|███▁      | 35/103 [00:00<00:00, 2365.92it/s, Materializing param=encoder.layer.1.output.LayerNorm.weight]Loading weights:  35%|███▁      | 36/103 [00:00<00:00, 2421.15it/s, Materializing param=encoder.layer.1.output.dense.bias]      Loading weights:  35%|███▁      | 36/103 [00:00<00:00, 2414.61it/s, Materializing param=encoder.layer.1.output.dense.bias]Loading weights:  36%|███▌      | 37/103 [00:00<00:00, 2469.55it/s, Materializing param=encoder.layer.1.output.dense.weight]Loading weights:  36%|███▌      | 37/103 [00:00<00:00, 2463.13it/s, Materializing param=encoder.layer.1.output.dense.weight]Loading weights:  37%|███▋      | 38/103 [00:00<00:00, 2517.71it/s, Materializing param=encoder.layer.2.attention.output.LayerNorm.bias]Loading weights:  37%|███▋      | 38/103 [00:00<00:00, 2511.04it/s, Materializing param=encoder.layer.2.attention.output.LayerNorm.bias]Loading weights:  38%|███▊      | 39/103 [00:00<00:00, 2563.88it/s, Materializing param=encoder.layer.2.attention.output.LayerNorm.weight]Loading weights:  38%|███▊      | 39/103 [00:00<00:00, 2556.98it/s, Materializing param=encoder.layer.2.attention.output.LayerNorm.weight]Loading weights:  39%|███▉      | 40/103 [00:00<00:00, 2610.02it/s, Materializing param=encoder.layer.2.attention.output.dense.bias]      Loading weights:  39%|███▉      | 40/103 [00:00<00:00, 2603.26it/s, Materializing param=encoder.layer.2.attention.output.dense.bias]Loading weights:  40%|███▉      | 41/103 [00:00<00:00, 2655.57it/s, Materializing param=encoder.layer.2.attention.output.dense.weight]Loading weights:  40%|███▉      | 41/103 [00:00<00:00, 2648.61it/s, Materializing param=encoder.layer.2.attention.output.dense.weight]Loading weights:  41%|████      | 42/103 [00:00<00:00, 2697.84it/s, Materializing param=encoder.layer.2.attention.self.key.bias]      Loading weights:  41%|████      | 42/103 [00:00<00:00, 2690.71it/s, Materializing param=encoder.layer.2.attention.self.key.bias]Loading weights:  42%|████▁     | 43/103 [00:00<00:00, 2741.71it/s, Materializing param=encoder.layer.2.attention.self.key.weight]Loading weights:  42%|████▁     | 43/103 [00:00<00:00, 2734.72it/s, Materializing param=encoder.layer.2.attention.self.key.weight]Loading weights:  43%|████▎     | 44/103 [00:00<00:00, 2785.31it/s, Materializing param=encoder.layer.2.attention.self.query.bias]Loading weights:  43%|████▎     | 44/103 [00:00<00:00, 2776.35it/s, Materializing param=encoder.layer.2.attention.self.query.bias]Loading weights:  44%|████▎     | 45/103 [00:00<00:00, 2825.29it/s, Materializing param=encoder.layer.2.attention.self.query.weight]Loading weights:  44%|████▎     | 45/103 [00:00<00:00, 2818.12it/s, Materializing param=encoder.layer.2.attention.self.query.weight]Loading weights:  45%|████▁     | 46/103 [00:00<00:00, 2867.35it/s, Materializing param=encoder.layer.2.attention.self.value.bias]  Loading weights:  45%|████▁     | 46/103 [00:00<00:00, 2860.20it/s, Materializing param=encoder.layer.2.attention.self.value.bias]Loading weights:  46%|████▌     | 47/103 [00:00<00:00, 2908.71it/s, Materializing param=encoder.layer.2.attention.self.value.weight]Loading weights:  46%|████▌     | 47/103 [00:00<00:00, 2901.52it/s, Materializing param=encoder.layer.2.attention.self.value.weight]Loading weights:  47%|████▋     | 48/103 [00:00<00:00, 2949.84it/s, Materializing param=encoder.layer.2.intermediate.dense.bias]    Loading weights:  47%|████▋     | 48/103 [00:00<00:00, 2942.55it/s, Materializing param=encoder.layer.2.intermediate.dense.bias]Loading weights:  48%|████▊     | 49/103 [00:00<00:00, 2990.61it/s, Materializing param=encoder.layer.2.intermediate.dense.weight]Loading weights:  48%|████▊     | 49/103 [00:00<00:00, 2983.28it/s, Materializing param=encoder.layer.2.intermediate.dense.weight]Loading weights:  49%|████▊     | 50/103 [00:00<00:00, 3029.65it/s, Materializing param=encoder.layer.2.output.LayerNorm.bias]    Loading weights:  49%|████▊     | 50/103 [00:00<00:00, 3021.66it/s, Materializing param=encoder.layer.2.output.LayerNorm.bias]Loading weights:  50%|████▉     | 51/103 [00:00<00:00, 3068.12it/s, Materializing param=encoder.layer.2.output.LayerNorm.weight]Loading weights:  50%|████▉     | 51/103 [00:00<00:00, 3060.75it/s, Materializing param=encoder.layer.2.output.LayerNorm.weight]Loading weights:  50%|█████     | 52/103 [00:00<00:00, 3107.51it/s, Materializing param=encoder.layer.2.output.dense.bias]      Loading weights:  50%|█████     | 52/103 [00:00<00:00, 3100.22it/s, Materializing param=encoder.layer.2.output.dense.bias]Loading weights:  51%|█████▁    | 53/103 [00:00<00:00, 3146.56it/s, Materializing param=encoder.layer.2.output.dense.weight]Loading weights:  51%|█████▁    | 53/103 [00:00<00:00, 3139.14it/s, Materializing param=encoder.layer.2.output.dense.weight]Loading weights:  52%|█████▁    | 54/103 [00:00<00:00, 3185.19it/s, Materializing param=encoder.layer.3.attention.output.LayerNorm.bias]Loading weights:  52%|█████▁    | 54/103 [00:00<00:00, 3177.68it/s, Materializing param=encoder.layer.3.attention.output.LayerNorm.bias]Loading weights:  53%|█████▎    | 55/103 [00:00<00:00, 3221.70it/s, Materializing param=encoder.layer.3.attention.output.LayerNorm.weight]Loading weights:  53%|█████▎    | 55/103 [00:00<00:00, 3213.89it/s, Materializing param=encoder.layer.3.attention.output.LayerNorm.weight]Loading weights:  54%|█████▁    | 56/103 [00:00<00:00, 3258.30it/s, Materializing param=encoder.layer.3.attention.output.dense.bias]      Loading weights:  54%|█████▁    | 56/103 [00:00<00:00, 3250.77it/s, Materializing param=encoder.layer.3.attention.output.dense.bias]Loading weights:  55%|█████▌    | 57/103 [00:00<00:00, 3294.73it/s, Materializing param=encoder.layer.3.attention.output.dense.weight]Loading weights:  55%|█████▌    | 57/103 [00:00<00:00, 3287.07it/s, Materializing param=encoder.layer.3.attention.output.dense.weight]Loading weights:  56%|█████▋    | 58/103 [00:00<00:00, 3330.77it/s, Materializing param=encoder.layer.3.attention.self.key.bias]      Loading weights:  56%|█████▋    | 58/103 [00:00<00:00, 3323.17it/s, Materializing param=encoder.layer.3.attention.self.key.bias]Loading weights:  57%|█████▋    | 59/103 [00:00<00:00, 3363.56it/s, Materializing param=encoder.layer.3.attention.self.key.weight]Loading weights:  57%|█████▋    | 59/103 [00:00<00:00, 3354.94it/s, Materializing param=encoder.layer.3.attention.self.key.weight]Loading weights:  58%|█████▊    | 60/103 [00:00<00:00, 3397.48it/s, Materializing param=encoder.layer.3.attention.self.query.bias]Loading weights:  58%|█████▊    | 60/103 [00:00<00:00, 3389.79it/s, Materializing param=encoder.layer.3.attention.self.query.bias]Loading weights:  59%|█████▉    | 61/103 [00:00<00:00, 3432.01it/s, Materializing param=encoder.layer.3.attention.self.query.weight]Loading weights:  59%|█████▉    | 61/103 [00:00<00:00, 3424.29it/s, Materializing param=encoder.layer.3.attention.self.query.weight]Loading weights:  60%|██████    | 62/103 [00:00<00:00, 3466.14it/s, Materializing param=encoder.layer.3.attention.self.value.bias]  Loading weights:  60%|██████    | 62/103 [00:00<00:00, 3458.35it/s, Materializing param=encoder.layer.3.attention.self.value.bias]Loading weights:  61%|██████    | 63/103 [00:00<00:00, 3500.16it/s, Materializing param=encoder.layer.3.attention.self.value.weight]Loading weights:  61%|██████    | 63/103 [00:00<00:00, 3492.44it/s, Materializing param=encoder.layer.3.attention.self.value.weight]Loading weights:  62%|██████▁   | 64/103 [00:00<00:00, 3533.44it/s, Materializing param=encoder.layer.3.intermediate.dense.bias]    Loading weights:  62%|██████▁   | 64/103 [00:00<00:00, 3525.23it/s, Materializing param=encoder.layer.3.intermediate.dense.bias]Loading weights:  63%|██████▎   | 65/103 [00:00<00:00, 3566.07it/s, Materializing param=encoder.layer.3.intermediate.dense.weight]Loading weights:  63%|██████▎   | 65/103 [00:00<00:00, 3558.30it/s, Materializing param=encoder.layer.3.intermediate.dense.weight]Loading weights:  64%|██████▁   | 66/103 [00:00<00:00, 3599.04it/s, Materializing param=encoder.layer.3.output.LayerNorm.bias]    Loading weights:  64%|██████▁   | 66/103 [00:00<00:00, 3591.39it/s, Materializing param=encoder.layer.3.output.LayerNorm.bias]Loading weights:  65%|██████▌   | 67/103 [00:00<00:00, 3631.90it/s, Materializing param=encoder.layer.3.output.LayerNorm.weight]Loading weights:  65%|██████▌   | 67/103 [00:00<00:00, 3624.36it/s, Materializing param=encoder.layer.3.output.LayerNorm.weight]Loading weights:  66%|██████▌   | 68/103 [00:00<00:00, 3662.30it/s, Materializing param=encoder.layer.3.output.dense.bias]      Loading weights:  66%|██████▌   | 68/103 [00:00<00:00, 3654.65it/s, Materializing param=encoder.layer.3.output.dense.bias]Loading weights:  67%|██████▋   | 69/103 [00:00<00:00, 3693.25it/s, Materializing param=encoder.layer.3.output.dense.weight]Loading weights:  67%|██████▋   | 69/103 [00:00<00:00, 3685.63it/s, Materializing param=encoder.layer.3.output.dense.weight]Loading weights:  68%|██████▊   | 70/103 [00:00<00:00, 3724.82it/s, Materializing param=encoder.layer.4.attention.output.LayerNorm.bias]Loading weights:  68%|██████▊   | 70/103 [00:00<00:00, 3716.99it/s, Materializing param=encoder.layer.4.attention.output.LayerNorm.bias]Loading weights:  69%|██████▉   | 71/103 [00:00<00:00, 3755.73it/s, Materializing param=encoder.layer.4.attention.output.LayerNorm.weight]Loading weights:  69%|██████▉   | 71/103 [00:00<00:00, 3748.07it/s, Materializing param=encoder.layer.4.attention.output.LayerNorm.weight]Loading weights:  70%|██████▉   | 72/103 [00:00<00:00, 3786.33it/s, Materializing param=encoder.layer.4.attention.output.dense.bias]      Loading weights:  70%|██████▉   | 72/103 [00:00<00:00, 3778.70it/s, Materializing param=encoder.layer.4.attention.output.dense.bias]Loading weights:  71%|███████   | 73/103 [00:00<00:00, 3815.09it/s, Materializing param=encoder.layer.4.attention.output.dense.weight]Loading weights:  71%|███████   | 73/103 [00:00<00:00, 3807.12it/s, Materializing param=encoder.layer.4.attention.output.dense.weight]Loading weights:  72%|███████▁  | 74/103 [00:00<00:00, 3844.65it/s, Materializing param=encoder.layer.4.attention.self.key.bias]      Loading weights:  72%|███████▁  | 74/103 [00:00<00:00, 3837.00it/s, Materializing param=encoder.layer.4.attention.self.key.bias]Loading weights:  73%|███████▎  | 75/103 [00:00<00:00, 3874.19it/s, Materializing param=encoder.layer.4.attention.self.key.weight]Loading weights:  73%|███████▎  | 75/103 [00:00<00:00, 3866.62it/s, Materializing param=encoder.layer.4.attention.self.key.weight]Loading weights:  74%|███████▁  | 76/103 [00:00<00:00, 3903.30it/s, Materializing param=encoder.layer.4.attention.self.query.bias]Loading weights:  74%|███████▁  | 76/103 [00:00<00:00, 3893.67it/s, Materializing param=encoder.layer.4.attention.self.query.bias]Loading weights:  75%|███████▁  | 77/103 [00:00<00:00, 3929.35it/s, Materializing param=encoder.layer.4.attention.self.query.weight]Loading weights:  75%|███████▁  | 77/103 [00:00<00:00, 3920.67it/s, Materializing param=encoder.layer.4.attention.self.query.weight]Loading weights:  76%|███████▌  | 78/103 [00:00<00:00, 3956.99it/s, Materializing param=encoder.layer.4.attention.self.value.bias]  Loading weights:  76%|███████▌  | 78/103 [00:00<00:00, 3949.20it/s, Materializing param=encoder.layer.4.attention.self.value.bias]Loading weights:  77%|███████▋  | 79/103 [00:00<00:00, 3985.21it/s, Materializing param=encoder.layer.4.attention.self.value.weight]Loading weights:  77%|███████▋  | 79/103 [00:00<00:00, 3977.12it/s, Materializing param=encoder.layer.4.attention.self.value.weight]Loading weights:  78%|███████▊  | 80/103 [00:00<00:00, 4012.97it/s, Materializing param=encoder.layer.4.intermediate.dense.bias]    Loading weights:  78%|███████▊  | 80/103 [00:00<00:00, 4005.30it/s, Materializing param=encoder.layer.4.intermediate.dense.bias]Loading weights:  79%|███████▊  | 81/103 [00:00<00:00, 4041.24it/s, Materializing param=encoder.layer.4.intermediate.dense.weight]Loading weights:  79%|███████▊  | 81/103 [00:00<00:00, 4033.61it/s, Materializing param=encoder.layer.4.intermediate.dense.weight]Loading weights:  80%|███████▉  | 82/103 [00:00<00:00, 4069.25it/s, Materializing param=encoder.layer.4.output.LayerNorm.bias]    Loading weights:  80%|███████▉  | 82/103 [00:00<00:00, 4061.56it/s, Materializing param=encoder.layer.4.output.LayerNorm.bias]Loading weights:  81%|████████  | 83/103 [00:00<00:00, 4096.63it/s, Materializing param=encoder.layer.4.output.LayerNorm.weight]Loading weights:  81%|████████  | 83/103 [00:00<00:00, 4088.88it/s, Materializing param=encoder.layer.4.output.LayerNorm.weight]Loading weights:  82%|████████▁ | 84/103 [00:00<00:00, 4123.03it/s, Materializing param=encoder.layer.4.output.dense.bias]      Loading weights:  82%|████████▁ | 84/103 [00:00<00:00, 4114.13it/s, Materializing param=encoder.layer.4.output.dense.bias]Loading weights:  83%|████████▎ | 85/103 [00:00<00:00, 4148.67it/s, Materializing param=encoder.layer.4.output.dense.weight]Loading weights:  83%|████████▎ | 85/103 [00:00<00:00, 4138.03it/s, Materializing param=encoder.layer.4.output.dense.weight]Loading weights:  83%|████████▎ | 86/103 [00:00<00:00, 4171.94it/s, Materializing param=encoder.layer.5.attention.output.LayerNorm.bias]Loading weights:  83%|████████▎ | 86/103 [00:00<00:00, 4164.14it/s, Materializing param=encoder.layer.5.attention.output.LayerNorm.bias]Loading weights:  84%|████████▁ | 87/103 [00:00<00:00, 4196.38it/s, Materializing param=encoder.layer.5.attention.output.LayerNorm.weight]Loading weights:  84%|████████▁ | 87/103 [00:00<00:00, 4188.24it/s, Materializing param=encoder.layer.5.attention.output.LayerNorm.weight]Loading weights:  85%|████████▌ | 88/103 [00:00<00:00, 4221.79it/s, Materializing param=encoder.layer.5.attention.output.dense.bias]      Loading weights:  85%|████████▌ | 88/103 [00:00<00:00, 4214.08it/s, Materializing param=encoder.layer.5.attention.output.dense.bias]Loading weights:  86%|████████▋ | 89/103 [00:00<00:00, 4247.13it/s, Materializing param=encoder.layer.5.attention.output.dense.weight]Loading weights:  86%|████████▋ | 89/103 [00:00<00:00, 4239.03it/s, Materializing param=encoder.layer.5.attention.output.dense.weight]Loading weights:  87%|████████▋ | 90/103 [00:00<00:00, 4272.10it/s, Materializing param=encoder.layer.5.attention.self.key.bias]      Loading weights:  87%|████████▋ | 90/103 [00:00<00:00, 4264.48it/s, Materializing param=encoder.layer.5.attention.self.key.bias]Loading weights:  88%|████████▊ | 91/103 [00:00<00:00, 4296.91it/s, Materializing param=encoder.layer.5.attention.self.key.weight]Loading weights:  88%|████████▊ | 91/103 [00:00<00:00, 4289.14it/s, Materializing param=encoder.layer.5.attention.self.key.weight]Loading weights:  89%|████████▉ | 92/103 [00:00<00:00, 4321.60it/s, Materializing param=encoder.layer.5.attention.self.query.bias]Loading weights:  89%|████████▉ | 92/103 [00:00<00:00, 4313.92it/s, Materializing param=encoder.layer.5.attention.self.query.bias]Loading weights:  90%|█████████ | 93/103 [00:00<00:00, 4345.94it/s, Materializing param=encoder.layer.5.attention.self.query.weight]Loading weights:  90%|█████████ | 93/103 [00:00<00:00, 4337.20it/s, Materializing param=encoder.layer.5.attention.self.query.weight]Loading weights:  91%|█████████▁| 94/103 [00:00<00:00, 4367.32it/s, Materializing param=encoder.layer.5.attention.self.value.bias]  Loading weights:  91%|█████████▁| 94/103 [00:00<00:00, 4358.73it/s, Materializing param=encoder.layer.5.attention.self.value.bias]Loading weights:  92%|█████████▁| 95/103 [00:00<00:00, 4390.10it/s, Materializing param=encoder.layer.5.attention.self.value.weight]Loading weights:  92%|█████████▁| 95/103 [00:00<00:00, 4382.43it/s, Materializing param=encoder.layer.5.attention.self.value.weight]Loading weights:  93%|█████████▎| 96/103 [00:00<00:00, 4414.23it/s, Materializing param=encoder.layer.5.intermediate.dense.bias]    Loading weights:  93%|█████████▎| 96/103 [00:00<00:00, 4406.31it/s, Materializing param=encoder.layer.5.intermediate.dense.bias]Loading weights:  94%|█████████▁| 97/103 [00:00<00:00, 4437.64it/s, Materializing param=encoder.layer.5.intermediate.dense.weight]Loading weights:  94%|█████████▁| 97/103 [00:00<00:00, 4429.96it/s, Materializing param=encoder.layer.5.intermediate.dense.weight]Loading weights:  95%|█████████▌| 98/103 [00:00<00:00, 4461.49it/s, Materializing param=encoder.layer.5.output.LayerNorm.bias]    Loading weights:  95%|█████████▌| 98/103 [00:00<00:00, 4453.90it/s, Materializing param=encoder.layer.5.output.LayerNorm.bias]Loading weights:  96%|█████████▌| 99/103 [00:00<00:00, 4483.85it/s, Materializing param=encoder.layer.5.output.LayerNorm.weight]Loading weights:  96%|█████████▌| 99/103 [00:00<00:00, 4475.78it/s, Materializing param=encoder.layer.5.output.LayerNorm.weight]Loading weights:  97%|█████████▋| 100/103 [00:00<00:00, 4506.52it/s, Materializing param=encoder.layer.5.output.dense.bias]     Loading weights:  97%|█████████▋| 100/103 [00:00<00:00, 4497.77it/s, Materializing param=encoder.layer.5.output.dense.bias]Loading weights:  98%|█████████▊| 101/103 [00:00<00:00, 4528.03it/s, Materializing param=encoder.layer.5.output.dense.weight]Loading weights:  98%|█████████▊| 101/103 [00:00<00:00, 4520.30it/s, Materializing param=encoder.layer.5.output.dense.weight]Loading weights:  99%|█████████▉| 102/103 [00:00<00:00, 4550.88it/s, Materializing param=pooler.dense.bias]                  Loading weights:  99%|█████████▉| 102/103 [00:00<00:00, 4543.19it/s, Materializing param=pooler.dense.bias]Loading weights: 100%|██████████| 103/103 [00:00<00:00, 4572.97it/s, Materializing param=pooler.dense.weight]Loading weights: 100%|██████████| 103/103 [00:00<00:00, 4564.71it/s, Materializing param=pooler.dense.weight]Loading weights: 100%|██████████| 103/103 [00:00<00:00, 4548.27it/s, Materializing param=pooler.dense.weight]
[1mBertModel LOAD REPORT[0m from: sentence-transformers/all-MiniLM-L6-v2
Key                     | Status     |  | 
------------------------+------------+--+-
embeddings.position_ids | UNEXPECTED |  | 

[3mNotes:
- UNEXPECTED[3m	:can be ignored when loading from different task/architecture; not ok if you expect identical arch.[0m
API calls:   0%|          | 0/5000 [00:00<?, ?call/s]Evaluating 100 puzzles
Methods: ['self_consistency']

============================================================
STARTING EVALUATION
============================================================

Evaluating SelfConsistencyStopping on 100 puzzles...

  SelfConsistencyStopp:   0%|          | 0/100 [00:00<?, ?it/s][AAPI calls:   0%|          | 1/5000 [00:02<2:54:15,  2.09s/call]API calls:   0%|          | 2/5000 [00:02<1:49:46,  1.32s/call]API calls:   0%|          | 7/5000 [00:02<34:35,  2.41call/s]  API calls:   0%|          | 24/5000 [00:02<08:09, 10.16call/s]API calls:   0%|          | 25/5000 [00:02<04:14, 19.52call/s]API calls:   1%|          | 33/5000 [00:02<03:38, 22.77call/s]API calls:   1%|          | 34/5000 [00:02<03:01, 27.30call/s]API calls:   1%|          | 60/5000 [00:02<01:35, 51.86call/s]
  SelfConsistencyStopp:   1%|          | 1/100 [00:03<05:21,  3.25s/it][A
  SelfConsistencyStopp:   1%|          | 1/100 [00:03<05:21,  3.25s/it, acc=0%, turns=1.0][AAPI calls:   1%|▁         | 70/5000 [00:03<01:52, 43.78call/s]
  SelfConsistencyStopp:   2%|▁         | 2/100 [00:03<02:17,  1.41s/it, acc=0%, turns=1.0][A
  SelfConsistencyStopp:   2%|▁         | 2/100 [00:03<02:17,  1.41s/it, acc=0%, turns=1.0][AAPI calls:   2%|▁         | 78/5000 [00:03<01:44, 46.91call/s]
  SelfConsistencyStopp:   3%|▎         | 3/100 [00:03<01:19,  1.23it/s, acc=0%, turns=1.0][A
  SelfConsistencyStopp:   3%|▎         | 3/100 [00:03<01:19,  1.23it/s, acc=33%, turns=1.0][AAPI calls:   2%|▁         | 102/5000 [00:03<01:04, 75.38call/s]API calls:   2%|▁         | 114/5000 [00:03<01:23, 58.71call/s]API calls:   2%|▁         | 115/5000 [00:03<01:35, 51.14call/s]API calls:   3%|▎         | 134/5000 [00:03<01:09, 69.79call/s]API calls:   3%|▎         | 145/5000 [00:04<01:40, 48.24call/s]API calls:   3%|▎         | 169/5000 [00:04<01:06, 72.72call/s]API calls:   4%|▁         | 190/5000 [00:04<00:51, 92.81call/s]
  SelfConsistencyStopp:   4%|▁         | 4/100 [00:04<01:41,  1.05s/it, acc=33%, turns=1.0][A
  SelfConsistencyStopp:   4%|▁         | 4/100 [00:04<01:41,  1.05s/it, acc=25%, turns=1.0][A
  SelfConsistencyStopp:   5%|▌         | 5/100 [00:04<01:40,  1.05s/it, acc=20%, turns=1.0][AAPI calls:   4%|▁         | 205/5000 [00:04<01:05, 72.69call/s]
  SelfConsistencyStopp:   6%|▌         | 6/100 [00:04<01:38,  1.05s/it, acc=17%, turns=1.0][AAPI calls:   4%|▁         | 217/5000 [00:05<01:00, 79.47call/s]
  SelfConsistencyStopp:   7%|▋         | 7/100 [00:05<00:39,  2.33it/s, acc=17%, turns=1.0][A
  SelfConsistencyStopp:   7%|▋         | 7/100 [00:05<00:39,  2.33it/s, acc=14%, turns=1.0][A
  SelfConsistencyStopp:   8%|▊         | 8/100 [00:05<00:39,  2.33it/s, acc=25%, turns=1.0][AAPI calls:   5%|▁         | 229/5000 [00:05<00:55, 85.87call/s]
  SelfConsistencyStopp:   9%|▉         | 9/100 [00:05<00:26,  3.38it/s, acc=25%, turns=1.0][A
  SelfConsistencyStopp:   9%|▉         | 9/100 [00:05<00:26,  3.38it/s, acc=22%, turns=1.0][A
  SelfConsistencyStopp:  10%|█         | 10/100 [00:05<00:26,  3.38it/s, acc=20%, turns=1.0][A
  SelfConsistencyStopp:  11%|█         | 11/100 [00:05<00:26,  3.38it/s, acc=18%, turns=1.0][AAPI calls:   5%|▁         | 241/5000 [00:05<00:54, 87.89call/s]
  SelfConsistencyStopp:  12%|█▁        | 12/100 [00:05<00:26,  3.38it/s, acc=17%, turns=1.0][A
  SelfConsistencyStopp:  13%|█▎        | 13/100 [00:05<00:13,  6.35it/s, acc=17%, turns=1.0][A
  SelfConsistencyStopp:  13%|█▎        | 13/100 [00:05<00:13,  6.35it/s, acc=15%, turns=1.0][A
  SelfConsistencyStopp:  14%|█▁        | 14/100 [00:05<00:13,  6.35it/s, acc=14%, turns=1.0][A
  SelfConsistencyStopp:  15%|█▌        | 15/100 [00:05<00:13,  6.35it/s, acc=13%, turns=1.0][A
  SelfConsistencyStopp:  16%|█▌        | 16/100 [00:05<00:10,  7.98it/s, acc=13%, turns=1.0][A
  SelfConsistencyStopp:  16%|█▌        | 16/100 [00:05<00:10,  7.98it/s, acc=19%, turns=1.0][A
  SelfConsistencyStopp:  17%|█▋        | 17/100 [00:05<00:10,  7.98it/s, acc=18%, turns=1.0][AAPI calls:   5%|▌         | 252/5000 [00:05<01:14, 64.00call/s]API calls:   5%|▌         | 261/5000 [00:05<01:13, 64.18call/s]API calls:   6%|▌         | 275/5000 [00:05<01:03, 74.70call/s]
  SelfConsistencyStopp:  18%|█▊        | 18/100 [00:06<00:12,  6.39it/s, acc=18%, turns=1.0][A
  SelfConsistencyStopp:  18%|█▊        | 18/100 [00:06<00:12,  6.39it/s, acc=22%, turns=1.0][AAPI calls:   6%|▌         | 284/5000 [00:06<01:21, 57.55call/s]
  SelfConsistencyStopp:  19%|█▉        | 19/100 [00:06<00:12,  6.39it/s, acc=21%, turns=1.0][AAPI calls:   6%|▌         | 308/5000 [00:06<00:52, 88.83call/s]API calls:   6%|▋         | 320/5000 [00:06<00:55, 84.22call/s]
  SelfConsistencyStopp:  20%|██        | 20/100 [00:06<00:14,  5.70it/s, acc=21%, turns=1.0][A
  SelfConsistencyStopp:  20%|██        | 20/100 [00:06<00:14,  5.70it/s, acc=25%, turns=1.0][A
  SelfConsistencyStopp:  21%|██        | 21/100 [00:06<00:13,  5.70it/s, acc=29%, turns=1.0][AAPI calls:   7%|▋         | 333/5000 [00:06<00:51, 90.76call/s]
  SelfConsistencyStopp:  22%|██▁       | 22/100 [00:06<00:13,  5.70it/s, acc=32%, turns=1.0][A
  SelfConsistencyStopp:  23%|██▎       | 23/100 [00:06<00:13,  5.70it/s, acc=30%, turns=1.0][AAPI calls:   7%|▋         | 344/5000 [00:06<00:50, 92.05call/s]API calls:   7%|▋         | 355/5000 [00:06<00:53, 87.00call/s]
  SelfConsistencyStopp:  24%|██▁       | 24/100 [00:06<00:11,  6.71it/s, acc=30%, turns=1.0][A
  SelfConsistencyStopp:  24%|██▁       | 24/100 [00:06<00:11,  6.71it/s, acc=33%, turns=1.0][AAPI calls:   7%|▋         | 365/5000 [00:06<01:00, 76.68call/s]API calls:   7%|▋         | 366/5000 [00:06<01:04, 71.98call/s]API calls:   8%|▊         | 376/5000 [00:07<01:10, 65.56call/s]API calls:   8%|▊         | 389/5000 [00:07<00:59, 77.14call/s]API calls:   8%|▊         | 398/5000 [00:07<01:10, 65.28call/s]API calls:   8%|▊         | 406/5000 [00:07<01:14, 61.37call/s]
  SelfConsistencyStopp:  25%|██▌       | 25/100 [00:07<00:19,  3.92it/s, acc=33%, turns=1.0][A
  SelfConsistencyStopp:  25%|██▌       | 25/100 [00:07<00:19,  3.92it/s, acc=32%, turns=1.0][AAPI calls:   8%|▊         | 413/5000 [00:07<01:48, 42.19call/s]API calls:   8%|▊         | 414/5000 [00:07<02:12, 34.72call/s]
  SelfConsistencyStopp:  26%|██▌       | 26/100 [00:07<00:18,  3.92it/s, acc=35%, turns=1.0][AAPI calls:   8%|▊         | 420/5000 [00:08<02:37, 29.02call/s]
  SelfConsistencyStopp:  27%|██▋       | 27/100 [00:08<00:16,  4.34it/s, acc=35%, turns=1.0][A
  SelfConsistencyStopp:  27%|██▋       | 27/100 [00:08<00:16,  4.34it/s, acc=33%, turns=1.0][AAPI calls:   8%|▊         | 424/5000 [00:08<02:58, 25.58call/s]
  SelfConsistencyStopp:  28%|██▊       | 28/100 [00:08<00:16,  4.31it/s, acc=33%, turns=1.0][A
  SelfConsistencyStopp:  28%|██▊       | 28/100 [00:08<00:16,  4.31it/s, acc=32%, turns=1.0][A
  SelfConsistencyStopp:  29%|██▉       | 29/100 [00:08<00:16,  4.31it/s, acc=34%, turns=1.0][A
  SelfConsistencyStopp:  30%|███       | 30/100 [00:08<00:12,  5.75it/s, acc=34%, turns=1.0][A
  SelfConsistencyStopp:  30%|███       | 30/100 [00:08<00:12,  5.75it/s, acc=37%, turns=1.0][AAPI calls:   9%|▊         | 428/5000 [00:08<03:02, 25.08call/s]API calls:   9%|▊         | 431/5000 [00:08<03:01, 25.21call/s]API calls:   9%|▊         | 435/5000 [00:08<02:44, 27.81call/s]
  SelfConsistencyStopp:  31%|███       | 31/100 [00:08<00:12,  5.75it/s, acc=35%, turns=1.0][AAPI calls:   9%|▉         | 443/5000 [00:08<02:07, 35.85call/s]API calls:   9%|▉         | 447/5000 [00:09<02:16, 33.45call/s]API calls:   9%|▉         | 456/5000 [00:09<01:44, 43.57call/s]
  SelfConsistencyStopp:  32%|███▁      | 32/100 [00:09<00:15,  4.36it/s, acc=35%, turns=1.0][A
  SelfConsistencyStopp:  32%|███▁      | 32/100 [00:09<00:15,  4.36it/s, acc=34%, turns=1.0][AAPI calls:   9%|▉         | 461/5000 [00:09<01:51, 40.59call/s]
  SelfConsistencyStopp:  33%|███▎      | 33/100 [00:09<00:14,  4.63it/s, acc=34%, turns=1.0][A
  SelfConsistencyStopp:  33%|███▎      | 33/100 [00:09<00:14,  4.63it/s, acc=33%, turns=1.0][A
  SelfConsistencyStopp:  34%|███▁      | 34/100 [00:09<00:14,  4.63it/s, acc=35%, turns=1.0][AAPI calls:   9%|▉         | 470/5000 [00:09<01:36, 46.76call/s]API calls:  10%|▉         | 475/5000 [00:09<02:11, 34.50call/s]API calls:  10%|▉         | 477/5000 [00:09<02:31, 29.77call/s]API calls:  10%|▉         | 484/5000 [00:10<02:31, 29.79call/s]API calls:  10%|▉         | 488/5000 [00:10<02:24, 31.18call/s]
  SelfConsistencyStopp:  35%|███▌      | 35/100 [00:10<00:17,  3.76it/s, acc=35%, turns=1.0][A
  SelfConsistencyStopp:  35%|███▌      | 35/100 [00:10<00:17,  3.76it/s, acc=37%, turns=1.0][AAPI calls:  10%|▉         | 497/5000 [00:10<01:47, 41.79call/s]API calls:  10%|█         | 502/5000 [00:10<02:06, 35.58call/s]API calls:  10%|█         | 507/5000 [00:10<02:08, 34.95call/s]API calls:  10%|█         | 511/5000 [00:10<02:24, 30.98call/s]API calls:  10%|█         | 515/5000 [00:11<03:07, 23.86call/s]API calls:  10%|█         | 518/5000 [00:11<03:15, 22.91call/s]API calls:  10%|█         | 521/5000 [00:11<03:21, 22.20call/s]
  SelfConsistencyStopp:  36%|███▌      | 36/100 [00:11<00:29,  2.19it/s, acc=37%, turns=1.0][A
  SelfConsistencyStopp:  36%|███▌      | 36/100 [00:11<00:29,  2.19it/s, acc=36%, turns=1.0][A
  SelfConsistencyStopp:  37%|███▋      | 37/100 [00:11<00:28,  2.19it/s, acc=35%, turns=1.0][AAPI calls:  10%|█         | 525/5000 [00:11<04:51, 15.35call/s]
  SelfConsistencyStopp:  38%|███▊      | 38/100 [00:11<00:22,  2.71it/s, acc=35%, turns=1.0][A
  SelfConsistencyStopp:  38%|███▊      | 38/100 [00:11<00:22,  2.71it/s, acc=37%, turns=1.0][A
  SelfConsistencyStopp:  39%|███▉      | 39/100 [00:11<00:22,  2.71it/s, acc=36%, turns=1.0][AAPI calls:  11%|█         | 533/5000 [00:11<03:07, 23.85call/s]
  SelfConsistencyStopp:  40%|████      | 40/100 [00:11<00:16,  3.73it/s, acc=36%, turns=1.0][A
  SelfConsistencyStopp:  40%|████      | 40/100 [00:11<00:16,  3.73it/s, acc=35%, turns=1.0][AAPI calls:  11%|█         | 537/5000 [00:12<03:00, 24.69call/s]
  SelfConsistencyStopp:  41%|████      | 41/100 [00:12<00:14,  4.18it/s, acc=35%, turns=1.0][A
  SelfConsistencyStopp:  41%|████      | 41/100 [00:12<00:14,  4.18it/s, acc=37%, turns=1.0][A
  SelfConsistencyStopp:  42%|████▁     | 42/100 [00:12<00:13,  4.18it/s, acc=36%, turns=1.0][AAPI calls:  11%|█         | 543/5000 [00:12<02:26, 30.47call/s]API calls:  11%|█         | 548/5000 [00:12<02:11, 33.92call/s]
  SelfConsistencyStopp:  43%|████▎     | 43/100 [00:12<00:10,  5.19it/s, acc=36%, turns=1.0][A
  SelfConsistencyStopp:  43%|████▎     | 43/100 [00:12<00:10,  5.19it/s, acc=37%, turns=1.0][A
  SelfConsistencyStopp:  44%|████▁     | 44/100 [00:12<00:10,  5.19it/s, acc=36%, turns=1.0][A
  SelfConsistencyStopp:  45%|████▌     | 45/100 [00:12<00:10,  5.19it/s, acc=36%, turns=1.0][AAPI calls:  11%|█         | 553/5000 [00:12<02:05, 35.39call/s]API calls:  11%|█▁        | 568/5000 [00:12<01:27, 50.86call/s]API calls:  12%|█▁        | 576/5000 [00:12<01:23, 53.04call/s]API calls:  12%|█▁        | 587/5000 [00:12<01:08, 64.76call/s]API calls:  12%|█▁        | 594/5000 [00:13<01:26, 50.81call/s]
  SelfConsistencyStopp:  46%|████▌     | 46/100 [00:13<00:12,  4.24it/s, acc=36%, turns=1.0][A
  SelfConsistencyStopp:  46%|████▌     | 46/100 [00:13<00:12,  4.24it/s, acc=35%, turns=1.0][AAPI calls:  12%|█▁        | 606/5000 [00:13<01:14, 59.03call/s]API calls:  12%|█▁        | 613/5000 [00:13<01:23, 52.43call/s]API calls:  12%|█▁        | 622/5000 [00:13<01:19, 54.96call/s]API calls:  13%|█▎        | 629/5000 [00:13<01:17, 56.58call/s]API calls:  13%|█▎        | 635/5000 [00:14<02:06, 34.37call/s]
  SelfConsistencyStopp:  47%|████▋     | 47/100 [00:14<00:18,  2.87it/s, acc=35%, turns=1.0][A
  SelfConsistencyStopp:  47%|████▋     | 47/100 [00:14<00:18,  2.87it/s, acc=34%, turns=1.0][A
  SelfConsistencyStopp:  48%|████▊     | 48/100 [00:14<00:18,  2.87it/s, acc=35%, turns=1.0][AAPI calls:  13%|█▎        | 640/5000 [00:14<02:30, 28.89call/s]API calls:  13%|█▎        | 644/5000 [00:14<03:02, 23.87call/s]API calls:  13%|█▎        | 653/5000 [00:14<02:38, 27.40call/s]
  SelfConsistencyStopp:  49%|████▉     | 49/100 [00:14<00:19,  2.64it/s, acc=35%, turns=1.0][A
  SelfConsistencyStopp:  49%|████▉     | 49/100 [00:14<00:19,  2.64it/s, acc=35%, turns=1.0][AAPI calls:  13%|█▎        | 663/5000 [00:15<02:08, 33.88call/s]API calls:  13%|█▎        | 667/5000 [00:15<02:16, 31.72call/s]
  SelfConsistencyStopp:  50%|█████     | 50/100 [00:15<00:18,  2.68it/s, acc=35%, turns=1.0][A
  SelfConsistencyStopp:  50%|█████     | 50/100 [00:15<00:18,  2.68it/s, acc=34%, turns=1.0][AAPI calls:  13%|█▎        | 671/5000 [00:15<02:18, 31.29call/s]API calls:  14%|█▎        | 676/5000 [00:15<02:08, 33.55call/s]
  SelfConsistencyStopp:  51%|█████     | 51/100 [00:15<00:16,  3.02it/s, acc=34%, turns=1.0][A
  SelfConsistencyStopp:  51%|█████     | 51/100 [00:15<00:16,  3.02it/s, acc=35%, turns=1.0][AAPI calls:  14%|█▎        | 680/5000 [00:15<02:07, 33.96call/s]
  SelfConsistencyStopp:  52%|█████▁    | 52/100 [00:15<00:14,  3.38it/s, acc=35%, turns=1.0][A
  SelfConsistencyStopp:  52%|█████▁    | 52/100 [00:15<00:14,  3.38it/s, acc=35%, turns=1.0][AAPI calls:  14%|█▎        | 684/5000 [00:15<02:04, 34.66call/s]
  SelfConsistencyStopp:  53%|█████▎    | 53/100 [00:15<00:13,  3.38it/s, acc=36%, turns=1.0][AAPI calls:  14%|█▁        | 688/5000 [00:15<02:22, 30.31call/s]API calls:  14%|█▁        | 692/5000 [00:16<02:24, 29.78call/s]API calls:  14%|█▁        | 696/5000 [00:16<02:20, 30.57call/s]API calls:  14%|█▁        | 707/5000 [00:16<01:34, 45.37call/s]
  SelfConsistencyStopp:  54%|█████▁    | 54/100 [00:16<00:14,  3.24it/s, acc=36%, turns=1.0][A
  SelfConsistencyStopp:  54%|█████▁    | 54/100 [00:16<00:14,  3.24it/s, acc=35%, turns=1.0][AAPI calls:  14%|█▁        | 717/5000 [00:16<01:44, 41.17call/s]API calls:  14%|█▁        | 718/5000 [00:16<01:45, 40.47call/s]
  SelfConsistencyStopp:  55%|█████▌    | 55/100 [00:16<00:13,  3.27it/s, acc=35%, turns=1.0][A
  SelfConsistencyStopp:  55%|█████▌    | 55/100 [00:16<00:13,  3.27it/s, acc=35%, turns=1.0][AAPI calls:  15%|█▁        | 737/5000 [00:16<01:06, 63.67call/s]API calls:  15%|█▁        | 746/5000 [00:17<01:40, 42.29call/s]API calls:  15%|█▌        | 753/5000 [00:17<01:53, 37.40call/s]API calls:  15%|█▌        | 764/5000 [00:17<01:38, 42.94call/s]API calls:  15%|█▌        | 772/5000 [00:17<01:29, 47.31call/s]
  SelfConsistencyStopp:  56%|█████▌    | 56/100 [00:17<00:21,  2.07it/s, acc=35%, turns=1.0][A
  SelfConsistencyStopp:  56%|█████▌    | 56/100 [00:17<00:21,  2.07it/s, acc=34%, turns=1.0][AAPI calls:  16%|█▌        | 778/5000 [00:17<01:51, 37.73call/s]
  SelfConsistencyStopp:  57%|█████▋    | 57/100 [00:18<00:19,  2.19it/s, acc=34%, turns=1.0][A
  SelfConsistencyStopp:  57%|█████▋    | 57/100 [00:18<00:19,  2.19it/s, acc=33%, turns=1.0][AAPI calls:  16%|█▌        | 783/5000 [00:18<01:57, 35.75call/s]
  SelfConsistencyStopp:  58%|█████▊    | 58/100 [00:18<00:19,  2.19it/s, acc=34%, turns=1.0][A
  SelfConsistencyStopp:  59%|█████▉    | 59/100 [00:18<00:18,  2.19it/s, acc=34%, turns=1.0][AAPI calls:  16%|█▌        | 788/5000 [00:18<02:01, 34.74call/s]API calls:  16%|█▌        | 795/5000 [00:18<01:43, 40.79call/s]
  SelfConsistencyStopp:  60%|██████    | 60/100 [00:18<00:12,  3.31it/s, acc=34%, turns=1.0][A
  SelfConsistencyStopp:  60%|██████    | 60/100 [00:18<00:12,  3.31it/s, acc=35%, turns=1.0][AAPI calls:  16%|█▌        | 800/5000 [00:18<01:58, 35.39call/s]API calls:  16%|█▌        | 805/5000 [00:18<02:06, 33.19call/s]
  SelfConsistencyStopp:  61%|██████    | 61/100 [00:18<00:11,  3.28it/s, acc=35%, turns=1.0][A
  SelfConsistencyStopp:  61%|██████    | 61/100 [00:18<00:11,  3.28it/s, acc=36%, turns=1.0][AAPI calls:  16%|█▋        | 824/5000 [00:18<01:12, 57.52call/s]API calls:  16%|█▋        | 825/5000 [00:18<00:54, 77.14call/s]
  SelfConsistencyStopp:  62%|██████▁   | 62/100 [00:18<00:11,  3.28it/s, acc=37%, turns=1.0][A
  SelfConsistencyStopp:  63%|██████▎   | 63/100 [00:18<00:11,  3.28it/s, acc=38%, turns=1.0][A
  SelfConsistencyStopp:  64%|██████▁   | 64/100 [00:18<00:06,  5.32it/s, acc=38%, turns=1.0][A
  SelfConsistencyStopp:  64%|██████▁   | 64/100 [00:18<00:06,  5.32it/s, acc=38%, turns=1.0][AAPI calls:  17%|█▋        | 834/5000 [00:19<01:00, 69.41call/s]API calls:  17%|█▋        | 842/5000 [00:19<01:22, 50.51call/s]
  SelfConsistencyStopp:  65%|██████▌   | 65/100 [00:19<00:08,  4.30it/s, acc=38%, turns=1.0][A
  SelfConsistencyStopp:  65%|██████▌   | 65/100 [00:19<00:08,  4.30it/s, acc=37%, turns=1.0][AAPI calls:  17%|█▋        | 852/5000 [00:19<01:20, 51.81call/s]API calls:  17%|█▋        | 865/5000 [00:19<01:16, 53.90call/s]API calls:  17%|█▋        | 871/5000 [00:19<01:21, 50.59call/s]API calls:  18%|█▊        | 877/5000 [00:20<01:21, 50.70call/s]
  SelfConsistencyStopp:  66%|██████▌   | 66/100 [00:20<00:10,  3.21it/s, acc=37%, turns=1.0][A
  SelfConsistencyStopp:  66%|██████▌   | 66/100 [00:20<00:10,  3.21it/s, acc=36%, turns=1.0][AAPI calls:  18%|█▊        | 883/5000 [00:20<01:46, 38.53call/s]
  SelfConsistencyStopp:  67%|██████▋   | 67/100 [00:20<00:11,  2.99it/s, acc=36%, turns=1.0][A
  SelfConsistencyStopp:  67%|██████▋   | 67/100 [00:20<00:11,  2.99it/s, acc=37%, turns=1.0][AAPI calls:  18%|█▊        | 888/5000 [00:20<01:58, 34.83call/s]API calls:  18%|█▊        | 893/5000 [00:20<01:55, 35.71call/s]
  SelfConsistencyStopp:  68%|██████▊   | 68/100 [00:20<00:09,  3.20it/s, acc=37%, turns=1.0][A
  SelfConsistencyStopp:  68%|██████▊   | 68/100 [00:20<00:09,  3.20it/s, acc=37%, turns=1.0][AAPI calls:  18%|█▊        | 897/5000 [00:20<02:08, 32.05call/s]
  SelfConsistencyStopp:  69%|██████▉   | 69/100 [00:20<00:08,  3.63it/s, acc=37%, turns=1.0][A
  SelfConsistencyStopp:  69%|██████▉   | 69/100 [00:20<00:08,  3.63it/s, acc=38%, turns=1.0][AAPI calls:  18%|█▊        | 904/5000 [00:20<01:45, 38.66call/s]API calls:  18%|█▊        | 909/5000 [00:21<01:53, 35.96call/s]API calls:  18%|█▊        | 914/5000 [00:21<01:49, 37.17call/s]API calls:  18%|█▊        | 918/5000 [00:21<02:02, 33.19call/s]API calls:  18%|█▊        | 922/5000 [00:21<02:28, 27.40call/s]API calls:  19%|█▊        | 926/5000 [00:21<02:18, 29.47call/s]
  SelfConsistencyStopp:  70%|███████   | 70/100 [00:21<00:12,  2.34it/s, acc=38%, turns=1.0][A
  SelfConsistencyStopp:  70%|███████   | 70/100 [00:21<00:12,  2.34it/s, acc=37%, turns=1.0][A
  SelfConsistencyStopp:  71%|███████   | 71/100 [00:21<00:12,  2.34it/s, acc=37%, turns=1.0][A
  SelfConsistencyStopp:  72%|███████▁  | 72/100 [00:21<00:11,  2.34it/s, acc=36%, turns=1.0][AAPI calls:  19%|█▊        | 933/5000 [00:21<01:50, 36.72call/s]
  SelfConsistencyStopp:  73%|███████▎  | 73/100 [00:22<00:07,  3.81it/s, acc=36%, turns=1.0][A
  SelfConsistencyStopp:  73%|███████▎  | 73/100 [00:22<00:07,  3.81it/s, acc=37%, turns=1.0][AAPI calls:  19%|█▊        | 937/5000 [00:22<03:17, 20.59call/s]
  SelfConsistencyStopp:  74%|███████▁  | 74/100 [00:22<00:06,  3.95it/s, acc=37%, turns=1.0][A
  SelfConsistencyStopp:  74%|███████▁  | 74/100 [00:22<00:06,  3.95it/s, acc=38%, turns=1.0][AAPI calls:  19%|█▉        | 941/5000 [00:22<04:27, 15.19call/s]API calls:  19%|█▉        | 942/5000 [00:22<05:01, 13.46call/s]API calls:  19%|█▉        | 945/5000 [00:22<04:35, 14.74call/s]API calls:  19%|█▉        | 948/5000 [00:23<05:04, 13.31call/s]API calls:  19%|█▉        | 951/5000 [00:23<04:47, 14.08call/s]
  SelfConsistencyStopp:  75%|███████▌  | 75/100 [00:23<00:10,  2.28it/s, acc=38%, turns=1.0][A
  SelfConsistencyStopp:  75%|███████▌  | 75/100 [00:23<00:10,  2.28it/s, acc=39%, turns=1.0][A
  SelfConsistencyStopp:  76%|███████▌  | 76/100 [00:23<00:10,  2.28it/s, acc=38%, turns=1.1][AAPI calls:  19%|█▉        | 956/5000 [00:23<03:36, 18.69call/s]API calls:  19%|█▉        | 959/5000 [00:23<04:37, 14.55call/s]API calls:  19%|█▉        | 961/5000 [00:23<04:29, 15.00call/s]
  SelfConsistencyStopp:  77%|███████▋  | 77/100 [00:23<00:08,  2.63it/s, acc=38%, turns=1.1][A
  SelfConsistencyStopp:  77%|███████▋  | 77/100 [00:23<00:08,  2.63it/s, acc=38%, turns=1.1][AAPI calls:  19%|█▉        | 963/5000 [00:24<04:52, 13.82call/s]API calls:  19%|█▉        | 966/5000 [00:24<04:15, 15.77call/s]
  SelfConsistencyStopp:  78%|███████▊  | 78/100 [00:24<00:08,  2.73it/s, acc=38%, turns=1.1][A
  SelfConsistencyStopp:  78%|███████▊  | 78/100 [00:24<00:08,  2.73it/s, acc=37%, turns=1.1][AAPI calls:  19%|█▉        | 970/5000 [00:24<03:28, 19.29call/s]
  SelfConsistencyStopp:  79%|███████▉  | 79/100 [00:24<00:06,  3.23it/s, acc=37%, turns=1.1][A
  SelfConsistencyStopp:  79%|███████▉  | 79/100 [00:24<00:06,  3.23it/s, acc=37%, turns=1.1][A
  SelfConsistencyStopp:  80%|████████  | 80/100 [00:24<00:06,  3.23it/s, acc=38%, turns=1.1][A
  SelfConsistencyStopp:  81%|████████  | 81/100 [00:24<00:05,  3.23it/s, acc=37%, turns=1.1][AAPI calls:  19%|█▉        | 973/5000 [00:24<03:35, 18.68call/s]
  SelfConsistencyStopp:  82%|████████▁ | 82/100 [00:24<00:03,  5.47it/s, acc=37%, turns=1.1][A
  SelfConsistencyStopp:  82%|████████▁ | 82/100 [00:24<00:03,  5.47it/s, acc=37%, turns=1.1][A
  SelfConsistencyStopp:  83%|████████▎ | 83/100 [00:24<00:03,  5.47it/s, acc=36%, turns=1.1][AAPI calls:  20%|█▉        | 976/5000 [00:24<03:24, 19.65call/s]API calls:  20%|█▉        | 979/5000 [00:24<03:16, 20.46call/s]
  SelfConsistencyStopp:  84%|████████▁ | 84/100 [00:24<00:02,  5.84it/s, acc=36%, turns=1.1][A
  SelfConsistencyStopp:  84%|████████▁ | 84/100 [00:24<00:02,  5.84it/s, acc=36%, turns=1.1][AAPI calls:  20%|█▉        | 982/5000 [00:24<03:11, 20.97call/s]
  SelfConsistencyStopp:  85%|████████▌ | 85/100 [00:24<00:02,  6.00it/s, acc=36%, turns=1.1][A
  SelfConsistencyStopp:  85%|████████▌ | 85/100 [00:24<00:02,  6.00it/s, acc=35%, turns=1.1][AAPI calls:  20%|█▉        | 985/5000 [00:25<03:57, 16.91call/s]API calls:  20%|█▉        | 988/5000 [00:25<04:07, 16.23call/s]API calls:  20%|█▉        | 993/5000 [00:25<03:28, 19.23call/s]API calls:  20%|█▉        | 998/5000 [00:25<02:41, 24.73call/s]API calls:  20%|██        | 1001/5000 [00:25<02:36, 25.53call/s]API calls:  20%|██        | 1007/5000 [00:25<02:01, 32.91call/s]API calls:  20%|██        | 1012/5000 [00:26<01:47, 36.95call/s]API calls:  20%|██        | 1017/5000 [00:26<01:44, 38.15call/s]API calls:  20%|██        | 1022/5000 [00:26<01:58, 33.64call/s]API calls:  21%|██        | 1026/5000 [00:26<01:57, 33.70call/s]API calls:  21%|██        | 1032/5000 [00:26<01:39, 39.98call/s]API calls:  21%|██        | 1037/5000 [00:26<01:33, 42.46call/s]API calls:  21%|██        | 1045/5000 [00:26<01:15, 52.43call/s]API calls:  21%|██        | 1051/5000 [00:27<01:59, 33.04call/s]API calls:  21%|██        | 1056/5000 [00:27<02:30, 26.26call/s]
  SelfConsistencyStopp:  86%|████████▌ | 86/100 [00:27<00:09,  1.48it/s, acc=35%, turns=1.1][A
  SelfConsistencyStopp:  86%|████████▌ | 86/100 [00:27<00:09,  1.48it/s, acc=35%, turns=1.1][AAPI calls:  21%|██        | 1060/5000 [00:27<02:46, 23.66call/s]
  SelfConsistencyStopp:  87%|████████▋ | 87/100 [00:27<00:08,  1.48it/s, acc=34%, turns=1.1][A
  SelfConsistencyStopp:  88%|████████▊ | 88/100 [00:27<00:05,  2.26it/s, acc=34%, turns=1.1][A
  SelfConsistencyStopp:  88%|████████▊ | 88/100 [00:27<00:05,  2.26it/s, acc=34%, turns=1.1][AAPI calls:  21%|██▁       | 1064/5000 [00:27<02:34, 25.43call/s]API calls:  21%|██▁       | 1068/5000 [00:27<02:56, 22.27call/s]
  SelfConsistencyStopp:  89%|████████▉ | 89/100 [00:27<00:04,  2.41it/s, acc=34%, turns=1.1][A
  SelfConsistencyStopp:  89%|████████▉ | 89/100 [00:27<00:04,  2.41it/s, acc=34%, turns=1.1][AAPI calls:  21%|██▁       | 1072/5000 [00:28<02:36, 25.06call/s]API calls:  22%|██▁       | 1079/5000 [00:28<02:02, 32.02call/s]
  SelfConsistencyStopp:  90%|█████████ | 90/100 [00:28<00:03,  2.62it/s, acc=34%, turns=1.1][A
  SelfConsistencyStopp:  90%|█████████ | 90/100 [00:28<00:03,  2.62it/s, acc=33%, turns=1.2][AAPI calls:  22%|██▁       | 1084/5000 [00:28<02:16, 28.67call/s]API calls:  22%|██▁       | 1093/5000 [00:28<01:42, 38.00call/s]
  SelfConsistencyStopp:  91%|█████████ | 91/100 [00:28<00:03,  2.46it/s, acc=33%, turns=1.2][A
  SelfConsistencyStopp:  91%|█████████ | 91/100 [00:28<00:03,  2.46it/s, acc=34%, turns=1.2][AAPI calls:  22%|██▁       | 1098/5000 [00:28<02:09, 30.14call/s]API calls:  22%|██▁       | 1102/5000 [00:29<02:52, 22.66call/s]API calls:  22%|██▁       | 1107/5000 [00:29<02:35, 24.99call/s]API calls:  22%|██▁       | 1111/5000 [00:29<02:54, 22.23call/s]API calls:  22%|██▁       | 1115/5000 [00:29<02:40, 24.17call/s]API calls:  22%|██▁       | 1120/5000 [00:29<02:24, 26.80call/s]API calls:  22%|██▁       | 1124/5000 [00:30<02:39, 24.35call/s]API calls:  23%|██▎       | 1128/5000 [00:30<02:24, 26.87call/s]
  SelfConsistencyStopp:  92%|█████████▁| 92/100 [00:30<00:05,  1.47it/s, acc=34%, turns=1.2][A
  SelfConsistencyStopp:  92%|█████████▁| 92/100 [00:30<00:05,  1.47it/s, acc=34%, turns=1.2][AAPI calls:  23%|██▎       | 1134/5000 [00:30<02:05, 30.79call/s]
  SelfConsistencyStopp:  93%|█████████▎| 93/100 [00:30<00:04,  1.47it/s, acc=33%, turns=1.2][A
  SelfConsistencyStopp:  94%|█████████▁| 94/100 [00:30<00:02,  2.41it/s, acc=33%, turns=1.2][A
  SelfConsistencyStopp:  94%|█████████▁| 94/100 [00:30<00:02,  2.41it/s, acc=33%, turns=1.2][AAPI calls:  23%|██▎       | 1140/5000 [00:30<02:15, 28.38call/s]API calls:  23%|██▎       | 1144/5000 [00:30<02:45, 23.31call/s]API calls:  23%|██▎       | 1147/5000 [00:31<03:52, 16.56call/s]API calls:  23%|██▎       | 1150/5000 [00:31<03:53, 16.47call/s]API calls:  23%|██▎       | 1151/5000 [00:31<03:37, 17.72call/s]API calls:  23%|██▎       | 1155/5000 [00:31<03:30, 18.29call/s]API calls:  23%|██▎       | 1157/5000 [00:31<03:34, 17.89call/s]API calls:  23%|██▎       | 1164/5000 [00:31<02:30, 25.43call/s]API calls:  23%|██▎       | 1168/5000 [00:31<02:22, 26.81call/s]API calls:  23%|██▎       | 1173/5000 [00:32<02:12, 28.96call/s]
  SelfConsistencyStopp:  95%|█████████▌| 95/100 [00:32<00:03,  1.34it/s, acc=33%, turns=1.2][A
  SelfConsistencyStopp:  95%|█████████▌| 95/100 [00:32<00:03,  1.34it/s, acc=33%, turns=1.2][AAPI calls:  24%|██▎       | 1181/5000 [00:32<01:36, 39.75call/s]
  SelfConsistencyStopp:  96%|█████████▌| 96/100 [00:32<00:02,  1.34it/s, acc=32%, turns=1.2][A
  SelfConsistencyStopp:  97%|█████████▋| 97/100 [00:32<00:02,  1.34it/s, acc=33%, turns=1.3][AAPI calls:  24%|██▎       | 1186/5000 [00:32<01:41, 37.46call/s]API calls:  24%|██▁       | 1191/5000 [00:33<04:03, 15.67call/s]API calls:  24%|██▁       | 1195/5000 [00:33<05:36, 11.31call/s]API calls:  24%|██▁       | 1200/5000 [00:33<04:36, 13.76call/s]API calls:  24%|██▁       | 1203/5000 [00:34<07:05,  8.92call/s]API calls:  24%|██▁       | 1211/5000 [00:34<04:48, 13.12call/s]API calls:  24%|██▁       | 1214/5000 [00:35<05:53, 10.71call/s]API calls:  24%|██▁       | 1216/5000 [00:35<05:39, 11.14call/s]API calls:  24%|██▁       | 1218/5000 [00:35<05:24, 11.67call/s]API calls:  24%|██▁       | 1222/5000 [00:36<04:55, 12.77call/s]API calls:  24%|██▁       | 1224/5000 [00:36<04:46, 13.16call/s]API calls:  25%|██▁       | 1227/5000 [00:36<04:07, 15.27call/s]API calls:  25%|██▁       | 1231/5000 [00:36<03:41, 17.01call/s]API calls:  25%|██▁       | 1234/5000 [00:36<05:25, 11.58call/s]API calls:  25%|██▁       | 1236/5000 [00:37<06:53,  9.10call/s]API calls:  25%|██▁       | 1239/5000 [00:37<05:25, 11.55call/s]API calls:  25%|██▁       | 1242/5000 [00:37<04:36, 13.61call/s]API calls:  25%|██▁       | 1245/5000 [00:38<06:12, 10.07call/s]API calls:  25%|██▁       | 1247/5000 [00:38<07:48,  8.01call/s]API calls:  25%|██▁       | 1249/5000 [00:38<07:49,  7.99call/s]API calls:  25%|██▌       | 1251/5000 [00:38<06:42,  9.32call/s]API calls:  25%|██▌       | 1257/5000 [00:39<04:24, 14.16call/s]
  SelfConsistencyStopp:  98%|█████████▊| 98/100 [00:39<00:03,  1.53s/it, acc=33%, turns=1.3][A
  SelfConsistencyStopp:  98%|█████████▊| 98/100 [00:39<00:03,  1.53s/it, acc=34%, turns=1.3][AAPI calls:  25%|██▌       | 1259/5000 [00:39<05:22, 11.60call/s]API calls:  25%|██▌       | 1263/5000 [00:39<04:24, 14.13call/s]API calls:  25%|██▌       | 1265/5000 [00:40<06:42,  9.27call/s]API calls:  25%|██▌       | 1267/5000 [00:40<09:36,  6.47call/s]API calls:  25%|██▌       | 1271/5000 [00:40<06:40,  9.30call/s]API calls:  25%|██▌       | 1273/5000 [00:41<06:47,  9.15call/s]API calls:  26%|██▌       | 1275/5000 [00:41<08:20,  7.45call/s]API calls:  26%|██▌       | 1277/5000 [00:42<12:03,  5.14call/s]API calls:  26%|██▌       | 1283/5000 [00:42<07:57,  7.79call/s]
  SelfConsistencyStopp:  99%|█████████▉| 99/100 [00:42<00:01,  1.92s/it, acc=34%, turns=1.3][A
  SelfConsistencyStopp:  99%|█████████▉| 99/100 [00:42<00:01,  1.92s/it, acc=34%, turns=1.4][AAPI calls:  26%|██▌       | 1285/5000 [00:43<09:25,  6.57call/s]API calls:  26%|██▌       | 1286/5000 [00:43<12:17,  5.03call/s]API calls:  26%|██▌       | 1287/5000 [00:44<17:01,  3.63call/s]API calls:  26%|██▌       | 1288/5000 [00:44<20:12,  3.06call/s]API calls:  26%|██▌       | 1293/5000 [00:45<09:45,  6.33call/s]API calls:  26%|██▌       | 1295/5000 [00:45<13:45,  4.49call/s]API calls:  26%|██▌       | 1297/5000 [00:46<18:24,  3.35call/s]API calls:  26%|██▌       | 1298/5000 [00:47<21:13,  2.91call/s]API calls:  26%|██▌       | 1299/5000 [00:48<25:17,  2.44call/s]API calls:  26%|██▌       | 1306/5000 [00:48<10:34,  5.83call/s]
  SelfConsistencyStopp: 100%|██████████| 100/100 [00:48<00:00,  2.78s/it, acc=34%, turns=1.4][A
  SelfConsistencyStopp: 100%|██████████| 100/100 [00:48<00:00,  2.78s/it, acc=34%, turns=1.5][A
                                                                                             [AAPI calls:  26%|██▌       | 1306/5000 [00:48<02:17, 26.89call/s]
  Results: Accuracy=34.00% [25.00%, 44.00%], Avg Turns=1.5 [1.2, 1.7]

==========================================================================================
COMPARISON RESULTS
==========================================================================================
Method                      Accuracy           95% CI  Avg Turns           95% CI
------------------------------------------------------------------------------------------
SelfConsistencyStopping       34.00%  [25.00%,44.00%]        1.5        [1.2,1.7]
==========================================================================================

Total API usage:
  Prompt tokens: 801,089
  Completion tokens: 4,079
  Total tokens: 805,168
