Warning: You are sending unauthenticated requests to the HF Hub. Please set a HF_TOKEN to enable higher rate limits and faster downloads.

============================================================
RRMC Experiment: dc_methods/cip_lite
============================================================
Initializing LLM: qwen/qwen-2.5-7b-instruct (max_workers=32)
Task: detective_cases
Data: /root/RRMC/AR-Bench/data/dc/test.json
Loading weights:   0%|          | 0/103 [00:00<?, ?it/s]Loading weights:   1%|          | 1/103 [00:00<00:00, 21959.71it/s, Materializing param=embeddings.LayerNorm.bias]Loading weights:   1%|          | 1/103 [00:00<00:00, 3000.22it/s, Materializing param=embeddings.LayerNorm.bias] Loading weights:   2%|▁         | 2/103 [00:00<00:00, 3916.25it/s, Materializing param=embeddings.LayerNorm.weight]Loading weights:   2%|▁         | 2/103 [00:00<00:00, 3476.42it/s, Materializing param=embeddings.LayerNorm.weight]Loading weights:   3%|▎         | 3/103 [00:00<00:00, 3759.46it/s, Materializing param=embeddings.position_embeddings.weight]Loading weights:   3%|▎         | 3/103 [00:00<00:00, 2206.75it/s, Materializing param=embeddings.position_embeddings.weight]Loading weights:   4%|▁         | 4/103 [00:00<00:00, 2678.78it/s, Materializing param=embeddings.token_type_embeddings.weight]Loading weights:   4%|▁         | 4/103 [00:00<00:00, 2347.12it/s, Materializing param=embeddings.token_type_embeddings.weight]Loading weights:   5%|▁         | 5/103 [00:00<00:00, 2614.25it/s, Materializing param=embeddings.word_embeddings.weight]      Loading weights:   5%|▁         | 5/103 [00:00<00:00, 2192.76it/s, Materializing param=embeddings.word_embeddings.weight]Loading weights:   6%|▌         | 6/103 [00:00<00:00, 2432.19it/s, Materializing param=encoder.layer.0.attention.output.LayerNorm.bias]Loading weights:   6%|▌         | 6/103 [00:00<00:00, 2276.42it/s, Materializing param=encoder.layer.0.attention.output.LayerNorm.bias]Loading weights:   7%|▋         | 7/103 [00:00<00:00, 2295.73it/s, Materializing param=encoder.layer.0.attention.output.LayerNorm.weight]Loading weights:   7%|▋         | 7/103 [00:00<00:00, 2172.57it/s, Materializing param=encoder.layer.0.attention.output.LayerNorm.weight]Loading weights:   8%|▊         | 8/103 [00:00<00:00, 2172.51it/s, Materializing param=encoder.layer.0.attention.output.dense.bias]      Loading weights:   8%|▊         | 8/103 [00:00<00:00, 2137.91it/s, Materializing param=encoder.layer.0.attention.output.dense.bias]Loading weights:   9%|▊         | 9/103 [00:00<00:00, 2343.48it/s, Materializing param=encoder.layer.0.attention.output.dense.weight]Loading weights:   9%|▊         | 9/103 [00:00<00:00, 2232.07it/s, Materializing param=encoder.layer.0.attention.output.dense.weight]Loading weights:  10%|▉         | 10/103 [00:00<00:00, 2355.03it/s, Materializing param=encoder.layer.0.attention.self.key.bias]     Loading weights:  10%|▉         | 10/103 [00:00<00:00, 2328.49it/s, Materializing param=encoder.layer.0.attention.self.key.bias]Loading weights:  11%|█         | 11/103 [00:00<00:00, 2432.12it/s, Materializing param=encoder.layer.0.attention.self.key.weight]Loading weights:  11%|█         | 11/103 [00:00<00:00, 2371.12it/s, Materializing param=encoder.layer.0.attention.self.key.weight]Loading weights:  12%|█▁        | 12/103 [00:00<00:00, 2349.42it/s, Materializing param=encoder.layer.0.attention.self.query.bias]Loading weights:  12%|█▁        | 12/103 [00:00<00:00, 2231.41it/s, Materializing param=encoder.layer.0.attention.self.query.bias]Loading weights:  13%|█▎        | 13/103 [00:00<00:00, 2253.88it/s, Materializing param=encoder.layer.0.attention.self.query.weight]Loading weights:  13%|█▎        | 13/103 [00:00<00:00, 2174.60it/s, Materializing param=encoder.layer.0.attention.self.query.weight]Loading weights:  14%|█▎        | 14/103 [00:00<00:00, 2234.15it/s, Materializing param=encoder.layer.0.attention.self.value.bias]  Loading weights:  14%|█▎        | 14/103 [00:00<00:00, 2166.40it/s, Materializing param=encoder.layer.0.attention.self.value.bias]Loading weights:  15%|█▁        | 15/103 [00:00<00:00, 2205.05it/s, Materializing param=encoder.layer.0.attention.self.value.weight]Loading weights:  15%|█▁        | 15/103 [00:00<00:00, 2121.91it/s, Materializing param=encoder.layer.0.attention.self.value.weight]Loading weights:  16%|█▌        | 16/103 [00:00<00:00, 2225.83it/s, Materializing param=encoder.layer.0.intermediate.dense.bias]    Loading weights:  16%|█▌        | 16/103 [00:00<00:00, 2059.63it/s, Materializing param=encoder.layer.0.intermediate.dense.bias]Loading weights:  17%|█▋        | 17/103 [00:00<00:00, 2092.84it/s, Materializing param=encoder.layer.0.intermediate.dense.weight]Loading weights:  17%|█▋        | 17/103 [00:00<00:00, 2029.35it/s, Materializing param=encoder.layer.0.intermediate.dense.weight]Loading weights:  17%|█▋        | 18/103 [00:00<00:00, 2080.68it/s, Materializing param=encoder.layer.0.output.LayerNorm.bias]    Loading weights:  17%|█▋        | 18/103 [00:00<00:00, 2065.76it/s, Materializing param=encoder.layer.0.output.LayerNorm.bias]Loading weights:  18%|█▊        | 19/103 [00:00<00:00, 2158.03it/s, Materializing param=encoder.layer.0.output.LayerNorm.weight]Loading weights:  18%|█▊        | 19/103 [00:00<00:00, 2130.40it/s, Materializing param=encoder.layer.0.output.LayerNorm.weight]Loading weights:  19%|█▉        | 20/103 [00:00<00:00, 2179.31it/s, Materializing param=encoder.layer.0.output.dense.bias]      Loading weights:  19%|█▉        | 20/103 [00:00<00:00, 2158.34it/s, Materializing param=encoder.layer.0.output.dense.bias]Loading weights:  20%|██        | 21/103 [00:00<00:00, 2173.38it/s, Materializing param=encoder.layer.0.output.dense.weight]Loading weights:  20%|██        | 21/103 [00:00<00:00, 2152.71it/s, Materializing param=encoder.layer.0.output.dense.weight]Loading weights:  21%|██▁       | 22/103 [00:00<00:00, 2224.67it/s, Materializing param=encoder.layer.1.attention.output.LayerNorm.bias]Loading weights:  21%|██▁       | 22/103 [00:00<00:00, 2211.81it/s, Materializing param=encoder.layer.1.attention.output.LayerNorm.bias]Loading weights:  22%|██▁       | 23/103 [00:00<00:00, 2291.70it/s, Materializing param=encoder.layer.1.attention.output.LayerNorm.weight]Loading weights:  22%|██▁       | 23/103 [00:00<00:00, 2277.47it/s, Materializing param=encoder.layer.1.attention.output.LayerNorm.weight]Loading weights:  23%|██▎       | 24/103 [00:00<00:00, 2354.42it/s, Materializing param=encoder.layer.1.attention.output.dense.bias]      Loading weights:  23%|██▎       | 24/103 [00:00<00:00, 2338.18it/s, Materializing param=encoder.layer.1.attention.output.dense.bias]Loading weights:  24%|██▁       | 25/103 [00:00<00:00, 2415.46it/s, Materializing param=encoder.layer.1.attention.output.dense.weight]Loading weights:  24%|██▁       | 25/103 [00:00<00:00, 2406.15it/s, Materializing param=encoder.layer.1.attention.output.dense.weight]Loading weights:  25%|██▌       | 26/103 [00:00<00:00, 2484.44it/s, Materializing param=encoder.layer.1.attention.self.key.bias]      Loading weights:  25%|██▌       | 26/103 [00:00<00:00, 2475.41it/s, Materializing param=encoder.layer.1.attention.self.key.bias]Loading weights:  26%|██▌       | 27/103 [00:00<00:00, 2552.49it/s, Materializing param=encoder.layer.1.attention.self.key.weight]Loading weights:  26%|██▌       | 27/103 [00:00<00:00, 2542.86it/s, Materializing param=encoder.layer.1.attention.self.key.weight]Loading weights:  27%|██▋       | 28/103 [00:00<00:00, 2617.23it/s, Materializing param=encoder.layer.1.attention.self.query.bias]Loading weights:  27%|██▋       | 28/103 [00:00<00:00, 2606.66it/s, Materializing param=encoder.layer.1.attention.self.query.bias]Loading weights:  28%|██▊       | 29/103 [00:00<00:00, 2681.13it/s, Materializing param=encoder.layer.1.attention.self.query.weight]Loading weights:  28%|██▊       | 29/103 [00:00<00:00, 2671.36it/s, Materializing param=encoder.layer.1.attention.self.query.weight]Loading weights:  29%|██▉       | 30/103 [00:00<00:00, 2743.29it/s, Materializing param=encoder.layer.1.attention.self.value.bias]  Loading weights:  29%|██▉       | 30/103 [00:00<00:00, 2733.22it/s, Materializing param=encoder.layer.1.attention.self.value.bias]Loading weights:  30%|███       | 31/103 [00:00<00:00, 2805.86it/s, Materializing param=encoder.layer.1.attention.self.value.weight]Loading weights:  30%|███       | 31/103 [00:00<00:00, 2795.72it/s, Materializing param=encoder.layer.1.attention.self.value.weight]Loading weights:  31%|███       | 32/103 [00:00<00:00, 2867.17it/s, Materializing param=encoder.layer.1.intermediate.dense.bias]    Loading weights:  31%|███       | 32/103 [00:00<00:00, 2856.85it/s, Materializing param=encoder.layer.1.intermediate.dense.bias]Loading weights:  32%|███▁      | 33/103 [00:00<00:00, 2927.00it/s, Materializing param=encoder.layer.1.intermediate.dense.weight]Loading weights:  32%|███▁      | 33/103 [00:00<00:00, 2916.89it/s, Materializing param=encoder.layer.1.intermediate.dense.weight]Loading weights:  33%|███▎      | 34/103 [00:00<00:00, 2986.83it/s, Materializing param=encoder.layer.1.output.LayerNorm.bias]    Loading weights:  33%|███▎      | 34/103 [00:00<00:00, 2976.67it/s, Materializing param=encoder.layer.1.output.LayerNorm.bias]Loading weights:  34%|███▁      | 35/103 [00:00<00:00, 3043.83it/s, Materializing param=encoder.layer.1.output.LayerNorm.weight]Loading weights:  34%|███▁      | 35/103 [00:00<00:00, 3031.13it/s, Materializing param=encoder.layer.1.output.LayerNorm.weight]Loading weights:  35%|███▁      | 36/103 [00:00<00:00, 3097.52it/s, Materializing param=encoder.layer.1.output.dense.bias]      Loading weights:  35%|███▁      | 36/103 [00:00<00:00, 3087.14it/s, Materializing param=encoder.layer.1.output.dense.bias]Loading weights:  36%|███▌      | 37/103 [00:00<00:00, 3150.67it/s, Materializing param=encoder.layer.1.output.dense.weight]Loading weights:  36%|███▌      | 37/103 [00:00<00:00, 3139.96it/s, Materializing param=encoder.layer.1.output.dense.weight]Loading weights:  37%|███▋      | 38/103 [00:00<00:00, 3206.01it/s, Materializing param=encoder.layer.2.attention.output.LayerNorm.bias]Loading weights:  37%|███▋      | 38/103 [00:00<00:00, 3195.60it/s, Materializing param=encoder.layer.2.attention.output.LayerNorm.bias]Loading weights:  38%|███▊      | 39/103 [00:00<00:00, 3257.23it/s, Materializing param=encoder.layer.2.attention.output.LayerNorm.weight]Loading weights:  38%|███▊      | 39/103 [00:00<00:00, 3245.98it/s, Materializing param=encoder.layer.2.attention.output.LayerNorm.weight]Loading weights:  39%|███▉      | 40/103 [00:00<00:00, 3308.92it/s, Materializing param=encoder.layer.2.attention.output.dense.bias]      Loading weights:  39%|███▉      | 40/103 [00:00<00:00, 3298.32it/s, Materializing param=encoder.layer.2.attention.output.dense.bias]Loading weights:  40%|███▉      | 41/103 [00:00<00:00, 3360.89it/s, Materializing param=encoder.layer.2.attention.output.dense.weight]Loading weights:  40%|███▉      | 41/103 [00:00<00:00, 3349.95it/s, Materializing param=encoder.layer.2.attention.output.dense.weight]Loading weights:  41%|████      | 42/103 [00:00<00:00, 3411.46it/s, Materializing param=encoder.layer.2.attention.self.key.bias]      Loading weights:  41%|████      | 42/103 [00:00<00:00, 3400.79it/s, Materializing param=encoder.layer.2.attention.self.key.bias]Loading weights:  42%|████▁     | 43/103 [00:00<00:00, 3461.84it/s, Materializing param=encoder.layer.2.attention.self.key.weight]Loading weights:  42%|████▁     | 43/103 [00:00<00:00, 3451.18it/s, Materializing param=encoder.layer.2.attention.self.key.weight]Loading weights:  43%|████▎     | 44/103 [00:00<00:00, 3511.15it/s, Materializing param=encoder.layer.2.attention.self.query.bias]Loading weights:  43%|████▎     | 44/103 [00:00<00:00, 3498.77it/s, Materializing param=encoder.layer.2.attention.self.query.bias]Loading weights:  44%|████▎     | 45/103 [00:00<00:00, 3557.58it/s, Materializing param=encoder.layer.2.attention.self.query.weight]Loading weights:  44%|████▎     | 45/103 [00:00<00:00, 3544.82it/s, Materializing param=encoder.layer.2.attention.self.query.weight]Loading weights:  45%|████▁     | 46/103 [00:00<00:00, 3600.73it/s, Materializing param=encoder.layer.2.attention.self.value.bias]  Loading weights:  45%|████▁     | 46/103 [00:00<00:00, 3589.14it/s, Materializing param=encoder.layer.2.attention.self.value.bias]Loading weights:  46%|████▌     | 47/103 [00:00<00:00, 3646.07it/s, Materializing param=encoder.layer.2.attention.self.value.weight]Loading weights:  46%|████▌     | 47/103 [00:00<00:00, 3634.58it/s, Materializing param=encoder.layer.2.attention.self.value.weight]Loading weights:  47%|████▋     | 48/103 [00:00<00:00, 3690.95it/s, Materializing param=encoder.layer.2.intermediate.dense.bias]    Loading weights:  47%|████▋     | 48/103 [00:00<00:00, 3678.14it/s, Materializing param=encoder.layer.2.intermediate.dense.bias]Loading weights:  48%|████▊     | 49/103 [00:00<00:00, 3734.10it/s, Materializing param=encoder.layer.2.intermediate.dense.weight]Loading weights:  48%|████▊     | 49/103 [00:00<00:00, 3723.14it/s, Materializing param=encoder.layer.2.intermediate.dense.weight]Loading weights:  49%|████▊     | 50/103 [00:00<00:00, 3778.79it/s, Materializing param=encoder.layer.2.output.LayerNorm.bias]    Loading weights:  49%|████▊     | 50/103 [00:00<00:00, 3767.72it/s, Materializing param=encoder.layer.2.output.LayerNorm.bias]Loading weights:  50%|████▉     | 51/103 [00:00<00:00, 3822.61it/s, Materializing param=encoder.layer.2.output.LayerNorm.weight]Loading weights:  50%|████▉     | 51/103 [00:00<00:00, 3811.58it/s, Materializing param=encoder.layer.2.output.LayerNorm.weight]Loading weights:  50%|█████     | 52/103 [00:00<00:00, 3866.27it/s, Materializing param=encoder.layer.2.output.dense.bias]      Loading weights:  50%|█████     | 52/103 [00:00<00:00, 3855.33it/s, Materializing param=encoder.layer.2.output.dense.bias]Loading weights:  51%|█████▁    | 53/103 [00:00<00:00, 3909.36it/s, Materializing param=encoder.layer.2.output.dense.weight]Loading weights:  51%|█████▁    | 53/103 [00:00<00:00, 3898.33it/s, Materializing param=encoder.layer.2.output.dense.weight]Loading weights:  52%|█████▁    | 54/103 [00:00<00:00, 3951.71it/s, Materializing param=encoder.layer.3.attention.output.LayerNorm.bias]Loading weights:  52%|█████▁    | 54/103 [00:00<00:00, 3936.33it/s, Materializing param=encoder.layer.3.attention.output.LayerNorm.bias]Loading weights:  53%|█████▎    | 55/103 [00:00<00:00, 3984.91it/s, Materializing param=encoder.layer.3.attention.output.LayerNorm.weight]Loading weights:  53%|█████▎    | 55/103 [00:00<00:00, 3973.11it/s, Materializing param=encoder.layer.3.attention.output.LayerNorm.weight]Loading weights:  54%|█████▁    | 56/103 [00:00<00:00, 4023.52it/s, Materializing param=encoder.layer.3.attention.output.dense.bias]      Loading weights:  54%|█████▁    | 56/103 [00:00<00:00, 4012.39it/s, Materializing param=encoder.layer.3.attention.output.dense.bias]Loading weights:  55%|█████▌    | 57/103 [00:00<00:00, 4062.66it/s, Materializing param=encoder.layer.3.attention.output.dense.weight]Loading weights:  55%|█████▌    | 57/103 [00:00<00:00, 4051.51it/s, Materializing param=encoder.layer.3.attention.output.dense.weight]Loading weights:  56%|█████▋    | 58/103 [00:00<00:00, 4101.46it/s, Materializing param=encoder.layer.3.attention.self.key.bias]      Loading weights:  56%|█████▋    | 58/103 [00:00<00:00, 4090.28it/s, Materializing param=encoder.layer.3.attention.self.key.bias]Loading weights:  57%|█████▋    | 59/103 [00:00<00:00, 4137.92it/s, Materializing param=encoder.layer.3.attention.self.key.weight]Loading weights:  57%|█████▋    | 59/103 [00:00<00:00, 4126.53it/s, Materializing param=encoder.layer.3.attention.self.key.weight]Loading weights:  58%|█████▊    | 60/103 [00:00<00:00, 4175.65it/s, Materializing param=encoder.layer.3.attention.self.query.bias]Loading weights:  58%|█████▊    | 60/103 [00:00<00:00, 4164.67it/s, Materializing param=encoder.layer.3.attention.self.query.bias]Loading weights:  59%|█████▉    | 61/103 [00:00<00:00, 4213.37it/s, Materializing param=encoder.layer.3.attention.self.query.weight]Loading weights:  59%|█████▉    | 61/103 [00:00<00:00, 4202.09it/s, Materializing param=encoder.layer.3.attention.self.query.weight]Loading weights:  60%|██████    | 62/103 [00:00<00:00, 4249.90it/s, Materializing param=encoder.layer.3.attention.self.value.bias]  Loading weights:  60%|██████    | 62/103 [00:00<00:00, 4238.95it/s, Materializing param=encoder.layer.3.attention.self.value.bias]Loading weights:  61%|██████    | 63/103 [00:00<00:00, 4284.41it/s, Materializing param=encoder.layer.3.attention.self.value.weight]Loading weights:  61%|██████    | 63/103 [00:00<00:00, 4272.29it/s, Materializing param=encoder.layer.3.attention.self.value.weight]Loading weights:  62%|██████▁   | 64/103 [00:00<00:00, 4318.25it/s, Materializing param=encoder.layer.3.intermediate.dense.bias]    Loading weights:  62%|██████▁   | 64/103 [00:00<00:00, 4306.68it/s, Materializing param=encoder.layer.3.intermediate.dense.bias]Loading weights:  63%|██████▎   | 65/103 [00:00<00:00, 4353.30it/s, Materializing param=encoder.layer.3.intermediate.dense.weight]Loading weights:  63%|██████▎   | 65/103 [00:00<00:00, 4342.55it/s, Materializing param=encoder.layer.3.intermediate.dense.weight]Loading weights:  64%|██████▁   | 66/103 [00:00<00:00, 4388.81it/s, Materializing param=encoder.layer.3.output.LayerNorm.bias]    Loading weights:  64%|██████▁   | 66/103 [00:00<00:00, 4377.98it/s, Materializing param=encoder.layer.3.output.LayerNorm.bias]Loading weights:  65%|██████▌   | 67/103 [00:00<00:00, 4423.74it/s, Materializing param=encoder.layer.3.output.LayerNorm.weight]Loading weights:  65%|██████▌   | 67/103 [00:00<00:00, 4412.01it/s, Materializing param=encoder.layer.3.output.LayerNorm.weight]Loading weights:  66%|██████▌   | 68/103 [00:00<00:00, 4457.56it/s, Materializing param=encoder.layer.3.output.dense.bias]      Loading weights:  66%|██████▌   | 68/103 [00:00<00:00, 4446.72it/s, Materializing param=encoder.layer.3.output.dense.bias]Loading weights:  67%|██████▋   | 69/103 [00:00<00:00, 4490.41it/s, Materializing param=encoder.layer.3.output.dense.weight]Loading weights:  67%|██████▋   | 69/103 [00:00<00:00, 4479.29it/s, Materializing param=encoder.layer.3.output.dense.weight]Loading weights:  68%|██████▊   | 70/103 [00:00<00:00, 4523.83it/s, Materializing param=encoder.layer.4.attention.output.LayerNorm.bias]Loading weights:  68%|██████▊   | 70/103 [00:00<00:00, 4513.05it/s, Materializing param=encoder.layer.4.attention.output.LayerNorm.bias]Loading weights:  69%|██████▉   | 71/103 [00:00<00:00, 4556.45it/s, Materializing param=encoder.layer.4.attention.output.LayerNorm.weight]Loading weights:  69%|██████▉   | 71/103 [00:00<00:00, 4545.11it/s, Materializing param=encoder.layer.4.attention.output.LayerNorm.weight]Loading weights:  70%|██████▉   | 72/103 [00:00<00:00, 4585.82it/s, Materializing param=encoder.layer.4.attention.output.dense.bias]      Loading weights:  70%|██████▉   | 72/103 [00:00<00:00, 4573.18it/s, Materializing param=encoder.layer.4.attention.output.dense.bias]Loading weights:  71%|███████   | 73/103 [00:00<00:00, 4612.74it/s, Materializing param=encoder.layer.4.attention.output.dense.weight]Loading weights:  71%|███████   | 73/103 [00:00<00:00, 4601.09it/s, Materializing param=encoder.layer.4.attention.output.dense.weight]Loading weights:  72%|███████▁  | 74/103 [00:00<00:00, 4642.91it/s, Materializing param=encoder.layer.4.attention.self.key.bias]      Loading weights:  72%|███████▁  | 74/103 [00:00<00:00, 4631.69it/s, Materializing param=encoder.layer.4.attention.self.key.bias]Loading weights:  73%|███████▎  | 75/103 [00:00<00:00, 4674.05it/s, Materializing param=encoder.layer.4.attention.self.key.weight]Loading weights:  73%|███████▎  | 75/103 [00:00<00:00, 4662.96it/s, Materializing param=encoder.layer.4.attention.self.key.weight]Loading weights:  74%|███████▁  | 76/103 [00:00<00:00, 4704.63it/s, Materializing param=encoder.layer.4.attention.self.query.bias]Loading weights:  74%|███████▁  | 76/103 [00:00<00:00, 4693.62it/s, Materializing param=encoder.layer.4.attention.self.query.bias]Loading weights:  75%|███████▁  | 77/103 [00:00<00:00, 4735.02it/s, Materializing param=encoder.layer.4.attention.self.query.weight]Loading weights:  75%|███████▁  | 77/103 [00:00<00:00, 4723.94it/s, Materializing param=encoder.layer.4.attention.self.query.weight]Loading weights:  76%|███████▌  | 78/103 [00:00<00:00, 4764.52it/s, Materializing param=encoder.layer.4.attention.self.value.bias]  Loading weights:  76%|███████▌  | 78/103 [00:00<00:00, 4753.37it/s, Materializing param=encoder.layer.4.attention.self.value.bias]Loading weights:  77%|███████▋  | 79/103 [00:00<00:00, 4793.35it/s, Materializing param=encoder.layer.4.attention.self.value.weight]Loading weights:  77%|███████▋  | 79/103 [00:00<00:00, 4782.21it/s, Materializing param=encoder.layer.4.attention.self.value.weight]Loading weights:  78%|███████▊  | 80/103 [00:00<00:00, 4822.08it/s, Materializing param=encoder.layer.4.intermediate.dense.bias]    Loading weights:  78%|███████▊  | 80/103 [00:00<00:00, 4810.95it/s, Materializing param=encoder.layer.4.intermediate.dense.bias]Loading weights:  79%|███████▊  | 81/103 [00:00<00:00, 4848.08it/s, Materializing param=encoder.layer.4.intermediate.dense.weight]Loading weights:  79%|███████▊  | 81/103 [00:00<00:00, 4835.52it/s, Materializing param=encoder.layer.4.intermediate.dense.weight]Loading weights:  80%|███████▉  | 82/103 [00:00<00:00, 4874.19it/s, Materializing param=encoder.layer.4.output.LayerNorm.bias]    Loading weights:  80%|███████▉  | 82/103 [00:00<00:00, 4863.03it/s, Materializing param=encoder.layer.4.output.LayerNorm.bias]Loading weights:  81%|████████  | 83/103 [00:00<00:00, 4902.16it/s, Materializing param=encoder.layer.4.output.LayerNorm.weight]Loading weights:  81%|████████  | 83/103 [00:00<00:00, 4891.14it/s, Materializing param=encoder.layer.4.output.LayerNorm.weight]Loading weights:  82%|████████▁ | 84/103 [00:00<00:00, 4928.95it/s, Materializing param=encoder.layer.4.output.dense.bias]      Loading weights:  82%|████████▁ | 84/103 [00:00<00:00, 4917.67it/s, Materializing param=encoder.layer.4.output.dense.bias]Loading weights:  83%|████████▎ | 85/103 [00:00<00:00, 4955.67it/s, Materializing param=encoder.layer.4.output.dense.weight]Loading weights:  83%|████████▎ | 85/103 [00:00<00:00, 4944.54it/s, Materializing param=encoder.layer.4.output.dense.weight]Loading weights:  83%|████████▎ | 86/103 [00:00<00:00, 4982.87it/s, Materializing param=encoder.layer.5.attention.output.LayerNorm.bias]Loading weights:  83%|████████▎ | 86/103 [00:00<00:00, 4971.75it/s, Materializing param=encoder.layer.5.attention.output.LayerNorm.bias]Loading weights:  84%|████████▁ | 87/103 [00:00<00:00, 5006.99it/s, Materializing param=encoder.layer.5.attention.output.LayerNorm.weight]Loading weights:  84%|████████▁ | 87/103 [00:00<00:00, 4995.61it/s, Materializing param=encoder.layer.5.attention.output.LayerNorm.weight]Loading weights:  85%|████████▌ | 88/103 [00:00<00:00, 5032.43it/s, Materializing param=encoder.layer.5.attention.output.dense.bias]      Loading weights:  85%|████████▌ | 88/103 [00:00<00:00, 5021.21it/s, Materializing param=encoder.layer.5.attention.output.dense.bias]Loading weights:  86%|████████▋ | 89/103 [00:00<00:00, 5057.35it/s, Materializing param=encoder.layer.5.attention.output.dense.weight]Loading weights:  86%|████████▋ | 89/103 [00:00<00:00, 5045.18it/s, Materializing param=encoder.layer.5.attention.output.dense.weight]Loading weights:  87%|████████▋ | 90/103 [00:00<00:00, 5076.62it/s, Materializing param=encoder.layer.5.attention.self.key.bias]      Loading weights:  87%|████████▋ | 90/103 [00:00<00:00, 5064.29it/s, Materializing param=encoder.layer.5.attention.self.key.bias]Loading weights:  88%|████████▊ | 91/103 [00:00<00:00, 5099.63it/s, Materializing param=encoder.layer.5.attention.self.key.weight]Loading weights:  88%|████████▊ | 91/103 [00:00<00:00, 5088.68it/s, Materializing param=encoder.layer.5.attention.self.key.weight]Loading weights:  89%|████████▉ | 92/103 [00:00<00:00, 5124.65it/s, Materializing param=encoder.layer.5.attention.self.query.bias]Loading weights:  89%|████████▉ | 92/103 [00:00<00:00, 5113.85it/s, Materializing param=encoder.layer.5.attention.self.query.bias]Loading weights:  90%|█████████ | 93/103 [00:00<00:00, 5149.44it/s, Materializing param=encoder.layer.5.attention.self.query.weight]Loading weights:  90%|█████████ | 93/103 [00:00<00:00, 5138.45it/s, Materializing param=encoder.layer.5.attention.self.query.weight]Loading weights:  91%|█████████▁| 94/103 [00:00<00:00, 5173.13it/s, Materializing param=encoder.layer.5.attention.self.value.bias]  Loading weights:  91%|█████████▁| 94/103 [00:00<00:00, 5162.02it/s, Materializing param=encoder.layer.5.attention.self.value.bias]Loading weights:  92%|█████████▁| 95/103 [00:00<00:00, 5196.93it/s, Materializing param=encoder.layer.5.attention.self.value.weight]Loading weights:  92%|█████████▁| 95/103 [00:00<00:00, 5186.11it/s, Materializing param=encoder.layer.5.attention.self.value.weight]Loading weights:  93%|█████████▎| 96/103 [00:00<00:00, 5220.72it/s, Materializing param=encoder.layer.5.intermediate.dense.bias]    Loading weights:  93%|█████████▎| 96/103 [00:00<00:00, 5210.11it/s, Materializing param=encoder.layer.5.intermediate.dense.bias]Loading weights:  94%|█████████▁| 97/103 [00:00<00:00, 5245.11it/s, Materializing param=encoder.layer.5.intermediate.dense.weight]Loading weights:  94%|█████████▁| 97/103 [00:00<00:00, 5234.25it/s, Materializing param=encoder.layer.5.intermediate.dense.weight]Loading weights:  95%|█████████▌| 98/103 [00:00<00:00, 5268.62it/s, Materializing param=encoder.layer.5.output.LayerNorm.bias]    Loading weights:  95%|█████████▌| 98/103 [00:00<00:00, 5257.77it/s, Materializing param=encoder.layer.5.output.LayerNorm.bias]Loading weights:  96%|█████████▌| 99/103 [00:00<00:00, 5288.08it/s, Materializing param=encoder.layer.5.output.LayerNorm.weight]Loading weights:  96%|█████████▌| 99/103 [00:00<00:00, 5275.79it/s, Materializing param=encoder.layer.5.output.LayerNorm.weight]Loading weights:  97%|█████████▋| 100/103 [00:00<00:00, 5308.57it/s, Materializing param=encoder.layer.5.output.dense.bias]     Loading weights:  97%|█████████▋| 100/103 [00:00<00:00, 5296.24it/s, Materializing param=encoder.layer.5.output.dense.bias]Loading weights:  98%|█████████▊| 101/103 [00:00<00:00, 5329.01it/s, Materializing param=encoder.layer.5.output.dense.weight]Loading weights:  98%|█████████▊| 101/103 [00:00<00:00, 5318.11it/s, Materializing param=encoder.layer.5.output.dense.weight]Loading weights:  99%|█████████▉| 102/103 [00:00<00:00, 5351.35it/s, Materializing param=pooler.dense.bias]                  Loading weights:  99%|█████████▉| 102/103 [00:00<00:00, 5340.66it/s, Materializing param=pooler.dense.bias]Loading weights: 100%|██████████| 103/103 [00:00<00:00, 5375.10it/s, Materializing param=pooler.dense.weight]Loading weights: 100%|██████████| 103/103 [00:00<00:00, 5364.76it/s, Materializing param=pooler.dense.weight]Loading weights: 100%|██████████| 103/103 [00:00<00:00, 5343.13it/s, Materializing param=pooler.dense.weight]
[1mBertModel LOAD REPORT[0m from: sentence-transformers/all-MiniLM-L6-v2
Key                     | Status     |  | 
------------------------+------------+--+-
embeddings.position_ids | UNEXPECTED |  | 

[3mNotes:
- UNEXPECTED[3m	:can be ignored when loading from different task/architecture; not ok if you expect identical arch.[0m
API calls:   0%|          | 0/5000 [00:00<?, ?call/s]Evaluating 100 puzzles
Methods: ['cip_lite']

============================================================
STARTING EVALUATION
============================================================

Evaluating CIPLiteStopping on 100 puzzles...

  CIPLiteStopping:   0%|          | 0/100 [00:00<?, ?it/s][AAPI calls:   0%|          | 1/5000 [00:02<2:53:28,  2.08s/call]API calls:   0%|          | 3/5000 [00:02<1:05:11,  1.28call/s]API calls:   0%|          | 4/5000 [00:02<49:56,  1.67call/s]  API calls:   0%|          | 7/5000 [00:03<23:20,  3.57call/s]API calls:   0%|          | 11/5000 [00:03<12:20,  6.74call/s]API calls:   0%|          | 18/5000 [00:03<05:59, 13.87call/s]API calls:   0%|          | 23/5000 [00:03<04:24, 18.83call/s]API calls:   1%|          | 27/5000 [00:03<03:59, 20.74call/s]API calls:   1%|          | 37/5000 [00:03<02:30, 33.05call/s]API calls:   1%|          | 49/5000 [00:03<01:45, 47.04call/s]API calls:   1%|          | 56/5000 [00:04<01:48, 45.74call/s]API calls:   1%|          | 62/5000 [00:04<01:48, 45.49call/s]API calls:   2%|▁         | 85/5000 [00:04<00:58, 83.31call/s]API calls:   2%|▁         | 95/5000 [00:04<01:17, 63.34call/s]API calls:   2%|▁         | 109/5000 [00:04<01:02, 78.08call/s]API calls:   2%|▁         | 116/5000 [00:04<00:52, 93.18call/s]API calls:   3%|▎         | 141/5000 [00:04<00:46, 104.34call/s]API calls:   3%|▎         | 165/5000 [00:04<00:35, 136.87call/s]API calls:   3%|▎         | 167/5000 [00:04<00:29, 164.18call/s]
  CIPLiteStopping:   1%|          | 1/100 [00:04<08:09,  4.95s/it][A
  CIPLiteStopping:   1%|          | 1/100 [00:04<08:09,  4.95s/it, acc=0%, turns=1.0][A
  CIPLiteStopping:   2%|▁         | 2/100 [00:04<08:04,  4.95s/it, acc=50%, turns=1.0][A
  CIPLiteStopping:   3%|▎         | 3/100 [00:05<02:09,  1.34s/it, acc=50%, turns=1.0][A
  CIPLiteStopping:   3%|▎         | 3/100 [00:05<02:09,  1.34s/it, acc=33%, turns=1.0][AAPI calls:   4%|▁         | 189/5000 [00:05<00:37, 127.83call/s]
  CIPLiteStopping:   4%|▁         | 4/100 [00:05<01:29,  1.08it/s, acc=33%, turns=1.0][A
  CIPLiteStopping:   4%|▁         | 4/100 [00:05<01:29,  1.08it/s, acc=25%, turns=1.0][A
  CIPLiteStopping:   5%|▌         | 5/100 [00:05<01:28,  1.08it/s, acc=40%, turns=1.0][AAPI calls:   4%|▁         | 205/5000 [00:05<00:58, 81.69call/s] API calls:   4%|▁         | 217/5000 [00:05<00:54, 87.38call/s]API calls:   5%|▁         | 229/5000 [00:05<00:59, 79.97call/s]
  CIPLiteStopping:   6%|▌         | 6/100 [00:06<01:01,  1.52it/s, acc=40%, turns=1.0][A
  CIPLiteStopping:   6%|▌         | 6/100 [00:06<01:01,  1.52it/s, acc=50%, turns=1.0][AAPI calls:   5%|▁         | 240/5000 [00:06<01:08, 69.28call/s]
  CIPLiteStopping:   7%|▋         | 7/100 [00:06<01:01,  1.52it/s, acc=57%, turns=1.0][A
  CIPLiteStopping:   8%|▊         | 8/100 [00:06<00:37,  2.42it/s, acc=57%, turns=1.0][A
  CIPLiteStopping:   8%|▊         | 8/100 [00:06<00:37,  2.42it/s, acc=62%, turns=1.0][AAPI calls:   5%|▁         | 249/5000 [00:06<01:36, 49.17call/s]API calls:   5%|▌         | 256/5000 [00:06<01:32, 51.06call/s]
  CIPLiteStopping:   9%|▉         | 9/100 [00:06<00:40,  2.25it/s, acc=62%, turns=1.0][A
  CIPLiteStopping:   9%|▉         | 9/100 [00:06<00:40,  2.25it/s, acc=67%, turns=1.0][AAPI calls:   5%|▌         | 263/5000 [00:06<01:41, 46.83call/s]
  CIPLiteStopping:  10%|█         | 10/100 [00:06<00:34,  2.61it/s, acc=67%, turns=1.0][A
  CIPLiteStopping:  10%|█         | 10/100 [00:06<00:34,  2.61it/s, acc=70%, turns=1.0][AAPI calls:   5%|▌         | 269/5000 [00:06<01:55, 41.11call/s]
  CIPLiteStopping:  11%|█         | 11/100 [00:06<00:34,  2.61it/s, acc=64%, turns=1.0][AAPI calls:   5%|▌         | 274/5000 [00:07<01:59, 39.60call/s]API calls:   6%|▌         | 281/5000 [00:07<01:47, 44.01call/s]
  CIPLiteStopping:  12%|█▁        | 12/100 [00:07<00:28,  3.11it/s, acc=64%, turns=1.0][A
  CIPLiteStopping:  12%|█▁        | 12/100 [00:07<00:28,  3.11it/s, acc=67%, turns=1.0][AAPI calls:   6%|▌         | 286/5000 [00:07<01:54, 41.32call/s]API calls:   6%|▌         | 292/5000 [00:07<01:53, 41.47call/s]
  CIPLiteStopping:  13%|█▎        | 13/100 [00:07<00:25,  3.43it/s, acc=67%, turns=1.0][A
  CIPLiteStopping:  13%|█▎        | 13/100 [00:07<00:25,  3.43it/s, acc=69%, turns=1.0][A
  CIPLiteStopping:  14%|█▁        | 14/100 [00:07<00:25,  3.43it/s, acc=71%, turns=1.0][AAPI calls:   6%|▌         | 297/5000 [00:07<02:11, 35.86call/s]API calls:   6%|▌         | 302/5000 [00:07<02:10, 36.11call/s]API calls:   6%|▌         | 306/5000 [00:08<02:36, 29.94call/s]
  CIPLiteStopping:  15%|█▌        | 15/100 [00:08<00:23,  3.63it/s, acc=71%, turns=1.0][A
  CIPLiteStopping:  15%|█▌        | 15/100 [00:08<00:23,  3.63it/s, acc=67%, turns=1.0][AAPI calls:   6%|▋         | 314/5000 [00:08<02:10, 35.99call/s]API calls:   6%|▋         | 319/5000 [00:08<02:10, 35.91call/s]API calls:   6%|▋         | 323/5000 [00:08<02:14, 34.73call/s]
  CIPLiteStopping:  16%|█▌        | 16/100 [00:08<00:25,  3.25it/s, acc=67%, turns=1.0][A
  CIPLiteStopping:  16%|█▌        | 16/100 [00:08<00:25,  3.25it/s, acc=62%, turns=1.0][A
  CIPLiteStopping:  17%|█▋        | 17/100 [00:08<00:25,  3.25it/s, acc=59%, turns=1.0][A
  CIPLiteStopping:  18%|█▊        | 18/100 [00:08<00:17,  4.75it/s, acc=59%, turns=1.0][A
  CIPLiteStopping:  18%|█▊        | 18/100 [00:08<00:17,  4.75it/s, acc=56%, turns=1.0][AAPI calls:   7%|▋         | 331/5000 [00:08<02:01, 38.49call/s]
  CIPLiteStopping:  19%|█▉        | 19/100 [00:08<00:17,  4.75it/s, acc=53%, turns=1.0][A
  CIPLiteStopping:  20%|██        | 20/100 [00:08<00:12,  6.20it/s, acc=53%, turns=1.0][A
  CIPLiteStopping:  20%|██        | 20/100 [00:08<00:12,  6.20it/s, acc=50%, turns=1.0][A
  CIPLiteStopping:  21%|██        | 21/100 [00:08<00:12,  6.20it/s, acc=52%, turns=1.0][AAPI calls:   7%|▋         | 340/5000 [00:08<01:42, 45.55call/s]
  CIPLiteStopping:  22%|██▁       | 22/100 [00:08<00:12,  6.20it/s, acc=50%, turns=1.0][A
  CIPLiteStopping:  23%|██▎       | 23/100 [00:08<00:12,  6.20it/s, acc=48%, turns=1.0][AAPI calls:   7%|▋         | 348/5000 [00:08<01:31, 50.57call/s]
  CIPLiteStopping:  24%|██▁       | 24/100 [00:08<00:07,  9.52it/s, acc=48%, turns=1.0][A
  CIPLiteStopping:  24%|██▁       | 24/100 [00:08<00:07,  9.52it/s, acc=46%, turns=1.0][A
  CIPLiteStopping:  25%|██▌       | 25/100 [00:08<00:07,  9.52it/s, acc=44%, turns=1.0][A
  CIPLiteStopping:  26%|██▌       | 26/100 [00:09<00:07,  9.52it/s, acc=42%, turns=1.0][AAPI calls:   7%|▋         | 355/5000 [00:09<01:28, 52.45call/s]
  CIPLiteStopping:  27%|██▋       | 27/100 [00:09<00:06, 11.46it/s, acc=42%, turns=1.0][A
  CIPLiteStopping:  27%|██▋       | 27/100 [00:09<00:06, 11.46it/s, acc=41%, turns=1.0][AAPI calls:   7%|▋         | 361/5000 [00:09<02:04, 37.25call/s]
  CIPLiteStopping:  28%|██▊       | 28/100 [00:09<00:06, 11.46it/s, acc=43%, turns=1.0][AAPI calls:   8%|▊         | 379/5000 [00:09<01:15, 60.94call/s]API calls:   8%|▊         | 387/5000 [00:09<01:28, 52.07call/s]API calls:   8%|▊         | 394/5000 [00:09<01:42, 44.99call/s]
  CIPLiteStopping:  29%|██▉       | 29/100 [00:09<00:12,  5.82it/s, acc=43%, turns=1.0][A
  CIPLiteStopping:  29%|██▉       | 29/100 [00:09<00:12,  5.82it/s, acc=45%, turns=1.0][AAPI calls:   8%|▊         | 400/5000 [00:10<01:54, 40.32call/s]API calls:   8%|▊         | 405/5000 [00:10<01:50, 41.71call/s]
  CIPLiteStopping:  30%|███       | 30/100 [00:10<00:12,  5.82it/s, acc=43%, turns=1.0][AAPI calls:   8%|▊         | 410/5000 [00:10<02:03, 37.23call/s]API calls:   8%|▊         | 416/5000 [00:10<01:55, 39.77call/s]
  CIPLiteStopping:  31%|███       | 31/100 [00:10<00:14,  4.90it/s, acc=43%, turns=1.0][A
  CIPLiteStopping:  31%|███       | 31/100 [00:10<00:14,  4.90it/s, acc=42%, turns=1.0][AAPI calls:   8%|▊         | 424/5000 [00:10<01:45, 43.25call/s]API calls:   9%|▊         | 429/5000 [00:10<01:48, 42.30call/s]API calls:   9%|▊         | 434/5000 [00:11<02:11, 34.77call/s]API calls:   9%|▉         | 443/5000 [00:11<01:44, 43.41call/s]API calls:   9%|▉         | 448/5000 [00:11<01:43, 44.13call/s]API calls:   9%|▉         | 454/5000 [00:11<01:37, 46.64call/s]API calls:   9%|▉         | 463/5000 [00:11<01:20, 56.63call/s]API calls:   9%|▉         | 470/5000 [00:11<01:23, 53.95call/s]
  CIPLiteStopping:  32%|███▁      | 32/100 [00:11<00:24,  2.78it/s, acc=42%, turns=1.0][A
  CIPLiteStopping:  32%|███▁      | 32/100 [00:11<00:24,  2.78it/s, acc=44%, turns=1.0][AAPI calls:  10%|▉         | 476/5000 [00:11<02:06, 35.84call/s]
  CIPLiteStopping:  33%|███▎      | 33/100 [00:11<00:22,  2.94it/s, acc=44%, turns=1.0][A
  CIPLiteStopping:  33%|███▎      | 33/100 [00:11<00:22,  2.94it/s, acc=42%, turns=1.0][A
  CIPLiteStopping:  34%|███▁      | 34/100 [00:12<00:19,  3.43it/s, acc=42%, turns=1.0][A
  CIPLiteStopping:  34%|███▁      | 34/100 [00:12<00:19,  3.43it/s, acc=44%, turns=1.0][AAPI calls:  10%|▉         | 481/5000 [00:12<02:15, 33.39call/s]
  CIPLiteStopping:  35%|███▌      | 35/100 [00:12<00:18,  3.43it/s, acc=43%, turns=1.0][AAPI calls:  10%|▉         | 485/5000 [00:12<02:20, 32.15call/s]API calls:  10%|▉         | 489/5000 [00:12<02:22, 31.74call/s]
  CIPLiteStopping:  36%|███▌      | 36/100 [00:12<00:15,  4.18it/s, acc=43%, turns=1.0][A
  CIPLiteStopping:  36%|███▌      | 36/100 [00:12<00:15,  4.18it/s, acc=42%, turns=1.0][AAPI calls:  10%|▉         | 496/5000 [00:12<01:54, 39.50call/s]API calls:  10%|█         | 501/5000 [00:12<01:57, 38.39call/s]
  CIPLiteStopping:  37%|███▋      | 37/100 [00:12<00:15,  4.01it/s, acc=42%, turns=1.0][A
  CIPLiteStopping:  37%|███▋      | 37/100 [00:12<00:15,  4.01it/s, acc=41%, turns=1.0][AAPI calls:  10%|█         | 508/5000 [00:12<01:39, 45.19call/s]
  CIPLiteStopping:  38%|███▊      | 38/100 [00:12<00:13,  4.54it/s, acc=41%, turns=1.0][A
  CIPLiteStopping:  38%|███▊      | 38/100 [00:12<00:13,  4.54it/s, acc=42%, turns=1.0][AAPI calls:  10%|█         | 514/5000 [00:12<01:36, 46.58call/s]
  CIPLiteStopping:  39%|███▉      | 39/100 [00:12<00:13,  4.54it/s, acc=44%, turns=1.0][AAPI calls:  10%|█         | 520/5000 [00:12<01:32, 48.70call/s]
  CIPLiteStopping:  40%|████      | 40/100 [00:12<00:10,  5.91it/s, acc=44%, turns=1.0][A
  CIPLiteStopping:  40%|████      | 40/100 [00:12<00:10,  5.91it/s, acc=45%, turns=1.0][AAPI calls:  11%|█         | 526/5000 [00:13<01:38, 45.58call/s]API calls:  11%|█         | 531/5000 [00:13<01:52, 39.79call/s]API calls:  11%|█         | 542/5000 [00:13<01:32, 47.98call/s]API calls:  11%|█         | 554/5000 [00:13<01:21, 54.76call/s]
  CIPLiteStopping:  41%|████      | 41/100 [00:13<00:16,  3.50it/s, acc=45%, turns=1.0][A
  CIPLiteStopping:  41%|████      | 41/100 [00:13<00:16,  3.50it/s, acc=44%, turns=1.0][AAPI calls:  11%|█         | 562/5000 [00:13<01:18, 56.38call/s]
  CIPLiteStopping:  42%|████▁     | 42/100 [00:13<00:14,  3.90it/s, acc=44%, turns=1.0][A
  CIPLiteStopping:  42%|████▁     | 42/100 [00:13<00:14,  3.90it/s, acc=43%, turns=1.0][AAPI calls:  11%|█▁        | 568/5000 [00:13<01:23, 53.11call/s]
  CIPLiteStopping:  43%|████▎     | 43/100 [00:14<00:13,  4.26it/s, acc=43%, turns=1.0][A
  CIPLiteStopping:  43%|████▎     | 43/100 [00:14<00:13,  4.26it/s, acc=42%, turns=1.0][AAPI calls:  11%|█▁        | 574/5000 [00:14<01:31, 48.24call/s]API calls:  12%|█▁        | 579/5000 [00:14<01:45, 41.93call/s]
  CIPLiteStopping:  44%|████▁     | 44/100 [00:14<00:14,  3.92it/s, acc=42%, turns=1.0][A
  CIPLiteStopping:  44%|████▁     | 44/100 [00:14<00:14,  3.92it/s, acc=41%, turns=1.0][AAPI calls:  12%|█▁        | 587/5000 [00:14<01:36, 45.60call/s]
  CIPLiteStopping:  45%|████▌     | 45/100 [00:14<00:11,  4.66it/s, acc=41%, turns=1.0][A
  CIPLiteStopping:  45%|████▌     | 45/100 [00:14<00:11,  4.66it/s, acc=42%, turns=1.0][AAPI calls:  12%|█▁        | 593/5000 [00:14<01:42, 43.02call/s]
  CIPLiteStopping:  46%|████▌     | 46/100 [00:14<00:11,  4.85it/s, acc=42%, turns=1.0][A
  CIPLiteStopping:  46%|████▌     | 46/100 [00:14<00:11,  4.85it/s, acc=41%, turns=1.0][AAPI calls:  12%|█▁        | 602/5000 [00:14<01:28, 49.87call/s]
  CIPLiteStopping:  47%|████▋     | 47/100 [00:14<00:10,  4.85it/s, acc=40%, turns=1.0][A
  CIPLiteStopping:  48%|████▊     | 48/100 [00:14<00:08,  6.45it/s, acc=40%, turns=1.0][A
  CIPLiteStopping:  48%|████▊     | 48/100 [00:14<00:08,  6.45it/s, acc=40%, turns=1.0][AAPI calls:  12%|█▁        | 608/5000 [00:14<01:31, 48.13call/s]API calls:  12%|█▁        | 613/5000 [00:14<01:30, 48.24call/s]API calls:  12%|█▁        | 619/5000 [00:15<01:25, 51.06call/s]API calls:  12%|█▎        | 625/5000 [00:15<01:38, 44.48call/s]API calls:  13%|█▎        | 630/5000 [00:15<01:59, 36.42call/s]API calls:  13%|█▎        | 634/5000 [00:15<02:17, 31.86call/s]API calls:  13%|█▎        | 638/5000 [00:15<02:14, 32.44call/s]API calls:  13%|█▎        | 642/5000 [00:15<02:30, 28.90call/s]API calls:  13%|█▎        | 646/5000 [00:15<02:25, 29.92call/s]
  CIPLiteStopping:  49%|████▉     | 49/100 [00:16<00:22,  2.23it/s, acc=40%, turns=1.0][A
  CIPLiteStopping:  49%|████▉     | 49/100 [00:16<00:22,  2.23it/s, acc=41%, turns=1.0][AAPI calls:  13%|█▎        | 650/5000 [00:16<02:56, 24.69call/s]API calls:  13%|█▎        | 654/5000 [00:16<02:46, 26.08call/s]API calls:  13%|█▎        | 657/5000 [00:16<03:02, 23.85call/s]API calls:  13%|█▎        | 661/5000 [00:16<02:46, 26.12call/s]
  CIPLiteStopping:  50%|█████     | 50/100 [00:16<00:23,  2.15it/s, acc=41%, turns=1.0][A
  CIPLiteStopping:  50%|█████     | 50/100 [00:16<00:23,  2.15it/s, acc=42%, turns=1.0][A
  CIPLiteStopping:  51%|█████     | 51/100 [00:16<00:22,  2.15it/s, acc=43%, turns=1.0][AAPI calls:  13%|█▎        | 666/5000 [00:16<02:30, 28.76call/s]API calls:  13%|█▎        | 671/5000 [00:16<02:14, 32.19call/s]
  CIPLiteStopping:  52%|█████▁    | 52/100 [00:16<00:15,  3.17it/s, acc=43%, turns=1.0][A
  CIPLiteStopping:  52%|█████▁    | 52/100 [00:16<00:15,  3.17it/s, acc=42%, turns=1.0][AAPI calls:  14%|█▎        | 675/5000 [00:17<02:22, 30.29call/s]API calls:  14%|█▎        | 679/5000 [00:17<02:25, 29.60call/s]API calls:  14%|█▎        | 684/5000 [00:17<02:11, 32.85call/s]API calls:  14%|█▁        | 692/5000 [00:17<01:38, 43.74call/s]
  CIPLiteStopping:  53%|█████▎    | 53/100 [00:17<00:19,  2.47it/s, acc=42%, turns=1.0][A
  CIPLiteStopping:  53%|█████▎    | 53/100 [00:17<00:19,  2.47it/s, acc=43%, turns=1.0][A
  CIPLiteStopping:  54%|█████▁    | 54/100 [00:17<00:15,  2.98it/s, acc=43%, turns=1.0][A
  CIPLiteStopping:  54%|█████▁    | 54/100 [00:17<00:15,  2.98it/s, acc=43%, turns=1.0][AAPI calls:  14%|█▁        | 697/5000 [00:17<02:34, 27.93call/s]API calls:  14%|█▁        | 701/5000 [00:17<02:51, 25.01call/s]
  CIPLiteStopping:  55%|█████▌    | 55/100 [00:17<00:14,  3.19it/s, acc=43%, turns=1.0][A
  CIPLiteStopping:  55%|█████▌    | 55/100 [00:17<00:14,  3.19it/s, acc=44%, turns=1.0][AAPI calls:  14%|█▁        | 705/5000 [00:18<03:18, 21.67call/s]API calls:  14%|█▁        | 706/5000 [00:18<03:26, 20.82call/s]
  CIPLiteStopping:  56%|█████▌    | 56/100 [00:18<00:13,  3.22it/s, acc=44%, turns=1.0][A
  CIPLiteStopping:  56%|█████▌    | 56/100 [00:18<00:13,  3.22it/s, acc=43%, turns=1.0][AAPI calls:  14%|█▁        | 714/5000 [00:18<02:36, 27.40call/s]
  CIPLiteStopping:  57%|█████▋    | 57/100 [00:18<00:13,  3.22it/s, acc=44%, turns=1.0][A
  CIPLiteStopping:  58%|█████▊    | 58/100 [00:18<00:09,  4.56it/s, acc=44%, turns=1.0][A
  CIPLiteStopping:  58%|█████▊    | 58/100 [00:18<00:09,  4.56it/s, acc=43%, turns=1.0][AAPI calls:  14%|█▁        | 718/5000 [00:18<02:48, 25.45call/s]
  CIPLiteStopping:  59%|█████▉    | 59/100 [00:18<00:08,  4.56it/s, acc=42%, turns=1.0][AAPI calls:  14%|█▁        | 721/5000 [00:18<02:48, 25.40call/s]
  CIPLiteStopping:  60%|██████    | 60/100 [00:18<00:07,  5.48it/s, acc=42%, turns=1.0][A
  CIPLiteStopping:  60%|██████    | 60/100 [00:18<00:07,  5.48it/s, acc=42%, turns=1.1][AAPI calls:  15%|█▁        | 727/5000 [00:18<02:13, 32.11call/s]API calls:  15%|█▁        | 729/5000 [00:18<01:46, 40.15call/s]API calls:  15%|█▁        | 736/5000 [00:18<01:31, 46.37call/s]API calls:  15%|█▁        | 742/5000 [00:19<01:50, 38.41call/s]
  CIPLiteStopping:  61%|██████    | 61/100 [00:19<00:08,  4.48it/s, acc=42%, turns=1.1][A
  CIPLiteStopping:  61%|██████    | 61/100 [00:19<00:08,  4.48it/s, acc=43%, turns=1.0][AAPI calls:  15%|█▁        | 747/5000 [00:19<02:12, 32.18call/s]
  CIPLiteStopping:  62%|██████▁   | 62/100 [00:19<00:09,  4.17it/s, acc=43%, turns=1.0][A
  CIPLiteStopping:  62%|██████▁   | 62/100 [00:19<00:09,  4.17it/s, acc=44%, turns=1.0][AAPI calls:  15%|█▌        | 756/5000 [00:19<01:39, 42.48call/s]
  CIPLiteStopping:  63%|██████▎   | 63/100 [00:19<00:07,  4.75it/s, acc=44%, turns=1.0][A
  CIPLiteStopping:  63%|██████▎   | 63/100 [00:19<00:07,  4.75it/s, acc=44%, turns=1.0][AAPI calls:  15%|█▌        | 762/5000 [00:19<01:35, 44.15call/s]
  CIPLiteStopping:  64%|██████▁   | 64/100 [00:19<00:06,  5.21it/s, acc=44%, turns=1.0][A
  CIPLiteStopping:  64%|██████▁   | 64/100 [00:19<00:06,  5.21it/s, acc=45%, turns=1.0][AAPI calls:  15%|█▌        | 771/5000 [00:19<01:22, 51.23call/s]API calls:  16%|█▌        | 777/5000 [00:19<01:20, 52.49call/s]
  CIPLiteStopping:  65%|██████▌   | 65/100 [00:19<00:06,  5.39it/s, acc=45%, turns=1.0][A
  CIPLiteStopping:  65%|██████▌   | 65/100 [00:19<00:06,  5.39it/s, acc=45%, turns=1.0][AAPI calls:  16%|█▌        | 783/5000 [00:19<01:18, 53.78call/s]API calls:  16%|█▌        | 789/5000 [00:20<01:17, 54.32call/s]API calls:  16%|█▌        | 795/5000 [00:20<01:19, 52.75call/s]
  CIPLiteStopping:  66%|██████▌   | 66/100 [00:20<00:08,  3.98it/s, acc=45%, turns=1.0][A
  CIPLiteStopping:  66%|██████▌   | 66/100 [00:20<00:08,  3.98it/s, acc=44%, turns=1.0][AAPI calls:  16%|█▌        | 801/5000 [00:20<01:31, 46.04call/s]API calls:  16%|█▌        | 806/5000 [00:20<01:38, 42.56call/s]API calls:  16%|█▌        | 811/5000 [00:20<01:46, 39.17call/s]API calls:  16%|█▋        | 818/5000 [00:20<01:34, 44.05call/s]API calls:  16%|█▋        | 823/5000 [00:20<01:54, 36.39call/s]API calls:  17%|█▋        | 827/5000 [00:21<01:58, 35.07call/s]API calls:  17%|█▋        | 836/5000 [00:21<01:28, 47.23call/s]
  CIPLiteStopping:  67%|██████▋   | 67/100 [00:21<00:15,  2.20it/s, acc=44%, turns=1.0][A
  CIPLiteStopping:  67%|██████▋   | 67/100 [00:21<00:15,  2.20it/s, acc=43%, turns=1.1][AAPI calls:  17%|█▋        | 842/5000 [00:21<01:29, 46.34call/s]API calls:  17%|█▋        | 853/5000 [00:21<01:15, 55.03call/s]
  CIPLiteStopping:  68%|██████▊   | 68/100 [00:21<00:12,  2.46it/s, acc=43%, turns=1.1][A
  CIPLiteStopping:  68%|██████▊   | 68/100 [00:21<00:12,  2.46it/s, acc=43%, turns=1.1][A
  CIPLiteStopping:  69%|██████▉   | 69/100 [00:21<00:12,  2.46it/s, acc=42%, turns=1.1][AAPI calls:  17%|█▋        | 859/5000 [00:21<01:18, 53.05call/s]API calls:  17%|█▋        | 865/5000 [00:21<01:20, 51.49call/s]API calls:  17%|█▋        | 871/5000 [00:21<01:31, 44.91call/s]API calls:  18%|█▊        | 876/5000 [00:22<01:51, 37.05call/s]API calls:  18%|█▊        | 877/5000 [00:22<02:00, 34.08call/s]API calls:  18%|█▊        | 882/5000 [00:22<01:54, 35.97call/s]API calls:  18%|█▊        | 886/5000 [00:22<02:11, 31.23call/s]
  CIPLiteStopping:  70%|███████   | 70/100 [00:22<00:12,  2.36it/s, acc=42%, turns=1.1][A
  CIPLiteStopping:  70%|███████   | 70/100 [00:22<00:12,  2.36it/s, acc=43%, turns=1.1][A
  CIPLiteStopping:  71%|███████   | 71/100 [00:22<00:12,  2.36it/s, acc=44%, turns=1.1][AAPI calls:  18%|█▊        | 893/5000 [00:22<01:59, 34.29call/s]
  CIPLiteStopping:  72%|███████▁  | 72/100 [00:22<00:08,  3.31it/s, acc=44%, turns=1.1][A
  CIPLiteStopping:  72%|███████▁  | 72/100 [00:22<00:08,  3.31it/s, acc=43%, turns=1.1][A
  CIPLiteStopping:  73%|███████▎  | 73/100 [00:22<00:08,  3.31it/s, acc=42%, turns=1.1][AAPI calls:  18%|█▊        | 898/5000 [00:22<01:59, 34.39call/s]API calls:  18%|█▊        | 902/5000 [00:22<02:33, 26.72call/s]
  CIPLiteStopping:  74%|███████▁  | 74/100 [00:23<00:07,  3.65it/s, acc=42%, turns=1.1][A
  CIPLiteStopping:  74%|███████▁  | 74/100 [00:23<00:07,  3.65it/s, acc=43%, turns=1.1][AAPI calls:  18%|█▊        | 905/5000 [00:23<03:07, 21.80call/s]API calls:  18%|█▊        | 908/5000 [00:23<02:59, 22.85call/s]API calls:  18%|█▊        | 911/5000 [00:23<03:38, 18.69call/s]API calls:  18%|█▊        | 914/5000 [00:23<03:26, 19.81call/s]
  CIPLiteStopping:  75%|███████▌  | 75/100 [00:23<00:08,  2.91it/s, acc=43%, turns=1.1][A
  CIPLiteStopping:  75%|███████▌  | 75/100 [00:23<00:08,  2.91it/s, acc=43%, turns=1.1][AAPI calls:  18%|█▊        | 917/5000 [00:23<03:56, 17.28call/s]
  CIPLiteStopping:  76%|███████▌  | 76/100 [00:23<00:08,  2.97it/s, acc=43%, turns=1.1][A
  CIPLiteStopping:  76%|███████▌  | 76/100 [00:23<00:08,  2.97it/s, acc=42%, turns=1.1][AAPI calls:  18%|█▊        | 920/5000 [00:24<03:42, 18.38call/s]API calls:  18%|█▊        | 923/5000 [00:24<03:53, 17.48call/s]API calls:  18%|█▊        | 924/5000 [00:24<03:41, 18.40call/s]API calls:  19%|█▊        | 926/5000 [00:24<03:41, 18.42call/s]
  CIPLiteStopping:  77%|███████▋  | 77/100 [00:24<00:07,  2.91it/s, acc=42%, turns=1.1][A
  CIPLiteStopping:  77%|███████▋  | 77/100 [00:24<00:07,  2.91it/s, acc=42%, turns=1.1][A
  CIPLiteStopping:  78%|███████▊  | 78/100 [00:24<00:07,  2.91it/s, acc=41%, turns=1.1][AAPI calls:  19%|█▊        | 928/5000 [00:24<03:51, 17.59call/s]
  CIPLiteStopping:  79%|███████▉  | 79/100 [00:24<00:05,  4.11it/s, acc=41%, turns=1.1][A
  CIPLiteStopping:  79%|███████▉  | 79/100 [00:24<00:05,  4.11it/s, acc=41%, turns=1.1][AAPI calls:  19%|█▊        | 930/5000 [00:24<03:54, 17.37call/s]API calls:  19%|█▊        | 932/5000 [00:24<04:05, 16.54call/s]API calls:  19%|█▊        | 934/5000 [00:24<04:03, 16.69call/s]API calls:  19%|█▊        | 936/5000 [00:25<04:25, 15.29call/s]
  CIPLiteStopping:  80%|████████  | 80/100 [00:25<00:06,  3.32it/s, acc=41%, turns=1.1][A
  CIPLiteStopping:  80%|████████  | 80/100 [00:25<00:06,  3.32it/s, acc=41%, turns=1.1][AAPI calls:  19%|█▉        | 940/5000 [00:25<03:28, 19.47call/s]
  CIPLiteStopping:  81%|████████  | 81/100 [00:25<00:05,  3.74it/s, acc=41%, turns=1.1][A
  CIPLiteStopping:  81%|████████  | 81/100 [00:25<00:05,  3.74it/s, acc=41%, turns=1.1][AAPI calls:  19%|█▉        | 943/5000 [00:25<03:14, 20.86call/s]
  CIPLiteStopping:  82%|████████▁ | 82/100 [00:25<00:04,  3.67it/s, acc=41%, turns=1.1][A
  CIPLiteStopping:  82%|████████▁ | 82/100 [00:25<00:04,  3.67it/s, acc=40%, turns=1.1][AAPI calls:  19%|█▉        | 946/5000 [00:25<04:42, 14.36call/s]
  CIPLiteStopping:  83%|████████▎ | 83/100 [00:25<00:03,  4.30it/s, acc=40%, turns=1.1][A
  CIPLiteStopping:  83%|████████▎ | 83/100 [00:25<00:03,  4.30it/s, acc=40%, turns=1.1][AAPI calls:  19%|█▉        | 948/5000 [00:25<04:34, 14.75call/s]API calls:  19%|█▉        | 950/5000 [00:25<04:58, 13.55call/s]
  CIPLiteStopping:  84%|████████▁ | 84/100 [00:25<00:04,  3.86it/s, acc=40%, turns=1.1][A
  CIPLiteStopping:  84%|████████▁ | 84/100 [00:25<00:04,  3.86it/s, acc=40%, turns=1.1][AAPI calls:  19%|█▉        | 954/5000 [00:26<04:33, 14.78call/s]API calls:  19%|█▉        | 956/5000 [00:26<04:57, 13.61call/s]API calls:  19%|█▉        | 958/5000 [00:26<06:06, 11.04call/s]
  CIPLiteStopping:  85%|████████▌ | 85/100 [00:26<00:05,  2.51it/s, acc=40%, turns=1.1][A
  CIPLiteStopping:  85%|████████▌ | 85/100 [00:26<00:05,  2.51it/s, acc=40%, turns=1.1][AAPI calls:  19%|█▉        | 960/5000 [00:26<05:35, 12.03call/s]
  CIPLiteStopping:  86%|████████▌ | 86/100 [00:26<00:05,  2.51it/s, acc=41%, turns=1.1][AAPI calls:  19%|█▉        | 962/5000 [00:26<05:35, 12.03call/s]
  CIPLiteStopping:  87%|████████▋ | 87/100 [00:26<00:03,  3.69it/s, acc=41%, turns=1.1][A
  CIPLiteStopping:  87%|████████▋ | 87/100 [00:26<00:03,  3.69it/s, acc=40%, turns=1.1][AAPI calls:  19%|█▉        | 964/5000 [00:27<05:37, 11.94call/s]
  CIPLiteStopping:  88%|████████▊ | 88/100 [00:27<00:02,  4.05it/s, acc=40%, turns=1.1][A
  CIPLiteStopping:  88%|████████▊ | 88/100 [00:27<00:02,  4.05it/s, acc=40%, turns=1.1][AAPI calls:  19%|█▉        | 967/5000 [00:27<04:47, 14.02call/s]API calls:  19%|█▉        | 970/5000 [00:27<04:30, 14.91call/s]API calls:  19%|█▉        | 974/5000 [00:27<03:38, 18.44call/s]API calls:  20%|█▉        | 976/5000 [00:27<05:24, 12.39call/s]API calls:  20%|█▉        | 978/5000 [00:28<05:39, 11.83call/s]
  CIPLiteStopping:  89%|████████▉ | 89/100 [00:28<00:04,  2.21it/s, acc=40%, turns=1.1][A
  CIPLiteStopping:  89%|████████▉ | 89/100 [00:28<00:04,  2.21it/s, acc=39%, turns=1.1][AAPI calls:  20%|█▉        | 982/5000 [00:28<04:19, 15.49call/s]API calls:  20%|█▉        | 986/5000 [00:28<03:35, 18.61call/s]
  CIPLiteStopping:  90%|█████████ | 90/100 [00:28<00:04,  2.42it/s, acc=39%, turns=1.1][A
  CIPLiteStopping:  90%|█████████ | 90/100 [00:28<00:04,  2.42it/s, acc=39%, turns=1.1][AAPI calls:  20%|█▉        | 989/5000 [00:28<03:25, 19.56call/s]API calls:  20%|█▉        | 992/5000 [00:28<03:18, 20.21call/s]API calls:  20%|█▉        | 995/5000 [00:28<04:21, 15.33call/s]API calls:  20%|█▉        | 997/5000 [00:29<04:13, 15.81call/s]API calls:  20%|██        | 1000/5000 [00:29<03:39, 18.25call/s]API calls:  20%|██        | 1003/5000 [00:29<03:51, 17.29call/s]
  CIPLiteStopping:  91%|█████████ | 91/100 [00:29<00:05,  1.77it/s, acc=39%, turns=1.1][A
  CIPLiteStopping:  91%|█████████ | 91/100 [00:29<00:05,  1.77it/s, acc=40%, turns=1.1][AAPI calls:  20%|██        | 1005/5000 [00:29<04:29, 14.81call/s]API calls:  20%|██        | 1007/5000 [00:29<06:09, 10.80call/s]API calls:  20%|██        | 1013/5000 [00:30<03:44, 17.78call/s]API calls:  20%|██        | 1016/5000 [00:30<04:54, 13.54call/s]API calls:  20%|██        | 1018/5000 [00:30<04:36, 14.40call/s]
  CIPLiteStopping:  92%|█████████▁| 92/100 [00:30<00:05,  1.37it/s, acc=40%, turns=1.1][A
  CIPLiteStopping:  92%|█████████▁| 92/100 [00:30<00:05,  1.37it/s, acc=39%, turns=1.1][AAPI calls:  20%|██        | 1021/5000 [00:30<04:12, 15.75call/s]API calls:  20%|██        | 1023/5000 [00:30<04:42, 14.08call/s]API calls:  20%|██        | 1025/5000 [00:31<04:43, 14.02call/s]
  CIPLiteStopping:  93%|█████████▎| 93/100 [00:31<00:04,  1.50it/s, acc=39%, turns=1.1][A
  CIPLiteStopping:  93%|█████████▎| 93/100 [00:31<00:04,  1.50it/s, acc=39%, turns=1.2][AAPI calls:  21%|██        | 1028/5000 [00:31<06:37, 10.00call/s]API calls:  21%|██        | 1030/5000 [00:31<05:58, 11.08call/s]API calls:  21%|██        | 1033/5000 [00:31<04:50, 13.65call/s]
  CIPLiteStopping:  94%|█████████▁| 94/100 [00:31<00:04,  1.49it/s, acc=39%, turns=1.2][A
  CIPLiteStopping:  94%|█████████▁| 94/100 [00:31<00:04,  1.49it/s, acc=39%, turns=1.2][AAPI calls:  21%|██        | 1036/5000 [00:31<04:18, 15.36call/s]API calls:  21%|██        | 1038/5000 [00:32<08:31,  7.75call/s]API calls:  21%|██        | 1040/5000 [00:33<10:21,  6.37call/s]API calls:  21%|██        | 1042/5000 [00:33<13:41,  4.82call/s]API calls:  21%|██        | 1044/5000 [00:33<10:54,  6.05call/s]API calls:  21%|██        | 1046/5000 [00:34<11:21,  5.80call/s]API calls:  21%|██        | 1049/5000 [00:34<08:07,  8.10call/s]
  CIPLiteStopping:  95%|█████████▌| 95/100 [00:34<00:06,  1.24s/it, acc=39%, turns=1.2][A
  CIPLiteStopping:  95%|█████████▌| 95/100 [00:34<00:06,  1.24s/it, acc=39%, turns=1.2][AAPI calls:  21%|██        | 1051/5000 [00:34<07:35,  8.67call/s]API calls:  21%|██        | 1053/5000 [00:35<13:36,  4.83call/s]API calls:  21%|██        | 1059/5000 [00:35<07:02,  9.32call/s]API calls:  21%|██        | 1062/5000 [00:36<08:29,  7.72call/s]API calls:  21%|██▁       | 1064/5000 [00:36<09:59,  6.56call/s]
  CIPLiteStopping:  96%|█████████▌| 96/100 [00:36<00:06,  1.54s/it, acc=39%, turns=1.2][A
  CIPLiteStopping:  96%|█████████▌| 96/100 [00:36<00:06,  1.54s/it, acc=39%, turns=1.2][AAPI calls:  21%|██▁       | 1068/5000 [00:36<06:57,  9.42call/s]API calls:  21%|██▁       | 1071/5000 [00:37<07:36,  8.61call/s]API calls:  21%|██▁       | 1073/5000 [00:37<06:59,  9.35call/s]API calls:  22%|██▁       | 1076/5000 [00:37<05:46, 11.34call/s]API calls:  22%|██▁       | 1078/5000 [00:37<08:31,  7.66call/s]API calls:  22%|██▁       | 1080/5000 [00:38<07:23,  8.83call/s]API calls:  22%|██▁       | 1082/5000 [00:38<06:57,  9.40call/s]API calls:  22%|██▁       | 1086/5000 [00:38<06:37,  9.85call/s]
  CIPLiteStopping:  97%|█████████▋| 97/100 [00:38<00:05,  1.69s/it, acc=39%, turns=1.2][A
  CIPLiteStopping:  97%|█████████▋| 97/100 [00:38<00:05,  1.69s/it, acc=38%, turns=1.2][AAPI calls:  22%|██▁       | 1089/5000 [00:38<06:01, 10.81call/s]
  CIPLiteStopping:  98%|█████████▊| 98/100 [00:38<00:02,  1.25s/it, acc=38%, turns=1.2][A
  CIPLiteStopping:  98%|█████████▊| 98/100 [00:38<00:02,  1.25s/it, acc=38%, turns=1.2][AAPI calls:  22%|██▁       | 1091/5000 [00:39<08:17,  7.86call/s]API calls:  22%|██▁       | 1093/5000 [00:39<08:20,  7.80call/s]API calls:  22%|██▁       | 1096/5000 [00:40<09:43,  6.69call/s]API calls:  22%|██▁       | 1097/5000 [00:41<17:20,  3.75call/s]API calls:  22%|██▁       | 1098/5000 [00:41<19:01,  3.42call/s]API calls:  22%|██▁       | 1099/5000 [00:41<17:52,  3.64call/s]
  CIPLiteStopping:  99%|█████████▉| 99/100 [00:41<00:01,  1.74s/it, acc=38%, turns=1.2][A
  CIPLiteStopping:  99%|█████████▉| 99/100 [00:41<00:01,  1.74s/it, acc=37%, turns=1.2][AAPI calls:  22%|██▁       | 1100/5000 [00:43<33:05,  1.96call/s]API calls:  22%|██▁       | 1101/5000 [00:44<39:07,  1.66call/s]API calls:  22%|██▁       | 1103/5000 [00:44<30:32,  2.13call/s]API calls:  22%|██▁       | 1105/5000 [00:44<21:39,  3.00call/s]API calls:  22%|██▁       | 1107/5000 [00:44<16:17,  3.98call/s]API calls:  22%|██▁       | 1108/5000 [00:45<14:35,  4.45call/s]API calls:  22%|██▁       | 1109/5000 [00:45<23:19,  2.78call/s]API calls:  22%|██▁       | 1110/5000 [00:48<52:31,  1.23call/s]API calls:  22%|██▁       | 1111/5000 [00:50<1:19:08,  1.22s/call]API calls:  22%|██▁       | 1112/5000 [00:51<1:06:47,  1.03s/call]API calls:  22%|██▁       | 1113/5000 [00:51<56:13,  1.15call/s]  API calls:  22%|██▁       | 1115/5000 [00:51<33:10,  1.95call/s]API calls:  22%|██▁       | 1119/5000 [00:52<18:26,  3.51call/s]
  CIPLiteStopping: 100%|██████████| 100/100 [00:52<00:00,  4.30s/it, acc=37%, turns=1.2][A
  CIPLiteStopping: 100%|██████████| 100/100 [00:52<00:00,  4.30s/it, acc=37%, turns=1.3][A
                                                                                        [AAPI calls:  22%|██▁       | 1119/5000 [00:52<03:00, 21.46call/s]
  Results: Accuracy=37.00% [27.00%, 47.00%], Avg Turns=1.3 [1.1, 1.4]

==========================================================================================
COMPARISON RESULTS
==========================================================================================
Method                      Accuracy           95% CI  Avg Turns           95% CI
------------------------------------------------------------------------------------------
CIPLiteStopping               37.00%  [27.00%,47.00%]        1.3        [1.1,1.4]
==========================================================================================

Total API usage:
  Prompt tokens: 648,560
  Completion tokens: 3,156
  Total tokens: 651,716
