
============================================================
RRMC Experiment: gn_methods/mi_only_min5
============================================================
Initializing LLM: qwen/qwen-2.5-7b-instruct (max_workers=32)
Task: guessing_numbers
Data: /root/RRMC/AR-Bench/data/gn/test.json
Loading weights:   0%|          | 0/103 [00:00<?, ?it/s]Loading weights:   1%|          | 1/103 [00:00<00:00, 23172.95it/s, Materializing param=embeddings.LayerNorm.bias]Loading weights:   1%|          | 1/103 [00:00<00:00, 9868.95it/s, Materializing param=embeddings.LayerNorm.bias] Loading weights:   2%|▁         | 2/103 [00:00<00:00, 9279.43it/s, Materializing param=embeddings.LayerNorm.weight]Loading weights:   2%|▁         | 2/103 [00:00<00:00, 7456.54it/s, Materializing param=embeddings.LayerNorm.weight]Loading weights:   3%|▎         | 3/103 [00:00<00:00, 7489.83it/s, Materializing param=embeddings.position_embeddings.weight]Loading weights:   3%|▎         | 3/103 [00:00<00:00, 6640.06it/s, Materializing param=embeddings.position_embeddings.weight]Loading weights:   4%|▁         | 4/103 [00:00<00:00, 6792.40it/s, Materializing param=embeddings.token_type_embeddings.weight]Loading weights:   4%|▁         | 4/103 [00:00<00:00, 6154.52it/s, Materializing param=embeddings.token_type_embeddings.weight]Loading weights:   5%|▁         | 5/103 [00:00<00:00, 6551.55it/s, Materializing param=embeddings.word_embeddings.weight]      Loading weights:   5%|▁         | 5/103 [00:00<00:00, 6168.09it/s, Materializing param=embeddings.word_embeddings.weight]Loading weights:   6%|▌         | 6/103 [00:00<00:00, 6339.00it/s, Materializing param=encoder.layer.0.attention.output.LayerNorm.bias]Loading weights:   6%|▌         | 6/103 [00:00<00:00, 3512.33it/s, Materializing param=encoder.layer.0.attention.output.LayerNorm.bias]Loading weights:   7%|▋         | 7/103 [00:00<00:00, 3839.93it/s, Materializing param=encoder.layer.0.attention.output.LayerNorm.weight]Loading weights:   7%|▋         | 7/103 [00:00<00:00, 3719.30it/s, Materializing param=encoder.layer.0.attention.output.LayerNorm.weight]Loading weights:   8%|▊         | 8/103 [00:00<00:00, 3998.38it/s, Materializing param=encoder.layer.0.attention.output.dense.bias]      Loading weights:   8%|▊         | 8/103 [00:00<00:00, 3910.32it/s, Materializing param=encoder.layer.0.attention.output.dense.bias]Loading weights:   9%|▊         | 9/103 [00:00<00:00, 4162.85it/s, Materializing param=encoder.layer.0.attention.output.dense.weight]Loading weights:   9%|▊         | 9/103 [00:00<00:00, 4076.10it/s, Materializing param=encoder.layer.0.attention.output.dense.weight]Loading weights:  10%|▉         | 10/103 [00:00<00:00, 4310.25it/s, Materializing param=encoder.layer.0.attention.self.key.bias]     Loading weights:  10%|▉         | 10/103 [00:00<00:00, 4229.41it/s, Materializing param=encoder.layer.0.attention.self.key.bias]Loading weights:  11%|█         | 11/103 [00:00<00:00, 4449.12it/s, Materializing param=encoder.layer.0.attention.self.key.weight]Loading weights:  11%|█         | 11/103 [00:00<00:00, 4363.28it/s, Materializing param=encoder.layer.0.attention.self.key.weight]Loading weights:  12%|█▁        | 12/103 [00:00<00:00, 4561.92it/s, Materializing param=encoder.layer.0.attention.self.query.bias]Loading weights:  12%|█▁        | 12/103 [00:00<00:00, 4487.09it/s, Materializing param=encoder.layer.0.attention.self.query.bias]Loading weights:  13%|█▎        | 13/103 [00:00<00:00, 4667.92it/s, Materializing param=encoder.layer.0.attention.self.query.weight]Loading weights:  13%|█▎        | 13/103 [00:00<00:00, 4574.32it/s, Materializing param=encoder.layer.0.attention.self.query.weight]Loading weights:  14%|█▎        | 14/103 [00:00<00:00, 4733.21it/s, Materializing param=encoder.layer.0.attention.self.value.bias]  Loading weights:  14%|█▎        | 14/103 [00:00<00:00, 4662.93it/s, Materializing param=encoder.layer.0.attention.self.value.bias]Loading weights:  15%|█▁        | 15/103 [00:00<00:00, 4820.30it/s, Materializing param=encoder.layer.0.attention.self.value.weight]Loading weights:  15%|█▁        | 15/103 [00:00<00:00, 4270.32it/s, Materializing param=encoder.layer.0.attention.self.value.weight]Loading weights:  16%|█▌        | 16/103 [00:00<00:00, 4407.81it/s, Materializing param=encoder.layer.0.intermediate.dense.bias]    Loading weights:  16%|█▌        | 16/103 [00:00<00:00, 4353.48it/s, Materializing param=encoder.layer.0.intermediate.dense.bias]Loading weights:  17%|█▋        | 17/103 [00:00<00:00, 4509.72it/s, Materializing param=encoder.layer.0.intermediate.dense.weight]Loading weights:  17%|█▋        | 17/103 [00:00<00:00, 4450.88it/s, Materializing param=encoder.layer.0.intermediate.dense.weight]Loading weights:  17%|█▋        | 18/103 [00:00<00:00, 4560.68it/s, Materializing param=encoder.layer.0.output.LayerNorm.bias]    Loading weights:  17%|█▋        | 18/103 [00:00<00:00, 4508.93it/s, Materializing param=encoder.layer.0.output.LayerNorm.bias]Loading weights:  18%|█▊        | 19/103 [00:00<00:00, 4636.21it/s, Materializing param=encoder.layer.0.output.LayerNorm.weight]Loading weights:  18%|█▊        | 19/103 [00:00<00:00, 4586.58it/s, Materializing param=encoder.layer.0.output.LayerNorm.weight]Loading weights:  19%|█▉        | 20/103 [00:00<00:00, 4705.30it/s, Materializing param=encoder.layer.0.output.dense.bias]      Loading weights:  19%|█▉        | 20/103 [00:00<00:00, 4655.94it/s, Materializing param=encoder.layer.0.output.dense.bias]Loading weights:  20%|██        | 21/103 [00:00<00:00, 4772.45it/s, Materializing param=encoder.layer.0.output.dense.weight]Loading weights:  20%|██        | 21/103 [00:00<00:00, 4650.99it/s, Materializing param=encoder.layer.0.output.dense.weight]Loading weights:  21%|██▁       | 22/103 [00:00<00:00, 4770.94it/s, Materializing param=encoder.layer.1.attention.output.LayerNorm.bias]Loading weights:  21%|██▁       | 22/103 [00:00<00:00, 4725.73it/s, Materializing param=encoder.layer.1.attention.output.LayerNorm.bias]Loading weights:  22%|██▁       | 23/103 [00:00<00:00, 4309.34it/s, Materializing param=encoder.layer.1.attention.output.LayerNorm.weight]Loading weights:  22%|██▁       | 23/103 [00:00<00:00, 3525.27it/s, Materializing param=encoder.layer.1.attention.output.LayerNorm.weight]Loading weights:  23%|██▎       | 24/103 [00:00<00:00, 3048.00it/s, Materializing param=encoder.layer.1.attention.output.dense.bias]      Loading weights:  23%|██▎       | 24/103 [00:00<00:00, 2748.04it/s, Materializing param=encoder.layer.1.attention.output.dense.bias]Loading weights:  24%|██▁       | 25/103 [00:00<00:00, 2818.37it/s, Materializing param=encoder.layer.1.attention.output.dense.weight]Loading weights:  24%|██▁       | 25/103 [00:00<00:00, 2579.97it/s, Materializing param=encoder.layer.1.attention.output.dense.weight]Loading weights:  25%|██▌       | 26/103 [00:00<00:00, 2651.78it/s, Materializing param=encoder.layer.1.attention.self.key.bias]      Loading weights:  25%|██▌       | 26/103 [00:00<00:00, 2482.35it/s, Materializing param=encoder.layer.1.attention.self.key.bias]Loading weights:  26%|██▌       | 27/103 [00:00<00:00, 2548.75it/s, Materializing param=encoder.layer.1.attention.self.key.weight]Loading weights:  26%|██▌       | 27/103 [00:00<00:00, 2538.01it/s, Materializing param=encoder.layer.1.attention.self.key.weight]Loading weights:  27%|██▋       | 28/103 [00:00<00:00, 2609.50it/s, Materializing param=encoder.layer.1.attention.self.query.bias]Loading weights:  27%|██▋       | 28/103 [00:00<00:00, 2599.28it/s, Materializing param=encoder.layer.1.attention.self.query.bias]Loading weights:  28%|██▊       | 29/103 [00:00<00:00, 2662.76it/s, Materializing param=encoder.layer.1.attention.self.query.weight]Loading weights:  28%|██▊       | 29/103 [00:00<00:00, 2650.63it/s, Materializing param=encoder.layer.1.attention.self.query.weight]Loading weights:  29%|██▉       | 30/103 [00:00<00:00, 2714.82it/s, Materializing param=encoder.layer.1.attention.self.value.bias]  Loading weights:  29%|██▉       | 30/103 [00:00<00:00, 2671.30it/s, Materializing param=encoder.layer.1.attention.self.value.bias]Loading weights:  30%|███       | 31/103 [00:00<00:00, 2734.00it/s, Materializing param=encoder.layer.1.attention.self.value.weight]Loading weights:  30%|███       | 31/103 [00:00<00:00, 2723.40it/s, Materializing param=encoder.layer.1.attention.self.value.weight]Loading weights:  31%|███       | 32/103 [00:00<00:00, 2789.46it/s, Materializing param=encoder.layer.1.intermediate.dense.bias]    Loading weights:  31%|███       | 32/103 [00:00<00:00, 2779.35it/s, Materializing param=encoder.layer.1.intermediate.dense.bias]Loading weights:  32%|███▁      | 33/103 [00:00<00:00, 2839.98it/s, Materializing param=encoder.layer.1.intermediate.dense.weight]Loading weights:  32%|███▁      | 33/103 [00:00<00:00, 2829.24it/s, Materializing param=encoder.layer.1.intermediate.dense.weight]Loading weights:  33%|███▎      | 34/103 [00:00<00:00, 2888.11it/s, Materializing param=encoder.layer.1.output.LayerNorm.bias]    Loading weights:  33%|███▎      | 34/103 [00:00<00:00, 2877.62it/s, Materializing param=encoder.layer.1.output.LayerNorm.bias]Loading weights:  34%|███▁      | 35/103 [00:00<00:00, 2927.58it/s, Materializing param=encoder.layer.1.output.LayerNorm.weight]Loading weights:  34%|███▁      | 35/103 [00:00<00:00, 2916.01it/s, Materializing param=encoder.layer.1.output.LayerNorm.weight]Loading weights:  35%|███▁      | 36/103 [00:00<00:00, 2977.91it/s, Materializing param=encoder.layer.1.output.dense.bias]      Loading weights:  35%|███▁      | 36/103 [00:00<00:00, 2967.90it/s, Materializing param=encoder.layer.1.output.dense.bias]Loading weights:  36%|███▌      | 37/103 [00:00<00:00, 3024.31it/s, Materializing param=encoder.layer.1.output.dense.weight]Loading weights:  36%|███▌      | 37/103 [00:00<00:00, 3013.85it/s, Materializing param=encoder.layer.1.output.dense.weight]Loading weights:  37%|███▋      | 38/103 [00:00<00:00, 3069.44it/s, Materializing param=encoder.layer.2.attention.output.LayerNorm.bias]Loading weights:  37%|███▋      | 38/103 [00:00<00:00, 3059.01it/s, Materializing param=encoder.layer.2.attention.output.LayerNorm.bias]Loading weights:  38%|███▊      | 39/103 [00:00<00:00, 3113.10it/s, Materializing param=encoder.layer.2.attention.output.LayerNorm.weight]Loading weights:  38%|███▊      | 39/103 [00:00<00:00, 3102.41it/s, Materializing param=encoder.layer.2.attention.output.LayerNorm.weight]Loading weights:  39%|███▉      | 40/103 [00:00<00:00, 3155.45it/s, Materializing param=encoder.layer.2.attention.output.dense.bias]      Loading weights:  39%|███▉      | 40/103 [00:00<00:00, 3144.80it/s, Materializing param=encoder.layer.2.attention.output.dense.bias]Loading weights:  40%|███▉      | 41/103 [00:00<00:00, 3197.41it/s, Materializing param=encoder.layer.2.attention.output.dense.weight]Loading weights:  40%|███▉      | 41/103 [00:00<00:00, 3183.39it/s, Materializing param=encoder.layer.2.attention.output.dense.weight]Loading weights:  41%|████      | 42/103 [00:00<00:00, 3233.20it/s, Materializing param=encoder.layer.2.attention.self.key.bias]      Loading weights:  41%|████      | 42/103 [00:00<00:00, 3222.32it/s, Materializing param=encoder.layer.2.attention.self.key.bias]Loading weights:  42%|████▁     | 43/103 [00:00<00:00, 3273.29it/s, Materializing param=encoder.layer.2.attention.self.key.weight]Loading weights:  42%|████▁     | 43/103 [00:00<00:00, 3262.69it/s, Materializing param=encoder.layer.2.attention.self.key.weight]Loading weights:  43%|████▎     | 44/103 [00:00<00:00, 3311.97it/s, Materializing param=encoder.layer.2.attention.self.query.bias]Loading weights:  43%|████▎     | 44/103 [00:00<00:00, 3301.48it/s, Materializing param=encoder.layer.2.attention.self.query.bias]Loading weights:  44%|████▎     | 45/103 [00:00<00:00, 3276.69it/s, Materializing param=encoder.layer.2.attention.self.query.weight]Loading weights:  44%|████▎     | 45/103 [00:00<00:00, 3265.18it/s, Materializing param=encoder.layer.2.attention.self.query.weight]Loading weights:  45%|████▁     | 46/103 [00:00<00:00, 3309.91it/s, Materializing param=encoder.layer.2.attention.self.value.bias]  Loading weights:  45%|████▁     | 46/103 [00:00<00:00, 3253.32it/s, Materializing param=encoder.layer.2.attention.self.value.bias]Loading weights:  46%|████▌     | 47/103 [00:00<00:00, 3293.50it/s, Materializing param=encoder.layer.2.attention.self.value.weight]Loading weights:  46%|████▌     | 47/103 [00:00<00:00, 3283.02it/s, Materializing param=encoder.layer.2.attention.self.value.weight]Loading weights:  47%|████▋     | 48/103 [00:00<00:00, 3327.11it/s, Materializing param=encoder.layer.2.intermediate.dense.bias]    Loading weights:  47%|████▋     | 48/103 [00:00<00:00, 3317.13it/s, Materializing param=encoder.layer.2.intermediate.dense.bias]Loading weights:  48%|████▊     | 49/103 [00:00<00:00, 3360.71it/s, Materializing param=encoder.layer.2.intermediate.dense.weight]Loading weights:  48%|████▊     | 49/103 [00:00<00:00, 3350.36it/s, Materializing param=encoder.layer.2.intermediate.dense.weight]Loading weights:  49%|████▊     | 50/103 [00:00<00:00, 3394.27it/s, Materializing param=encoder.layer.2.output.LayerNorm.bias]    Loading weights:  49%|████▊     | 50/103 [00:00<00:00, 3384.47it/s, Materializing param=encoder.layer.2.output.LayerNorm.bias]Loading weights:  50%|████▉     | 51/103 [00:00<00:00, 3423.26it/s, Materializing param=encoder.layer.2.output.LayerNorm.weight]Loading weights:  50%|████▉     | 51/103 [00:00<00:00, 3360.87it/s, Materializing param=encoder.layer.2.output.LayerNorm.weight]Loading weights:  50%|█████     | 52/103 [00:00<00:00, 3403.41it/s, Materializing param=encoder.layer.2.output.dense.bias]      Loading weights:  50%|█████     | 52/103 [00:00<00:00, 3168.92it/s, Materializing param=encoder.layer.2.output.dense.bias]Loading weights:  51%|█████▁    | 53/103 [00:00<00:00, 3207.67it/s, Materializing param=encoder.layer.2.output.dense.weight]Loading weights:  51%|█████▁    | 53/103 [00:00<00:00, 3130.74it/s, Materializing param=encoder.layer.2.output.dense.weight]Loading weights:  52%|█████▁    | 54/103 [00:00<00:00, 3162.68it/s, Materializing param=encoder.layer.3.attention.output.LayerNorm.bias]Loading weights:  52%|█████▁    | 54/103 [00:00<00:00, 3153.92it/s, Materializing param=encoder.layer.3.attention.output.LayerNorm.bias]Loading weights:  53%|█████▎    | 55/103 [00:00<00:00, 3191.75it/s, Materializing param=encoder.layer.3.attention.output.LayerNorm.weight]Loading weights:  53%|█████▎    | 55/103 [00:00<00:00, 3183.42it/s, Materializing param=encoder.layer.3.attention.output.LayerNorm.weight]Loading weights:  54%|█████▁    | 56/103 [00:00<00:00, 3221.48it/s, Materializing param=encoder.layer.3.attention.output.dense.bias]      Loading weights:  54%|█████▁    | 56/103 [00:00<00:00, 3213.32it/s, Materializing param=encoder.layer.3.attention.output.dense.bias]Loading weights:  55%|█████▌    | 57/103 [00:00<00:00, 3250.69it/s, Materializing param=encoder.layer.3.attention.output.dense.weight]Loading weights:  55%|█████▌    | 57/103 [00:00<00:00, 3242.75it/s, Materializing param=encoder.layer.3.attention.output.dense.weight]Loading weights:  56%|█████▋    | 58/103 [00:00<00:00, 3280.07it/s, Materializing param=encoder.layer.3.attention.self.key.bias]      Loading weights:  56%|█████▋    | 58/103 [00:00<00:00, 3272.22it/s, Materializing param=encoder.layer.3.attention.self.key.bias]Loading weights:  57%|█████▋    | 59/103 [00:00<00:00, 3307.28it/s, Materializing param=encoder.layer.3.attention.self.key.weight]Loading weights:  57%|█████▋    | 59/103 [00:00<00:00, 3131.82it/s, Materializing param=encoder.layer.3.attention.self.key.weight]Loading weights:  58%|█████▊    | 60/103 [00:00<00:00, 3162.09it/s, Materializing param=encoder.layer.3.attention.self.query.bias]Loading weights:  58%|█████▊    | 60/103 [00:00<00:00, 3133.98it/s, Materializing param=encoder.layer.3.attention.self.query.bias]Loading weights:  59%|█████▉    | 61/103 [00:00<00:00, 3119.54it/s, Materializing param=encoder.layer.3.attention.self.query.weight]Loading weights:  59%|█████▉    | 61/103 [00:00<00:00, 3109.61it/s, Materializing param=encoder.layer.3.attention.self.query.weight]Loading weights:  60%|██████    | 62/103 [00:00<00:00, 3142.67it/s, Materializing param=encoder.layer.3.attention.self.value.bias]  Loading weights:  60%|██████    | 62/103 [00:00<00:00, 3135.63it/s, Materializing param=encoder.layer.3.attention.self.value.bias]Loading weights:  61%|██████    | 63/103 [00:00<00:00, 3086.21it/s, Materializing param=encoder.layer.3.attention.self.value.weight]Loading weights:  61%|██████    | 63/103 [00:00<00:00, 3078.41it/s, Materializing param=encoder.layer.3.attention.self.value.weight]Loading weights:  62%|██████▁   | 64/103 [00:00<00:00, 3105.85it/s, Materializing param=encoder.layer.3.intermediate.dense.bias]    Loading weights:  62%|██████▁   | 64/103 [00:00<00:00, 3098.39it/s, Materializing param=encoder.layer.3.intermediate.dense.bias]Loading weights:  63%|██████▎   | 65/103 [00:00<00:00, 3099.02it/s, Materializing param=encoder.layer.3.intermediate.dense.weight]Loading weights:  63%|██████▎   | 65/103 [00:00<00:00, 3067.70it/s, Materializing param=encoder.layer.3.intermediate.dense.weight]Loading weights:  64%|██████▁   | 66/103 [00:00<00:00, 3095.22it/s, Materializing param=encoder.layer.3.output.LayerNorm.bias]    Loading weights:  64%|██████▁   | 66/103 [00:00<00:00, 3088.76it/s, Materializing param=encoder.layer.3.output.LayerNorm.bias]Loading weights:  65%|██████▌   | 67/103 [00:00<00:00, 3119.97it/s, Materializing param=encoder.layer.3.output.LayerNorm.weight]Loading weights:  65%|██████▌   | 67/103 [00:00<00:00, 3113.78it/s, Materializing param=encoder.layer.3.output.LayerNorm.weight]Loading weights:  66%|██████▌   | 68/103 [00:00<00:00, 3147.17it/s, Materializing param=encoder.layer.3.output.dense.bias]      Loading weights:  66%|██████▌   | 68/103 [00:00<00:00, 3141.21it/s, Materializing param=encoder.layer.3.output.dense.bias]Loading weights:  67%|██████▋   | 69/103 [00:00<00:00, 3171.83it/s, Materializing param=encoder.layer.3.output.dense.weight]Loading weights:  67%|██████▋   | 69/103 [00:00<00:00, 3165.79it/s, Materializing param=encoder.layer.3.output.dense.weight]Loading weights:  68%|██████▊   | 70/103 [00:00<00:00, 3196.08it/s, Materializing param=encoder.layer.4.attention.output.LayerNorm.bias]Loading weights:  68%|██████▊   | 70/103 [00:00<00:00, 3189.10it/s, Materializing param=encoder.layer.4.attention.output.LayerNorm.bias]Loading weights:  69%|██████▉   | 71/103 [00:00<00:00, 3221.15it/s, Materializing param=encoder.layer.4.attention.output.LayerNorm.weight]Loading weights:  69%|██████▉   | 71/103 [00:00<00:00, 3215.03it/s, Materializing param=encoder.layer.4.attention.output.LayerNorm.weight]Loading weights:  70%|██████▉   | 72/103 [00:00<00:00, 3243.23it/s, Materializing param=encoder.layer.4.attention.output.dense.bias]      Loading weights:  70%|██████▉   | 72/103 [00:00<00:00, 3236.90it/s, Materializing param=encoder.layer.4.attention.output.dense.bias]Loading weights:  71%|███████   | 73/103 [00:00<00:00, 3268.34it/s, Materializing param=encoder.layer.4.attention.output.dense.weight]Loading weights:  71%|███████   | 73/103 [00:00<00:00, 3243.82it/s, Materializing param=encoder.layer.4.attention.output.dense.weight]Loading weights:  72%|███████▁  | 74/103 [00:00<00:00, 3273.17it/s, Materializing param=encoder.layer.4.attention.self.key.bias]      Loading weights:  72%|███████▁  | 74/103 [00:00<00:00, 3266.39it/s, Materializing param=encoder.layer.4.attention.self.key.bias]Loading weights:  73%|███████▎  | 75/103 [00:00<00:00, 3294.13it/s, Materializing param=encoder.layer.4.attention.self.key.weight]Loading weights:  73%|███████▎  | 75/103 [00:00<00:00, 3287.83it/s, Materializing param=encoder.layer.4.attention.self.key.weight]Loading weights:  74%|███████▁  | 76/103 [00:00<00:00, 3314.66it/s, Materializing param=encoder.layer.4.attention.self.query.bias]Loading weights:  74%|███████▁  | 76/103 [00:00<00:00, 3308.22it/s, Materializing param=encoder.layer.4.attention.self.query.bias]Loading weights:  75%|███████▁  | 77/103 [00:00<00:00, 3336.83it/s, Materializing param=encoder.layer.4.attention.self.query.weight]Loading weights:  75%|███████▁  | 77/103 [00:00<00:00, 3330.53it/s, Materializing param=encoder.layer.4.attention.self.query.weight]Loading weights:  76%|███████▌  | 78/103 [00:00<00:00, 3358.82it/s, Materializing param=encoder.layer.4.attention.self.value.bias]  Loading weights:  76%|███████▌  | 78/103 [00:00<00:00, 3352.66it/s, Materializing param=encoder.layer.4.attention.self.value.bias]Loading weights:  77%|███████▋  | 79/103 [00:00<00:00, 3380.19it/s, Materializing param=encoder.layer.4.attention.self.value.weight]Loading weights:  77%|███████▋  | 79/103 [00:00<00:00, 3374.13it/s, Materializing param=encoder.layer.4.attention.self.value.weight]Loading weights:  78%|███████▊  | 80/103 [00:00<00:00, 3400.88it/s, Materializing param=encoder.layer.4.intermediate.dense.bias]    Loading weights:  78%|███████▊  | 80/103 [00:00<00:00, 3394.75it/s, Materializing param=encoder.layer.4.intermediate.dense.bias]Loading weights:  79%|███████▊  | 81/103 [00:00<00:00, 3422.27it/s, Materializing param=encoder.layer.4.intermediate.dense.weight]Loading weights:  79%|███████▊  | 81/103 [00:00<00:00, 3416.18it/s, Materializing param=encoder.layer.4.intermediate.dense.weight]Loading weights:  80%|███████▉  | 82/103 [00:00<00:00, 3256.51it/s, Materializing param=encoder.layer.4.output.LayerNorm.bias]    Loading weights:  80%|███████▉  | 82/103 [00:00<00:00, 3203.34it/s, Materializing param=encoder.layer.4.output.LayerNorm.bias]Loading weights:  81%|████████  | 83/103 [00:00<00:00, 3228.78it/s, Materializing param=encoder.layer.4.output.LayerNorm.weight]Loading weights:  81%|████████  | 83/103 [00:00<00:00, 3223.49it/s, Materializing param=encoder.layer.4.output.LayerNorm.weight]Loading weights:  82%|████████▁ | 84/103 [00:00<00:00, 3248.10it/s, Materializing param=encoder.layer.4.output.dense.bias]      Loading weights:  82%|████████▁ | 84/103 [00:00<00:00, 3242.27it/s, Materializing param=encoder.layer.4.output.dense.bias]Loading weights:  83%|████████▎ | 85/103 [00:00<00:00, 3266.80it/s, Materializing param=encoder.layer.4.output.dense.weight]Loading weights:  83%|████████▎ | 85/103 [00:00<00:00, 3261.39it/s, Materializing param=encoder.layer.4.output.dense.weight]Loading weights:  83%|████████▎ | 86/103 [00:00<00:00, 3286.74it/s, Materializing param=encoder.layer.5.attention.output.LayerNorm.bias]Loading weights:  83%|████████▎ | 86/103 [00:00<00:00, 3281.12it/s, Materializing param=encoder.layer.5.attention.output.LayerNorm.bias]Loading weights:  84%|████████▁ | 87/103 [00:00<00:00, 3306.10it/s, Materializing param=encoder.layer.5.attention.output.LayerNorm.weight]Loading weights:  84%|████████▁ | 87/103 [00:00<00:00, 3297.44it/s, Materializing param=encoder.layer.5.attention.output.LayerNorm.weight]Loading weights:  85%|████████▌ | 88/103 [00:00<00:00, 3321.00it/s, Materializing param=encoder.layer.5.attention.output.dense.bias]      Loading weights:  85%|████████▌ | 88/103 [00:00<00:00, 3315.54it/s, Materializing param=encoder.layer.5.attention.output.dense.bias]Loading weights:  86%|████████▋ | 89/103 [00:00<00:00, 3339.98it/s, Materializing param=encoder.layer.5.attention.output.dense.weight]Loading weights:  86%|████████▋ | 89/103 [00:00<00:00, 3334.64it/s, Materializing param=encoder.layer.5.attention.output.dense.weight]Loading weights:  87%|████████▋ | 90/103 [00:00<00:00, 3358.79it/s, Materializing param=encoder.layer.5.attention.self.key.bias]      Loading weights:  87%|████████▋ | 90/103 [00:00<00:00, 3352.61it/s, Materializing param=encoder.layer.5.attention.self.key.bias]Loading weights:  88%|████████▊ | 91/103 [00:00<00:00, 3376.01it/s, Materializing param=encoder.layer.5.attention.self.key.weight]Loading weights:  88%|████████▊ | 91/103 [00:00<00:00, 3370.23it/s, Materializing param=encoder.layer.5.attention.self.key.weight]Loading weights:  89%|████████▉ | 92/103 [00:00<00:00, 3393.60it/s, Materializing param=encoder.layer.5.attention.self.query.bias]Loading weights:  89%|████████▉ | 92/103 [00:00<00:00, 3388.24it/s, Materializing param=encoder.layer.5.attention.self.query.bias]Loading weights:  90%|█████████ | 93/103 [00:00<00:00, 3411.67it/s, Materializing param=encoder.layer.5.attention.self.query.weight]Loading weights:  90%|█████████ | 93/103 [00:00<00:00, 3406.10it/s, Materializing param=encoder.layer.5.attention.self.query.weight]Loading weights:  91%|█████████▁| 94/103 [00:00<00:00, 3429.01it/s, Materializing param=encoder.layer.5.attention.self.value.bias]  Loading weights:  91%|█████████▁| 94/103 [00:00<00:00, 3423.65it/s, Materializing param=encoder.layer.5.attention.self.value.bias]Loading weights:  92%|█████████▁| 95/103 [00:00<00:00, 3447.17it/s, Materializing param=encoder.layer.5.attention.self.value.weight]Loading weights:  92%|█████████▁| 95/103 [00:00<00:00, 3441.96it/s, Materializing param=encoder.layer.5.attention.self.value.weight]Loading weights:  93%|█████████▎| 96/103 [00:00<00:00, 3465.20it/s, Materializing param=encoder.layer.5.intermediate.dense.bias]    Loading weights:  93%|█████████▎| 96/103 [00:00<00:00, 3459.96it/s, Materializing param=encoder.layer.5.intermediate.dense.bias]Loading weights:  94%|█████████▁| 97/103 [00:00<00:00, 3482.51it/s, Materializing param=encoder.layer.5.intermediate.dense.weight]Loading weights:  94%|█████████▁| 97/103 [00:00<00:00, 3467.28it/s, Materializing param=encoder.layer.5.intermediate.dense.weight]Loading weights:  95%|█████████▌| 98/103 [00:00<00:00, 3489.02it/s, Materializing param=encoder.layer.5.output.LayerNorm.bias]    Loading weights:  95%|█████████▌| 98/103 [00:00<00:00, 3475.81it/s, Materializing param=encoder.layer.5.output.LayerNorm.bias]Loading weights:  96%|█████████▌| 99/103 [00:00<00:00, 3499.47it/s, Materializing param=encoder.layer.5.output.LayerNorm.weight]Loading weights:  96%|█████████▌| 99/103 [00:00<00:00, 3494.19it/s, Materializing param=encoder.layer.5.output.LayerNorm.weight]Loading weights:  97%|█████████▋| 100/103 [00:00<00:00, 3519.42it/s, Materializing param=encoder.layer.5.output.dense.bias]     Loading weights:  97%|█████████▋| 100/103 [00:00<00:00, 3514.35it/s, Materializing param=encoder.layer.5.output.dense.bias]Loading weights:  98%|█████████▊| 101/103 [00:00<00:00, 3533.53it/s, Materializing param=encoder.layer.5.output.dense.weight]Loading weights:  98%|█████████▊| 101/103 [00:00<00:00, 3528.06it/s, Materializing param=encoder.layer.5.output.dense.weight]Loading weights:  99%|█████████▉| 102/103 [00:00<00:00, 3553.96it/s, Materializing param=pooler.dense.bias]                  Loading weights:  99%|█████████▉| 102/103 [00:00<00:00, 3549.07it/s, Materializing param=pooler.dense.bias]Loading weights: 100%|██████████| 103/103 [00:00<00:00, 3575.77it/s, Materializing param=pooler.dense.weight]Loading weights: 100%|██████████| 103/103 [00:00<00:00, 3569.33it/s, Materializing param=pooler.dense.weight]Loading weights: 100%|██████████| 103/103 [00:00<00:00, 3558.92it/s, Materializing param=pooler.dense.weight]
[1mBertModel LOAD REPORT[0m from: sentence-transformers/all-MiniLM-L6-v2
Key                     | Status     |  | 
------------------------+------------+--+-
embeddings.position_ids | UNEXPECTED |  | 

[3mNotes:
- UNEXPECTED[3m	:can be ignored when loading from different task/architecture; not ok if you expect identical arch.[0m
API calls:   0%|          | 0/500 [00:00<?, ?call/s]Evaluating 20 puzzles
Methods: ['mi_only']

============================================================
STARTING EVALUATION
============================================================

Evaluating MIOnlyStopping on 20 puzzles...

  MIOnlyStopping:   0%|          | 0/20 [00:00<?, ?it/s][AAPI calls:   0%|          | 1/500 [00:01<10:52,  1.31s/call]API calls:   0%|          | 2/500 [00:01<05:25,  1.53call/s]API calls:   1%|          | 4/500 [00:01<02:20,  3.53call/s]API calls:   1%|          | 5/500 [00:01<02:19,  3.54call/s]API calls:   1%|▁         | 7/500 [00:02<01:28,  5.58call/s]API calls:   2%|▁         | 12/500 [00:02<00:39, 12.27call/s]API calls:   4%|▁         | 19/500 [00:02<00:22, 21.69call/s]API calls:   5%|▌         | 25/500 [00:02<00:16, 29.12call/s]API calls:   6%|▌         | 30/500 [00:02<00:16, 28.64call/s]API calls:   7%|▋         | 37/500 [00:02<00:13, 35.23call/s]API calls:   8%|▊         | 42/500 [00:02<00:12, 37.88call/s]API calls:   9%|▉         | 47/500 [00:02<00:12, 36.16call/s]API calls:  10%|█         | 52/500 [00:03<00:12, 35.43call/s]API calls:  12%|█▁        | 58/500 [00:03<00:11, 38.20call/s]API calls:  14%|█▎        | 68/500 [00:03<00:08, 50.59call/s]API calls:  15%|█▁        | 74/500 [00:03<00:08, 49.88call/s]API calls:  16%|█▌        | 80/500 [00:03<00:08, 51.35call/s]API calls:  17%|█▋        | 86/500 [00:03<00:09, 42.02call/s]API calls:  18%|█▊        | 91/500 [00:04<00:14, 29.11call/s]API calls:  19%|█▉        | 97/500 [00:04<00:11, 33.76call/s]API calls:  20%|██        | 102/500 [00:04<00:16, 23.95call/s]API calls:  21%|██        | 106/500 [00:06<00:47,  8.30call/s]API calls:  22%|██▁       | 109/500 [00:06<00:45,  8.62call/s]API calls:  22%|██▁       | 111/500 [00:06<00:43,  8.97call/s]API calls:  23%|██▎       | 113/500 [00:06<00:41,  9.25call/s]API calls:  23%|██▎       | 116/500 [00:06<00:37, 10.33call/s]API calls:  24%|██▎       | 118/500 [00:07<00:41,  9.23call/s]API calls:  24%|██▁       | 121/500 [00:07<00:32, 11.75call/s]API calls:  25%|██▁       | 123/500 [00:07<00:33, 11.12call/s]API calls:  25%|██▌       | 125/500 [00:07<00:35, 10.68call/s]API calls:  25%|██▌       | 127/500 [00:08<00:37, 10.02call/s]API calls:  26%|██▌       | 129/500 [00:08<00:33, 10.98call/s]API calls:  26%|██▋       | 132/500 [00:08<00:27, 13.44call/s]API calls:  27%|██▋       | 134/500 [00:08<00:33, 10.83call/s]API calls:  27%|██▋       | 137/500 [00:08<00:27, 13.05call/s]API calls:  28%|██▊       | 140/500 [00:08<00:23, 15.02call/s]API calls:  29%|██▉       | 146/500 [00:09<00:19, 18.01call/s]API calls:  30%|███       | 151/500 [00:09<00:19, 17.66call/s]
  MIOnlyStopping:   5%|▌         | 1/20 [00:09<02:59,  9.45s/it][A
  MIOnlyStopping:   5%|▌         | 1/20 [00:09<02:59,  9.45s/it, acc=0%, turns=1.0][A
  MIOnlyStopping:  10%|█         | 2/20 [00:09<02:50,  9.45s/it, acc=0%, turns=1.0][AAPI calls:  31%|███       | 155/500 [00:09<00:20, 17.16call/s]API calls:  31%|███▁      | 157/500 [00:09<00:25, 13.67call/s]API calls:  32%|███▁      | 159/500 [00:10<00:28, 12.08call/s]
  MIOnlyStopping:  15%|█▌        | 3/20 [00:10<00:47,  2.77s/it, acc=0%, turns=1.0][A
  MIOnlyStopping:  15%|█▌        | 3/20 [00:10<00:47,  2.77s/it, acc=0%, turns=1.0][AAPI calls:  33%|███▎      | 163/500 [00:10<00:21, 15.72call/s]
  MIOnlyStopping:  20%|██        | 4/20 [00:10<00:44,  2.77s/it, acc=0%, turns=1.0][AAPI calls:  34%|███▎      | 168/500 [00:10<00:15, 21.05call/s]API calls:  35%|███▁      | 173/500 [00:10<00:13, 24.09call/s]API calls:  35%|███▌      | 176/500 [00:10<00:18, 17.45call/s]
  MIOnlyStopping:  25%|██▌       | 5/20 [00:11<00:22,  1.53s/it, acc=0%, turns=1.0][A
  MIOnlyStopping:  25%|██▌       | 5/20 [00:11<00:22,  1.53s/it, acc=0%, turns=1.0][AAPI calls:  37%|███▋      | 183/500 [00:11<00:13, 22.78call/s]API calls:  37%|███▋      | 187/500 [00:11<00:14, 21.34call/s]API calls:  38%|███▊      | 190/500 [00:11<00:19, 16.22call/s]API calls:  38%|███▊      | 192/500 [00:11<00:19, 16.20call/s]
  MIOnlyStopping:  30%|███       | 6/20 [00:11<00:18,  1.33s/it, acc=0%, turns=1.0][A
  MIOnlyStopping:  30%|███       | 6/20 [00:11<00:18,  1.33s/it, acc=0%, turns=1.0][AAPI calls:  39%|███▉      | 195/500 [00:11<00:17, 17.22call/s]
  MIOnlyStopping:  35%|███▌      | 7/20 [00:12<00:13,  1.02s/it, acc=0%, turns=1.0][A
  MIOnlyStopping:  35%|███▌      | 7/20 [00:12<00:13,  1.02s/it, acc=0%, turns=1.0][AAPI calls:  40%|███▉      | 199/500 [00:12<00:14, 20.36call/s]API calls:  40%|████      | 202/500 [00:12<00:14, 20.85call/s]API calls:  41%|████      | 206/500 [00:12<00:12, 23.76call/s]API calls:  42%|████▁     | 211/500 [00:12<00:10, 27.19call/s]
  MIOnlyStopping:  40%|████      | 8/20 [00:12<00:10,  1.13it/s, acc=0%, turns=1.0][A
  MIOnlyStopping:  40%|████      | 8/20 [00:12<00:10,  1.13it/s, acc=0%, turns=1.0][AAPI calls:  43%|████▎     | 214/500 [00:12<00:12, 22.36call/s]API calls:  43%|████▎     | 217/500 [00:12<00:14, 19.01call/s]API calls:  44%|████▁     | 220/500 [00:13<00:22, 12.30call/s]API calls:  45%|████▁     | 223/500 [00:13<00:21, 12.83call/s]API calls:  45%|████▌     | 225/500 [00:13<00:24, 11.46call/s]
  MIOnlyStopping:  45%|████▌     | 9/20 [00:13<00:11,  1.01s/it, acc=0%, turns=1.0][A
  MIOnlyStopping:  45%|████▌     | 9/20 [00:13<00:11,  1.01s/it, acc=0%, turns=1.0][AAPI calls:  45%|████▌     | 227/500 [00:14<00:25, 10.83call/s]API calls:  46%|████▌     | 229/500 [00:14<00:30,  8.89call/s]
  MIOnlyStopping:  50%|█████     | 10/20 [00:14<00:08,  1.15it/s, acc=0%, turns=1.0][A
  MIOnlyStopping:  50%|█████     | 10/20 [00:14<00:08,  1.15it/s, acc=0%, turns=1.0][A
  MIOnlyStopping:  55%|█████▌    | 11/20 [00:14<00:05,  1.56it/s, acc=0%, turns=1.0][A
  MIOnlyStopping:  55%|█████▌    | 11/20 [00:14<00:05,  1.56it/s, acc=0%, turns=1.0][AAPI calls:  46%|████▌     | 231/500 [00:14<00:26,  9.97call/s]
  MIOnlyStopping:  60%|██████    | 12/20 [00:14<00:05,  1.56it/s, acc=0%, turns=1.0][AAPI calls:  47%|████▋     | 233/500 [00:14<00:25, 10.49call/s]
  MIOnlyStopping:  65%|██████▌   | 13/20 [00:14<00:02,  2.54it/s, acc=0%, turns=1.0][A
  MIOnlyStopping:  65%|██████▌   | 13/20 [00:14<00:02,  2.54it/s, acc=0%, turns=1.0][A
  MIOnlyStopping:  70%|███████   | 14/20 [00:14<00:01,  3.06it/s, acc=0%, turns=1.0][A
  MIOnlyStopping:  70%|███████   | 14/20 [00:14<00:01,  3.06it/s, acc=0%, turns=1.0][AAPI calls:  47%|████▋     | 235/500 [00:14<00:24, 10.99call/s]
  MIOnlyStopping:  75%|███████▌  | 15/20 [00:14<00:01,  3.06it/s, acc=0%, turns=1.0][AAPI calls:  47%|████▋     | 237/500 [00:15<00:34,  7.70call/s]
  MIOnlyStopping:  80%|████████  | 16/20 [00:15<00:01,  3.41it/s, acc=0%, turns=1.0][A
  MIOnlyStopping:  80%|████████  | 16/20 [00:15<00:01,  3.41it/s, acc=0%, turns=1.0][AAPI calls:  48%|████▊     | 238/500 [00:15<00:40,  6.52call/s]API calls:  48%|████▊     | 239/500 [00:15<00:43,  6.00call/s]
  MIOnlyStopping:  85%|████████▌ | 17/20 [00:15<00:01,  2.96it/s, acc=0%, turns=1.0][A
  MIOnlyStopping:  85%|████████▌ | 17/20 [00:15<00:01,  2.96it/s, acc=0%, turns=1.0][AAPI calls:  48%|████▊     | 240/500 [00:17<01:48,  2.41call/s]
  MIOnlyStopping:  90%|█████████ | 18/20 [00:17<00:01,  1.74it/s, acc=0%, turns=1.0][A
  MIOnlyStopping:  90%|█████████ | 18/20 [00:17<00:01,  1.74it/s, acc=0%, turns=1.0][AAPI calls:  48%|████▊     | 241/500 [00:17<01:48,  2.38call/s]API calls:  48%|████▊     | 242/500 [00:17<01:29,  2.88call/s]API calls:  49%|████▊     | 243/500 [00:17<01:18,  3.27call/s]
  MIOnlyStopping:  95%|█████████▌| 19/20 [00:17<00:00,  1.54it/s, acc=0%, turns=1.0][A
  MIOnlyStopping:  95%|█████████▌| 19/20 [00:17<00:00,  1.54it/s, acc=0%, turns=1.0][AAPI calls:  49%|████▉     | 245/500 [00:18<01:01,  4.17call/s]API calls:  49%|████▉     | 247/500 [00:19<01:46,  2.36call/s]API calls:  50%|████▉     | 248/500 [00:22<03:36,  1.16call/s]API calls:  50%|████▉     | 249/500 [00:22<02:51,  1.46call/s]API calls:  50%|█████     | 251/500 [00:23<03:03,  1.36call/s]API calls:  50%|█████     | 252/500 [00:24<03:19,  1.24call/s]API calls:  51%|█████     | 253/500 [00:25<03:11,  1.29call/s]API calls:  51%|█████     | 254/500 [00:26<03:25,  1.20call/s]API calls:  51%|█████     | 255/500 [00:28<05:09,  1.26s/call]API calls:  51%|█████▁    | 257/500 [00:29<03:44,  1.08call/s]API calls:  52%|█████▁    | 259/500 [00:30<03:04,  1.31call/s]API calls:  52%|█████▁    | 260/500 [00:31<02:59,  1.34call/s]API calls:  52%|█████▁    | 261/500 [00:34<04:52,  1.22s/call]API calls:  52%|█████▁    | 262/500 [00:35<04:13,  1.07s/call]API calls:  53%|█████▎    | 264/500 [00:35<02:58,  1.32call/s]API calls:  53%|█████▎    | 265/500 [00:35<02:27,  1.59call/s]API calls:  53%|█████▎    | 266/500 [00:37<03:44,  1.04call/s]
  MIOnlyStopping: 100%|██████████| 20/20 [00:37<00:00,  5.85s/it, acc=0%, turns=1.0][A
  MIOnlyStopping: 100%|██████████| 20/20 [00:37<00:00,  5.85s/it, acc=0%, turns=1.1][A
                                                                                    [AAPI calls:  53%|█████▎    | 266/500 [00:37<00:33,  7.02call/s]
  Results: Accuracy=0.00% [0.00%, 0.00%], Avg Turns=1.1 [1.0, 1.3]

==========================================================================================
COMPARISON RESULTS
==========================================================================================
Method                      Accuracy           95% CI  Avg Turns           95% CI
------------------------------------------------------------------------------------------
MIOnlyStopping                 0.00%    [0.00%,0.00%]        1.1        [1.0,1.3]
==========================================================================================

Total API usage:
  Prompt tokens: 39,809
  Completion tokens: 36,369
  Total tokens: 76,178
