Warning: You are sending unauthenticated requests to the HF Hub. Please set a HF_TOKEN to enable higher rate limits and faster downloads.

============================================================
RRMC Experiment: sp_methods/mi_only_min3
============================================================
Initializing LLM: qwen/qwen-2.5-7b-instruct (max_workers=32)
Task: situation_puzzles
Data: /root/RRMC/AR-Bench/data/sp/test.json
Loading weights:   0%|          | 0/103 [00:00<?, ?it/s]Loading weights:   1%|          | 1/103 [00:00<00:00, 14716.86it/s, Materializing param=embeddings.LayerNorm.bias]Loading weights:   1%|          | 1/103 [00:00<00:00, 2666.44it/s, Materializing param=embeddings.LayerNorm.bias] Loading weights:   2%|▁         | 2/103 [00:00<00:00, 1445.81it/s, Materializing param=embeddings.LayerNorm.weight]Loading weights:   2%|▁         | 2/103 [00:00<00:00, 1256.72it/s, Materializing param=embeddings.LayerNorm.weight]Loading weights:   3%|▎         | 3/103 [00:00<00:00, 1720.39it/s, Materializing param=embeddings.position_embeddings.weight]Loading weights:   3%|▎         | 3/103 [00:00<00:00, 1661.33it/s, Materializing param=embeddings.position_embeddings.weight]Loading weights:   4%|▁         | 4/103 [00:00<00:00, 2057.04it/s, Materializing param=embeddings.token_type_embeddings.weight]Loading weights:   4%|▁         | 4/103 [00:00<00:00, 1982.89it/s, Materializing param=embeddings.token_type_embeddings.weight]Loading weights:   5%|▁         | 5/103 [00:00<00:00, 2319.86it/s, Materializing param=embeddings.word_embeddings.weight]      Loading weights:   5%|▁         | 5/103 [00:00<00:00, 2260.84it/s, Materializing param=embeddings.word_embeddings.weight]Loading weights:   6%|▌         | 6/103 [00:00<00:00, 2567.42it/s, Materializing param=encoder.layer.0.attention.output.LayerNorm.bias]Loading weights:   6%|▌         | 6/103 [00:00<00:00, 2507.06it/s, Materializing param=encoder.layer.0.attention.output.LayerNorm.bias]Loading weights:   7%|▋         | 7/103 [00:00<00:00, 2775.58it/s, Materializing param=encoder.layer.0.attention.output.LayerNorm.weight]Loading weights:   7%|▋         | 7/103 [00:00<00:00, 2717.52it/s, Materializing param=encoder.layer.0.attention.output.LayerNorm.weight]Loading weights:   8%|▊         | 8/103 [00:00<00:00, 2946.47it/s, Materializing param=encoder.layer.0.attention.output.dense.bias]      Loading weights:   8%|▊         | 8/103 [00:00<00:00, 2313.78it/s, Materializing param=encoder.layer.0.attention.output.dense.bias]Loading weights:   9%|▊         | 9/103 [00:00<00:00, 2114.78it/s, Materializing param=encoder.layer.0.attention.output.dense.weight]Loading weights:   9%|▊         | 9/103 [00:00<00:00, 2049.67it/s, Materializing param=encoder.layer.0.attention.output.dense.weight]Loading weights:  10%|▉         | 10/103 [00:00<00:00, 1930.55it/s, Materializing param=encoder.layer.0.attention.self.key.bias]     Loading weights:  10%|▉         | 10/103 [00:00<00:00, 1799.82it/s, Materializing param=encoder.layer.0.attention.self.key.bias]Loading weights:  11%|█         | 11/103 [00:00<00:00, 1826.93it/s, Materializing param=encoder.layer.0.attention.self.key.weight]Loading weights:  11%|█         | 11/103 [00:00<00:00, 1788.82it/s, Materializing param=encoder.layer.0.attention.self.key.weight]Loading weights:  12%|█▁        | 12/103 [00:00<00:00, 1830.04it/s, Materializing param=encoder.layer.0.attention.self.query.bias]Loading weights:  12%|█▁        | 12/103 [00:00<00:00, 1760.34it/s, Materializing param=encoder.layer.0.attention.self.query.bias]Loading weights:  13%|█▎        | 13/103 [00:00<00:00, 1826.54it/s, Materializing param=encoder.layer.0.attention.self.query.weight]Loading weights:  13%|█▎        | 13/103 [00:00<00:00, 1780.38it/s, Materializing param=encoder.layer.0.attention.self.query.weight]Loading weights:  14%|█▎        | 14/103 [00:00<00:00, 1763.00it/s, Materializing param=encoder.layer.0.attention.self.value.bias]  Loading weights:  14%|█▎        | 14/103 [00:00<00:00, 1708.62it/s, Materializing param=encoder.layer.0.attention.self.value.bias]Loading weights:  15%|█▁        | 15/103 [00:00<00:00, 1712.99it/s, Materializing param=encoder.layer.0.attention.self.value.weight]Loading weights:  15%|█▁        | 15/103 [00:00<00:00, 1688.48it/s, Materializing param=encoder.layer.0.attention.self.value.weight]Loading weights:  16%|█▌        | 16/103 [00:00<00:00, 1722.42it/s, Materializing param=encoder.layer.0.intermediate.dense.bias]    Loading weights:  16%|█▌        | 16/103 [00:00<00:00, 1514.94it/s, Materializing param=encoder.layer.0.intermediate.dense.bias]Loading weights:  17%|█▋        | 17/103 [00:00<00:00, 1527.42it/s, Materializing param=encoder.layer.0.intermediate.dense.weight]Loading weights:  17%|█▋        | 17/103 [00:00<00:00, 1447.75it/s, Materializing param=encoder.layer.0.intermediate.dense.weight]Loading weights:  17%|█▋        | 18/103 [00:00<00:00, 1404.79it/s, Materializing param=encoder.layer.0.output.LayerNorm.bias]    Loading weights:  17%|█▋        | 18/103 [00:00<00:00, 1352.93it/s, Materializing param=encoder.layer.0.output.LayerNorm.bias]Loading weights:  18%|█▊        | 19/103 [00:00<00:00, 1325.17it/s, Materializing param=encoder.layer.0.output.LayerNorm.weight]Loading weights:  18%|█▊        | 19/103 [00:00<00:00, 1313.46it/s, Materializing param=encoder.layer.0.output.LayerNorm.weight]Loading weights:  19%|█▉        | 20/103 [00:00<00:00, 1342.24it/s, Materializing param=encoder.layer.0.output.dense.bias]      Loading weights:  19%|█▉        | 20/103 [00:00<00:00, 1300.62it/s, Materializing param=encoder.layer.0.output.dense.bias]Loading weights:  20%|██        | 21/103 [00:00<00:00, 1319.16it/s, Materializing param=encoder.layer.0.output.dense.weight]Loading weights:  20%|██        | 21/103 [00:00<00:00, 1257.54it/s, Materializing param=encoder.layer.0.output.dense.weight]Loading weights:  21%|██▁       | 22/103 [00:00<00:00, 1254.18it/s, Materializing param=encoder.layer.1.attention.output.LayerNorm.bias]Loading weights:  21%|██▁       | 22/103 [00:00<00:00, 1211.02it/s, Materializing param=encoder.layer.1.attention.output.LayerNorm.bias]Loading weights:  22%|██▁       | 23/103 [00:00<00:00, 1227.17it/s, Materializing param=encoder.layer.1.attention.output.LayerNorm.weight]Loading weights:  22%|██▁       | 23/103 [00:00<00:00, 1200.80it/s, Materializing param=encoder.layer.1.attention.output.LayerNorm.weight]Loading weights:  23%|██▎       | 24/103 [00:00<00:00, 1233.20it/s, Materializing param=encoder.layer.1.attention.output.dense.bias]      Loading weights:  23%|██▎       | 24/103 [00:00<00:00, 1220.72it/s, Materializing param=encoder.layer.1.attention.output.dense.bias]Loading weights:  24%|██▁       | 25/103 [00:00<00:00, 1246.24it/s, Materializing param=encoder.layer.1.attention.output.dense.weight]Loading weights:  24%|██▁       | 25/103 [00:00<00:00, 1236.05it/s, Materializing param=encoder.layer.1.attention.output.dense.weight]Loading weights:  25%|██▌       | 26/103 [00:00<00:00, 1269.91it/s, Materializing param=encoder.layer.1.attention.self.key.bias]      Loading weights:  25%|██▌       | 26/103 [00:00<00:00, 1262.67it/s, Materializing param=encoder.layer.1.attention.self.key.bias]Loading weights:  26%|██▌       | 27/103 [00:00<00:00, 1296.41it/s, Materializing param=encoder.layer.1.attention.self.key.weight]Loading weights:  26%|██▌       | 27/103 [00:00<00:00, 1288.70it/s, Materializing param=encoder.layer.1.attention.self.key.weight]Loading weights:  27%|██▋       | 28/103 [00:00<00:00, 1323.91it/s, Materializing param=encoder.layer.1.attention.self.query.bias]Loading weights:  27%|██▋       | 28/103 [00:00<00:00, 1317.32it/s, Materializing param=encoder.layer.1.attention.self.query.bias]Loading weights:  28%|██▊       | 29/103 [00:00<00:00, 1352.49it/s, Materializing param=encoder.layer.1.attention.self.query.weight]Loading weights:  28%|██▊       | 29/103 [00:00<00:00, 1345.64it/s, Materializing param=encoder.layer.1.attention.self.query.weight]Loading weights:  29%|██▉       | 30/103 [00:00<00:00, 1377.32it/s, Materializing param=encoder.layer.1.attention.self.value.bias]  Loading weights:  29%|██▉       | 30/103 [00:00<00:00, 1370.18it/s, Materializing param=encoder.layer.1.attention.self.value.bias]Loading weights:  30%|███       | 31/103 [00:00<00:00, 1403.61it/s, Materializing param=encoder.layer.1.attention.self.value.weight]Loading weights:  30%|███       | 31/103 [00:00<00:00, 1397.26it/s, Materializing param=encoder.layer.1.attention.self.value.weight]Loading weights:  31%|███       | 32/103 [00:00<00:00, 1430.24it/s, Materializing param=encoder.layer.1.intermediate.dense.bias]    Loading weights:  31%|███       | 32/103 [00:00<00:00, 1423.73it/s, Materializing param=encoder.layer.1.intermediate.dense.bias]Loading weights:  32%|███▁      | 33/103 [00:00<00:00, 1455.96it/s, Materializing param=encoder.layer.1.intermediate.dense.weight]Loading weights:  32%|███▁      | 33/103 [00:00<00:00, 1447.81it/s, Materializing param=encoder.layer.1.intermediate.dense.weight]Loading weights:  33%|███▎      | 34/103 [00:00<00:00, 1479.20it/s, Materializing param=encoder.layer.1.output.LayerNorm.bias]    Loading weights:  33%|███▎      | 34/103 [00:00<00:00, 1472.80it/s, Materializing param=encoder.layer.1.output.LayerNorm.bias]Loading weights:  34%|███▁      | 35/103 [00:00<00:00, 1504.04it/s, Materializing param=encoder.layer.1.output.LayerNorm.weight]Loading weights:  34%|███▁      | 35/103 [00:00<00:00, 1497.58it/s, Materializing param=encoder.layer.1.output.LayerNorm.weight]Loading weights:  35%|███▁      | 36/103 [00:00<00:00, 1528.29it/s, Materializing param=encoder.layer.1.output.dense.bias]      Loading weights:  35%|███▁      | 36/103 [00:00<00:00, 1521.87it/s, Materializing param=encoder.layer.1.output.dense.bias]Loading weights:  36%|███▌      | 37/103 [00:00<00:00, 1550.00it/s, Materializing param=encoder.layer.1.output.dense.weight]Loading weights:  36%|███▌      | 37/103 [00:00<00:00, 1543.23it/s, Materializing param=encoder.layer.1.output.dense.weight]Loading weights:  37%|███▋      | 38/103 [00:00<00:00, 1572.96it/s, Materializing param=encoder.layer.2.attention.output.LayerNorm.bias]Loading weights:  37%|███▋      | 38/103 [00:00<00:00, 1566.39it/s, Materializing param=encoder.layer.2.attention.output.LayerNorm.bias]Loading weights:  38%|███▊      | 39/103 [00:00<00:00, 1595.29it/s, Materializing param=encoder.layer.2.attention.output.LayerNorm.weight]Loading weights:  38%|███▊      | 39/103 [00:00<00:00, 1588.71it/s, Materializing param=encoder.layer.2.attention.output.LayerNorm.weight]Loading weights:  39%|███▉      | 40/103 [00:00<00:00, 1615.94it/s, Materializing param=encoder.layer.2.attention.output.dense.bias]      Loading weights:  39%|███▉      | 40/103 [00:00<00:00, 1608.60it/s, Materializing param=encoder.layer.2.attention.output.dense.bias]Loading weights:  40%|███▉      | 41/103 [00:00<00:00, 1636.14it/s, Materializing param=encoder.layer.2.attention.output.dense.weight]Loading weights:  40%|███▉      | 41/103 [00:00<00:00, 1629.72it/s, Materializing param=encoder.layer.2.attention.output.dense.weight]Loading weights:  41%|████      | 42/103 [00:00<00:00, 1656.38it/s, Materializing param=encoder.layer.2.attention.self.key.bias]      Loading weights:  41%|████      | 42/103 [00:00<00:00, 1649.66it/s, Materializing param=encoder.layer.2.attention.self.key.bias]Loading weights:  42%|████▁     | 43/103 [00:00<00:00, 1676.55it/s, Materializing param=encoder.layer.2.attention.self.key.weight]Loading weights:  42%|████▁     | 43/103 [00:00<00:00, 1668.47it/s, Materializing param=encoder.layer.2.attention.self.key.weight]Loading weights:  43%|████▎     | 44/103 [00:00<00:00, 1694.53it/s, Materializing param=encoder.layer.2.attention.self.query.bias]Loading weights:  43%|████▎     | 44/103 [00:00<00:00, 1687.19it/s, Materializing param=encoder.layer.2.attention.self.query.bias]Loading weights:  44%|████▎     | 45/103 [00:00<00:00, 1712.97it/s, Materializing param=encoder.layer.2.attention.self.query.weight]Loading weights:  44%|████▎     | 45/103 [00:00<00:00, 1706.39it/s, Materializing param=encoder.layer.2.attention.self.query.weight]Loading weights:  45%|████▁     | 46/103 [00:00<00:00, 1732.05it/s, Materializing param=encoder.layer.2.attention.self.value.bias]  Loading weights:  45%|████▁     | 46/103 [00:00<00:00, 1725.48it/s, Materializing param=encoder.layer.2.attention.self.value.bias]Loading weights:  46%|████▌     | 47/103 [00:00<00:00, 1748.12it/s, Materializing param=encoder.layer.2.attention.self.value.weight]Loading weights:  46%|████▌     | 47/103 [00:00<00:00, 1741.41it/s, Materializing param=encoder.layer.2.attention.self.value.weight]Loading weights:  47%|████▋     | 48/103 [00:00<00:00, 1766.18it/s, Materializing param=encoder.layer.2.intermediate.dense.bias]    Loading weights:  47%|████▋     | 48/103 [00:00<00:00, 1759.76it/s, Materializing param=encoder.layer.2.intermediate.dense.bias]Loading weights:  48%|████▊     | 49/103 [00:00<00:00, 1784.45it/s, Materializing param=encoder.layer.2.intermediate.dense.weight]Loading weights:  48%|████▊     | 49/103 [00:00<00:00, 1777.92it/s, Materializing param=encoder.layer.2.intermediate.dense.weight]Loading weights:  49%|████▊     | 50/103 [00:00<00:00, 1801.04it/s, Materializing param=encoder.layer.2.output.LayerNorm.bias]    Loading weights:  49%|████▊     | 50/103 [00:00<00:00, 1793.92it/s, Materializing param=encoder.layer.2.output.LayerNorm.bias]Loading weights:  50%|████▉     | 51/103 [00:00<00:00, 1817.58it/s, Materializing param=encoder.layer.2.output.LayerNorm.weight]Loading weights:  50%|████▉     | 51/103 [00:00<00:00, 1811.07it/s, Materializing param=encoder.layer.2.output.LayerNorm.weight]Loading weights:  50%|█████     | 52/103 [00:00<00:00, 1834.79it/s, Materializing param=encoder.layer.2.output.dense.bias]      Loading weights:  50%|█████     | 52/103 [00:00<00:00, 1828.46it/s, Materializing param=encoder.layer.2.output.dense.bias]Loading weights:  51%|█████▁    | 53/103 [00:00<00:00, 1851.84it/s, Materializing param=encoder.layer.2.output.dense.weight]Loading weights:  51%|█████▁    | 53/103 [00:00<00:00, 1843.74it/s, Materializing param=encoder.layer.2.output.dense.weight]Loading weights:  52%|█████▁    | 54/103 [00:00<00:00, 1866.02it/s, Materializing param=encoder.layer.3.attention.output.LayerNorm.bias]Loading weights:  52%|█████▁    | 54/103 [00:00<00:00, 1856.53it/s, Materializing param=encoder.layer.3.attention.output.LayerNorm.bias]Loading weights:  53%|█████▎    | 55/103 [00:00<00:00, 1878.22it/s, Materializing param=encoder.layer.3.attention.output.LayerNorm.weight]Loading weights:  53%|█████▎    | 55/103 [00:00<00:00, 1871.74it/s, Materializing param=encoder.layer.3.attention.output.LayerNorm.weight]Loading weights:  54%|█████▁    | 56/103 [00:00<00:00, 1893.79it/s, Materializing param=encoder.layer.3.attention.output.dense.bias]      Loading weights:  54%|█████▁    | 56/103 [00:00<00:00, 1887.43it/s, Materializing param=encoder.layer.3.attention.output.dense.bias]Loading weights:  55%|█████▌    | 57/103 [00:00<00:00, 1906.12it/s, Materializing param=encoder.layer.3.attention.output.dense.weight]Loading weights:  55%|█████▌    | 57/103 [00:00<00:00, 1899.52it/s, Materializing param=encoder.layer.3.attention.output.dense.weight]Loading weights:  56%|█████▋    | 58/103 [00:00<00:00, 1920.98it/s, Materializing param=encoder.layer.3.attention.self.key.bias]      Loading weights:  56%|█████▋    | 58/103 [00:00<00:00, 1914.65it/s, Materializing param=encoder.layer.3.attention.self.key.bias]Loading weights:  57%|█████▋    | 59/103 [00:00<00:00, 1933.19it/s, Materializing param=encoder.layer.3.attention.self.key.weight]Loading weights:  57%|█████▋    | 59/103 [00:00<00:00, 1926.21it/s, Materializing param=encoder.layer.3.attention.self.key.weight]Loading weights:  58%|█████▊    | 60/103 [00:00<00:00, 1944.97it/s, Materializing param=encoder.layer.3.attention.self.query.bias]Loading weights:  58%|█████▊    | 60/103 [00:00<00:00, 1938.49it/s, Materializing param=encoder.layer.3.attention.self.query.bias]Loading weights:  59%|█████▉    | 61/103 [00:00<00:00, 1959.01it/s, Materializing param=encoder.layer.3.attention.self.query.weight]Loading weights:  59%|█████▉    | 61/103 [00:00<00:00, 1952.85it/s, Materializing param=encoder.layer.3.attention.self.query.weight]Loading weights:  60%|██████    | 62/103 [00:00<00:00, 1973.09it/s, Materializing param=encoder.layer.3.attention.self.value.bias]  Loading weights:  60%|██████    | 62/103 [00:00<00:00, 1966.76it/s, Materializing param=encoder.layer.3.attention.self.value.bias]Loading weights:  61%|██████    | 63/103 [00:00<00:00, 1985.73it/s, Materializing param=encoder.layer.3.attention.self.value.weight]Loading weights:  61%|██████    | 63/103 [00:00<00:00, 1978.83it/s, Materializing param=encoder.layer.3.attention.self.value.weight]Loading weights:  62%|██████▁   | 64/103 [00:00<00:00, 1998.30it/s, Materializing param=encoder.layer.3.intermediate.dense.bias]    Loading weights:  62%|██████▁   | 64/103 [00:00<00:00, 1991.11it/s, Materializing param=encoder.layer.3.intermediate.dense.bias]Loading weights:  63%|██████▎   | 65/103 [00:00<00:00, 2010.62it/s, Materializing param=encoder.layer.3.intermediate.dense.weight]Loading weights:  63%|██████▎   | 65/103 [00:00<00:00, 2006.12it/s, Materializing param=encoder.layer.3.intermediate.dense.weight]Loading weights:  64%|██████▁   | 66/103 [00:00<00:00, 2027.17it/s, Materializing param=encoder.layer.3.output.LayerNorm.bias]    Loading weights:  64%|██████▁   | 66/103 [00:00<00:00, 2022.27it/s, Materializing param=encoder.layer.3.output.LayerNorm.bias]Loading weights:  65%|██████▌   | 67/103 [00:00<00:00, 2043.21it/s, Materializing param=encoder.layer.3.output.LayerNorm.weight]Loading weights:  65%|██████▌   | 67/103 [00:00<00:00, 2038.58it/s, Materializing param=encoder.layer.3.output.LayerNorm.weight]Loading weights:  66%|██████▌   | 68/103 [00:00<00:00, 2060.87it/s, Materializing param=encoder.layer.3.output.dense.bias]      Loading weights:  66%|██████▌   | 68/103 [00:00<00:00, 2056.45it/s, Materializing param=encoder.layer.3.output.dense.bias]Loading weights:  67%|██████▋   | 69/103 [00:00<00:00, 2078.64it/s, Materializing param=encoder.layer.3.output.dense.weight]Loading weights:  67%|██████▋   | 69/103 [00:00<00:00, 2074.29it/s, Materializing param=encoder.layer.3.output.dense.weight]Loading weights:  68%|██████▊   | 70/103 [00:00<00:00, 2096.36it/s, Materializing param=encoder.layer.4.attention.output.LayerNorm.bias]Loading weights:  68%|██████▊   | 70/103 [00:00<00:00, 2091.91it/s, Materializing param=encoder.layer.4.attention.output.LayerNorm.bias]Loading weights:  69%|██████▉   | 71/103 [00:00<00:00, 2113.58it/s, Materializing param=encoder.layer.4.attention.output.LayerNorm.weight]Loading weights:  69%|██████▉   | 71/103 [00:00<00:00, 2109.11it/s, Materializing param=encoder.layer.4.attention.output.LayerNorm.weight]Loading weights:  70%|██████▉   | 72/103 [00:00<00:00, 2128.35it/s, Materializing param=encoder.layer.4.attention.output.dense.bias]      Loading weights:  70%|██████▉   | 72/103 [00:00<00:00, 2123.76it/s, Materializing param=encoder.layer.4.attention.output.dense.bias]Loading weights:  71%|███████   | 73/103 [00:00<00:00, 2144.09it/s, Materializing param=encoder.layer.4.attention.output.dense.weight]Loading weights:  71%|███████   | 73/103 [00:00<00:00, 2138.96it/s, Materializing param=encoder.layer.4.attention.output.dense.weight]Loading weights:  72%|███████▁  | 74/103 [00:00<00:00, 2158.49it/s, Materializing param=encoder.layer.4.attention.self.key.bias]      Loading weights:  72%|███████▁  | 74/103 [00:00<00:00, 2153.25it/s, Materializing param=encoder.layer.4.attention.self.key.bias]Loading weights:  73%|███████▎  | 75/103 [00:00<00:00, 2172.55it/s, Materializing param=encoder.layer.4.attention.self.key.weight]Loading weights:  73%|███████▎  | 75/103 [00:00<00:00, 2167.29it/s, Materializing param=encoder.layer.4.attention.self.key.weight]Loading weights:  74%|███████▁  | 76/103 [00:00<00:00, 2190.33it/s, Materializing param=encoder.layer.4.attention.self.query.bias]Loading weights:  74%|███████▁  | 76/103 [00:00<00:00, 2187.71it/s, Materializing param=encoder.layer.4.attention.self.query.bias]Loading weights:  75%|███████▁  | 77/103 [00:00<00:00, 2211.85it/s, Materializing param=encoder.layer.4.attention.self.query.weight]Loading weights:  75%|███████▁  | 77/103 [00:00<00:00, 2209.48it/s, Materializing param=encoder.layer.4.attention.self.query.weight]Loading weights:  76%|███████▌  | 78/103 [00:00<00:00, 2233.57it/s, Materializing param=encoder.layer.4.attention.self.value.bias]  Loading weights:  76%|███████▌  | 78/103 [00:00<00:00, 2231.13it/s, Materializing param=encoder.layer.4.attention.self.value.bias]Loading weights:  77%|███████▋  | 79/103 [00:00<00:00, 2255.08it/s, Materializing param=encoder.layer.4.attention.self.value.weight]Loading weights:  77%|███████▋  | 79/103 [00:00<00:00, 2252.61it/s, Materializing param=encoder.layer.4.attention.self.value.weight]Loading weights:  78%|███████▊  | 80/103 [00:00<00:00, 2276.48it/s, Materializing param=encoder.layer.4.intermediate.dense.bias]    Loading weights:  78%|███████▊  | 80/103 [00:00<00:00, 2274.04it/s, Materializing param=encoder.layer.4.intermediate.dense.bias]Loading weights:  79%|███████▊  | 81/103 [00:00<00:00, 2297.88it/s, Materializing param=encoder.layer.4.intermediate.dense.weight]Loading weights:  79%|███████▊  | 81/103 [00:00<00:00, 2295.44it/s, Materializing param=encoder.layer.4.intermediate.dense.weight]Loading weights:  80%|███████▉  | 82/103 [00:00<00:00, 2319.19it/s, Materializing param=encoder.layer.4.output.LayerNorm.bias]    Loading weights:  80%|███████▉  | 82/103 [00:00<00:00, 2316.72it/s, Materializing param=encoder.layer.4.output.LayerNorm.bias]Loading weights:  81%|████████  | 83/103 [00:00<00:00, 2340.30it/s, Materializing param=encoder.layer.4.output.LayerNorm.weight]Loading weights:  81%|████████  | 83/103 [00:00<00:00, 2337.77it/s, Materializing param=encoder.layer.4.output.LayerNorm.weight]Loading weights:  82%|████████▁ | 84/103 [00:00<00:00, 2361.28it/s, Materializing param=encoder.layer.4.output.dense.bias]      Loading weights:  82%|████████▁ | 84/103 [00:00<00:00, 2358.75it/s, Materializing param=encoder.layer.4.output.dense.bias]Loading weights:  83%|████████▎ | 85/103 [00:00<00:00, 2381.65it/s, Materializing param=encoder.layer.4.output.dense.weight]Loading weights:  83%|████████▎ | 85/103 [00:00<00:00, 2378.87it/s, Materializing param=encoder.layer.4.output.dense.weight]Loading weights:  83%|████████▎ | 86/103 [00:00<00:00, 2402.00it/s, Materializing param=encoder.layer.5.attention.output.LayerNorm.bias]Loading weights:  83%|████████▎ | 86/103 [00:00<00:00, 2399.39it/s, Materializing param=encoder.layer.5.attention.output.LayerNorm.bias]Loading weights:  84%|████████▁ | 87/103 [00:00<00:00, 2421.89it/s, Materializing param=encoder.layer.5.attention.output.LayerNorm.weight]Loading weights:  84%|████████▁ | 87/103 [00:00<00:00, 2419.23it/s, Materializing param=encoder.layer.5.attention.output.LayerNorm.weight]Loading weights:  85%|████████▌ | 88/103 [00:00<00:00, 2442.13it/s, Materializing param=encoder.layer.5.attention.output.dense.bias]      Loading weights:  85%|████████▌ | 88/103 [00:00<00:00, 2439.55it/s, Materializing param=encoder.layer.5.attention.output.dense.bias]Loading weights:  86%|████████▋ | 89/103 [00:00<00:00, 2462.36it/s, Materializing param=encoder.layer.5.attention.output.dense.weight]Loading weights:  86%|████████▋ | 89/103 [00:00<00:00, 2459.79it/s, Materializing param=encoder.layer.5.attention.output.dense.weight]Loading weights:  87%|████████▋ | 90/103 [00:00<00:00, 2482.24it/s, Materializing param=encoder.layer.5.attention.self.key.bias]      Loading weights:  87%|████████▋ | 90/103 [00:00<00:00, 2479.62it/s, Materializing param=encoder.layer.5.attention.self.key.bias]Loading weights:  88%|████████▊ | 91/103 [00:00<00:00, 2502.14it/s, Materializing param=encoder.layer.5.attention.self.key.weight]Loading weights:  88%|████████▊ | 91/103 [00:00<00:00, 2499.54it/s, Materializing param=encoder.layer.5.attention.self.key.weight]Loading weights:  89%|████████▉ | 92/103 [00:00<00:00, 2522.07it/s, Materializing param=encoder.layer.5.attention.self.query.bias]Loading weights:  89%|████████▉ | 92/103 [00:00<00:00, 2519.40it/s, Materializing param=encoder.layer.5.attention.self.query.bias]Loading weights:  90%|█████████ | 93/103 [00:00<00:00, 2541.70it/s, Materializing param=encoder.layer.5.attention.self.query.weight]Loading weights:  90%|█████████ | 93/103 [00:00<00:00, 2539.04it/s, Materializing param=encoder.layer.5.attention.self.query.weight]Loading weights:  91%|█████████▁| 94/103 [00:00<00:00, 2560.82it/s, Materializing param=encoder.layer.5.attention.self.value.bias]  Loading weights:  91%|█████████▁| 94/103 [00:00<00:00, 2557.90it/s, Materializing param=encoder.layer.5.attention.self.value.bias]Loading weights:  92%|█████████▁| 95/103 [00:00<00:00, 2579.81it/s, Materializing param=encoder.layer.5.attention.self.value.weight]Loading weights:  92%|█████████▁| 95/103 [00:00<00:00, 2577.14it/s, Materializing param=encoder.layer.5.attention.self.value.weight]Loading weights:  93%|█████████▎| 96/103 [00:00<00:00, 2599.20it/s, Materializing param=encoder.layer.5.intermediate.dense.bias]    Loading weights:  93%|█████████▎| 96/103 [00:00<00:00, 2596.52it/s, Materializing param=encoder.layer.5.intermediate.dense.bias]Loading weights:  94%|█████████▁| 97/103 [00:00<00:00, 2618.59it/s, Materializing param=encoder.layer.5.intermediate.dense.weight]Loading weights:  94%|█████████▁| 97/103 [00:00<00:00, 2615.89it/s, Materializing param=encoder.layer.5.intermediate.dense.weight]Loading weights:  95%|█████████▌| 98/103 [00:00<00:00, 2637.86it/s, Materializing param=encoder.layer.5.output.LayerNorm.bias]    Loading weights:  95%|█████████▌| 98/103 [00:00<00:00, 2635.20it/s, Materializing param=encoder.layer.5.output.LayerNorm.bias]Loading weights:  96%|█████████▌| 99/103 [00:00<00:00, 2657.03it/s, Materializing param=encoder.layer.5.output.LayerNorm.weight]Loading weights:  96%|█████████▌| 99/103 [00:00<00:00, 2654.35it/s, Materializing param=encoder.layer.5.output.LayerNorm.weight]Loading weights:  97%|█████████▋| 100/103 [00:00<00:00, 2676.12it/s, Materializing param=encoder.layer.5.output.dense.bias]     Loading weights:  97%|█████████▋| 100/103 [00:00<00:00, 2673.06it/s, Materializing param=encoder.layer.5.output.dense.bias]Loading weights:  98%|█████████▊| 101/103 [00:00<00:00, 2694.54it/s, Materializing param=encoder.layer.5.output.dense.weight]Loading weights:  98%|█████████▊| 101/103 [00:00<00:00, 2691.80it/s, Materializing param=encoder.layer.5.output.dense.weight]Loading weights:  99%|█████████▉| 102/103 [00:00<00:00, 2713.28it/s, Materializing param=pooler.dense.bias]                  Loading weights:  99%|█████████▉| 102/103 [00:00<00:00, 2710.60it/s, Materializing param=pooler.dense.bias]Loading weights: 100%|██████████| 103/103 [00:00<00:00, 2731.81it/s, Materializing param=pooler.dense.weight]Loading weights: 100%|██████████| 103/103 [00:00<00:00, 2728.84it/s, Materializing param=pooler.dense.weight]Loading weights: 100%|██████████| 103/103 [00:00<00:00, 2722.90it/s, Materializing param=pooler.dense.weight]
[1mBertModel LOAD REPORT[0m from: sentence-transformers/all-MiniLM-L6-v2
Key                     | Status     |  | 
------------------------+------------+--+-
embeddings.position_ids | UNEXPECTED |  | 

[3mNotes:
- UNEXPECTED[3m	:can be ignored when loading from different task/architecture; not ok if you expect identical arch.[0m
API calls:   0%|          | 0/5000 [00:00<?, ?call/s]Evaluating 100 puzzles
Methods: ['mi_only']

============================================================
STARTING EVALUATION
============================================================

Evaluating MIOnlyStopping on 100 puzzles...

  MIOnlyStopping:   0%|          | 0/100 [00:00<?, ?it/s][AAPI calls:   0%|          | 1/5000 [00:01<2:12:59,  1.60s/call]API calls:   0%|          | 2/5000 [00:01<1:09:24,  1.20call/s]API calls:   0%|          | 4/5000 [00:02<29:26,  2.83call/s]  API calls:   0%|          | 9/5000 [00:02<10:46,  7.72call/s]API calls:   0%|          | 18/5000 [00:02<04:34, 18.17call/s]API calls:   1%|          | 27/5000 [00:02<02:58, 27.87call/s]API calls:   1%|          | 39/5000 [00:02<02:02, 40.37call/s]API calls:   1%|          | 48/5000 [00:02<01:40, 49.09call/s]API calls:   1%|          | 55/5000 [00:02<01:44, 47.16call/s]API calls:   1%|          | 61/5000 [00:02<01:45, 46.76call/s]API calls:   1%|▁         | 67/5000 [00:03<01:56, 42.50call/s]API calls:   1%|▁         | 72/5000 [00:03<02:38, 31.18call/s]API calls:   2%|▁         | 76/5000 [00:03<02:30, 32.67call/s]API calls:   2%|▁         | 80/5000 [00:03<03:14, 25.35call/s]API calls:   2%|▁         | 84/5000 [00:04<03:36, 22.70call/s]API calls:   2%|▁         | 88/5000 [00:04<03:18, 24.71call/s]API calls:   2%|▁         | 91/5000 [00:04<03:34, 22.84call/s]API calls:   2%|▁         | 100/5000 [00:04<02:27, 33.29call/s]API calls:   2%|▁         | 107/5000 [00:04<02:24, 33.91call/s]API calls:   2%|▁         | 111/5000 [00:04<03:10, 25.73call/s]API calls:   2%|▁         | 116/5000 [00:05<02:47, 29.23call/s]API calls:   2%|▁         | 121/5000 [00:05<02:29, 32.72call/s]API calls:   2%|▎         | 125/5000 [00:05<03:47, 21.45call/s]API calls:   3%|▎         | 129/5000 [00:05<03:28, 23.40call/s]API calls:   3%|▎         | 135/5000 [00:05<02:42, 29.95call/s]API calls:   3%|▎         | 139/5000 [00:05<02:55, 27.66call/s]API calls:   3%|▎         | 143/5000 [00:06<02:59, 27.00call/s]API calls:   3%|▎         | 147/5000 [00:06<02:53, 27.91call/s]API calls:   3%|▎         | 151/5000 [00:06<03:14, 24.87call/s]API calls:   3%|▎         | 158/5000 [00:06<02:24, 33.61call/s]API calls:   3%|▎         | 164/5000 [00:06<02:11, 36.76call/s]API calls:   3%|▎         | 171/5000 [00:06<01:57, 41.20call/s]API calls:   4%|▎         | 176/5000 [00:07<02:15, 35.48call/s]API calls:   4%|▎         | 180/5000 [00:07<03:43, 21.56call/s]API calls:   4%|▎         | 184/5000 [00:07<03:20, 24.02call/s]API calls:   4%|▁         | 188/5000 [00:07<03:30, 22.85call/s]API calls:   4%|▁         | 194/5000 [00:07<02:46, 28.91call/s]API calls:   4%|▁         | 201/5000 [00:08<02:30, 31.88call/s]API calls:   4%|▁         | 205/5000 [00:08<02:48, 28.49call/s]API calls:   4%|▁         | 209/5000 [00:08<03:02, 26.31call/s]API calls:   4%|▁         | 213/5000 [00:08<03:13, 24.72call/s]API calls:   4%|▁         | 216/5000 [00:08<03:31, 22.64call/s]API calls:   4%|▁         | 222/5000 [00:08<02:51, 27.87call/s]API calls:   5%|▁         | 226/5000 [00:09<02:45, 28.93call/s]API calls:   5%|▁         | 230/5000 [00:09<02:44, 29.06call/s]API calls:   5%|▁         | 234/5000 [00:09<03:14, 24.54call/s]API calls:   5%|▁         | 237/5000 [00:09<03:23, 23.46call/s]API calls:   5%|▁         | 240/5000 [00:09<04:10, 19.01call/s]API calls:   5%|▁         | 243/5000 [00:09<03:59, 19.86call/s]API calls:   5%|▁         | 246/5000 [00:10<03:51, 20.54call/s]API calls:   5%|▁         | 249/5000 [00:10<04:54, 16.14call/s]API calls:   5%|▌         | 253/5000 [00:10<03:55, 20.12call/s]API calls:   5%|▌         | 258/5000 [00:10<03:03, 25.91call/s]API calls:   5%|▌         | 264/5000 [00:10<02:24, 32.73call/s]API calls:   5%|▌         | 270/5000 [00:10<02:05, 37.61call/s]API calls:   6%|▌         | 275/5000 [00:10<02:18, 34.21call/s]API calls:   6%|▌         | 279/5000 [00:11<02:34, 30.52call/s]
  MIOnlyStopping:   1%|          | 1/100 [00:11<18:28, 11.19s/it][A
  MIOnlyStopping:   1%|          | 1/100 [00:11<18:28, 11.19s/it, acc=100%, turns=1.0][A
  MIOnlyStopping:   2%|▁         | 2/100 [00:11<18:16, 11.19s/it, acc=100%, turns=1.0][A
  MIOnlyStopping:   3%|▎         | 3/100 [00:11<04:45,  2.95s/it, acc=100%, turns=1.0][A
  MIOnlyStopping:   3%|▎         | 3/100 [00:11<04:45,  2.95s/it, acc=100%, turns=1.0][AAPI calls:   6%|▌         | 283/5000 [00:11<02:48, 28.05call/s]
  MIOnlyStopping:   4%|▁         | 4/100 [00:11<04:42,  2.95s/it, acc=100%, turns=1.0][AAPI calls:   6%|▌         | 287/5000 [00:11<03:25, 22.97call/s]
  MIOnlyStopping:   5%|▌         | 5/100 [00:11<02:24,  1.52s/it, acc=100%, turns=1.0][A
  MIOnlyStopping:   5%|▌         | 5/100 [00:11<02:24,  1.52s/it, acc=100%, turns=1.0][AAPI calls:   6%|▌         | 292/5000 [00:11<02:56, 26.64call/s]
  MIOnlyStopping:   6%|▌         | 6/100 [00:11<02:23,  1.52s/it, acc=100%, turns=1.0][AAPI calls:   6%|▌         | 295/5000 [00:11<03:09, 24.89call/s]
  MIOnlyStopping:   7%|▋         | 7/100 [00:11<01:26,  1.08it/s, acc=100%, turns=1.0][A
  MIOnlyStopping:   7%|▋         | 7/100 [00:11<01:26,  1.08it/s, acc=100%, turns=1.0][AAPI calls:   6%|▌         | 298/5000 [00:12<04:20, 18.06call/s]API calls:   6%|▌         | 302/5000 [00:12<03:40, 21.33call/s]
  MIOnlyStopping:   8%|▊         | 8/100 [00:12<01:14,  1.23it/s, acc=100%, turns=1.0][A
  MIOnlyStopping:   8%|▊         | 8/100 [00:12<01:14,  1.23it/s, acc=100%, turns=1.0][AAPI calls:   6%|▌         | 308/5000 [00:12<03:00, 25.99call/s]
  MIOnlyStopping:   9%|▉         | 9/100 [00:12<00:59,  1.54it/s, acc=100%, turns=1.0][A
  MIOnlyStopping:   9%|▉         | 9/100 [00:12<00:59,  1.54it/s, acc=100%, turns=1.0][AAPI calls:   6%|▋         | 313/5000 [00:12<02:35, 30.13call/s]API calls:   6%|▋         | 318/5000 [00:12<02:23, 32.73call/s]API calls:   6%|▋         | 324/5000 [00:12<02:03, 37.80call/s]API calls:   7%|▋         | 329/5000 [00:12<02:12, 35.25call/s]
  MIOnlyStopping:  10%|█         | 10/100 [00:12<00:54,  1.64it/s, acc=100%, turns=1.0][A
  MIOnlyStopping:  10%|█         | 10/100 [00:12<00:54,  1.64it/s, acc=100%, turns=1.0][AAPI calls:   7%|▋         | 335/5000 [00:13<01:57, 39.62call/s]API calls:   7%|▋         | 342/5000 [00:13<01:39, 46.92call/s]
  MIOnlyStopping:  11%|█         | 11/100 [00:13<00:44,  2.01it/s, acc=100%, turns=1.0][A
  MIOnlyStopping:  11%|█         | 11/100 [00:13<00:44,  2.01it/s, acc=100%, turns=1.0][A
  MIOnlyStopping:  12%|█▁        | 12/100 [00:13<00:43,  2.01it/s, acc=100%, turns=1.0][A
  MIOnlyStopping:  13%|█▎        | 13/100 [00:13<00:43,  2.01it/s, acc=100%, turns=1.0][AAPI calls:   7%|▋         | 348/5000 [00:13<01:40, 46.46call/s]
  MIOnlyStopping:  14%|█▁        | 14/100 [00:13<00:21,  3.99it/s, acc=100%, turns=1.0][A
  MIOnlyStopping:  14%|█▁        | 14/100 [00:13<00:21,  3.99it/s, acc=100%, turns=1.0][AAPI calls:   7%|▋         | 354/5000 [00:13<01:41, 45.57call/s]API calls:   7%|▋         | 362/5000 [00:13<01:26, 53.54call/s]
  MIOnlyStopping:  15%|█▌        | 15/100 [00:13<00:21,  3.99it/s, acc=100%, turns=1.0][A
  MIOnlyStopping:  16%|█▌        | 16/100 [00:13<00:19,  4.42it/s, acc=100%, turns=1.0][A
  MIOnlyStopping:  16%|█▌        | 16/100 [00:13<00:19,  4.42it/s, acc=100%, turns=1.0][AAPI calls:   7%|▋         | 368/5000 [00:13<01:43, 44.74call/s]
  MIOnlyStopping:  17%|█▋        | 17/100 [00:13<00:17,  4.70it/s, acc=100%, turns=1.0][A
  MIOnlyStopping:  17%|█▋        | 17/100 [00:13<00:17,  4.70it/s, acc=100%, turns=1.0][AAPI calls:   7%|▋         | 373/5000 [00:13<01:53, 40.84call/s]API calls:   8%|▊         | 378/5000 [00:14<02:02, 37.72call/s]
  MIOnlyStopping:  18%|█▊        | 18/100 [00:14<00:19,  4.30it/s, acc=100%, turns=1.0][A
  MIOnlyStopping:  18%|█▊        | 18/100 [00:14<00:19,  4.30it/s, acc=100%, turns=1.0][AAPI calls:   8%|▊         | 383/5000 [00:14<01:59, 38.72call/s]API calls:   8%|▊         | 388/5000 [00:14<02:00, 38.29call/s]API calls:   8%|▊         | 397/5000 [00:14<01:33, 49.17call/s]
  MIOnlyStopping:  19%|█▉        | 19/100 [00:14<00:20,  4.03it/s, acc=100%, turns=1.0][A
  MIOnlyStopping:  19%|█▉        | 19/100 [00:14<00:20,  4.03it/s, acc=100%, turns=1.0][AAPI calls:   8%|▊         | 406/5000 [00:14<01:17, 58.93call/s]API calls:   8%|▊         | 415/5000 [00:14<01:10, 64.90call/s]
  MIOnlyStopping:  20%|██        | 20/100 [00:14<00:19,  4.11it/s, acc=100%, turns=1.0][A
  MIOnlyStopping:  20%|██        | 20/100 [00:14<00:19,  4.11it/s, acc=100%, turns=1.0][AAPI calls:   8%|▊         | 422/5000 [00:14<01:32, 49.49call/s]API calls:   8%|▊         | 424/5000 [00:14<01:48, 42.12call/s]API calls:   9%|▊         | 426/5000 [00:14<01:48, 42.12call/s]API calls:   9%|▊         | 436/5000 [00:15<01:37, 46.86call/s]
  MIOnlyStopping:  21%|██        | 21/100 [00:15<00:22,  3.53it/s, acc=100%, turns=1.0][A
  MIOnlyStopping:  21%|██        | 21/100 [00:15<00:22,  3.53it/s, acc=100%, turns=1.0][AAPI calls:   9%|▉         | 448/5000 [00:15<01:15, 60.04call/s]
  MIOnlyStopping:  22%|██▁       | 22/100 [00:15<00:18,  4.20it/s, acc=100%, turns=1.0][A
  MIOnlyStopping:  22%|██▁       | 22/100 [00:15<00:18,  4.20it/s, acc=100%, turns=1.0][AAPI calls:   9%|▉         | 455/5000 [00:15<01:19, 57.18call/s]
  MIOnlyStopping:  23%|██▎       | 23/100 [00:15<00:16,  4.73it/s, acc=100%, turns=1.0][A
  MIOnlyStopping:  23%|██▎       | 23/100 [00:15<00:16,  4.73it/s, acc=100%, turns=1.0][AAPI calls:   9%|▉         | 462/5000 [00:15<01:28, 51.52call/s]API calls:   9%|▉         | 468/5000 [00:15<01:43, 43.74call/s]
  MIOnlyStopping:  24%|██▁       | 24/100 [00:15<00:20,  3.77it/s, acc=100%, turns=1.0][A
  MIOnlyStopping:  24%|██▁       | 24/100 [00:15<00:20,  3.77it/s, acc=100%, turns=1.0][AAPI calls:   9%|▉         | 473/5000 [00:15<01:44, 43.44call/s]API calls:  10%|▉         | 478/5000 [00:15<01:50, 40.89call/s]API calls:  10%|▉         | 483/5000 [00:16<01:51, 40.58call/s]API calls:  10%|▉         | 488/5000 [00:16<01:51, 40.42call/s]API calls:  10%|▉         | 493/5000 [00:16<02:00, 37.55call/s]API calls:  10%|▉         | 497/5000 [00:16<02:01, 37.21call/s]API calls:  10%|█         | 501/5000 [00:16<02:16, 32.99call/s]API calls:  10%|█         | 506/5000 [00:16<02:03, 36.30call/s]API calls:  10%|█         | 510/5000 [00:16<02:01, 37.07call/s]API calls:  10%|█         | 518/5000 [00:16<01:42, 43.83call/s]API calls:  10%|█         | 525/5000 [00:17<01:32, 48.14call/s]API calls:  11%|█         | 530/5000 [00:17<01:56, 38.34call/s]API calls:  11%|█         | 535/5000 [00:17<02:56, 25.29call/s]API calls:  11%|█         | 539/5000 [00:17<03:06, 23.96call/s]API calls:  11%|█         | 542/5000 [00:18<03:44, 19.85call/s]API calls:  11%|█         | 546/5000 [00:18<03:30, 21.13call/s]API calls:  11%|█         | 550/5000 [00:18<03:06, 23.88call/s]API calls:  11%|█         | 553/5000 [00:18<03:08, 23.57call/s]API calls:  11%|█         | 558/5000 [00:18<02:41, 27.53call/s]API calls:  11%|█▁        | 563/5000 [00:18<02:25, 30.49call/s]API calls:  11%|█▁        | 569/5000 [00:18<02:07, 34.83call/s]API calls:  12%|█▁        | 579/5000 [00:19<01:35, 46.10call/s]API calls:  12%|█▁        | 584/5000 [00:19<01:41, 43.44call/s]API calls:  12%|█▁        | 589/5000 [00:19<01:41, 43.51call/s]API calls:  12%|█▁        | 595/5000 [00:19<01:36, 45.83call/s]API calls:  12%|█▁        | 600/5000 [00:19<01:53, 38.65call/s]API calls:  12%|█▁        | 605/5000 [00:19<02:17, 31.95call/s]API calls:  12%|█▁        | 609/5000 [00:19<02:30, 29.09call/s]API calls:  12%|█▁        | 613/5000 [00:20<02:31, 29.05call/s]API calls:  12%|█▁        | 617/5000 [00:20<02:33, 28.63call/s]API calls:  12%|█▁        | 620/5000 [00:20<02:44, 26.66call/s]API calls:  12%|█▎        | 625/5000 [00:20<02:19, 31.31call/s]
  MIOnlyStopping:  25%|██▌       | 25/100 [00:20<01:59,  1.59s/it, acc=100%, turns=1.0][A
  MIOnlyStopping:  25%|██▌       | 25/100 [00:20<01:59,  1.59s/it, acc=100%, turns=1.0][AAPI calls:  13%|█▎        | 629/5000 [00:20<02:53, 25.18call/s]API calls:  13%|█▎        | 633/5000 [00:20<02:54, 25.06call/s]
  MIOnlyStopping:  26%|██▌       | 26/100 [00:20<01:32,  1.25s/it, acc=100%, turns=1.0][A
  MIOnlyStopping:  26%|██▌       | 26/100 [00:20<01:32,  1.25s/it, acc=100%, turns=1.0][AAPI calls:  13%|█▎        | 639/5000 [00:21<02:49, 25.72call/s]API calls:  13%|█▎        | 644/5000 [00:21<02:27, 29.43call/s]
  MIOnlyStopping:  27%|██▋       | 27/100 [00:21<01:11,  1.01it/s, acc=100%, turns=1.0][A
  MIOnlyStopping:  27%|██▋       | 27/100 [00:21<01:11,  1.01it/s, acc=100%, turns=1.0][AAPI calls:  13%|█▎        | 648/5000 [00:21<02:40, 27.17call/s]API calls:  13%|█▎        | 651/5000 [00:21<02:45, 26.26call/s]API calls:  13%|█▎        | 655/5000 [00:21<02:36, 27.74call/s]API calls:  13%|█▎        | 658/5000 [00:21<03:36, 20.03call/s]API calls:  13%|█▎        | 662/5000 [00:22<03:11, 22.70call/s]API calls:  13%|█▎        | 668/5000 [00:22<02:25, 29.71call/s]
  MIOnlyStopping:  28%|██▊       | 28/100 [00:22<01:10,  1.03it/s, acc=100%, turns=1.0][A
  MIOnlyStopping:  28%|██▊       | 28/100 [00:22<01:10,  1.03it/s, acc=100%, turns=1.0][AAPI calls:  13%|█▎        | 672/5000 [00:22<02:17, 31.41call/s]
  MIOnlyStopping:  29%|██▉       | 29/100 [00:22<01:09,  1.03it/s, acc=100%, turns=1.0][A
  MIOnlyStopping:  30%|███       | 30/100 [00:22<00:39,  1.79it/s, acc=100%, turns=1.0][A
  MIOnlyStopping:  30%|███       | 30/100 [00:22<00:39,  1.79it/s, acc=100%, turns=1.0][AAPI calls:  14%|█▎        | 680/5000 [00:22<01:48, 39.88call/s]
  MIOnlyStopping:  31%|███       | 31/100 [00:22<00:38,  1.79it/s, acc=100%, turns=1.0][AAPI calls:  14%|█▎        | 685/5000 [00:22<01:46, 40.33call/s]API calls:  14%|█▁        | 690/5000 [00:22<02:16, 31.68call/s]API calls:  14%|█▁        | 701/5000 [00:22<01:32, 46.43call/s]
  MIOnlyStopping:  32%|███▁      | 32/100 [00:22<00:30,  2.24it/s, acc=100%, turns=1.0][A
  MIOnlyStopping:  32%|███▁      | 32/100 [00:22<00:30,  2.24it/s, acc=100%, turns=1.0][AAPI calls:  14%|█▁        | 707/5000 [00:23<01:31, 47.16call/s]
  MIOnlyStopping:  33%|███▎      | 33/100 [00:23<00:25,  2.68it/s, acc=100%, turns=1.0][A
  MIOnlyStopping:  33%|███▎      | 33/100 [00:23<00:25,  2.68it/s, acc=100%, turns=1.0][AAPI calls:  14%|█▁        | 713/5000 [00:23<01:30, 47.60call/s]API calls:  14%|█▁        | 722/5000 [00:23<01:14, 57.14call/s]
  MIOnlyStopping:  34%|███▁      | 34/100 [00:23<00:22,  3.00it/s, acc=100%, turns=1.0][A
  MIOnlyStopping:  34%|███▁      | 34/100 [00:23<00:22,  3.00it/s, acc=100%, turns=1.0][AAPI calls:  15%|█▁        | 731/5000 [00:23<01:06, 64.27call/s]
  MIOnlyStopping:  35%|███▌      | 35/100 [00:23<00:17,  3.65it/s, acc=100%, turns=1.0][A
  MIOnlyStopping:  35%|███▌      | 35/100 [00:23<00:17,  3.65it/s, acc=100%, turns=1.0][A
  MIOnlyStopping:  36%|███▌      | 36/100 [00:23<00:17,  3.65it/s, acc=100%, turns=1.0][AAPI calls:  15%|█▁        | 738/5000 [00:23<01:11, 59.51call/s]API calls:  15%|█▁        | 745/5000 [00:23<01:17, 55.22call/s]
  MIOnlyStopping:  37%|███▋      | 37/100 [00:23<00:15,  4.19it/s, acc=100%, turns=1.0][A
  MIOnlyStopping:  37%|███▋      | 37/100 [00:23<00:15,  4.19it/s, acc=100%, turns=1.0][AAPI calls:  15%|█▌        | 751/5000 [00:23<01:26, 48.88call/s]
  MIOnlyStopping:  38%|███▊      | 38/100 [00:23<00:14,  4.19it/s, acc=100%, turns=1.0][AAPI calls:  15%|█▌        | 758/5000 [00:23<01:19, 53.24call/s]
  MIOnlyStopping:  39%|███▉      | 39/100 [00:24<00:12,  5.06it/s, acc=100%, turns=1.0][A
  MIOnlyStopping:  39%|███▉      | 39/100 [00:24<00:12,  5.06it/s, acc=100%, turns=1.0][AAPI calls:  15%|█▌        | 764/5000 [00:24<01:24, 50.30call/s]
  MIOnlyStopping:  40%|████      | 40/100 [00:24<00:10,  5.64it/s, acc=100%, turns=1.0][A
  MIOnlyStopping:  40%|████      | 40/100 [00:24<00:10,  5.64it/s, acc=100%, turns=1.0][AAPI calls:  15%|█▌        | 771/5000 [00:24<01:18, 54.13call/s]API calls:  16%|█▌        | 777/5000 [00:24<01:19, 53.23call/s]API calls:  16%|█▌        | 783/5000 [00:24<01:29, 46.95call/s]API calls:  16%|█▌        | 788/5000 [00:24<01:51, 37.77call/s]API calls:  16%|█▌        | 793/5000 [00:24<01:46, 39.44call/s]API calls:  16%|█▌        | 798/5000 [00:24<01:44, 40.32call/s]
  MIOnlyStopping:  41%|████      | 41/100 [00:24<00:19,  3.08it/s, acc=100%, turns=1.0][A
  MIOnlyStopping:  41%|████      | 41/100 [00:24<00:19,  3.08it/s, acc=100%, turns=1.0][AAPI calls:  16%|█▌        | 807/5000 [00:25<01:28, 47.33call/s]
  MIOnlyStopping:  42%|████▁     | 42/100 [00:25<00:17,  3.40it/s, acc=100%, turns=1.0][A
  MIOnlyStopping:  42%|████▁     | 42/100 [00:25<00:17,  3.40it/s, acc=100%, turns=1.0][AAPI calls:  16%|█▋        | 816/5000 [00:25<01:17, 54.28call/s]API calls:  16%|█▋        | 822/5000 [00:25<01:38, 42.57call/s]
  MIOnlyStopping:  43%|████▎     | 43/100 [00:25<00:17,  3.30it/s, acc=100%, turns=1.0][A
  MIOnlyStopping:  43%|████▎     | 43/100 [00:25<00:17,  3.30it/s, acc=100%, turns=1.0][AAPI calls:  17%|█▋        | 827/5000 [00:25<01:41, 41.11call/s]API calls:  17%|█▋        | 832/5000 [00:25<01:50, 37.66call/s]
  MIOnlyStopping:  44%|████▁     | 44/100 [00:25<00:17,  3.27it/s, acc=100%, turns=1.0][A
  MIOnlyStopping:  44%|████▁     | 44/100 [00:25<00:17,  3.27it/s, acc=100%, turns=1.0][AAPI calls:  17%|█▋        | 839/5000 [00:25<01:36, 43.33call/s]API calls:  17%|█▋        | 845/5000 [00:25<01:29, 46.67call/s]API calls:  17%|█▋        | 850/5000 [00:26<01:59, 34.85call/s]
  MIOnlyStopping:  45%|████▌     | 45/100 [00:26<00:19,  2.83it/s, acc=100%, turns=1.0][A
  MIOnlyStopping:  45%|████▌     | 45/100 [00:26<00:19,  2.83it/s, acc=100%, turns=1.0][AAPI calls:  17%|█▋        | 855/5000 [00:26<02:19, 29.67call/s]API calls:  17%|█▋        | 859/5000 [00:26<02:16, 30.25call/s]API calls:  17%|█▋        | 863/5000 [00:26<02:21, 29.18call/s]API calls:  17%|█▋        | 867/5000 [00:26<02:28, 27.84call/s]API calls:  17%|█▋        | 870/5000 [00:26<02:31, 27.18call/s]API calls:  17%|█▋        | 873/5000 [00:27<02:35, 26.53call/s]
  MIOnlyStopping:  46%|████▌     | 46/100 [00:27<00:27,  1.93it/s, acc=100%, turns=1.0][A
  MIOnlyStopping:  46%|████▌     | 46/100 [00:27<00:27,  1.93it/s, acc=100%, turns=1.0][AAPI calls:  18%|█▊        | 880/5000 [00:27<02:04, 32.96call/s]API calls:  18%|█▊        | 881/5000 [00:27<01:44, 39.31call/s]API calls:  18%|█▊        | 889/5000 [00:27<01:29, 46.04call/s]API calls:  18%|█▊        | 897/5000 [00:27<01:18, 52.18call/s]API calls:  18%|█▊        | 905/5000 [00:27<01:11, 57.08call/s]
  MIOnlyStopping:  47%|████▋     | 47/100 [00:27<00:25,  2.06it/s, acc=100%, turns=1.0][A
  MIOnlyStopping:  47%|████▋     | 47/100 [00:27<00:25,  2.06it/s, acc=100%, turns=1.1][A
  MIOnlyStopping:  48%|████▊     | 48/100 [00:27<00:25,  2.06it/s, acc=100%, turns=1.1][AAPI calls:  18%|█▊        | 911/5000 [00:27<01:13, 55.41call/s]API calls:  18%|█▊        | 917/5000 [00:27<01:20, 50.81call/s]
  MIOnlyStopping:  49%|████▉     | 49/100 [00:27<00:16,  3.07it/s, acc=100%, turns=1.1][A
  MIOnlyStopping:  49%|████▉     | 49/100 [00:27<00:16,  3.07it/s, acc=100%, turns=1.1][A
  MIOnlyStopping:  50%|█████     | 50/100 [00:27<00:13,  3.61it/s, acc=100%, turns=1.1][A
  MIOnlyStopping:  50%|█████     | 50/100 [00:27<00:13,  3.61it/s, acc=100%, turns=1.1][AAPI calls:  18%|█▊        | 923/5000 [00:28<02:19, 29.32call/s]API calls:  19%|█▊        | 928/5000 [00:28<02:31, 26.82call/s]API calls:  19%|█▊        | 932/5000 [00:28<02:42, 25.04call/s]API calls:  19%|█▊        | 936/5000 [00:28<02:36, 25.97call/s]API calls:  19%|█▉        | 949/5000 [00:28<01:35, 42.43call/s]API calls:  19%|█▉        | 955/5000 [00:29<01:39, 40.68call/s]API calls:  19%|█▉        | 960/5000 [00:29<01:43, 38.92call/s]API calls:  19%|█▉        | 967/5000 [00:29<01:32, 43.57call/s]
  MIOnlyStopping:  51%|█████     | 51/100 [00:29<00:28,  1.73it/s, acc=100%, turns=1.1][A
  MIOnlyStopping:  51%|█████     | 51/100 [00:29<00:28,  1.73it/s, acc=100%, turns=1.1][AAPI calls:  19%|█▉        | 972/5000 [00:29<01:42, 39.35call/s]API calls:  20%|█▉        | 977/5000 [00:29<01:51, 36.17call/s]API calls:  20%|█▉        | 981/5000 [00:29<01:55, 34.84call/s]API calls:  20%|█▉        | 985/5000 [00:30<02:24, 27.79call/s]API calls:  20%|█▉        | 989/5000 [00:30<02:42, 24.68call/s]API calls:  20%|█▉        | 992/5000 [00:30<02:41, 24.75call/s]API calls:  20%|█▉        | 995/5000 [00:30<02:47, 23.94call/s]API calls:  20%|█▉        | 998/5000 [00:30<03:20, 19.99call/s]API calls:  20%|██        | 1001/5000 [00:30<03:18, 20.10call/s]API calls:  20%|██        | 1005/5000 [00:30<03:18, 20.10call/s]API calls:  20%|██        | 1009/5000 [00:30<02:49, 23.57call/s]API calls:  20%|██        | 1012/5000 [00:30<02:46, 23.88call/s]API calls:  20%|██        | 1016/5000 [00:31<02:57, 22.40call/s]API calls:  20%|██        | 1022/5000 [00:31<02:14, 29.62call/s]
  MIOnlyStopping:  52%|█████▁    | 52/100 [00:31<00:45,  1.06it/s, acc=100%, turns=1.1][A
  MIOnlyStopping:  52%|█████▁    | 52/100 [00:31<00:45,  1.06it/s, acc=100%, turns=1.1][AAPI calls:  21%|██        | 1026/5000 [00:31<02:15, 29.32call/s]API calls:  21%|██        | 1027/5000 [00:31<02:07, 31.08call/s]
  MIOnlyStopping:  53%|█████▎    | 53/100 [00:31<00:33,  1.40it/s, acc=100%, turns=1.1][A
  MIOnlyStopping:  53%|█████▎    | 53/100 [00:31<00:33,  1.40it/s, acc=100%, turns=1.1][AAPI calls:  21%|██        | 1033/5000 [00:31<01:46, 37.39call/s]
  MIOnlyStopping:  54%|█████▁    | 54/100 [00:31<00:25,  1.81it/s, acc=100%, turns=1.1][A
  MIOnlyStopping:  54%|█████▁    | 54/100 [00:31<00:25,  1.81it/s, acc=100%, turns=1.1][AAPI calls:  21%|██        | 1038/5000 [00:31<01:46, 37.07call/s]
  MIOnlyStopping:  55%|█████▌    | 55/100 [00:31<00:20,  2.21it/s, acc=100%, turns=1.1][A
  MIOnlyStopping:  55%|█████▌    | 55/100 [00:31<00:20,  2.21it/s, acc=100%, turns=1.1][AAPI calls:  21%|██        | 1042/5000 [00:31<02:01, 32.53call/s]API calls:  21%|██        | 1047/5000 [00:31<01:55, 34.23call/s]API calls:  21%|██        | 1051/5000 [00:32<02:15, 29.16call/s]
  MIOnlyStopping:  56%|█████▌    | 56/100 [00:32<00:19,  2.22it/s, acc=100%, turns=1.1][A
  MIOnlyStopping:  56%|█████▌    | 56/100 [00:32<00:19,  2.22it/s, acc=100%, turns=1.1][AAPI calls:  21%|██        | 1055/5000 [00:32<02:52, 22.81call/s]API calls:  21%|██        | 1061/5000 [00:32<02:26, 26.82call/s]
  MIOnlyStopping:  57%|█████▋    | 57/100 [00:32<00:18,  2.32it/s, acc=100%, turns=1.1][A
  MIOnlyStopping:  57%|█████▋    | 57/100 [00:32<00:18,  2.32it/s, acc=100%, turns=1.1][A
  MIOnlyStopping:  58%|█████▊    | 58/100 [00:32<00:18,  2.32it/s, acc=100%, turns=1.1][AAPI calls:  21%|██▁       | 1068/5000 [00:32<02:11, 29.99call/s]API calls:  21%|██▁       | 1073/5000 [00:32<01:56, 33.66call/s]API calls:  22%|██▁       | 1079/5000 [00:33<01:56, 33.74call/s]API calls:  22%|██▁       | 1085/5000 [00:33<01:45, 36.99call/s]
  MIOnlyStopping:  59%|█████▉    | 59/100 [00:33<00:15,  2.67it/s, acc=100%, turns=1.1][A
  MIOnlyStopping:  59%|█████▉    | 59/100 [00:33<00:15,  2.67it/s, acc=100%, turns=1.1][A
  MIOnlyStopping:  60%|██████    | 60/100 [00:33<00:14,  2.67it/s, acc=100%, turns=1.1][A
  MIOnlyStopping:  61%|██████    | 61/100 [00:33<00:14,  2.67it/s, acc=100%, turns=1.1][AAPI calls:  22%|██▁       | 1089/5000 [00:33<02:13, 29.25call/s]
  MIOnlyStopping:  62%|██████▁   | 62/100 [00:33<00:08,  4.43it/s, acc=100%, turns=1.1][A
  MIOnlyStopping:  62%|██████▁   | 62/100 [00:33<00:08,  4.43it/s, acc=100%, turns=1.1][AAPI calls:  22%|██▁       | 1096/5000 [00:33<01:48, 36.03call/s]API calls:  22%|██▁       | 1101/5000 [00:33<02:03, 31.53call/s]API calls:  22%|██▁       | 1105/5000 [00:33<02:17, 28.31call/s]API calls:  22%|██▁       | 1111/5000 [00:34<01:53, 34.31call/s]
  MIOnlyStopping:  63%|██████▎   | 63/100 [00:34<00:11,  3.28it/s, acc=100%, turns=1.1][A
  MIOnlyStopping:  63%|██████▎   | 63/100 [00:34<00:11,  3.28it/s, acc=100%, turns=1.1][AAPI calls:  22%|██▁       | 1118/5000 [00:34<01:37, 39.77call/s]API calls:  22%|██▁       | 1123/5000 [00:34<01:35, 40.50call/s]
  MIOnlyStopping:  64%|██████▁   | 64/100 [00:34<00:09,  3.62it/s, acc=100%, turns=1.1][A
  MIOnlyStopping:  64%|██████▁   | 64/100 [00:34<00:09,  3.62it/s, acc=100%, turns=1.1][AAPI calls:  23%|██▎       | 1129/5000 [00:34<01:29, 43.34call/s]API calls:  23%|██▎       | 1134/5000 [00:34<01:30, 42.80call/s]API calls:  23%|██▎       | 1141/5000 [00:34<01:23, 46.15call/s]API calls:  23%|██▎       | 1149/5000 [00:34<01:13, 52.44call/s]
  MIOnlyStopping:  65%|██████▌   | 65/100 [00:34<00:11,  3.05it/s, acc=100%, turns=1.1][A
  MIOnlyStopping:  65%|██████▌   | 65/100 [00:34<00:11,  3.05it/s, acc=100%, turns=1.1][AAPI calls:  23%|██▎       | 1155/5000 [00:34<01:22, 46.35call/s]API calls:  23%|██▎       | 1160/5000 [00:35<01:41, 37.88call/s]API calls:  23%|██▎       | 1165/5000 [00:35<01:37, 39.34call/s]
  MIOnlyStopping:  66%|██████▌   | 66/100 [00:35<00:12,  2.70it/s, acc=100%, turns=1.1][A
  MIOnlyStopping:  66%|██████▌   | 66/100 [00:35<00:12,  2.70it/s, acc=100%, turns=1.1][AAPI calls:  23%|██▎       | 1170/5000 [00:35<02:15, 28.26call/s]API calls:  24%|██▎       | 1176/5000 [00:35<02:00, 31.71call/s]API calls:  24%|██▎       | 1181/5000 [00:35<01:52, 33.89call/s]API calls:  24%|██▎       | 1185/5000 [00:35<01:59, 31.96call/s]API calls:  24%|██▁       | 1189/5000 [00:36<02:08, 29.75call/s]API calls:  24%|██▁       | 1194/5000 [00:36<02:05, 30.36call/s]
  MIOnlyStopping:  67%|██████▋   | 67/100 [00:36<00:18,  1.79it/s, acc=100%, turns=1.1][A
  MIOnlyStopping:  67%|██████▋   | 67/100 [00:36<00:18,  1.79it/s, acc=100%, turns=1.1][AAPI calls:  24%|██▁       | 1198/5000 [00:36<02:01, 31.18call/s]
  MIOnlyStopping:  68%|██████▊   | 68/100 [00:36<00:13,  2.30it/s, acc=100%, turns=1.1][A
  MIOnlyStopping:  68%|██████▊   | 68/100 [00:36<00:13,  2.30it/s, acc=100%, turns=1.1][A
  MIOnlyStopping:  69%|██████▉   | 69/100 [00:36<00:13,  2.30it/s, acc=100%, turns=1.1][AAPI calls:  24%|██▁       | 1204/5000 [00:36<01:48, 35.14call/s]API calls:  24%|██▁       | 1205/5000 [00:36<01:34, 40.11call/s]
  MIOnlyStopping:  70%|███████   | 70/100 [00:36<00:13,  2.30it/s, acc=100%, turns=1.1][A
  MIOnlyStopping:  71%|███████   | 71/100 [00:36<00:12,  2.30it/s, acc=100%, turns=1.1][AAPI calls:  24%|██▁       | 1210/5000 [00:36<01:44, 36.12call/s]
  MIOnlyStopping:  72%|███████▁  | 72/100 [00:36<00:06,  4.65it/s, acc=100%, turns=1.1][A
  MIOnlyStopping:  72%|███████▁  | 72/100 [00:36<00:06,  4.65it/s, acc=100%, turns=1.1][AAPI calls:  24%|██▁       | 1214/5000 [00:36<01:55, 32.88call/s]API calls:  24%|██▁       | 1218/5000 [00:37<01:59, 31.67call/s]API calls:  24%|██▁       | 1222/5000 [00:37<02:05, 30.11call/s]API calls:  25%|██▁       | 1226/5000 [00:37<02:15, 27.88call/s]API calls:  25%|██▁       | 1229/5000 [00:37<02:30, 25.09call/s]API calls:  25%|██▁       | 1232/5000 [00:37<02:29, 25.12call/s]API calls:  25%|██▁       | 1237/5000 [00:37<02:08, 29.22call/s]API calls:  25%|██▁       | 1242/5000 [00:37<01:56, 32.22call/s]API calls:  25%|██▁       | 1247/5000 [00:37<01:44, 35.76call/s]API calls:  25%|██▌       | 1251/5000 [00:38<01:48, 34.45call/s]
  MIOnlyStopping:  73%|███████▎  | 73/100 [00:38<00:11,  2.27it/s, acc=100%, turns=1.1][A
  MIOnlyStopping:  73%|███████▎  | 73/100 [00:38<00:11,  2.27it/s, acc=100%, turns=1.1][AAPI calls:  25%|██▌       | 1255/5000 [00:38<02:36, 23.91call/s]API calls:  25%|██▌       | 1258/5000 [00:38<02:53, 21.60call/s]
  MIOnlyStopping:  74%|███████▁  | 74/100 [00:38<00:11,  2.23it/s, acc=100%, turns=1.1][A
  MIOnlyStopping:  74%|███████▁  | 74/100 [00:38<00:11,  2.23it/s, acc=100%, turns=1.1][AAPI calls:  25%|██▌       | 1264/5000 [00:38<02:39, 23.42call/s]API calls:  25%|██▌       | 1268/5000 [00:39<02:46, 22.36call/s]API calls:  25%|██▌       | 1271/5000 [00:39<03:15, 19.07call/s]API calls:  26%|██▌       | 1275/5000 [00:39<03:00, 20.67call/s]API calls:  26%|██▌       | 1278/5000 [00:39<02:51, 21.69call/s]API calls:  26%|██▌       | 1281/5000 [00:39<03:08, 19.70call/s]API calls:  26%|██▌       | 1286/5000 [00:39<02:42, 22.88call/s]API calls:  26%|██▌       | 1292/5000 [00:40<02:12, 27.97call/s]
  MIOnlyStopping:  75%|███████▌  | 75/100 [00:40<00:16,  1.51it/s, acc=100%, turns=1.1][A
  MIOnlyStopping:  75%|███████▌  | 75/100 [00:40<00:16,  1.51it/s, acc=100%, turns=1.1][AAPI calls:  26%|██▌       | 1295/5000 [00:40<02:18, 26.79call/s]API calls:  26%|██▌       | 1298/5000 [00:40<02:47, 22.13call/s]API calls:  26%|██▌       | 1301/5000 [00:40<02:55, 21.11call/s]API calls:  26%|██▌       | 1304/5000 [00:40<03:01, 20.32call/s]
  MIOnlyStopping:  76%|███████▌  | 76/100 [00:40<00:15,  1.53it/s, acc=100%, turns=1.1][A
  MIOnlyStopping:  76%|███████▌  | 76/100 [00:40<00:15,  1.53it/s, acc=100%, turns=1.1][AAPI calls:  26%|██▌       | 1309/5000 [00:40<02:21, 25.99call/s]API calls:  26%|██▌       | 1312/5000 [00:41<03:06, 19.75call/s]API calls:  26%|██▋       | 1317/5000 [00:41<02:27, 24.89call/s]API calls:  26%|██▋       | 1320/5000 [00:41<02:53, 21.18call/s]
  MIOnlyStopping:  77%|███████▋  | 77/100 [00:41<00:15,  1.53it/s, acc=100%, turns=1.1][A
  MIOnlyStopping:  77%|███████▋  | 77/100 [00:41<00:15,  1.53it/s, acc=100%, turns=1.1][AAPI calls:  26%|██▋       | 1323/5000 [00:41<02:54, 21.03call/s]API calls:  26%|██▋       | 1324/5000 [00:41<02:41, 22.71call/s]
  MIOnlyStopping:  78%|███████▊  | 78/100 [00:41<00:11,  1.90it/s, acc=100%, turns=1.1][A
  MIOnlyStopping:  78%|███████▊  | 78/100 [00:41<00:11,  1.90it/s, acc=100%, turns=1.1][A
  MIOnlyStopping:  79%|███████▉  | 79/100 [00:41<00:11,  1.90it/s, acc=100%, turns=1.1][A
  MIOnlyStopping:  80%|████████  | 80/100 [00:41<00:10,  1.90it/s, acc=100%, turns=1.1][AAPI calls:  27%|██▋       | 1329/5000 [00:41<02:20, 26.12call/s]
  MIOnlyStopping:  81%|████████  | 81/100 [00:41<00:05,  3.69it/s, acc=100%, turns=1.1][A
  MIOnlyStopping:  81%|████████  | 81/100 [00:41<00:05,  3.69it/s, acc=100%, turns=1.1][AAPI calls:  27%|██▋       | 1337/5000 [00:41<01:37, 37.54call/s]API calls:  27%|██▋       | 1342/5000 [00:42<02:11, 27.92call/s]API calls:  27%|██▋       | 1346/5000 [00:42<02:13, 27.33call/s]API calls:  27%|██▋       | 1347/5000 [00:42<02:07, 28.54call/s]
  MIOnlyStopping:  82%|████████▁ | 82/100 [00:42<00:05,  3.09it/s, acc=100%, turns=1.1][A
  MIOnlyStopping:  82%|████████▁ | 82/100 [00:42<00:05,  3.09it/s, acc=100%, turns=1.1][AAPI calls:  27%|██▋       | 1351/5000 [00:42<02:06, 28.74call/s]API calls:  27%|██▋       | 1355/5000 [00:42<02:35, 23.39call/s]
  MIOnlyStopping:  83%|████████▎ | 83/100 [00:42<00:06,  2.62it/s, acc=100%, turns=1.1][A
  MIOnlyStopping:  83%|████████▎ | 83/100 [00:42<00:06,  2.62it/s, acc=100%, turns=1.1][AAPI calls:  27%|██▋       | 1358/5000 [00:42<03:16, 18.52call/s]
  MIOnlyStopping:  84%|████████▁ | 84/100 [00:42<00:05,  3.18it/s, acc=100%, turns=1.1][A
  MIOnlyStopping:  84%|████████▁ | 84/100 [00:42<00:05,  3.18it/s, acc=100%, turns=1.1][A
  MIOnlyStopping:  85%|████████▌ | 85/100 [00:42<00:04,  3.18it/s, acc=100%, turns=1.1][AAPI calls:  27%|██▋       | 1361/5000 [00:43<03:07, 19.45call/s]
  MIOnlyStopping:  86%|████████▌ | 86/100 [00:43<00:03,  4.61it/s, acc=100%, turns=1.1][A
  MIOnlyStopping:  86%|████████▌ | 86/100 [00:43<00:03,  4.61it/s, acc=100%, turns=1.1][AAPI calls:  27%|██▋       | 1371/5000 [00:43<01:51, 32.42call/s]
  MIOnlyStopping:  87%|████████▋ | 87/100 [00:43<00:03,  4.13it/s, acc=100%, turns=1.1][A
  MIOnlyStopping:  87%|████████▋ | 87/100 [00:43<00:03,  4.13it/s, acc=100%, turns=1.1][AAPI calls:  28%|██▊       | 1375/5000 [00:43<02:28, 24.40call/s]API calls:  28%|██▊       | 1379/5000 [00:43<02:16, 26.45call/s]
  MIOnlyStopping:  88%|████████▊ | 88/100 [00:43<00:02,  4.14it/s, acc=100%, turns=1.1][A
  MIOnlyStopping:  88%|████████▊ | 88/100 [00:43<00:02,  4.14it/s, acc=100%, turns=1.1][AAPI calls:  28%|██▊       | 1383/5000 [00:44<03:38, 16.58call/s]API calls:  28%|██▊       | 1386/5000 [00:44<03:18, 18.21call/s]API calls:  28%|██▊       | 1389/5000 [00:44<03:03, 19.72call/s]
  MIOnlyStopping:  89%|████████▉ | 89/100 [00:44<00:03,  2.91it/s, acc=100%, turns=1.1][A
  MIOnlyStopping:  89%|████████▉ | 89/100 [00:44<00:03,  2.91it/s, acc=100%, turns=1.1][AAPI calls:  28%|██▊       | 1394/5000 [00:44<02:51, 20.97call/s]API calls:  28%|██▊       | 1397/5000 [00:44<03:38, 16.49call/s]API calls:  28%|██▊       | 1400/5000 [00:45<04:25, 13.56call/s]
  MIOnlyStopping:  90%|█████████ | 90/100 [00:45<00:04,  2.09it/s, acc=100%, turns=1.1][A
  MIOnlyStopping:  90%|█████████ | 90/100 [00:45<00:04,  2.09it/s, acc=100%, turns=1.1][AAPI calls:  28%|██▊       | 1402/5000 [00:45<04:32, 13.22call/s]
  MIOnlyStopping:  91%|█████████ | 91/100 [00:45<00:03,  2.55it/s, acc=100%, turns=1.1][A
  MIOnlyStopping:  91%|█████████ | 91/100 [00:45<00:03,  2.55it/s, acc=100%, turns=1.1][AAPI calls:  28%|██▊       | 1404/5000 [00:45<04:52, 12.30call/s]API calls:  28%|██▊       | 1406/5000 [00:45<06:50,  8.75call/s]
  MIOnlyStopping:  92%|█████████▁| 92/100 [00:46<00:03,  2.08it/s, acc=100%, turns=1.1][A
  MIOnlyStopping:  92%|█████████▁| 92/100 [00:46<00:03,  2.08it/s, acc=100%, turns=1.1][AAPI calls:  28%|██▊       | 1409/5000 [00:46<05:52, 10.17call/s]API calls:  28%|██▊       | 1412/5000 [00:46<04:49, 12.40call/s]
  MIOnlyStopping:  93%|█████████▎| 93/100 [00:46<00:03,  2.22it/s, acc=100%, turns=1.1][A
  MIOnlyStopping:  93%|█████████▎| 93/100 [00:46<00:03,  2.22it/s, acc=100%, turns=1.1][AAPI calls:  28%|██▊       | 1415/5000 [00:46<05:30, 10.85call/s]
  MIOnlyStopping:  94%|█████████▁| 94/100 [00:46<00:02,  2.54it/s, acc=100%, turns=1.1][A
  MIOnlyStopping:  94%|█████████▁| 94/100 [00:46<00:02,  2.54it/s, acc=100%, turns=1.1][A
  MIOnlyStopping:  95%|█████████▌| 95/100 [00:46<00:01,  2.54it/s, acc=100%, turns=1.1][AAPI calls:  28%|██▊       | 1418/5000 [00:46<05:13, 11.44call/s]
  MIOnlyStopping:  96%|█████████▌| 96/100 [00:47<00:01,  3.01it/s, acc=100%, turns=1.1][A
  MIOnlyStopping:  96%|█████████▌| 96/100 [00:47<00:01,  3.01it/s, acc=100%, turns=1.1][AAPI calls:  28%|██▊       | 1420/5000 [00:47<06:24,  9.30call/s]API calls:  28%|██▊       | 1422/5000 [00:47<09:18,  6.41call/s]
  MIOnlyStopping:  97%|█████████▋| 97/100 [00:47<00:01,  2.38it/s, acc=100%, turns=1.1][A
  MIOnlyStopping:  97%|█████████▋| 97/100 [00:47<00:01,  2.38it/s, acc=100%, turns=1.1][AAPI calls:  29%|██▊       | 1427/5000 [00:47<05:34, 10.70call/s]API calls:  29%|██▊       | 1429/5000 [00:48<05:14, 11.36call/s]
  MIOnlyStopping:  98%|█████████▊| 98/100 [00:48<00:00,  2.62it/s, acc=100%, turns=1.1][A
  MIOnlyStopping:  98%|█████████▊| 98/100 [00:48<00:00,  2.62it/s, acc=100%, turns=1.1][AAPI calls:  29%|██▊       | 1432/5000 [00:49<10:36,  5.60call/s]API calls:  29%|██▊       | 1434/5000 [00:49<09:05,  6.54call/s]API calls:  29%|██▊       | 1436/5000 [00:50<14:59,  3.96call/s]
  MIOnlyStopping:  99%|█████████▉| 99/100 [00:50<00:00,  1.05it/s, acc=100%, turns=1.1][A
  MIOnlyStopping:  99%|█████████▉| 99/100 [00:50<00:00,  1.05it/s, acc=100%, turns=1.1][AAPI calls:  29%|██▉       | 1438/5000 [00:50<15:03,  3.94call/s]
  MIOnlyStopping: 100%|██████████| 100/100 [00:50<00:00,  1.27it/s, acc=100%, turns=1.1][A
  MIOnlyStopping: 100%|██████████| 100/100 [00:50<00:00,  1.27it/s, acc=100%, turns=1.2][A
                                                                                        [AAPI calls:  29%|██▉       | 1438/5000 [00:51<02:06, 28.18call/s]
  Results: Accuracy=100.00% [100.00%, 100.00%], Avg Turns=1.2 [1.1, 1.3]

==========================================================================================
COMPARISON RESULTS
==========================================================================================
Method                      Accuracy           95% CI  Avg Turns           95% CI
------------------------------------------------------------------------------------------
MIOnlyStopping               100.00% [100.00%,100.00%]        1.2        [1.1,1.3]
==========================================================================================

Total API usage:
  Prompt tokens: 284,820
  Completion tokens: 245,318
  Total tokens: 530,138
