
============================================================
RRMC Experiment: sp_methods/cip_lite
============================================================
Initializing LLM: qwen/qwen-2.5-7b-instruct (max_workers=32)
Task: situation_puzzles
Data: /root/RRMC/AR-Bench/data/sp/test.json
Loading weights:   0%|          | 0/103 [00:00<?, ?it/s]Loading weights:   1%|          | 1/103 [00:00<00:00, 21399.51it/s, Materializing param=embeddings.LayerNorm.bias]Loading weights:   1%|          | 1/103 [00:00<00:00, 5769.33it/s, Materializing param=embeddings.LayerNorm.bias] Loading weights:   2%|▁         | 2/103 [00:00<00:00, 6887.20it/s, Materializing param=embeddings.LayerNorm.weight]Loading weights:   2%|▁         | 2/103 [00:00<00:00, 5849.80it/s, Materializing param=embeddings.LayerNorm.weight]Loading weights:   3%|▎         | 3/103 [00:00<00:00, 6403.52it/s, Materializing param=embeddings.position_embeddings.weight]Loading weights:   3%|▎         | 3/103 [00:00<00:00, 5795.91it/s, Materializing param=embeddings.position_embeddings.weight]Loading weights:   4%|▁         | 4/103 [00:00<00:00, 6335.81it/s, Materializing param=embeddings.token_type_embeddings.weight]Loading weights:   4%|▁         | 4/103 [00:00<00:00, 5079.39it/s, Materializing param=embeddings.token_type_embeddings.weight]Loading weights:   5%|▁         | 5/103 [00:00<00:00, 5614.86it/s, Materializing param=embeddings.word_embeddings.weight]      Loading weights:   5%|▁         | 5/103 [00:00<00:00, 5344.42it/s, Materializing param=embeddings.word_embeddings.weight]Loading weights:   6%|▌         | 6/103 [00:00<00:00, 5828.12it/s, Materializing param=encoder.layer.0.attention.output.LayerNorm.bias]Loading weights:   6%|▌         | 6/103 [00:00<00:00, 4011.13it/s, Materializing param=encoder.layer.0.attention.output.LayerNorm.bias]Loading weights:   7%|▋         | 7/103 [00:00<00:00, 3028.69it/s, Materializing param=encoder.layer.0.attention.output.LayerNorm.weight]Loading weights:   7%|▋         | 7/103 [00:00<00:00, 2871.97it/s, Materializing param=encoder.layer.0.attention.output.LayerNorm.weight]Loading weights:   8%|▊         | 8/103 [00:00<00:00, 2932.82it/s, Materializing param=encoder.layer.0.attention.output.dense.bias]      Loading weights:   8%|▊         | 8/103 [00:00<00:00, 2758.28it/s, Materializing param=encoder.layer.0.attention.output.dense.bias]Loading weights:   9%|▊         | 9/103 [00:00<00:00, 2771.16it/s, Materializing param=encoder.layer.0.attention.output.dense.weight]Loading weights:   9%|▊         | 9/103 [00:00<00:00, 2609.12it/s, Materializing param=encoder.layer.0.attention.output.dense.weight]Loading weights:  10%|▉         | 10/103 [00:00<00:00, 2727.12it/s, Materializing param=encoder.layer.0.attention.self.key.bias]     Loading weights:  10%|▉         | 10/103 [00:00<00:00, 2494.68it/s, Materializing param=encoder.layer.0.attention.self.key.bias]Loading weights:  11%|█         | 11/103 [00:00<00:00, 2480.77it/s, Materializing param=encoder.layer.0.attention.self.key.weight]Loading weights:  11%|█         | 11/103 [00:00<00:00, 2453.85it/s, Materializing param=encoder.layer.0.attention.self.key.weight]Loading weights:  12%|█▁        | 12/103 [00:00<00:00, 2615.04it/s, Materializing param=encoder.layer.0.attention.self.query.bias]Loading weights:  12%|█▁        | 12/103 [00:00<00:00, 2442.69it/s, Materializing param=encoder.layer.0.attention.self.query.bias]Loading weights:  13%|█▎        | 13/103 [00:00<00:00, 2552.59it/s, Materializing param=encoder.layer.0.attention.self.query.weight]Loading weights:  13%|█▎        | 13/103 [00:00<00:00, 2437.79it/s, Materializing param=encoder.layer.0.attention.self.query.weight]Loading weights:  14%|█▎        | 14/103 [00:00<00:00, 2412.00it/s, Materializing param=encoder.layer.0.attention.self.value.bias]  Loading weights:  14%|█▎        | 14/103 [00:00<00:00, 2311.55it/s, Materializing param=encoder.layer.0.attention.self.value.bias]Loading weights:  15%|█▁        | 15/103 [00:00<00:00, 2390.37it/s, Materializing param=encoder.layer.0.attention.self.value.weight]Loading weights:  15%|█▁        | 15/103 [00:00<00:00, 2294.81it/s, Materializing param=encoder.layer.0.attention.self.value.weight]Loading weights:  16%|█▌        | 16/103 [00:00<00:00, 2257.43it/s, Materializing param=encoder.layer.0.intermediate.dense.bias]    Loading weights:  16%|█▌        | 16/103 [00:00<00:00, 2239.05it/s, Materializing param=encoder.layer.0.intermediate.dense.bias]Loading weights:  17%|█▋        | 17/103 [00:00<00:00, 2281.63it/s, Materializing param=encoder.layer.0.intermediate.dense.weight]Loading weights:  17%|█▋        | 17/103 [00:00<00:00, 2247.18it/s, Materializing param=encoder.layer.0.intermediate.dense.weight]Loading weights:  17%|█▋        | 18/103 [00:00<00:00, 2348.43it/s, Materializing param=encoder.layer.0.output.LayerNorm.bias]    Loading weights:  17%|█▋        | 18/103 [00:00<00:00, 2290.30it/s, Materializing param=encoder.layer.0.output.LayerNorm.bias]Loading weights:  18%|█▊        | 19/103 [00:00<00:00, 2301.97it/s, Materializing param=encoder.layer.0.output.LayerNorm.weight]Loading weights:  18%|█▊        | 19/103 [00:00<00:00, 2260.18it/s, Materializing param=encoder.layer.0.output.LayerNorm.weight]Loading weights:  19%|█▉        | 20/103 [00:00<00:00, 2305.20it/s, Materializing param=encoder.layer.0.output.dense.bias]      Loading weights:  19%|█▉        | 20/103 [00:00<00:00, 2222.74it/s, Materializing param=encoder.layer.0.output.dense.bias]Loading weights:  20%|██        | 21/103 [00:00<00:00, 2279.40it/s, Materializing param=encoder.layer.0.output.dense.weight]Loading weights:  20%|██        | 21/103 [00:00<00:00, 2186.00it/s, Materializing param=encoder.layer.0.output.dense.weight]Loading weights:  21%|██▁       | 22/103 [00:00<00:00, 2237.88it/s, Materializing param=encoder.layer.1.attention.output.LayerNorm.bias]Loading weights:  21%|██▁       | 22/103 [00:00<00:00, 2200.79it/s, Materializing param=encoder.layer.1.attention.output.LayerNorm.bias]Loading weights:  22%|██▁       | 23/103 [00:00<00:00, 2250.53it/s, Materializing param=encoder.layer.1.attention.output.LayerNorm.weight]Loading weights:  22%|██▁       | 23/103 [00:00<00:00, 2216.56it/s, Materializing param=encoder.layer.1.attention.output.LayerNorm.weight]Loading weights:  23%|██▎       | 24/103 [00:00<00:00, 2171.48it/s, Materializing param=encoder.layer.1.attention.output.dense.bias]      Loading weights:  23%|██▎       | 24/103 [00:00<00:00, 2125.76it/s, Materializing param=encoder.layer.1.attention.output.dense.bias]Loading weights:  24%|██▁       | 25/103 [00:00<00:00, 2155.08it/s, Materializing param=encoder.layer.1.attention.output.dense.weight]Loading weights:  24%|██▁       | 25/103 [00:00<00:00, 2124.47it/s, Materializing param=encoder.layer.1.attention.output.dense.weight]Loading weights:  25%|██▌       | 26/103 [00:00<00:00, 2155.52it/s, Materializing param=encoder.layer.1.attention.self.key.bias]      Loading weights:  25%|██▌       | 26/103 [00:00<00:00, 2116.90it/s, Materializing param=encoder.layer.1.attention.self.key.bias]Loading weights:  26%|██▌       | 27/103 [00:00<00:00, 2172.80it/s, Materializing param=encoder.layer.1.attention.self.key.weight]Loading weights:  26%|██▌       | 27/103 [00:00<00:00, 2164.99it/s, Materializing param=encoder.layer.1.attention.self.key.weight]Loading weights:  27%|██▋       | 28/103 [00:00<00:00, 2230.72it/s, Materializing param=encoder.layer.1.attention.self.query.bias]Loading weights:  27%|██▋       | 28/103 [00:00<00:00, 2223.62it/s, Materializing param=encoder.layer.1.attention.self.query.bias]Loading weights:  28%|██▊       | 29/103 [00:00<00:00, 2289.29it/s, Materializing param=encoder.layer.1.attention.self.query.weight]Loading weights:  28%|██▊       | 29/103 [00:00<00:00, 2282.25it/s, Materializing param=encoder.layer.1.attention.self.query.weight]Loading weights:  29%|██▉       | 30/103 [00:00<00:00, 2346.07it/s, Materializing param=encoder.layer.1.attention.self.value.bias]  Loading weights:  29%|██▉       | 30/103 [00:00<00:00, 2337.35it/s, Materializing param=encoder.layer.1.attention.self.value.bias]Loading weights:  30%|███       | 31/103 [00:00<00:00, 2400.59it/s, Materializing param=encoder.layer.1.attention.self.value.weight]Loading weights:  30%|███       | 31/103 [00:00<00:00, 2393.39it/s, Materializing param=encoder.layer.1.attention.self.value.weight]Loading weights:  31%|███       | 32/103 [00:00<00:00, 2454.74it/s, Materializing param=encoder.layer.1.intermediate.dense.bias]    Loading weights:  31%|███       | 32/103 [00:00<00:00, 2446.37it/s, Materializing param=encoder.layer.1.intermediate.dense.bias]Loading weights:  32%|███▁      | 33/103 [00:00<00:00, 2508.10it/s, Materializing param=encoder.layer.1.intermediate.dense.weight]Loading weights:  32%|███▁      | 33/103 [00:00<00:00, 2500.53it/s, Materializing param=encoder.layer.1.intermediate.dense.weight]Loading weights:  33%|███▎      | 34/103 [00:00<00:00, 2562.70it/s, Materializing param=encoder.layer.1.output.LayerNorm.bias]    Loading weights:  33%|███▎      | 34/103 [00:00<00:00, 2555.30it/s, Materializing param=encoder.layer.1.output.LayerNorm.bias]Loading weights:  34%|███▁      | 35/103 [00:00<00:00, 2616.49it/s, Materializing param=encoder.layer.1.output.LayerNorm.weight]Loading weights:  34%|███▁      | 35/103 [00:00<00:00, 2608.86it/s, Materializing param=encoder.layer.1.output.LayerNorm.weight]Loading weights:  35%|███▁      | 36/103 [00:00<00:00, 2669.41it/s, Materializing param=encoder.layer.1.output.dense.bias]      Loading weights:  35%|███▁      | 36/103 [00:00<00:00, 2661.97it/s, Materializing param=encoder.layer.1.output.dense.bias]Loading weights:  36%|███▌      | 37/103 [00:00<00:00, 2722.09it/s, Materializing param=encoder.layer.1.output.dense.weight]Loading weights:  36%|███▌      | 37/103 [00:00<00:00, 2714.52it/s, Materializing param=encoder.layer.1.output.dense.weight]Loading weights:  37%|███▋      | 38/103 [00:00<00:00, 2773.91it/s, Materializing param=encoder.layer.2.attention.output.LayerNorm.bias]Loading weights:  37%|███▋      | 38/103 [00:00<00:00, 2766.16it/s, Materializing param=encoder.layer.2.attention.output.LayerNorm.bias]Loading weights:  38%|███▊      | 39/103 [00:00<00:00, 2824.15it/s, Materializing param=encoder.layer.2.attention.output.LayerNorm.weight]Loading weights:  38%|███▊      | 39/103 [00:00<00:00, 2816.28it/s, Materializing param=encoder.layer.2.attention.output.LayerNorm.weight]Loading weights:  39%|███▉      | 40/103 [00:00<00:00, 2873.89it/s, Materializing param=encoder.layer.2.attention.output.dense.bias]      Loading weights:  39%|███▉      | 40/103 [00:00<00:00, 2865.11it/s, Materializing param=encoder.layer.2.attention.output.dense.bias]Loading weights:  40%|███▉      | 41/103 [00:00<00:00, 2918.20it/s, Materializing param=encoder.layer.2.attention.output.dense.weight]Loading weights:  40%|███▉      | 41/103 [00:00<00:00, 2908.72it/s, Materializing param=encoder.layer.2.attention.output.dense.weight]Loading weights:  41%|████      | 42/103 [00:00<00:00, 2964.02it/s, Materializing param=encoder.layer.2.attention.self.key.bias]      Loading weights:  41%|████      | 42/103 [00:00<00:00, 2955.92it/s, Materializing param=encoder.layer.2.attention.self.key.bias]Loading weights:  42%|████▁     | 43/103 [00:00<00:00, 3011.24it/s, Materializing param=encoder.layer.2.attention.self.key.weight]Loading weights:  42%|████▁     | 43/103 [00:00<00:00, 3003.42it/s, Materializing param=encoder.layer.2.attention.self.key.weight]Loading weights:  43%|████▎     | 44/103 [00:00<00:00, 3055.45it/s, Materializing param=encoder.layer.2.attention.self.query.bias]Loading weights:  43%|████▎     | 44/103 [00:00<00:00, 3046.68it/s, Materializing param=encoder.layer.2.attention.self.query.bias]Loading weights:  44%|████▎     | 45/103 [00:00<00:00, 3095.88it/s, Materializing param=encoder.layer.2.attention.self.query.weight]Loading weights:  44%|████▎     | 45/103 [00:00<00:00, 3086.37it/s, Materializing param=encoder.layer.2.attention.self.query.weight]Loading weights:  45%|████▁     | 46/103 [00:00<00:00, 3138.02it/s, Materializing param=encoder.layer.2.attention.self.value.bias]  Loading weights:  45%|████▁     | 46/103 [00:00<00:00, 3128.86it/s, Materializing param=encoder.layer.2.attention.self.value.bias]Loading weights:  46%|████▌     | 47/103 [00:00<00:00, 3179.04it/s, Materializing param=encoder.layer.2.attention.self.value.weight]Loading weights:  46%|████▌     | 47/103 [00:00<00:00, 3170.20it/s, Materializing param=encoder.layer.2.attention.self.value.weight]Loading weights:  47%|████▋     | 48/103 [00:00<00:00, 3220.35it/s, Materializing param=encoder.layer.2.intermediate.dense.bias]    Loading weights:  47%|████▋     | 48/103 [00:00<00:00, 3211.62it/s, Materializing param=encoder.layer.2.intermediate.dense.bias]Loading weights:  48%|████▊     | 49/103 [00:00<00:00, 3261.36it/s, Materializing param=encoder.layer.2.intermediate.dense.weight]Loading weights:  48%|████▊     | 49/103 [00:00<00:00, 3251.66it/s, Materializing param=encoder.layer.2.intermediate.dense.weight]Loading weights:  49%|████▊     | 50/103 [00:00<00:00, 3302.08it/s, Materializing param=encoder.layer.2.output.LayerNorm.bias]    Loading weights:  49%|████▊     | 50/103 [00:00<00:00, 3293.68it/s, Materializing param=encoder.layer.2.output.LayerNorm.bias]Loading weights:  50%|████▉     | 51/103 [00:00<00:00, 3344.16it/s, Materializing param=encoder.layer.2.output.LayerNorm.weight]Loading weights:  50%|████▉     | 51/103 [00:00<00:00, 3335.77it/s, Materializing param=encoder.layer.2.output.LayerNorm.weight]Loading weights:  50%|█████     | 52/103 [00:00<00:00, 3385.60it/s, Materializing param=encoder.layer.2.output.dense.bias]      Loading weights:  50%|█████     | 52/103 [00:00<00:00, 3377.27it/s, Materializing param=encoder.layer.2.output.dense.bias]Loading weights:  51%|█████▁    | 53/103 [00:00<00:00, 3426.56it/s, Materializing param=encoder.layer.2.output.dense.weight]Loading weights:  51%|█████▁    | 53/103 [00:00<00:00, 3394.85it/s, Materializing param=encoder.layer.2.output.dense.weight]Loading weights:  52%|█████▁    | 54/103 [00:00<00:00, 3443.76it/s, Materializing param=encoder.layer.3.attention.output.LayerNorm.bias]Loading weights:  52%|█████▁    | 54/103 [00:00<00:00, 3435.35it/s, Materializing param=encoder.layer.3.attention.output.LayerNorm.bias]Loading weights:  53%|█████▎    | 55/103 [00:00<00:00, 3483.12it/s, Materializing param=encoder.layer.3.attention.output.LayerNorm.weight]Loading weights:  53%|█████▎    | 55/103 [00:00<00:00, 3474.56it/s, Materializing param=encoder.layer.3.attention.output.LayerNorm.weight]Loading weights:  54%|█████▁    | 56/103 [00:00<00:00, 3520.56it/s, Materializing param=encoder.layer.3.attention.output.dense.bias]      Loading weights:  54%|█████▁    | 56/103 [00:00<00:00, 3511.61it/s, Materializing param=encoder.layer.3.attention.output.dense.bias]Loading weights:  55%|█████▌    | 57/103 [00:00<00:00, 3556.08it/s, Materializing param=encoder.layer.3.attention.output.dense.weight]Loading weights:  55%|█████▌    | 57/103 [00:00<00:00, 3546.32it/s, Materializing param=encoder.layer.3.attention.output.dense.weight]Loading weights:  56%|█████▋    | 58/103 [00:00<00:00, 3591.54it/s, Materializing param=encoder.layer.3.attention.self.key.bias]      Loading weights:  56%|█████▋    | 58/103 [00:00<00:00, 3582.92it/s, Materializing param=encoder.layer.3.attention.self.key.bias]Loading weights:  57%|█████▋    | 59/103 [00:00<00:00, 3628.61it/s, Materializing param=encoder.layer.3.attention.self.key.weight]Loading weights:  57%|█████▋    | 59/103 [00:00<00:00, 3619.00it/s, Materializing param=encoder.layer.3.attention.self.key.weight]Loading weights:  58%|█████▊    | 60/103 [00:00<00:00, 3663.84it/s, Materializing param=encoder.layer.3.attention.self.query.bias]Loading weights:  58%|█████▊    | 60/103 [00:00<00:00, 3655.38it/s, Materializing param=encoder.layer.3.attention.self.query.bias]Loading weights:  59%|█████▉    | 61/103 [00:00<00:00, 3700.34it/s, Materializing param=encoder.layer.3.attention.self.query.weight]Loading weights:  59%|█████▉    | 61/103 [00:00<00:00, 3691.64it/s, Materializing param=encoder.layer.3.attention.self.query.weight]Loading weights:  60%|██████    | 62/103 [00:00<00:00, 3735.77it/s, Materializing param=encoder.layer.3.attention.self.value.bias]  Loading weights:  60%|██████    | 62/103 [00:00<00:00, 3727.09it/s, Materializing param=encoder.layer.3.attention.self.value.bias]Loading weights:  61%|██████    | 63/103 [00:00<00:00, 3770.62it/s, Materializing param=encoder.layer.3.attention.self.value.weight]Loading weights:  61%|██████    | 63/103 [00:00<00:00, 3761.81it/s, Materializing param=encoder.layer.3.attention.self.value.weight]Loading weights:  62%|██████▁   | 64/103 [00:00<00:00, 3805.00it/s, Materializing param=encoder.layer.3.intermediate.dense.bias]    Loading weights:  62%|██████▁   | 64/103 [00:00<00:00, 3795.86it/s, Materializing param=encoder.layer.3.intermediate.dense.bias]Loading weights:  63%|██████▎   | 65/103 [00:00<00:00, 3838.67it/s, Materializing param=encoder.layer.3.intermediate.dense.weight]Loading weights:  63%|██████▎   | 65/103 [00:00<00:00, 3829.93it/s, Materializing param=encoder.layer.3.intermediate.dense.weight]Loading weights:  64%|██████▁   | 66/103 [00:00<00:00, 3870.58it/s, Materializing param=encoder.layer.3.output.LayerNorm.bias]    Loading weights:  64%|██████▁   | 66/103 [00:00<00:00, 3860.65it/s, Materializing param=encoder.layer.3.output.LayerNorm.bias]Loading weights:  65%|██████▌   | 67/103 [00:00<00:00, 3902.65it/s, Materializing param=encoder.layer.3.output.LayerNorm.weight]Loading weights:  65%|██████▌   | 67/103 [00:00<00:00, 3893.89it/s, Materializing param=encoder.layer.3.output.LayerNorm.weight]Loading weights:  66%|██████▌   | 68/103 [00:00<00:00, 3935.98it/s, Materializing param=encoder.layer.3.output.dense.bias]      Loading weights:  66%|██████▌   | 68/103 [00:00<00:00, 3927.52it/s, Materializing param=encoder.layer.3.output.dense.bias]Loading weights:  67%|██████▋   | 69/103 [00:00<00:00, 3969.10it/s, Materializing param=encoder.layer.3.output.dense.weight]Loading weights:  67%|██████▋   | 69/103 [00:00<00:00, 3960.30it/s, Materializing param=encoder.layer.3.output.dense.weight]Loading weights:  68%|██████▊   | 70/103 [00:00<00:00, 4001.93it/s, Materializing param=encoder.layer.4.attention.output.LayerNorm.bias]Loading weights:  68%|██████▊   | 70/103 [00:00<00:00, 3993.11it/s, Materializing param=encoder.layer.4.attention.output.LayerNorm.bias]Loading weights:  69%|██████▉   | 71/103 [00:00<00:00, 4033.37it/s, Materializing param=encoder.layer.4.attention.output.LayerNorm.weight]Loading weights:  69%|██████▉   | 71/103 [00:00<00:00, 4024.65it/s, Materializing param=encoder.layer.4.attention.output.LayerNorm.weight]Loading weights:  70%|██████▉   | 72/103 [00:00<00:00, 4062.99it/s, Materializing param=encoder.layer.4.attention.output.dense.bias]      Loading weights:  70%|██████▉   | 72/103 [00:00<00:00, 4053.83it/s, Materializing param=encoder.layer.4.attention.output.dense.bias]Loading weights:  71%|███████   | 73/103 [00:00<00:00, 4093.65it/s, Materializing param=encoder.layer.4.attention.output.dense.weight]Loading weights:  71%|███████   | 73/103 [00:00<00:00, 4083.54it/s, Materializing param=encoder.layer.4.attention.output.dense.weight]Loading weights:  72%|███████▁  | 74/103 [00:00<00:00, 4122.44it/s, Materializing param=encoder.layer.4.attention.self.key.bias]      Loading weights:  72%|███████▁  | 74/103 [00:00<00:00, 4113.59it/s, Materializing param=encoder.layer.4.attention.self.key.bias]Loading weights:  73%|███████▎  | 75/103 [00:00<00:00, 4149.43it/s, Materializing param=encoder.layer.4.attention.self.key.weight]Loading weights:  73%|███████▎  | 75/103 [00:00<00:00, 4140.10it/s, Materializing param=encoder.layer.4.attention.self.key.weight]Loading weights:  74%|███████▁  | 76/103 [00:00<00:00, 4178.69it/s, Materializing param=encoder.layer.4.attention.self.query.bias]Loading weights:  74%|███████▁  | 76/103 [00:00<00:00, 4169.78it/s, Materializing param=encoder.layer.4.attention.self.query.bias]Loading weights:  75%|███████▁  | 77/103 [00:00<00:00, 4208.08it/s, Materializing param=encoder.layer.4.attention.self.query.weight]Loading weights:  75%|███████▁  | 77/103 [00:00<00:00, 4199.05it/s, Materializing param=encoder.layer.4.attention.self.query.weight]Loading weights:  76%|███████▌  | 78/103 [00:00<00:00, 4237.49it/s, Materializing param=encoder.layer.4.attention.self.value.bias]  Loading weights:  76%|███████▌  | 78/103 [00:00<00:00, 4228.78it/s, Materializing param=encoder.layer.4.attention.self.value.bias]Loading weights:  77%|███████▋  | 79/103 [00:00<00:00, 4266.73it/s, Materializing param=encoder.layer.4.attention.self.value.weight]Loading weights:  77%|███████▋  | 79/103 [00:00<00:00, 4257.90it/s, Materializing param=encoder.layer.4.attention.self.value.weight]Loading weights:  78%|███████▊  | 80/103 [00:00<00:00, 4295.30it/s, Materializing param=encoder.layer.4.intermediate.dense.bias]    Loading weights:  78%|███████▊  | 80/103 [00:00<00:00, 4286.41it/s, Materializing param=encoder.layer.4.intermediate.dense.bias]Loading weights:  79%|███████▊  | 81/103 [00:00<00:00, 4323.91it/s, Materializing param=encoder.layer.4.intermediate.dense.weight]Loading weights:  79%|███████▊  | 81/103 [00:00<00:00, 4314.91it/s, Materializing param=encoder.layer.4.intermediate.dense.weight]Loading weights:  80%|███████▉  | 82/103 [00:00<00:00, 4352.09it/s, Materializing param=encoder.layer.4.output.LayerNorm.bias]    Loading weights:  80%|███████▉  | 82/103 [00:00<00:00, 4343.36it/s, Materializing param=encoder.layer.4.output.LayerNorm.bias]Loading weights:  81%|████████  | 83/103 [00:00<00:00, 4380.50it/s, Materializing param=encoder.layer.4.output.LayerNorm.weight]Loading weights:  81%|████████  | 83/103 [00:00<00:00, 4371.10it/s, Materializing param=encoder.layer.4.output.LayerNorm.weight]Loading weights:  82%|████████▁ | 84/103 [00:00<00:00, 4404.18it/s, Materializing param=encoder.layer.4.output.dense.bias]      Loading weights:  82%|████████▁ | 84/103 [00:00<00:00, 4394.84it/s, Materializing param=encoder.layer.4.output.dense.bias]Loading weights:  83%|████████▎ | 85/103 [00:00<00:00, 4431.14it/s, Materializing param=encoder.layer.4.output.dense.weight]Loading weights:  83%|████████▎ | 85/103 [00:00<00:00, 4422.29it/s, Materializing param=encoder.layer.4.output.dense.weight]Loading weights:  83%|████████▎ | 86/103 [00:00<00:00, 4457.23it/s, Materializing param=encoder.layer.5.attention.output.LayerNorm.bias]Loading weights:  83%|████████▎ | 86/103 [00:00<00:00, 4447.89it/s, Materializing param=encoder.layer.5.attention.output.LayerNorm.bias]Loading weights:  84%|████████▁ | 87/103 [00:00<00:00, 4483.13it/s, Materializing param=encoder.layer.5.attention.output.LayerNorm.weight]Loading weights:  84%|████████▁ | 87/103 [00:00<00:00, 4473.07it/s, Materializing param=encoder.layer.5.attention.output.LayerNorm.weight]Loading weights:  85%|████████▌ | 88/103 [00:00<00:00, 4507.31it/s, Materializing param=encoder.layer.5.attention.output.dense.bias]      Loading weights:  85%|████████▌ | 88/103 [00:00<00:00, 4498.30it/s, Materializing param=encoder.layer.5.attention.output.dense.bias]Loading weights:  86%|████████▋ | 89/103 [00:00<00:00, 4532.79it/s, Materializing param=encoder.layer.5.attention.output.dense.weight]Loading weights:  86%|████████▋ | 89/103 [00:00<00:00, 4523.89it/s, Materializing param=encoder.layer.5.attention.output.dense.weight]Loading weights:  87%|████████▋ | 90/103 [00:00<00:00, 4558.09it/s, Materializing param=encoder.layer.5.attention.self.key.bias]      Loading weights:  87%|████████▋ | 90/103 [00:00<00:00, 4549.36it/s, Materializing param=encoder.layer.5.attention.self.key.bias]Loading weights:  88%|████████▊ | 91/103 [00:00<00:00, 4583.50it/s, Materializing param=encoder.layer.5.attention.self.key.weight]Loading weights:  88%|████████▊ | 91/103 [00:00<00:00, 4574.65it/s, Materializing param=encoder.layer.5.attention.self.key.weight]Loading weights:  89%|████████▉ | 92/103 [00:00<00:00, 4608.35it/s, Materializing param=encoder.layer.5.attention.self.query.bias]Loading weights:  89%|████████▉ | 92/103 [00:00<00:00, 4599.46it/s, Materializing param=encoder.layer.5.attention.self.query.bias]Loading weights:  90%|█████████ | 93/103 [00:00<00:00, 4628.82it/s, Materializing param=encoder.layer.5.attention.self.query.weight]Loading weights:  90%|█████████ | 93/103 [00:00<00:00, 4619.77it/s, Materializing param=encoder.layer.5.attention.self.query.weight]Loading weights:  91%|█████████▁| 94/103 [00:00<00:00, 4653.08it/s, Materializing param=encoder.layer.5.attention.self.value.bias]  Loading weights:  91%|█████████▁| 94/103 [00:00<00:00, 4644.31it/s, Materializing param=encoder.layer.5.attention.self.value.bias]Loading weights:  92%|█████████▁| 95/103 [00:00<00:00, 4677.63it/s, Materializing param=encoder.layer.5.attention.self.value.weight]Loading weights:  92%|█████████▁| 95/103 [00:00<00:00, 4668.80it/s, Materializing param=encoder.layer.5.attention.self.value.weight]Loading weights:  93%|█████████▎| 96/103 [00:00<00:00, 4701.59it/s, Materializing param=encoder.layer.5.intermediate.dense.bias]    Loading weights:  93%|█████████▎| 96/103 [00:00<00:00, 4692.98it/s, Materializing param=encoder.layer.5.intermediate.dense.bias]Loading weights:  94%|█████████▁| 97/103 [00:00<00:00, 4726.00it/s, Materializing param=encoder.layer.5.intermediate.dense.weight]Loading weights:  94%|█████████▁| 97/103 [00:00<00:00, 4717.40it/s, Materializing param=encoder.layer.5.intermediate.dense.weight]Loading weights:  95%|█████████▌| 98/103 [00:00<00:00, 4749.90it/s, Materializing param=encoder.layer.5.output.LayerNorm.bias]    Loading weights:  95%|█████████▌| 98/103 [00:00<00:00, 4741.02it/s, Materializing param=encoder.layer.5.output.LayerNorm.bias]Loading weights:  96%|█████████▌| 99/103 [00:00<00:00, 4773.21it/s, Materializing param=encoder.layer.5.output.LayerNorm.weight]Loading weights:  96%|█████████▌| 99/103 [00:00<00:00, 4764.61it/s, Materializing param=encoder.layer.5.output.LayerNorm.weight]Loading weights:  97%|█████████▋| 100/103 [00:00<00:00, 4797.11it/s, Materializing param=encoder.layer.5.output.dense.bias]     Loading weights:  97%|█████████▋| 100/103 [00:00<00:00, 4788.46it/s, Materializing param=encoder.layer.5.output.dense.bias]Loading weights:  98%|█████████▊| 101/103 [00:00<00:00, 4818.19it/s, Materializing param=encoder.layer.5.output.dense.weight]Loading weights:  98%|█████████▊| 101/103 [00:00<00:00, 4809.05it/s, Materializing param=encoder.layer.5.output.dense.weight]Loading weights:  99%|█████████▉| 102/103 [00:00<00:00, 4836.41it/s, Materializing param=pooler.dense.bias]                  Loading weights:  99%|█████████▉| 102/103 [00:00<00:00, 4827.57it/s, Materializing param=pooler.dense.bias]Loading weights: 100%|██████████| 103/103 [00:00<00:00, 4860.25it/s, Materializing param=pooler.dense.weight]Loading weights: 100%|██████████| 103/103 [00:00<00:00, 4851.79it/s, Materializing param=pooler.dense.weight]Loading weights: 100%|██████████| 103/103 [00:00<00:00, 4833.88it/s, Materializing param=pooler.dense.weight]
[1mBertModel LOAD REPORT[0m from: sentence-transformers/all-MiniLM-L6-v2
Key                     | Status     |  | 
------------------------+------------+--+-
embeddings.position_ids | UNEXPECTED |  | 

[3mNotes:
- UNEXPECTED[3m	:can be ignored when loading from different task/architecture; not ok if you expect identical arch.[0m
API calls:   0%|          | 0/5000 [00:00<?, ?call/s]Evaluating 100 puzzles
Methods: ['cip_lite']

============================================================
STARTING EVALUATION
============================================================

Evaluating CIPLiteStopping on 100 puzzles...

  CIPLiteStopping:   0%|          | 0/100 [00:00<?, ?it/s][AAPI calls:   0%|          | 1/5000 [00:02<3:05:42,  2.23s/call]API calls:   0%|          | 2/5000 [00:02<1:27:00,  1.04s/call]API calls:   0%|          | 3/5000 [00:03<1:11:12,  1.17call/s]API calls:   0%|          | 4/5000 [00:04<1:16:41,  1.09call/s]API calls:   1%|          | 38/5000 [00:04<04:04, 20.32call/s] API calls:   1%|▁         | 63/5000 [00:04<02:11, 37.42call/s]API calls:   2%|▁         | 82/5000 [00:04<01:48, 45.18call/s]API calls:   2%|▁         | 95/5000 [00:05<02:13, 36.79call/s]API calls:   2%|▁         | 105/5000 [00:05<02:34, 31.68call/s]API calls:   2%|▁         | 112/5000 [00:05<02:31, 32.30call/s]API calls:   2%|▁         | 120/5000 [00:05<02:10, 37.27call/s]API calls:   3%|▎         | 127/5000 [00:06<03:08, 25.89call/s]API calls:   3%|▎         | 132/5000 [00:06<03:28, 23.35call/s]API calls:   3%|▎         | 136/5000 [00:06<03:24, 23.80call/s]API calls:   3%|▎         | 141/5000 [00:07<03:03, 26.48call/s]API calls:   3%|▎         | 148/5000 [00:07<02:34, 31.45call/s]
  CIPLiteStopping:   1%|          | 1/100 [00:07<11:54,  7.22s/it][A
  CIPLiteStopping:   1%|          | 1/100 [00:07<11:54,  7.22s/it, acc=100%, turns=1.0][AAPI calls:   3%|▎         | 159/5000 [00:07<01:51, 43.58call/s]API calls:   3%|▎         | 165/5000 [00:07<01:44, 46.33call/s]
  CIPLiteStopping:   2%|▁         | 2/100 [00:07<05:10,  3.17s/it, acc=100%, turns=1.0][A
  CIPLiteStopping:   2%|▁         | 2/100 [00:07<05:10,  3.17s/it, acc=100%, turns=1.0][AAPI calls:   4%|▎         | 181/5000 [00:07<01:20, 59.89call/s]
  CIPLiteStopping:   3%|▎         | 3/100 [00:07<05:07,  3.17s/it, acc=100%, turns=1.0][AAPI calls:   4%|▁         | 188/5000 [00:07<01:30, 53.22call/s]
  CIPLiteStopping:   4%|▁         | 4/100 [00:07<02:01,  1.26s/it, acc=100%, turns=1.0][A
  CIPLiteStopping:   4%|▁         | 4/100 [00:07<02:01,  1.26s/it, acc=100%, turns=1.0][AAPI calls:   4%|▁         | 194/5000 [00:07<01:31, 52.26call/s]API calls:   4%|▁         | 200/5000 [00:08<01:37, 49.13call/s]
  CIPLiteStopping:   5%|▌         | 5/100 [00:08<01:35,  1.00s/it, acc=100%, turns=1.0][A
  CIPLiteStopping:   5%|▌         | 5/100 [00:08<01:35,  1.00s/it, acc=100%, turns=1.0][AAPI calls:   4%|▁         | 206/5000 [00:08<01:59, 40.19call/s]API calls:   4%|▁         | 211/5000 [00:08<02:01, 39.30call/s]API calls:   4%|▁         | 216/5000 [00:08<02:06, 37.68call/s]API calls:   4%|▁         | 220/5000 [00:08<02:37, 30.30call/s]
  CIPLiteStopping:   6%|▌         | 6/100 [00:08<01:22,  1.15it/s, acc=100%, turns=1.0][A
  CIPLiteStopping:   6%|▌         | 6/100 [00:08<01:22,  1.15it/s, acc=100%, turns=1.0][A
  CIPLiteStopping:   7%|▋         | 7/100 [00:08<01:21,  1.15it/s, acc=100%, turns=1.0][AAPI calls:   4%|▁         | 224/5000 [00:08<02:49, 28.16call/s]API calls:   5%|▁         | 227/5000 [00:09<03:11, 24.96call/s]API calls:   5%|▁         | 233/5000 [00:09<02:31, 31.41call/s]
  CIPLiteStopping:   8%|▊         | 8/100 [00:09<00:53,  1.71it/s, acc=100%, turns=1.0][A
  CIPLiteStopping:   8%|▊         | 8/100 [00:09<00:53,  1.71it/s, acc=100%, turns=1.0][A
  CIPLiteStopping:   9%|▉         | 9/100 [00:09<00:53,  1.71it/s, acc=100%, turns=1.0][AAPI calls:   5%|▁         | 239/5000 [00:09<02:14, 35.39call/s]
  CIPLiteStopping:  10%|█         | 10/100 [00:09<00:52,  1.71it/s, acc=100%, turns=1.0][A
  CIPLiteStopping:  11%|█         | 11/100 [00:09<00:51,  1.71it/s, acc=100%, turns=1.0][A
  CIPLiteStopping:  12%|█▁        | 12/100 [00:09<00:23,  3.69it/s, acc=100%, turns=1.0][A
  CIPLiteStopping:  12%|█▁        | 12/100 [00:09<00:23,  3.69it/s, acc=100%, turns=1.0][A
  CIPLiteStopping:  13%|█▎        | 13/100 [00:09<00:23,  3.69it/s, acc=100%, turns=1.0][AAPI calls:   5%|▁         | 244/5000 [00:09<02:27, 32.26call/s]API calls:   5%|▁         | 248/5000 [00:10<05:51, 13.50call/s]
  CIPLiteStopping:  14%|█▁        | 14/100 [00:10<00:28,  3.05it/s, acc=100%, turns=1.0][A
  CIPLiteStopping:  14%|█▁        | 14/100 [00:10<00:28,  3.05it/s, acc=100%, turns=1.0][AAPI calls:   5%|▌         | 251/5000 [00:10<06:34, 12.05call/s]API calls:   5%|▌         | 254/5000 [00:10<06:28, 12.22call/s]API calls:   5%|▌         | 258/5000 [00:11<06:00, 13.15call/s]API calls:   5%|▌         | 260/5000 [00:11<06:46, 11.66call/s]API calls:   5%|▌         | 263/5000 [00:11<05:54, 13.36call/s]API calls:   5%|▌         | 265/5000 [00:11<06:07, 12.89call/s]API calls:   5%|▌         | 267/5000 [00:11<06:02, 13.05call/s]API calls:   5%|▌         | 271/5000 [00:12<05:26, 14.49call/s]API calls:   5%|▌         | 273/5000 [00:12<05:43, 13.76call/s]API calls:   6%|▌         | 277/5000 [00:12<05:23, 14.58call/s]API calls:   6%|▌         | 287/5000 [00:12<02:47, 28.15call/s]
  CIPLiteStopping:  15%|█▌        | 15/100 [00:12<00:56,  1.51it/s, acc=100%, turns=1.0][A
  CIPLiteStopping:  15%|█▌        | 15/100 [00:12<00:56,  1.51it/s, acc=100%, turns=1.0][A
  CIPLiteStopping:  16%|█▌        | 16/100 [00:12<00:55,  1.51it/s, acc=100%, turns=1.0][AAPI calls:   6%|▌         | 292/5000 [00:12<02:26, 32.09call/s]
  CIPLiteStopping:  17%|█▋        | 17/100 [00:12<00:38,  2.15it/s, acc=100%, turns=1.0][A
  CIPLiteStopping:  17%|█▋        | 17/100 [00:12<00:38,  2.15it/s, acc=100%, turns=1.0][AAPI calls:   6%|▌         | 296/5000 [00:12<02:25, 32.37call/s]API calls:   6%|▌         | 300/5000 [00:13<02:37, 29.86call/s]
  CIPLiteStopping:  18%|█▊        | 18/100 [00:13<00:36,  2.27it/s, acc=100%, turns=1.0][A
  CIPLiteStopping:  18%|█▊        | 18/100 [00:13<00:36,  2.27it/s, acc=100%, turns=1.0][AAPI calls:   6%|▌         | 304/5000 [00:13<02:27, 31.90call/s]API calls:   6%|▌         | 310/5000 [00:13<02:05, 37.44call/s]API calls:   6%|▋         | 315/5000 [00:13<02:40, 29.27call/s]API calls:   6%|▋         | 319/5000 [00:13<02:37, 29.80call/s]
  CIPLiteStopping:  19%|█▉        | 19/100 [00:13<00:37,  2.14it/s, acc=100%, turns=1.0][A
  CIPLiteStopping:  19%|█▉        | 19/100 [00:13<00:37,  2.14it/s, acc=100%, turns=1.0][AAPI calls:   6%|▋         | 323/5000 [00:13<03:08, 24.82call/s]
  CIPLiteStopping:  20%|██        | 20/100 [00:14<00:34,  2.32it/s, acc=100%, turns=1.0][A
  CIPLiteStopping:  20%|██        | 20/100 [00:14<00:34,  2.32it/s, acc=100%, turns=1.0][AAPI calls:   7%|▋         | 327/5000 [00:14<02:54, 26.71call/s]API calls:   7%|▋         | 331/5000 [00:14<02:51, 27.22call/s]
  CIPLiteStopping:  21%|██        | 21/100 [00:14<00:29,  2.72it/s, acc=100%, turns=1.0][A
  CIPLiteStopping:  21%|██        | 21/100 [00:14<00:29,  2.72it/s, acc=100%, turns=1.0][AAPI calls:   7%|▋         | 334/5000 [00:14<03:01, 25.73call/s]API calls:   7%|▋         | 337/5000 [00:14<03:11, 24.36call/s]API calls:   7%|▋         | 340/5000 [00:14<03:58, 19.50call/s]API calls:   7%|▋         | 341/5000 [00:14<04:12, 18.44call/s]API calls:   7%|▋         | 345/5000 [00:14<03:31, 22.01call/s]API calls:   7%|▋         | 348/5000 [00:14<03:55, 19.76call/s]API calls:   7%|▋         | 354/5000 [00:15<02:57, 26.17call/s]API calls:   7%|▋         | 359/5000 [00:15<02:31, 30.54call/s]
  CIPLiteStopping:  22%|██▁       | 22/100 [00:15<00:43,  1.77it/s, acc=100%, turns=1.0][A
  CIPLiteStopping:  22%|██▁       | 22/100 [00:15<00:43,  1.77it/s, acc=100%, turns=1.0][AAPI calls:   7%|▋         | 365/5000 [00:15<02:08, 36.07call/s]
  CIPLiteStopping:  23%|██▎       | 23/100 [00:15<00:33,  2.29it/s, acc=100%, turns=1.0][A
  CIPLiteStopping:  23%|██▎       | 23/100 [00:15<00:33,  2.29it/s, acc=100%, turns=1.0][AAPI calls:   7%|▋         | 369/5000 [00:15<02:18, 33.55call/s]API calls:   8%|▊         | 376/5000 [00:15<02:02, 37.60call/s]API calls:   8%|▊         | 380/5000 [00:15<02:01, 38.10call/s]API calls:   8%|▊         | 385/5000 [00:15<01:53, 40.53call/s]API calls:   8%|▊         | 394/5000 [00:15<01:29, 51.60call/s]
  CIPLiteStopping:  24%|██▁       | 24/100 [00:16<00:36,  2.06it/s, acc=100%, turns=1.0][A
  CIPLiteStopping:  24%|██▁       | 24/100 [00:16<00:36,  2.06it/s, acc=100%, turns=1.0][AAPI calls:   8%|▊         | 401/5000 [00:16<01:37, 47.32call/s]
  CIPLiteStopping:  25%|██▌       | 25/100 [00:16<00:29,  2.54it/s, acc=100%, turns=1.0][A
  CIPLiteStopping:  25%|██▌       | 25/100 [00:16<00:29,  2.54it/s, acc=100%, turns=1.0][AAPI calls:   8%|▊         | 406/5000 [00:16<01:39, 46.27call/s]API calls:   8%|▊         | 412/5000 [00:16<01:41, 45.28call/s]
  CIPLiteStopping:  26%|██▌       | 26/100 [00:16<00:27,  2.71it/s, acc=100%, turns=1.0][A
  CIPLiteStopping:  26%|██▌       | 26/100 [00:16<00:27,  2.71it/s, acc=100%, turns=1.0][AAPI calls:   8%|▊         | 417/5000 [00:16<01:47, 42.55call/s]API calls:   8%|▊         | 424/5000 [00:16<01:39, 46.13call/s]
  CIPLiteStopping:  27%|██▋       | 27/100 [00:16<00:23,  3.05it/s, acc=100%, turns=1.0][A
  CIPLiteStopping:  27%|██▋       | 27/100 [00:16<00:23,  3.05it/s, acc=100%, turns=1.0][AAPI calls:   9%|▊         | 429/5000 [00:16<01:48, 42.21call/s]API calls:   9%|▊         | 434/5000 [00:17<02:41, 28.25call/s]API calls:   9%|▉         | 441/5000 [00:17<02:16, 33.33call/s]API calls:   9%|▉         | 445/5000 [00:17<02:12, 34.43call/s]API calls:   9%|▉         | 449/5000 [00:17<02:09, 35.03call/s]API calls:   9%|▉         | 453/5000 [00:17<02:15, 33.46call/s]
  CIPLiteStopping:  28%|██▊       | 28/100 [00:17<00:36,  1.97it/s, acc=100%, turns=1.0][A
  CIPLiteStopping:  28%|██▊       | 28/100 [00:17<00:36,  1.97it/s, acc=100%, turns=1.0][AAPI calls:   9%|▉         | 457/5000 [00:17<02:26, 30.93call/s]API calls:   9%|▉         | 461/5000 [00:17<02:23, 31.73call/s]API calls:   9%|▉         | 465/5000 [00:18<02:49, 26.80call/s]
  CIPLiteStopping:  29%|██▉       | 29/100 [00:18<00:34,  2.03it/s, acc=100%, turns=1.0][A
  CIPLiteStopping:  29%|██▉       | 29/100 [00:18<00:34,  2.03it/s, acc=100%, turns=1.0][AAPI calls:   9%|▉         | 468/5000 [00:18<02:50, 26.53call/s]API calls:   9%|▉         | 473/5000 [00:18<02:51, 26.34call/s]API calls:  10%|▉         | 477/5000 [00:18<03:00, 25.01call/s]API calls:  10%|▉         | 480/5000 [00:18<04:08, 18.19call/s]API calls:  10%|▉         | 483/5000 [00:18<03:47, 19.84call/s]API calls:  10%|▉         | 487/5000 [00:19<03:31, 21.33call/s]API calls:  10%|▉         | 494/5000 [00:19<03:08, 23.90call/s]API calls:  10%|▉         | 497/5000 [00:19<03:12, 23.39call/s]API calls:  10%|█         | 504/5000 [00:19<02:19, 32.33call/s]API calls:  10%|█         | 510/5000 [00:19<01:58, 37.75call/s]API calls:  10%|█         | 515/5000 [00:20<03:15, 22.97call/s]API calls:  10%|█         | 519/5000 [00:20<03:21, 22.24call/s]API calls:  10%|█         | 522/5000 [00:20<03:53, 19.20call/s]API calls:  11%|█         | 526/5000 [00:20<03:29, 21.36call/s]API calls:  11%|█         | 532/5000 [00:20<02:50, 26.19call/s]
  CIPLiteStopping:  30%|███       | 30/100 [00:20<01:22,  1.18s/it, acc=100%, turns=1.0][A
  CIPLiteStopping:  30%|███       | 30/100 [00:20<01:22,  1.18s/it, acc=100%, turns=1.0][AAPI calls:  11%|█         | 536/5000 [00:21<03:05, 24.09call/s]
  CIPLiteStopping:  31%|███       | 31/100 [00:21<01:01,  1.12it/s, acc=100%, turns=1.0][A
  CIPLiteStopping:  31%|███       | 31/100 [00:21<01:01,  1.12it/s, acc=100%, turns=1.0][AAPI calls:  11%|█         | 547/5000 [00:21<02:04, 35.78call/s]API calls:  11%|█         | 558/5000 [00:21<01:32, 48.20call/s]API calls:  11%|█▁        | 564/5000 [00:21<01:28, 50.21call/s]
  CIPLiteStopping:  32%|███▁      | 32/100 [00:21<00:52,  1.29it/s, acc=100%, turns=1.0][A
  CIPLiteStopping:  32%|███▁      | 32/100 [00:21<00:52,  1.29it/s, acc=100%, turns=1.0][AAPI calls:  11%|█▁        | 570/5000 [00:21<01:39, 44.57call/s]API calls:  12%|█▁        | 575/5000 [00:21<01:45, 41.90call/s]
  CIPLiteStopping:  33%|███▎      | 33/100 [00:21<00:41,  1.60it/s, acc=100%, turns=1.0][A
  CIPLiteStopping:  33%|███▎      | 33/100 [00:21<00:41,  1.60it/s, acc=100%, turns=1.0][A
  CIPLiteStopping:  34%|███▁      | 34/100 [00:21<00:41,  1.60it/s, acc=100%, turns=1.1][AAPI calls:  12%|█▁        | 580/5000 [00:22<02:07, 34.60call/s]
  CIPLiteStopping:  35%|███▌      | 35/100 [00:22<00:26,  2.50it/s, acc=100%, turns=1.1][A
  CIPLiteStopping:  35%|███▌      | 35/100 [00:22<00:26,  2.50it/s, acc=100%, turns=1.1][AAPI calls:  12%|█▁        | 584/5000 [00:22<02:35, 28.32call/s]API calls:  12%|█▁        | 588/5000 [00:22<02:29, 29.53call/s]API calls:  12%|█▁        | 592/5000 [00:22<03:06, 23.66call/s]API calls:  12%|█▁        | 595/5000 [00:22<03:30, 20.89call/s]
  CIPLiteStopping:  36%|███▌      | 36/100 [00:22<00:30,  2.10it/s, acc=100%, turns=1.1][A
  CIPLiteStopping:  36%|███▌      | 36/100 [00:22<00:30,  2.10it/s, acc=100%, turns=1.1][AAPI calls:  12%|█▁        | 600/5000 [00:22<02:49, 25.96call/s]API calls:  12%|█▁        | 608/5000 [00:23<02:04, 35.32call/s]
  CIPLiteStopping:  37%|███▋      | 37/100 [00:23<00:26,  2.34it/s, acc=100%, turns=1.1][A
  CIPLiteStopping:  37%|███▋      | 37/100 [00:23<00:26,  2.34it/s, acc=100%, turns=1.1][AAPI calls:  12%|█▁        | 613/5000 [00:23<02:04, 35.26call/s]
  CIPLiteStopping:  38%|███▊      | 38/100 [00:23<00:26,  2.34it/s, acc=100%, turns=1.1][AAPI calls:  12%|█▁        | 617/5000 [00:23<02:15, 32.44call/s]
  CIPLiteStopping:  39%|███▉      | 39/100 [00:23<00:17,  3.41it/s, acc=100%, turns=1.1][A
  CIPLiteStopping:  39%|███▉      | 39/100 [00:23<00:17,  3.41it/s, acc=100%, turns=1.1][AAPI calls:  12%|█▁        | 621/5000 [00:23<02:58, 24.58call/s]API calls:  12%|█▁        | 624/5000 [00:23<04:00, 18.23call/s]API calls:  13%|█▎        | 629/5000 [00:24<03:10, 22.94call/s]
  CIPLiteStopping:  40%|████      | 40/100 [00:24<00:23,  2.57it/s, acc=100%, turns=1.1][A
  CIPLiteStopping:  40%|████      | 40/100 [00:24<00:23,  2.57it/s, acc=100%, turns=1.1][A
  CIPLiteStopping:  41%|████      | 41/100 [00:24<00:22,  2.57it/s, acc=100%, turns=1.1][AAPI calls:  13%|█▎        | 633/5000 [00:24<02:57, 24.60call/s]
  CIPLiteStopping:  42%|████▁     | 42/100 [00:24<00:15,  3.84it/s, acc=100%, turns=1.1][A
  CIPLiteStopping:  42%|████▁     | 42/100 [00:24<00:15,  3.84it/s, acc=100%, turns=1.1][AAPI calls:  13%|█▎        | 639/5000 [00:24<02:18, 31.39call/s]API calls:  13%|█▎        | 643/5000 [00:24<02:46, 26.20call/s]
  CIPLiteStopping:  43%|████▎     | 43/100 [00:24<00:15,  3.58it/s, acc=100%, turns=1.1][A
  CIPLiteStopping:  43%|████▎     | 43/100 [00:24<00:15,  3.58it/s, acc=100%, turns=1.1][AAPI calls:  13%|█▎        | 647/5000 [00:24<02:33, 28.30call/s]
  CIPLiteStopping:  44%|████▁     | 44/100 [00:24<00:15,  3.58it/s, acc=100%, turns=1.1][AAPI calls:  13%|█▎        | 654/5000 [00:24<02:18, 31.34call/s]API calls:  13%|█▎        | 655/5000 [00:24<02:04, 34.96call/s]
  CIPLiteStopping:  45%|████▌     | 45/100 [00:24<00:12,  4.40it/s, acc=100%, turns=1.1][A
  CIPLiteStopping:  45%|████▌     | 45/100 [00:24<00:12,  4.40it/s, acc=100%, turns=1.1][AAPI calls:  13%|█▎        | 666/5000 [00:24<01:32, 46.70call/s]API calls:  13%|█▎        | 673/5000 [00:25<01:33, 46.22call/s]API calls:  14%|█▎        | 681/5000 [00:25<01:21, 52.85call/s]
  CIPLiteStopping:  46%|████▌     | 46/100 [00:25<00:15,  3.58it/s, acc=100%, turns=1.1][A
  CIPLiteStopping:  46%|████▌     | 46/100 [00:25<00:15,  3.58it/s, acc=100%, turns=1.1][AAPI calls:  14%|█▎        | 687/5000 [00:25<01:34, 45.62call/s]API calls:  14%|█▁        | 692/5000 [00:25<02:05, 34.26call/s]API calls:  14%|█▁        | 697/5000 [00:25<02:09, 33.27call/s]
  CIPLiteStopping:  47%|████▋     | 47/100 [00:25<00:19,  2.73it/s, acc=100%, turns=1.1][A
  CIPLiteStopping:  47%|████▋     | 47/100 [00:25<00:19,  2.73it/s, acc=100%, turns=1.1][AAPI calls:  14%|█▁        | 701/5000 [00:26<02:25, 29.48call/s]
  CIPLiteStopping:  48%|████▊     | 48/100 [00:26<00:19,  2.73it/s, acc=100%, turns=1.1][AAPI calls:  14%|█▁        | 707/5000 [00:26<02:12, 32.44call/s]API calls:  14%|█▁        | 713/5000 [00:26<02:00, 35.72call/s]
  CIPLiteStopping:  49%|████▉     | 49/100 [00:26<00:14,  3.50it/s, acc=100%, turns=1.1][A
  CIPLiteStopping:  49%|████▉     | 49/100 [00:26<00:14,  3.50it/s, acc=100%, turns=1.2][AAPI calls:  14%|█▁        | 720/5000 [00:26<02:12, 32.30call/s]API calls:  14%|█▁        | 724/5000 [00:26<02:16, 31.35call/s]API calls:  15%|█▁        | 728/5000 [00:26<02:13, 31.99call/s]API calls:  15%|█▁        | 732/5000 [00:26<02:22, 30.05call/s]API calls:  15%|█▁        | 736/5000 [00:27<02:25, 29.26call/s]API calls:  15%|█▁        | 739/5000 [00:27<02:24, 29.39call/s]
  CIPLiteStopping:  50%|█████     | 50/100 [00:27<00:22,  2.23it/s, acc=100%, turns=1.2][A
  CIPLiteStopping:  50%|█████     | 50/100 [00:27<00:22,  2.23it/s, acc=100%, turns=1.2][AAPI calls:  15%|█▁        | 746/5000 [00:27<02:01, 34.99call/s]API calls:  15%|█▌        | 750/5000 [00:27<02:19, 30.54call/s]
  CIPLiteStopping:  51%|█████     | 51/100 [00:27<00:20,  2.39it/s, acc=100%, turns=1.2][A
  CIPLiteStopping:  51%|█████     | 51/100 [00:27<00:20,  2.39it/s, acc=100%, turns=1.2][AAPI calls:  15%|█▌        | 761/5000 [00:27<01:38, 43.11call/s]API calls:  15%|█▌        | 766/5000 [00:27<01:54, 37.06call/s]API calls:  15%|█▌        | 772/5000 [00:28<02:01, 34.82call/s]API calls:  16%|█▌        | 777/5000 [00:28<02:02, 34.49call/s]API calls:  16%|█▌        | 781/5000 [00:28<02:29, 28.13call/s]API calls:  16%|█▌        | 786/5000 [00:28<02:20, 30.00call/s]API calls:  16%|█▌        | 794/5000 [00:28<01:47, 39.15call/s]API calls:  16%|█▌        | 802/5000 [00:28<01:30, 46.27call/s]
  CIPLiteStopping:  52%|█████▁    | 52/100 [00:28<00:29,  1.61it/s, acc=100%, turns=1.2][A
  CIPLiteStopping:  52%|█████▁    | 52/100 [00:28<00:29,  1.61it/s, acc=100%, turns=1.2][A
  CIPLiteStopping:  53%|█████▎    | 53/100 [00:28<00:29,  1.61it/s, acc=100%, turns=1.2][A
  CIPLiteStopping:  54%|█████▁    | 54/100 [00:28<00:17,  2.59it/s, acc=100%, turns=1.2][A
  CIPLiteStopping:  54%|█████▁    | 54/100 [00:28<00:17,  2.59it/s, acc=100%, turns=1.2][AAPI calls:  16%|█▌        | 808/5000 [00:29<01:48, 38.56call/s]
  CIPLiteStopping:  55%|█████▌    | 55/100 [00:29<00:14,  3.02it/s, acc=100%, turns=1.2][A
  CIPLiteStopping:  55%|█████▌    | 55/100 [00:29<00:14,  3.02it/s, acc=100%, turns=1.2][AAPI calls:  16%|█▋        | 813/5000 [00:29<02:03, 34.03call/s]
  CIPLiteStopping:  56%|█████▌    | 56/100 [00:29<00:13,  3.38it/s, acc=100%, turns=1.2][A
  CIPLiteStopping:  56%|█████▌    | 56/100 [00:29<00:13,  3.38it/s, acc=100%, turns=1.2][AAPI calls:  16%|█▋        | 819/5000 [00:29<01:59, 34.95call/s]API calls:  16%|█▋        | 823/5000 [00:29<02:37, 26.52call/s]API calls:  17%|█▋        | 827/5000 [00:29<03:05, 22.50call/s]
  CIPLiteStopping:  57%|█████▋    | 57/100 [00:29<00:16,  2.59it/s, acc=100%, turns=1.2][A
  CIPLiteStopping:  57%|█████▋    | 57/100 [00:29<00:16,  2.59it/s, acc=100%, turns=1.2][AAPI calls:  17%|█▋        | 830/5000 [00:30<03:36, 19.25call/s]API calls:  17%|█▋        | 831/5000 [00:30<03:47, 18.34call/s]
  CIPLiteStopping:  58%|█████▊    | 58/100 [00:30<00:14,  2.85it/s, acc=100%, turns=1.2][A
  CIPLiteStopping:  58%|█████▊    | 58/100 [00:30<00:14,  2.85it/s, acc=100%, turns=1.2][AAPI calls:  17%|█▋        | 843/5000 [00:30<02:15, 30.77call/s]API calls:  17%|█▋        | 850/5000 [00:30<01:50, 37.68call/s]
  CIPLiteStopping:  59%|█████▉    | 59/100 [00:30<00:14,  2.91it/s, acc=100%, turns=1.2][A
  CIPLiteStopping:  59%|█████▉    | 59/100 [00:30<00:14,  2.91it/s, acc=100%, turns=1.2][A
  CIPLiteStopping:  60%|██████    | 60/100 [00:30<00:11,  3.39it/s, acc=100%, turns=1.2][A
  CIPLiteStopping:  60%|██████    | 60/100 [00:30<00:11,  3.39it/s, acc=100%, turns=1.2][AAPI calls:  17%|█▋        | 856/5000 [00:30<02:34, 26.77call/s]API calls:  17%|█▋        | 861/5000 [00:30<02:19, 29.70call/s]API calls:  17%|█▋        | 866/5000 [00:31<02:44, 25.15call/s]API calls:  17%|█▋        | 874/5000 [00:31<02:04, 33.04call/s]
  CIPLiteStopping:  61%|██████    | 61/100 [00:31<00:15,  2.46it/s, acc=100%, turns=1.2][A
  CIPLiteStopping:  61%|██████    | 61/100 [00:31<00:15,  2.46it/s, acc=100%, turns=1.2][AAPI calls:  18%|█▊        | 879/5000 [00:31<02:15, 30.35call/s]API calls:  18%|█▊        | 886/5000 [00:31<01:58, 34.83call/s]API calls:  18%|█▊        | 891/5000 [00:31<01:57, 34.99call/s]
  CIPLiteStopping:  62%|██████▁   | 62/100 [00:31<00:16,  2.37it/s, acc=100%, turns=1.2][A
  CIPLiteStopping:  62%|██████▁   | 62/100 [00:31<00:16,  2.37it/s, acc=100%, turns=1.2][AAPI calls:  18%|█▊        | 897/5000 [00:31<01:43, 39.61call/s]
  CIPLiteStopping:  63%|██████▎   | 63/100 [00:31<00:15,  2.37it/s, acc=100%, turns=1.2][A
  CIPLiteStopping:  64%|██████▁   | 64/100 [00:31<00:15,  2.37it/s, acc=100%, turns=1.2][AAPI calls:  18%|█▊        | 904/5000 [00:32<01:39, 40.96call/s]
  CIPLiteStopping:  65%|██████▌   | 65/100 [00:32<00:07,  4.44it/s, acc=100%, turns=1.2][A
  CIPLiteStopping:  65%|██████▌   | 65/100 [00:32<00:07,  4.44it/s, acc=100%, turns=1.2][A
  CIPLiteStopping:  66%|██████▌   | 66/100 [00:32<00:07,  4.44it/s, acc=100%, turns=1.2][A
  CIPLiteStopping:  67%|██████▋   | 67/100 [00:32<00:05,  5.82it/s, acc=100%, turns=1.2][A
  CIPLiteStopping:  67%|██████▋   | 67/100 [00:32<00:05,  5.82it/s, acc=100%, turns=1.2][AAPI calls:  18%|█▊        | 909/5000 [00:32<02:07, 32.10call/s]API calls:  18%|█▊        | 913/5000 [00:32<02:51, 23.84call/s]API calls:  18%|█▊        | 916/5000 [00:32<03:13, 21.16call/s]
  CIPLiteStopping:  68%|██████▊   | 68/100 [00:32<00:09,  3.53it/s, acc=100%, turns=1.2][A
  CIPLiteStopping:  68%|██████▊   | 68/100 [00:32<00:09,  3.53it/s, acc=100%, turns=1.2][AAPI calls:  18%|█▊        | 922/5000 [00:32<02:38, 25.66call/s]API calls:  19%|█▊        | 927/5000 [00:33<02:55, 23.25call/s]API calls:  19%|█▊        | 932/5000 [00:33<02:29, 27.24call/s]API calls:  19%|█▊        | 936/5000 [00:33<03:12, 21.06call/s]API calls:  19%|█▉        | 941/5000 [00:33<02:54, 23.22call/s]API calls:  19%|█▉        | 947/5000 [00:33<02:19, 29.04call/s]
  CIPLiteStopping:  69%|██████▉   | 69/100 [00:33<00:14,  2.21it/s, acc=100%, turns=1.2][A
  CIPLiteStopping:  69%|██████▉   | 69/100 [00:33<00:14,  2.21it/s, acc=100%, turns=1.2][A
  CIPLiteStopping:  70%|███████   | 70/100 [00:34<00:13,  2.21it/s, acc=100%, turns=1.2][AAPI calls:  19%|█▉        | 951/5000 [00:34<02:12, 30.60call/s]API calls:  19%|█▉        | 957/5000 [00:34<01:55, 35.08call/s]
  CIPLiteStopping:  71%|███████   | 71/100 [00:34<00:09,  3.09it/s, acc=100%, turns=1.2][A
  CIPLiteStopping:  71%|███████   | 71/100 [00:34<00:09,  3.09it/s, acc=100%, turns=1.2][AAPI calls:  19%|█▉        | 961/5000 [00:34<01:56, 34.64call/s]API calls:  19%|█▉        | 965/5000 [00:34<02:01, 33.23call/s]
  CIPLiteStopping:  72%|███████▁  | 72/100 [00:34<00:08,  3.34it/s, acc=100%, turns=1.2][A
  CIPLiteStopping:  72%|███████▁  | 72/100 [00:34<00:08,  3.34it/s, acc=100%, turns=1.2][AAPI calls:  19%|█▉        | 970/5000 [00:34<01:48, 37.08call/s]API calls:  20%|█▉        | 976/5000 [00:34<01:34, 42.71call/s]API calls:  20%|█▉        | 981/5000 [00:34<01:47, 37.36call/s]API calls:  20%|█▉        | 986/5000 [00:34<01:58, 33.80call/s]
  CIPLiteStopping:  73%|███████▎  | 73/100 [00:35<00:09,  2.76it/s, acc=100%, turns=1.2][A
  CIPLiteStopping:  73%|███████▎  | 73/100 [00:35<00:09,  2.76it/s, acc=100%, turns=1.2][AAPI calls:  20%|█▉        | 990/5000 [00:35<01:55, 34.84call/s]API calls:  20%|█▉        | 996/5000 [00:35<01:40, 39.77call/s]API calls:  20%|██        | 1003/5000 [00:35<01:24, 47.09call/s]
  CIPLiteStopping:  74%|███████▁  | 74/100 [00:35<00:09,  2.85it/s, acc=100%, turns=1.2][A
  CIPLiteStopping:  74%|███████▁  | 74/100 [00:35<00:09,  2.85it/s, acc=100%, turns=1.2][AAPI calls:  20%|██        | 1011/5000 [00:35<01:16, 52.14call/s]API calls:  20%|██        | 1017/5000 [00:35<01:55, 34.52call/s]API calls:  21%|██        | 1027/5000 [00:35<01:30, 43.70call/s]API calls:  21%|██        | 1033/5000 [00:36<01:35, 41.57call/s]
  CIPLiteStopping:  75%|███████▌  | 75/100 [00:36<00:11,  2.09it/s, acc=100%, turns=1.2][A
  CIPLiteStopping:  75%|███████▌  | 75/100 [00:36<00:11,  2.09it/s, acc=100%, turns=1.2][AAPI calls:  21%|██        | 1041/5000 [00:36<01:26, 45.72call/s]API calls:  21%|██        | 1047/5000 [00:36<02:08, 30.76call/s]
  CIPLiteStopping:  76%|███████▌  | 76/100 [00:36<00:11,  2.05it/s, acc=100%, turns=1.2][A
  CIPLiteStopping:  76%|███████▌  | 76/100 [00:36<00:11,  2.05it/s, acc=100%, turns=1.2][A
  CIPLiteStopping:  77%|███████▋  | 77/100 [00:36<00:11,  2.05it/s, acc=100%, turns=1.2][AAPI calls:  21%|██        | 1051/5000 [00:36<02:40, 24.58call/s]
  CIPLiteStopping:  78%|███████▊  | 78/100 [00:36<00:07,  3.10it/s, acc=100%, turns=1.2][A
  CIPLiteStopping:  78%|███████▊  | 78/100 [00:36<00:07,  3.10it/s, acc=100%, turns=1.2][AAPI calls:  21%|██        | 1055/5000 [00:37<02:34, 25.46call/s]
  CIPLiteStopping:  79%|███████▉  | 79/100 [00:37<00:06,  3.40it/s, acc=100%, turns=1.2][A
  CIPLiteStopping:  79%|███████▉  | 79/100 [00:37<00:06,  3.40it/s, acc=100%, turns=1.2][AAPI calls:  21%|██        | 1059/5000 [00:37<02:31, 25.95call/s]API calls:  21%|██▁       | 1063/5000 [00:37<02:27, 26.61call/s]
  CIPLiteStopping:  80%|████████  | 80/100 [00:37<00:05,  3.42it/s, acc=100%, turns=1.2][A
  CIPLiteStopping:  80%|████████  | 80/100 [00:37<00:05,  3.42it/s, acc=100%, turns=1.2][AAPI calls:  21%|██▁       | 1070/5000 [00:37<02:02, 31.95call/s]
  CIPLiteStopping:  81%|████████  | 81/100 [00:37<00:05,  3.42it/s, acc=100%, turns=1.2][AAPI calls:  21%|██▁       | 1074/5000 [00:37<02:34, 25.39call/s]
  CIPLiteStopping:  82%|████████▁ | 82/100 [00:37<00:04,  3.90it/s, acc=100%, turns=1.2][A
  CIPLiteStopping:  82%|████████▁ | 82/100 [00:37<00:04,  3.90it/s, acc=100%, turns=1.2][AAPI calls:  22%|██▁       | 1079/5000 [00:37<02:21, 27.76call/s]API calls:  22%|██▁       | 1083/5000 [00:38<02:39, 24.58call/s]API calls:  22%|██▁       | 1087/5000 [00:38<02:48, 23.29call/s]
  CIPLiteStopping:  83%|████████▎ | 83/100 [00:38<00:05,  3.27it/s, acc=100%, turns=1.2][A
  CIPLiteStopping:  83%|████████▎ | 83/100 [00:38<00:05,  3.27it/s, acc=100%, turns=1.2][AAPI calls:  22%|██▁       | 1092/5000 [00:38<02:34, 25.27call/s]API calls:  22%|██▁       | 1095/5000 [00:38<02:31, 25.78call/s]API calls:  22%|██▁       | 1098/5000 [00:38<02:27, 26.54call/s]API calls:  22%|██▁       | 1101/5000 [00:38<02:25, 26.86call/s]API calls:  22%|██▁       | 1105/5000 [00:38<02:09, 30.03call/s]API calls:  22%|██▁       | 1109/5000 [00:39<03:04, 21.09call/s]
  CIPLiteStopping:  84%|████████▁ | 84/100 [00:39<00:07,  2.11it/s, acc=100%, turns=1.2][A
  CIPLiteStopping:  84%|████████▁ | 84/100 [00:39<00:07,  2.11it/s, acc=100%, turns=1.2][AAPI calls:  22%|██▁       | 1112/5000 [00:39<03:09, 20.47call/s]
  CIPLiteStopping:  85%|████████▌ | 85/100 [00:39<00:07,  2.11it/s, acc=100%, turns=1.2][AAPI calls:  22%|██▁       | 1116/5000 [00:39<02:50, 22.76call/s]API calls:  22%|██▁       | 1120/5000 [00:39<02:36, 24.77call/s]API calls:  22%|██▁       | 1123/5000 [00:39<02:38, 24.51call/s]API calls:  23%|██▎       | 1126/5000 [00:39<03:10, 20.36call/s]API calls:  23%|██▎       | 1129/5000 [00:40<03:24, 18.91call/s]
  CIPLiteStopping:  86%|████████▌ | 86/100 [00:40<00:06,  2.14it/s, acc=100%, turns=1.2][A
  CIPLiteStopping:  86%|████████▌ | 86/100 [00:40<00:06,  2.14it/s, acc=100%, turns=1.2][AAPI calls:  23%|██▎       | 1132/5000 [00:40<03:45, 17.17call/s]
  CIPLiteStopping:  87%|████████▋ | 87/100 [00:40<00:05,  2.47it/s, acc=100%, turns=1.2][A
  CIPLiteStopping:  87%|████████▋ | 87/100 [00:40<00:05,  2.47it/s, acc=100%, turns=1.2][A
  CIPLiteStopping:  88%|████████▊ | 88/100 [00:40<00:04,  2.47it/s, acc=100%, turns=1.2][AAPI calls:  23%|██▎       | 1137/5000 [00:40<02:56, 21.91call/s]
  CIPLiteStopping:  89%|████████▉ | 89/100 [00:40<00:03,  3.56it/s, acc=100%, turns=1.2][A
  CIPLiteStopping:  89%|████████▉ | 89/100 [00:40<00:03,  3.56it/s, acc=100%, turns=1.2][AAPI calls:  23%|██▎       | 1140/5000 [00:40<03:09, 20.35call/s]API calls:  23%|██▎       | 1143/5000 [00:40<03:16, 19.66call/s]
  CIPLiteStopping:  90%|█████████ | 90/100 [00:40<00:02,  3.54it/s, acc=100%, turns=1.2][A
  CIPLiteStopping:  90%|█████████ | 90/100 [00:40<00:02,  3.54it/s, acc=100%, turns=1.2][AAPI calls:  23%|██▎       | 1146/5000 [00:41<06:37,  9.68call/s]API calls:  23%|██▎       | 1149/5000 [00:41<05:36, 11.44call/s]API calls:  23%|██▎       | 1152/5000 [00:41<05:11, 12.35call/s]API calls:  23%|██▎       | 1154/5000 [00:41<04:59, 12.84call/s]API calls:  23%|██▎       | 1158/5000 [00:42<04:02, 15.86call/s]API calls:  23%|██▎       | 1162/5000 [00:42<03:26, 18.56call/s]API calls:  23%|██▎       | 1165/5000 [00:42<04:12, 15.16call/s]API calls:  23%|██▎       | 1167/5000 [00:42<05:14, 12.17call/s]API calls:  23%|██▎       | 1169/5000 [00:43<07:55,  8.06call/s]API calls:  23%|██▎       | 1171/5000 [00:43<06:55,  9.22call/s]API calls:  23%|██▎       | 1173/5000 [00:44<09:15,  6.89call/s]API calls:  24%|██▎       | 1175/5000 [00:44<11:03,  5.76call/s]API calls:  24%|██▎       | 1179/5000 [00:44<07:05,  8.98call/s]
  CIPLiteStopping:  91%|█████████ | 91/100 [00:44<00:10,  1.14s/it, acc=100%, turns=1.2][A
  CIPLiteStopping:  91%|█████████ | 91/100 [00:44<00:10,  1.14s/it, acc=100%, turns=1.2][AAPI calls:  24%|██▎       | 1185/5000 [00:44<04:26, 14.30call/s]API calls:  24%|██▁       | 1188/5000 [00:45<04:37, 13.75call/s]API calls:  24%|██▁       | 1190/5000 [00:45<04:54, 12.93call/s]API calls:  24%|██▁       | 1191/5000 [00:45<04:39, 13.61call/s]
  CIPLiteStopping:  92%|█████████▁| 92/100 [00:45<00:07,  1.01it/s, acc=100%, turns=1.2][A
  CIPLiteStopping:  92%|█████████▁| 92/100 [00:45<00:07,  1.01it/s, acc=100%, turns=1.3][AAPI calls:  24%|██▁       | 1193/5000 [00:45<04:31, 14.00call/s]API calls:  24%|██▁       | 1195/5000 [00:45<04:23, 14.45call/s]API calls:  24%|██▁       | 1200/5000 [00:45<03:21, 18.87call/s]API calls:  24%|██▁       | 1203/5000 [00:45<03:29, 18.14call/s]API calls:  24%|██▁       | 1205/5000 [00:46<04:24, 14.32call/s]API calls:  24%|██▁       | 1209/5000 [00:46<03:21, 18.84call/s]API calls:  24%|██▁       | 1212/5000 [00:46<03:20, 18.87call/s]
  CIPLiteStopping:  93%|█████████▎| 93/100 [00:46<00:07,  1.03s/it, acc=100%, turns=1.3][A
  CIPLiteStopping:  93%|█████████▎| 93/100 [00:46<00:07,  1.03s/it, acc=100%, turns=1.3][AAPI calls:  24%|██▁       | 1215/5000 [00:47<08:24,  7.50call/s]API calls:  24%|██▁       | 1218/5000 [00:47<07:03,  8.94call/s]API calls:  24%|██▁       | 1223/5000 [00:47<04:58, 12.64call/s]API calls:  25%|██▁       | 1226/5000 [00:47<05:07, 12.28call/s]API calls:  25%|██▁       | 1228/5000 [00:48<06:21,  9.89call/s]API calls:  25%|██▁       | 1230/5000 [00:48<06:12, 10.11call/s]
  CIPLiteStopping:  94%|█████████▁| 94/100 [00:48<00:08,  1.35s/it, acc=100%, turns=1.3][A
  CIPLiteStopping:  94%|█████████▁| 94/100 [00:48<00:08,  1.35s/it, acc=100%, turns=1.3][AAPI calls:  25%|██▁       | 1232/5000 [00:48<07:11,  8.73call/s]
  CIPLiteStopping:  95%|█████████▌| 95/100 [00:48<00:05,  1.04s/it, acc=100%, turns=1.3][A
  CIPLiteStopping:  95%|█████████▌| 95/100 [00:48<00:05,  1.04s/it, acc=100%, turns=1.3][AAPI calls:  25%|██▁       | 1234/5000 [00:49<08:49,  7.11call/s]API calls:  25%|██▁       | 1237/5000 [00:49<08:05,  7.76call/s]API calls:  25%|██▁       | 1238/5000 [00:49<07:54,  7.93call/s]API calls:  25%|██▁       | 1239/5000 [00:50<11:02,  5.67call/s]API calls:  25%|██▁       | 1242/5000 [00:50<07:23,  8.47call/s]API calls:  25%|██▁       | 1244/5000 [00:50<09:53,  6.32call/s]API calls:  25%|██▁       | 1246/5000 [00:51<10:09,  6.16call/s]API calls:  25%|██▁       | 1247/5000 [00:52<19:22,  3.23call/s]API calls:  25%|██▁       | 1248/5000 [00:52<18:27,  3.39call/s]API calls:  25%|██▌       | 1250/5000 [00:52<16:25,  3.80call/s]API calls:  25%|██▌       | 1251/5000 [00:53<17:13,  3.63call/s]
  CIPLiteStopping:  96%|█████████▌| 96/100 [00:53<00:07,  1.97s/it, acc=100%, turns=1.3][A
  CIPLiteStopping:  96%|█████████▌| 96/100 [00:53<00:07,  1.97s/it, acc=100%, turns=1.4][AAPI calls:  25%|██▌       | 1255/5000 [00:53<10:28,  5.96call/s]API calls:  25%|██▌       | 1257/5000 [00:53<09:34,  6.52call/s]
  CIPLiteStopping:  97%|█████████▋| 97/100 [00:53<00:04,  1.55s/it, acc=100%, turns=1.4][A
  CIPLiteStopping:  97%|█████████▋| 97/100 [00:53<00:04,  1.55s/it, acc=100%, turns=1.4][AAPI calls:  25%|██▌       | 1258/5000 [00:53<11:19,  5.51call/s]API calls:  25%|██▌       | 1261/5000 [00:54<09:02,  6.90call/s]API calls:  25%|██▌       | 1262/5000 [00:54<09:08,  6.82call/s]API calls:  25%|██▌       | 1263/5000 [00:54<10:54,  5.71call/s]API calls:  25%|██▌       | 1265/5000 [00:54<08:28,  7.34call/s]API calls:  25%|██▌       | 1267/5000 [00:55<08:06,  7.67call/s]API calls:  25%|██▌       | 1269/5000 [00:55<08:54,  6.98call/s]API calls:  25%|██▌       | 1271/5000 [00:55<10:03,  6.18call/s]API calls:  25%|██▌       | 1272/5000 [00:56<14:00,  4.44call/s]API calls:  25%|██▌       | 1273/5000 [00:56<17:31,  3.55call/s]API calls:  25%|██▌       | 1274/5000 [00:57<23:59,  2.59call/s]API calls:  26%|██▌       | 1276/5000 [00:57<17:35,  3.53call/s]API calls:  26%|██▌       | 1277/5000 [00:58<18:55,  3.28call/s]API calls:  26%|██▌       | 1279/5000 [00:58<13:35,  4.56call/s]API calls:  26%|██▌       | 1281/5000 [00:58<12:47,  4.85call/s]
  CIPLiteStopping:  98%|█████████▊| 98/100 [00:58<00:05,  2.58s/it, acc=100%, turns=1.4][A
  CIPLiteStopping:  98%|█████████▊| 98/100 [00:58<00:05,  2.58s/it, acc=100%, turns=1.4][AAPI calls:  26%|██▌       | 1282/5000 [00:59<18:12,  3.40call/s]API calls:  26%|██▌       | 1283/5000 [00:59<18:17,  3.39call/s]API calls:  26%|██▌       | 1284/5000 [01:00<28:39,  2.16call/s]API calls:  26%|██▌       | 1285/5000 [01:02<48:47,  1.27call/s]API calls:  26%|██▌       | 1289/5000 [01:02<21:02,  2.94call/s]API calls:  26%|██▌       | 1291/5000 [01:03<23:52,  2.59call/s]API calls:  26%|██▌       | 1293/5000 [01:05<35:42,  1.73call/s]
  CIPLiteStopping:  99%|█████████▉| 99/100 [01:05<00:03,  3.86s/it, acc=100%, turns=1.4][A
  CIPLiteStopping:  99%|█████████▉| 99/100 [01:05<00:03,  3.86s/it, acc=100%, turns=1.5][AAPI calls:  26%|██▌       | 1296/5000 [01:06<32:28,  1.90call/s]API calls:  26%|██▌       | 1298/5000 [01:06<24:38,  2.50call/s]API calls:  26%|██▌       | 1300/5000 [01:07<20:16,  3.04call/s]API calls:  26%|██▌       | 1301/5000 [01:08<30:01,  2.05call/s]API calls:  26%|██▌       | 1302/5000 [01:09<38:02,  1.62call/s]API calls:  26%|██▌       | 1303/5000 [01:12<1:02:18,  1.01s/call]API calls:  26%|██▌       | 1304/5000 [01:12<50:01,  1.23call/s]  API calls:  26%|██▌       | 1305/5000 [01:12<39:00,  1.58call/s]API calls:  26%|██▌       | 1306/5000 [01:15<1:22:52,  1.35s/call]API calls:  26%|██▌       | 1308/5000 [01:15<49:49,  1.24call/s]  API calls:  26%|██▌       | 1311/5000 [01:17<38:10,  1.61call/s]API calls:  26%|██▌       | 1312/5000 [01:18<41:50,  1.47call/s]API calls:  26%|██▋       | 1313/5000 [01:20<1:00:35,  1.01call/s]API calls:  26%|██▋       | 1314/5000 [01:21<58:00,  1.06call/s]  API calls:  26%|██▋       | 1315/5000 [01:21<45:51,  1.34call/s]API calls:  26%|██▋       | 1316/5000 [01:21<40:36,  1.51call/s]API calls:  26%|██▋       | 1317/5000 [01:24<1:11:04,  1.16s/call]API calls:  26%|██▋       | 1319/5000 [01:24<51:30,  1.19call/s]  API calls:  26%|██▋       | 1320/5000 [01:25<51:04,  1.20call/s]
  CIPLiteStopping: 100%|██████████| 100/100 [01:25<00:00,  8.72s/it, acc=100%, turns=1.5][A
  CIPLiteStopping: 100%|██████████| 100/100 [01:25<00:00,  8.72s/it, acc=100%, turns=1.5][A
                                                                                         [AAPI calls:  26%|██▋       | 1320/5000 [01:25<03:59, 15.37call/s]
  Results: Accuracy=100.00% [100.00%, 100.00%], Avg Turns=1.5 [1.3, 1.8]

==========================================================================================
COMPARISON RESULTS
==========================================================================================
Method                      Accuracy           95% CI  Avg Turns           95% CI
------------------------------------------------------------------------------------------
CIPLiteStopping              100.00% [100.00%,100.00%]        1.5        [1.3,1.8]
==========================================================================================

Total API usage:
  Prompt tokens: 146,884
  Completion tokens: 309,744
  Total tokens: 456,628
